year,code,title,genre,directors,actors,story,,,,,,,,,,,,,,,,,,,,,,,,,,,,,,,,
2014,122183,셰어하우스,,,손호영, 최희, 이상민,1인 싱글 가구 453만 명의 시대  '함께'가 아닌 '개인'의 삶이 편해진 세상    지금 우리는 누군가와 밥을 먹고  누구의 목소리를 들어주고  누구에게 마음을 털어놓고 있을까.    이곳에 당신을 위한 '셰어하우스'가 있다.  사람과 사랑에 상처 받은 이들이 쉬어가는 곳  따뜻한 밥 한 끼로 마음의 온기를 나누는 곳    나의 두 번째 식구를 만나다,  셰어하우스,,,,,,,,,,,,,,,,,,,,,,,,,,,,,
2014,121611,셰프의 야식 시즌2,,,홍석천,레스토랑 영업이 끝난 시각! 셰프는 어떤 모습일까? 다양한 꽃미남 셰프들과의 설레는 만남! 그리고 시즌2에서만 맛볼 수 있는 꽃셰프들의 야식 대결! 셰프의 냉장고 속, 남은 재료로 두 셰프가 동시에 만드는 세상에 하나뿐인 셰프의 야식 大공개! 릴레이로 이어지는 100% 리얼 야식 대결이 펼쳐진다!,,,,,,,,,,,,,,,,,,,,,,,,,,,,,,,
2014,123098,소녀 리오의 욕망,멜로/로맨스,후지와라 켄이치,니시노 쇼, 나카미츠 세이지, 나쯔카와 아사키,오늘도 사랑하는 덤프트럭을 몰고 도로를 달리는 여장부 리오. 그러나 동거하는 남자 친구  오사무는 도박에 빠져서 리오의 돈을 다 날리고 리오는 설상가상으로 임신까지 하여  앞 일이 깜깜하게 된다. 아이를 지우려는 리오 앞에 어느 날 살인으로 수배중인 토우야마가 나타나 리오의 덤프트럭에 올라타 10년 전 버린 딸이 사는 요코하마로 가자고 협박한다.  한편 십년 전 사라진 토우야마를 쫓아 두 형사가 요코하마로 쫓아온다.  공포에 질린 리오지만 토우야마가 말기암으로 얼마 살지 못한다는 걸 알고는  딸과의 재회를 돕게 되는데...,,,,,,,,,,,,,,,,,,,,,,,,,,,,,,
2014,120513,소녀괴담,공포, 스릴러,오인천,강하늘, 김소은,귀신을 보는 특별한 능력을 가졌지만 어린 시절 죽은 친구를 본 기억으로 고향을 떠나 늘 외톨이로 지내온 소년 인수(강하늘). 외로움에 지쳐 다시 퇴마사 삼촌 선일(김정태)이 있는 시골집으로 돌아오지만, 인수를 괴롭히는 초등학교 동창 해철(박두식) 때문에 전학 온 학교 생활도 순탄치 않다.    그러던 어느 날, 기억을 잃고 학교를 맴도는 또래의 소녀귀신(김소은)을 만난 인수는 조금은 특별한 그녀와의 우정을 쌓으면서 점차 마음을 열게 되고, 저주라고 생각했던 자신의 능력에 대해서도 조금씩 받아들이게 된다.    한편, 학교에서는 정체불명의 핏빛 마스크 괴담이 떠도는 가운데 반 친구들이 하나둘씩 사라지는 의문의 실종사건이 발생한다. 사건을 쫓던 인수는 소녀귀신조차 두려워 하는 괴담 속 마스크 귀신과 그녀의 관계에 얽힌 끔찍한 비밀을 점차 알아가기 시작하는데...,,,,,,,,,,,,,,,,,,,,,,,,,,
2014,124736,소년, 소녀 그리고 바다,멜로/로맨스,가와세 나오미,무라카미 니지로, 요시나가 준,8월 대보름 축제가 한창인 아마미 섬.  보름달이 뜬 밤바다에 시체 한 구가 떠오른다.  사건일까? 사고일까? 떠들썩해진 섬 사람들 사이에서  뭔가를 감추고 있는 듯한 ‘카이토’가 의심스러운 ‘쿄코’.    한편, 죽음을 앞둔 엄마와의 이별을 준비중인 ‘쿄코’는  유일한 친구인 ‘카이토’에게 의지하려 하지만,  그날 이후 어쩐지 냉랭해진 그가 원망스럽기만 하다.    그러던 어느 날 밤, 거센 태풍이 섬 전체를 덮치고  두 사람은 지금껏 경험하지 못했던 눈부신 순간을 맞이하게 되는데...,,,,,,,,,,,,,,,,,,,,,,,,,,,
2014,100041,소리굽쇠,드라마, 가족,추상록,조안, 김민상, 이옥희,일제강점기 방직공장에 취직시켜준다는 거짓말에 속아 중국으로 끌려간 소녀 ‘귀임(이옥희)’.  2차 세계대전이 끝나고 해방이 됐지만, 고국으로 돌아오지 못한 ‘귀임’은 모두의 기억 속에서 잊혀진 채 조선족 할머니가 되었다.  70년간 중국 땅에서 통한의 삶을 살아온 ‘귀임’ 할머니의 유일한 희망은 바로 손녀 ‘향옥(조안)’이다.  한국으로 어학연수를 떠나게 된 손녀 ‘향옥’이 할머니를 고향 땅에 모셔오겠다는 부푼 꿈을 안고 떠난 후,  ‘귀임’ 할머니는 홀로 중국에 남아 손녀의 소식을 간절히 기다리는데...,,,,,,,,,,,,,,,,,,,,,,,,,,,
2014,106361,소림사 2014,드라마, 액션, 판타지,나영창,유승준, 팝핀현준, 석행우,2차 세계 대전, 중국의 계속되는 저항을 막기 위해 일본의 고수들이 총출동한다.  그들에게 짓밟힌 자존심과 잃어버린 땅의 평화를 되찾기 위해  소림사에 은둔해 있던 최고의 무술 강호들이 다시 모습을 드러내기 시작한다.  살고 싶다면 죽여야만 한다! 목숨을 건 서바이벌이 지금 시작된다!,,,,,,,,,,,,,,,,,,,,,,,,,,,
2014,127722,소원을 말해봐,,,오현경,외모로 인한 콤플렉스 때문에 고통받고 있는 여성들의 변신을 통해 제2의 삶을 살게 해주는 메이크오버 프로그램,,,,,,,,,,,,,,,,,,,,,,,,,,,,,,,,
2014,123479,소원을 말해봐,,최원석, 이재진,기태영, 오지은, 유호린,한 신부가 불의의 사고로 식물인간이 된 것도 모자라 공금횡령범이라는 누명을 쓴 남편의 결백을 밝히기 위해 고군분투하는 이야기,,,,,,,,,,,,,,,,,,,,,,,,,,,,,
2014,129604,소원을 말해요,,,김성주, 희철, 김재경,SNS로 모두가 하나 되어 만드는 어메이징 소원성취 프로젝트,,,,,,,,,,,,,,,,,,,,,,,,,,,,,,
2014,122409,소치 2014 특집 별을 쏘다,다큐멘터리,,,소치 2014 동계올림픽 특집 다큐멘터리,,,,,,,,,,,,,,,,,,,,,,,,,,,,,,,,
2014,129341,속사정 쌀롱,,,윤종신, 진중권, 장동민,우리 주변의 일상 속에서 발견되는 인간의 다양한 심리를 간단한 심리 실험을 통해 확인하는 인간 심리 토크쇼,,,,,,,,,,,,,,,,,,,,,,,,,,,,,,
2014,114386,솔로,공포, 스릴러,이삭 크래빗,애니 클라크, 다니엘 캐쉬, 리처드 클라킨,여름 방학을 맞아 아일랜드의 무인도로 홀로 캠프를 떠나는 17살의 줄리안은 아무도 없는 외딴 섬에서 카운슬러로 그녀만의 캠프를 시작한다. 도착한 작은 섬에서 자꾸만 느껴지는 인기척, 그리고 풀숲에 나뒹굴고 있는 기이한 인형까지.. 아무도 없다고 생각했던 무인도에서 뭔가 불길한 기운을 느끼는 그녀. 하지만 그것은 줄리안의 캠프를 몰래 따라온 친구의 장난이었고 줄리안은 다시 안심한다. 하지만 안심한 순간, 피투성이가 되어 나타난 줄리안의 친구. 줄리안은 자신들을 노리는 누군가가 이 섬에 있다는 것을 알게 된다. 도망치려 할수록 마주하게 되는 진실과 그 섬에서 죽어 간 또 다른 소녀. 그리고 서서히 밝혀지는 비밀. 그들은 왜 그녀를 죽이려고 하는 것인가?,,,,,,,,,,,,,,,,,,,,,,,,,,,
2014,122521,쇼 미 더 머니 3,,고익조,김진표, 양동근, 더 콰이엇,실력 있는 래퍼들을 발굴하고 이들을 대중들에게 알리는 등용문이 될 수 있도록 기획된 프로그램,,,,,,,,,,,,,,,,,,,,,,,,,,,,,,
2014,112029,쇼트피스,애니메이션,오토모 가츠히로, 모리타 슈헤이, 안도 히로아키,하야미 사오리, 야마데라 코이치,[구십구]  18세기. 산 속을 헤매던 나그네는 갑작스럽게 폭풍우를 만나 길을 잃고 헤매다가 오래 된 사당을 발견하게 된다. 비를 피하기 위해 들어간 사당은 돌연 다른 세계의 방으로 변화한다. 버려진 우산, 더 이상 입지 않게 된 옷의 정령들 등 방은 여러 모습으로 변화하며 나그네를 혼란에 빠트리는데…    [화요진]  17세기 에도시대. 상인의 딸 오와카와는 소꿉친구 마쓰키치를 좋아하지만 집안은 그녀를 다른 남자와 혼인을 시키려하고 한다. 마쓰키치는 그런 오와카와의 마음도 모른 채 소방관이 되겠다며 집을 나간다. 결혼을 앞두고 마음이 뒤숭숭한 오와카와는 마쓰키치를 만나기 위해 집에 불을 지르는데…    [감보]  16세기 전국시대 말기. 도호쿠 지방의 산 안에 있는 촌락에 붉은 도깨비 형상의 괴물이 나타나 밤마다 마을에 있는 처녀들을 끌고 간다. 결국 마을에 남은 처녀라고는 어린 소녀 ‘기오’뿐. 산 속으로 도망 친 ‘가오’는 그 곳에서 사람의 말을 이해하는 백곰 ‘감보’를 만나 도움을 요청하는데…    [무기여 잘 있거라]  근 미래 도쿄. 사막 안에 폐허로 변한 도시를 프로텍션 슈트로 무장한 5명의 소대가 찾아 온다. 그들은 한 대의 전차형 무인병기와 전투를 벌이게 된다. 하지만 일은 점차 예상치 못한 방향으로 틀어지게 되는데…,,,,,,,,,,,,,,,,,,,,,,,,,,,,
2014,107924,수상한 그녀,코미디, 드라마,황동혁,심은경, 나문희, 박인환,아들 자랑이 유일한 낙인 욕쟁이 칠순 할매 오말순(나문희分)은 어느 날, 가족들이 자신을 요양원으로 독립(?)시키려 한다는 청천벽력 같은 사실을 알게 된다. 뒤숭숭한 마음을 안고 밤길을 방황하던 할매 말순은 오묘한 불빛에 이끌려 ‘청춘 사진관’으로 들어간다. 난생 처음 곱게 꽃단장을 하고 영정사진을 찍고 나오는 길, 그녀는 버스 차창 밖에 비친 자신의 얼굴을 보고 경악을 금치 못한다. 오드리 헵번처럼 뽀얀 피부, 날렵한 몸매... 주름진 할매에서 탱탱한 꽃처녀의 몸으로 돌아간 것! 아무도 알아보지 못하는 자신의 젊은 모습에 그녀는 스무살 ‘오두리’가 되어 빛나는 전성기를 즐겨 보기로 마음 먹는데...     2014년 새해,   대한민국에 웃음 보따리를 안겨줄 <수상한 그녀>가 온다!,,,,,,,,,,,,,,,,,,,,,,,,,
2014,120100,수호지 - 강철 보갑,액션, 무협,황조권,하중화, 양소빙, 모정,대송 시기, 금창반 교두로 일하던 서녕은 병가를 내고 양산박을 도와 조정 토벌군을 격퇴시킨다. 조정에서는 호연작에게 양산박 토벌을 명했으나, 호연작이 패했다는 소식에 의아함을 감추지 못한다. 패인이 서녕 집안의 절기인 구겸창법에 있었음을 알게 된 왕 태위는 이를 빌미로 어떤 상황에서도 창과 화살도 뚫지 못하는 서녕의 비밀병기인 보갑을 빼앗기 위한 계략을 꾸민다. 왕 태위는 서녕의 거짓 병가를 황상께 보고하고 양아들인 강발을 시켜 서녕의 부인을 잡아들여 강철 감옥에 가둔 뒤, 서녕이 보갑을 바치지 않으면 부인을 죽일 것이라고 협박한다. 대포로도 깨지지 않는 강철 감옥 앞에서 부인을 눈 앞에 두고도 구하지 못하는 서녕은 비탄에 빠진다. 설상가상으로 왕 태위는 대각사에 숨겨 놓은 서녕의 아들 소보까지 잡아 들여 서녕의 숨통을 조여 온다. 하지만 대장간 출신 아우 탕륭에게 왕 태위를 유인할 수 있는 묘안이 있었으니...서녕은 과연 무고한 가족을 구하고 조상의 유훈인 강철 보갑을 지켜낼 수 있을 것인가!,,,,,,,,,,,,,,,,,,,,,,,,,,
2014,123025,수호지 - 명포 배선,액션, 무협,류신의,노성우, 진가가, 하첨,배선은 경조부의 공목으로 부임하는 길에 영왕부의 세자가 수하들과 말을 타고 거리를 질주하며 백성들에게 안하무인으로 행동하자, 불의를 참지 못하고 세자의 말을 베어버린다. 한편 화기 제작장인 공성작의 폭발 사건을 맡은 부윤 한도는 사건을 덮으려 서둘러 화기 제작 장인들을 사형시키려 하지만 배선은 아직 죄가 드러나지 않았다며 처형 직전의 증인들을 구해 낸다. 사건에 대해 조사를 하던 배선은 영왕의 세자비인 여비가 적국인 요나라 장수의 수양딸임을 알게 되고, 여비가 꾸미고 있는 계략을 막기 위하여 애를 쓰지만, 영왕부의 저지에 계속해서 부딪힌다. 급기야 배선은 누명을 쓰고 그를 죽이기 위한 무리들로 인해 사면초가에 빠진다. 한도는 억울한 배선의 해결사를 자청하지만, 사실 그는 또 다른 음모를 꾸미고 있었으니..과연 배선은 누명을 벗고 무고한 백성들을 구할 수 있을 것인가!,,,,,,,,,,,,,,,,,,,,,,,,,
2014,126326,수호지 - 명포영웅 호연작,액션, 무협,황조권,전소호, 양가인,군사 요충지인 고당에서 황상의 신하가 역적들에게 살해를 당하고 황상은 군심을 안정시키기 위해 지주를 새로 뽑기로 한다. 용맹한 호연 대인의 아들 호연작이 그 후보에 오르는데, 어린 나이와 공적이 없는 터라 이를 증명하기 위해 사람들을 모아 호연작과 경합을 벌이게 한다. 그 후 능력을 인정받은 호연작은 양산을 토벌하기 위해 길을 나서는데...,,,,,,,,,,,,,,,,,,,,,,,,,,,,,
2014,123017,수호지 - 천하대인,액션, 무협,류신의,고천,양산 출신인 두천은 한부의 한 어사를 만나 어머니의 후사를 잘 처리해준 것에 대한 감사의 인사를 전하며 도움을 자청한다. 두천에게 위험할 수도 있다고 말하던 한 어사는 갑자기 날아온 괴한의 화살에 맞아 죽게 된다. 한 어사가 찾는 물건이 있을 거라고 여긴 두천은 사건 현장을 다시 찾게 되고 보검 한 자루를 줍게 된다. 두천을 도적이라고 생각하던 총 포두 엄 대인은 두천에게 큰 부상을 입히고 두천은 절친한 사이였던 시진 대인의 세가로 찾아가 몸을 숨긴다. 엄 대인은 두천을 쫓다가 시진의 집을 수색하려 하지만 시진 집안이 태조 황제의 은혜로 하사 받은 단서철권으로 인해 돌아가게 된다. 그 후 두천과 시진은 한 어사의 죽음에 대해 얘기하다 보검의 비밀을 알게 된다. 한편 시진 대인의 세가에서 키워진 범종록은 관병들의 위협에서 도와준 고원암을 알게 되고 엄대인의 부하로 들어가게 되는데 엄대인은 두천을 잡을 목적으로 단서철권을 요구한다. 이를 훔치려다 실패한 종록은 보검을 훔치려 드는데..보검에 얽힌 음모를 밝히기 위해 시진은 검을 찾으려 하고 음모에 연루 된 지부대인이 시 대인의 목숨을 노리게 된다. 과연 두천과 시 대인은 한 어사의 죽음에 얽힌 음모와 전말을 밝혀낼 수 있을까.,,,,,,,,,,,,,,,,,,,,,,,,,,,,,,,
2014,122060,수호지-강호의 장청,액션, 무협,류신의,상위림, 시시,맹주성의 실세 겸도회의 두목인 흑표의 죄를 대신해 옥살이를 하고 나온 장청은 감옥에 들어간 사이 아버지께서 돌아 가시고 집안이 몰락하자 강호에서 손을 씻으려 한다. 머물 곳을 찾아 떠돌던 장청은 외지에서 온 도적무리 지해 일당에게 절을 빼앗긴 뒤 자결하려던 광명사 주지를 구하게 되고, 농사를 지으며 절에게 지내게 된다. 장청의 은원이자 맹주성의 포두 이소보와 흑표는 뛰어난 무술의 소유자인 장청을 자기편으로 끌어들이기 위해 서로 계략을 꾸미고, 이를 알아챈 장청은 모두를 없애기 위해 그들을 궁지로 몰아넣는데..,,,,,,,,,,,,,,,,,,,,,,,,,,,,
2014,115537,숙희,멜로/로맨스,양지은,채민서, 조한철,한때 신부가 되려 했던, 금욕적 완벽주의자 윤교수(조한철)가 갑작스런 심근경색으로 쓰러진다. 몸을 가눌 수 없게 된 그를 간병하는데 지친 아내는 돌보는 환자마다 완치시킨다는 간병인 숙희(채민서)를 고용한다. 모든 환자를 자기 아이처럼 돌보며 치료한다는 빨간머리에 형형색색으로 손톱을 치장한 유별난 모습의 ‘숙희’  홀로 남은 윤교수에게 숙희는 특별한 간병을 시작하고 윤교수는 숙희의 기묘한 매력에 빠지며 알 수 없는 감정에 사로잡히는데…,,,,,,,,,,,,,,,,,,,,,,,,,,,,,,
2014,123537,순례여행,드라마,존 포드,헨리에타 크로스먼, 헤더 안젤,한나는 홀로 아들 짐을 키우며 농장을 꾸려 간다. 어떻게 해서든 고된 농장일에서 벗어나고 싶어하는 짐 때문에 모자의 관계는 편하지 않다. 결국 짐이 어머니의 뜻을 거스르고 연인 메리와 결혼하겠다고 하자, 한나는 둘을 떼어놓기 위해 짐을 입대시켜 버린다. 그런데 1차 세계대전에 참전한 짐이 작전 중에 사망하고 만다. 한편, 짐이 떠난 후, 메리는 임신 사실을 알게 되는데, 그녀는 누구에게도 알리지 않고 홀로 아들을 낳아 기른다. 몇 년 후, 한나는 전쟁에서 자식을 잃은 어머니들의 모임에서 주관하는 프랑스 여행에 참여한다. 자식들의 무덤을 찾아가는 이 특별한 여정 중 한나는 아들을 죽음으로 내몰았다는 씻을 수 없는 죄책감에 시달린다. <네 아들>의 원작을 썼던 I. A. R. 와일리의 다른 이야기를 바탕으로 하여, 전쟁으로 인한 상실과 슬픔 그리고 화해의 과정을 그린 수작. 평론가 조셉 맥브라이드는 미국식 영웅주의, 애국심 등을 비롯해 특유의 시각적 아름다움까지 포드의 후기 걸작들에서 찾을 수 있는 특징들을 모두 엿볼 수 있다고 했다.,,,,,,,,,,,,,,,,,,,,,,,,
2014,123044,순진한 예비신부의 학원정사,에로,쿠로카와 유키노리,카스미 카호,하루코는 동거 중인 남자친구 고헤이와 곧 결혼할 예정. 어느 날 아파트 옆집에 새로 이사 온 중년 부부가 인사하러 찾아오고, 하루코는 아직까지도 금슬이 무척 좋아 보이는 이 부부에게 야릇한 질투를 느낀다. 사실 하루코는 남자친구와의 잠자리가 그렇게 즐겁지가 않아 속앓이를 하고 있던 중이다. 한편 친구 유코를 따라 태국어 교실에 열심히 다니는 하루코. 태국어 선생님의 끈적한 눈길에도 아랑곳하지 않던 하루코는 알 수 없는 외로움에 그와 저녁 식사를 하기로 하는데…,,,,,,,,,,,,,,,,,,,,,,,,,,,,,,,
2014,115256,순천,다큐멘터리,이홍기,윤우숙, 차일선, 김종선,자연의 섭리에 따라 삶과 죽음의 순환이 반복되는, 변화무쌍한 생명의 터전 순천. 이곳에 칠순의 여자 어부 ‘윤우숙’이 술 좋아하는 남편 ‘차일선’과 함께 산다. 그녀는 평생토록 남편이 술을 끊고 건강해지는 것과 그저 자식들이 잘 먹고 잘 사는 것, 두 가지만 바라며 살아왔다. 오직 이를 위해 50년 동안 거친 바다와 갯벌에 나가 홀로 고기를 잡고 꼬막을 캐며 가계를 꾸렸다. 밥벌이에 무심한 남편도 가난도, 모두 하늘의 뜻이라 여기며 참말로 억척스럽게 살아왔다. 다행히 그런 그녀를 이웃의 어촌계장 김씨가 친누이처럼 따르며 어려울 때마다 돕고, 오늘도 그녀는 쉬지 않고 일한다.      그렇게 순천만에 겨울이 깊어가던 어느 날, 그녀에게 청천벽력 같은 일이 벌어지는데...,,,,,,,,,,,,,,,,,,,,,,,,,
2014,106270,숨바꼭질,서스펜스, 스릴러,이한욱,유병선, 유상재,“1.2.3…….9.10. 찾는다!”  오늘도 어김없이 인형들과 숨바꼭질 놀이를 하는 미영. 꼭꼭 숨어 있는 인형들을 찾기 바쁜 미영은 밖에서 들려오는 노크소리에 깜짝 놀라며 옷장 속에 자신의 몸을 숨긴다.  유치원 차량을 운전하는 오건은 그의 전과 이력을 알게 된 유치원 원장으로부터 해고 통지를 받고 거리를 방황한다. 성적 장애가 있는 그는 약물을 복용하며 욕정을 억제하려 하지만 결코 쉽지가 않다.  성적 유린을 당한 딸에 대한 복수를 결심한 ‘민수’는 모든 것을 다 포기한 채 가해자를 찾아내기 위해 고군분투 하고 결국 그를 찾아내 복수를 실행하게 되는데...,,,,,,,,,,,,,,,,,,,,,,,,,,,,,,
2014,92035,숫호구,코미디,백승기,백승기, 손이용, 박지나,서른 살이 되도록 제대로 된 연애 한 번, 사랑 한 번 못해본 욕구불만 청년 숫호구 ‘원준’은 열등감으로 가득 차 있다. 또래 친구들은 다 하는 번듯한 직장생활, 연애, 결혼도 원준은 쉽게 할 수가 없다.     그러던 어느 날 정체불명의 생명공학 박사가 진행한 비밀 생체실험으로 인해 자신이 직접 들어가 마음껏 조종할 수 있는 완벽한 몸매와 얼굴(?)의 슈퍼 섹시 아바타를 갖게 된다.    원준은 그 동안 누려보지 못했던 쾌락을 맘껏 누릴 수 있게 되고 기존의 자신의 삶과는 전혀 다른 삶을 살게 된다. 그러던 중 동네 헌 책방의 신입 아르바이트생 ‘지나’를 보고 사랑에 빠지게 되지만, 그녀는 원준의 본 모습이 아닌 아바타의 모습을 사랑하게 되는데…,,,,,,,,,,,,,,,,,,,,,,,,,,
2014,105246,숲속으로,판타지, 뮤지컬,롭 마샬,메릴 스트립, 조니 뎁, 에밀리 블런트,간절히 아이만을 원하며 평범한 삶을 살아가고 있는 ‘베이커 부부’  ‘마녀’는 ‘베이커 부부’에게 저주를 풀 수 있는 유일한 방법을 알려준다.    ‘베이커 부부’는 피처럼 붉은 망토, 우유처럼 하얀 소, 옥수수처럼 노란 머리카락 그리고 순금처럼 빛나는 구두를   100년 만에 찾아온 푸른 달이 뜨기 전까지 찾아야만 한다.    그들에게 주어진 시간은 단 3일  ‘마녀’의 위험한 거래를 받아들인 ‘베이커 부부’는 숲 속으로 위험한 여정을 떠나게 되는데…    신비롭고 위험한 숲 속에서 황홀한 여정이 펼쳐진다!,,,,,,,,,,,,,,,,,,,,,,,,,,,
2014,126319,숲의 전설,다큐멘터리,빌레 수호넨, 킴 사르닐루오토,투르카 마스토마키, 크리스티앙 루오타넨,옛날 옛적, 고대 핀란드인들은 거대한 나무 한 그루를 세계의 중심이라고 생각했답니다. 하늘이 나무를 축으로 사방으로 뻗어 세상을 뒤덮고, 나무가 하늘을 떠받치며 우주를 지켜준다고 믿었던 것이지요. 이들은 그 나무를 ‘세계수’라고 불렀습니다. 신성한 숲을 보호하기 위해서 숲 속 요정과 물의 정령, 도깨비들이 함께 살았던 시절, 나무와 사람이 운명을 같이 하던 시절의 이야기가 태고의 신비를 간직한 원시림 속 야생 동물들의 경이로운 모습들과 함께 펼쳐집니다. 그리고 <반지의 제왕>의 간달프의 시초인 '뵈이네 뫼이넨'에서 귀여운 캐릭터 '무민'을 탄생시킨 트롤 이야기까지.    아름다운 신화와 전설이 살아 숨쉬는 신비로운 핀란드 자연림으로 당신을 초대합니다!,,,,,,,,,,,,,,,,,,,,,,,,,,
2014,99731,슈퍼 사이클론 스톰,액션, SF,리즈 애덤스,밍나 웬, 니콜라스 터터로, 앤디 클리멘스,페트로 칼 정유회사가 운영하는 윌포스-3 시추선이 굴착 작업을 진행하던 중 지각 내부의 마그마 주머니를 건드려 화산이 폭발하는 사고가 발생한다. 이로 인해 바닷물의 온도가 올라가 여지껏 볼 수 없었던 초대형 슈퍼 사이클론이 발생하고 남부 캘리포니아 지역은 아수라장이 된다. 펜들턴 기지의 '채드윅 대령'은 문제 해결을 위해 기상학자인 '제나 스파크스' 박사를 윌포트-3으로 보내지만 이미 불구덩이가 된 윌포스-3는 되돌릴 수 없는 지경에 이른 상태. 가까스로 그곳을 빠져나온 제나와 기상학 교수인 '퍼시', 페트로 칼의 직원인 '트래비스'는 슈퍼 사이클론을 막기 위해 펜들턴 기지로 향하지만 폭풍으로 인해 이동조차 쉽지 않다. 우여곡절 끝에 기지에 도착한 제나는 대령을 설득해 자신이 연구하고 있는 요오드화은 나노 조각을 이용해 폭풍을 소멸시킬 계획을 세우고, 조종사는 요오드화은 조각을 싣고 폭풍의 눈으로 향하는데...,,,,,,,,,,,,,,,,,,,,,,,,,,,
2014,132308,슈퍼 컴퍼니,,,이천희,차세대 디자이너 발굴을 위한 서바이벌 프로그램,,,,,,,,,,,,,,,,,,,,,,,,,,,,,,,,
2014,96054,슈퍼노바 지구 탈출기,애니메이션, 모험, 코미디, 가족, SF,캘런 브런커,브렌든 프레이저, 제시카 알바, 사라 제시카 파커,허세작렬 우주 영웅 ‘스콜치’와 BASA의 소심한 천재 기술자 ‘게리’는 어느 날 어둠의 별(지구)에서 사라진 외계인들을 구출하라는 임파서블한 미션을 받게 된다. 그 동안 사라진 외계인들은 탈출 불가능한 감옥 ‘51 구역’에서 구글, 애플, 페이스북 등 지상 최고의 발명품들을 만들어 내며 고향 별로 돌아갈 날을 손꼽아 기다리고 있는 상황! 하지만 ‘스콜치’는 외계인들을 구출하기도 전에 지구인들에게 납치되고, 설상가상 ‘스콜치’를 구하기 위해 온 ‘게리’마저 ‘51 구역’ 외계인 납치 주동자 ‘쉥커 장군’에게 잡히고 마는데…,,,,,,,,,,,,,,,,,,,,,,,
