year,code,title,genre,directors,actors,story,,,,,,,,,,,,,,,,,,,,,,,,,,,,,,,,
2014,102648,잭 라이언 : 코드네임 쉐도우,액션, 드라마, 스릴러,케네스 브래너,크리스 파인, 키이라 나이틀리, 케빈 코스트너,뛰어난 두뇌와 탁월한 정보 분석 능력으로 은밀하게 발탁된 CIA 비밀요원 ‘잭 라이언’(크리스 파인).  뉴욕 증권가 월 스트리트의 능력 있는 임원으로 CIA 요원의 정체를 숨기고 살아가던 그는 전세계 경제를 붕괴시킬 치밀한 테러의 음모를 알아차리게 된다. 거대한 혼란을 야기할 경제 테러를 막을 유일한 인물로 지목된 ‘잭 라이언’.  누구도 믿을 수 없는 위기의 상황에 처하게 된 그는 자신의 조력자이자 파트너 ‘하퍼’(케빈 코스트너), 그리고 약혼녀 ‘캐시’(키이라 나이틀리)와 함께 음모의 열쇠를 쥐고 있는 ‘빅터’(케네스 브래너)에 맞서 절체절명 미션 수행에 나서게 되는데…!   누구도 믿지 말고, 모두를 속여라!   CIA 비밀요원 ‘잭 라이언’의 새로운 미션이 시작된다!,,,,,,,,,,,,,,,,,,,,,,,,,,
2014,129601,쟁반 릴레이송,,,신동엽, 아이유,해피투게더' 시즌1의 코너 '쟁반 노래방'의 업그레이드 버전으로 팀을 구성해서 서바이벌 방식으로 노래 대결을 펼치는 프로그램,,,,,,,,,,,,,,,,,,,,,,,,,,,,,,,
2014,120027,,,,,,,,,,,,,,,,,,,,,,,,,,,,,,,,,,,,,
2014,126946,전설의 마녀,드라마,주성우,한지혜, 하석진,저마다 억울하고 아픈 사연을 갖고 교도소에 수감된 네 여자가 '공공의 적'인 신화그룹을 상대로 유쾌 상쾌 통쾌한 '전설'(?雪, '설욕'을 의미)에 나서는 이야기,,,,,,,,,,,,,,,,,,,,,,,,,,,,,,
2014,122012,전설의 비밀,,,이성재,최고를 넘어, 전설로 불리는 사람들이 있다. 부와 명예를 거머쥔 화려한 성공만이 아닌, 누구도 따라 할 수 없는 자신만의 길을 걸어온 이들이 감춰진 '비밀'은 무엇일까? 전설들이 털어놓는 진한 인생 이야기를 들어볼 수 있는 프로그램,,,,,,,,,,,,,,,,,,,,,,,,,,,,,,
2014,98381,전장의 묵시록,드라마, 전쟁,마르신 크르즈스탈로윅스,마신 도로신스키, 마시에 스투, 소니아 보호시에윅스,1943년 늦가을, 깊은 산 속에 레지스탕스 소대원들이 질병, 배고픔과 싸우며 나치 대원들을 사살하고 동조자들을 납치해 처형하는 임무를 위해 숨어있다. 한편 독일군과 조국의 변절자들을 가차 없이 잔인하게 처치하기로 유명한 오터 상병은 나치의 끄나풀이자 어릴 적 학교 동창인 콘돌레비치를 납치해 죽이라는 명령을 받는다. 그는 콘돌레비치를 레지스탕스 은신처로 끌고 오지만 부대원 전체가 목이 잘려 처참히 학살당한 모습을 발견한다. 분노에 찬 오터는 비극의 진실을 파헤치고 배신자의 정체를 찾아내 피의 복수를 하기로 결심한다. 하지만 냉혈한 살인마인 오터도 자비심과 동정심을 지닌 인간임이 드러나고 영웅의 모습으로 변모한다. 나치의 대대적인 수색대가 점점 포위망을 좁혀오는 가운데 복수를 끝내고 홀로 남은 오터는 독일군의 총성과 고함 소리가 들려오지만 도망치지 않고 마지막 임무를 수행한다.,,,,,,,,,,,,,,,,,,,,,,,,,,,
2014,123027,,,,,,,,,,,,,,,,,,,,,,,,,,,,,,,,,,,,,
2014,124907,접속 2014,,,수지, 로이 킴,얼굴도 모르고 스팩도 모르는 사람과 사랑할 수 있을까? 디지털 시대의 무미건조한 사랑법에 도전한다! 사랑을 시작하는 남녀의 설렘을 각각의 시각으로 그려낸 프로그램,,,,,,,,,,,,,,,,,,,,,,,,,,,,,,,
2014,122552,정글의 법칙 in 브라질,,변진선,김병만, 봉태규, 오종혁,브라질로 떠난 병만족. 다양한 희귀 동물들과 천혜의 자연 속에서 펼쳐지는 생존기 프로그램,,,,,,,,,,,,,,,,,,,,,,,,,,,,,,
2014,126890,정글의 법칙 in 솔로몬,,김진호,김병만, 류담, 박정철,솔로몬제도로 떠난 병만족들이 자연 속에서 펼치는 생존기를 보여주는 프로그램,,,,,,,,,,,,,,,,,,,,,,,,,,,,,,
2014,129267,정글의 법칙 in 코스타리카,,변진선,김병만, 임창정, 정만식,코스타리카로 떠난 병만족들이 자연 속에서 펼치는 생존기를 보여주는 프로그램,,,,,,,,,,,,,,,,,,,,,,,,,,,,,,
2014,128202,정글히어로,애니메이션,박태동, 마우리시오 드 라 오르타,심규혁, 김현지, 조성목,1960년 멕시코 라켄돈 정글. 정글에서 태어난 코아티 마누와 사차는 어릴 때 부터 함께 자란 둘도 없는 친구다. 하지만 말썽꾸러기 마누는 코아티 왕의 명령으로 만들어진 거대한 동상을 망가뜨린 벌로 왕국에서 쫓겨나고, 여자친구 사차는 정글의 밀렵꾼에게 붙잡혀가게 되는데…!  사차를 구하기 위해 위험천만한 여정을 떠난 마누는 15가지의 무술 동작을 할 수 있다는 허풍쟁이 몽키 ‘츄이’, 재규어 ‘발람’ 등 다양한 정글의 동물들과 만나 함께 추적을 시작하고, 밀렵꾼과 ‘로코’ 박사가 정글 전체를 위험에 빠뜨릴 무서운 음모를 꾸미고 있다는 사실을 알게 되는데…  과연 마누는 무사히 사차를 구하고 정글의 평화를 지켜낼 수 있을 것인가?,,,,,,,,,,,,,,,,,,,,,,,,,,
2014,109763,정도전,드라마,강병택,조재현, 유동근, 박영규,고려에서 조선으로 교체되는 시기에 새 왕조 조선을 설계한 정도전의 이야기,,,,,,,,,,,,,,,,,,,,,,,,,,,,,,
2014,125709,정사,멜로/로맨스, 드라마,김정환,한세아,퇴직 이후 서점을 운영하며 살던 성민의 무료한 일상에 아름다운 얼굴, 매혹적 몸매를 가진 가희가 나타난다.    발레 학원을 운영하는 가희 또한 남편과의 관계가 석연치 않던 차, 가희와 성민은 지독하게 서로에게 빠져든다.    함께 하면 안 된다는 것을 알기에 더욱 뜨겁게 타오르는 두 사람. 이제 그 지독한 사랑이 파멸을 향해 달려가기 시작한다.,,,,,,,,,,,,,,,,,,,,,,,,,,,,,
2014,132917,정사 : 위험한 성적유희,멜로/로맨스,이민환,김시언, 백인권,결혼 6년차 가을은 남편과의 불화로 술에 의존하기 시작하면서 알코올중독자가 되고 가을의 이웃집에 살고 있던 현직 작가 희망은 가을 부부의 싸움소리에 잠 못 이루는 날이 계속되자 도저히 견디지 못하고 가을의 집에 찾아가 항의한다. 그렇게 둘 사이의 첫 만남이 시작되고, 그 후 가을은 남편과 싸워 술에 취할 때면 희망의 집에 찾아가 섹스를 한다. 알 수 없는 가을의 태도에 희망은 아리송해지며 점점 더 가을에게 빠져 든다. 그러던 사이 남편과의 관계가 회복되고 있는 가을의 모습을 발견하고는 가을의 집에 무작정 찾아가 삼자대면을 하는데 …,,,,,,,,,,,,,,,,,,,,,,,,,,,,,,
2014,117274,정사의 시작,에로, 드라마,카츠 리이치,후지와라 아키미, 니노미야 마사에,운명적인 만남    약혼자였던 마사에와 결혼식을 하려고 하던 날, 마사에가 교통사고로 죽자 니시자와는 절망에 빠진다. 그는 빌딩 옥상에 올라가 자살을 하려고 하고 우연히 그 장면을 목격한 아키미는 그를 만류한다. 덕분에 니시자와는 자살을 할 결심을 취소하고 아키미와 핸드폰 전화번호를 주고받는다. 아키미는 니시자와에게 호감을 느끼고 니시자와 역시 그녀에게 호감을 느끼지만 아키미에게는 약혼자 이시카와가 있었다. 그리고 니시자와 앞에 죽은 마사에의 여동생 아야네가 나타나 사랑을 고백하는데...     사랑의 시작    마사에를 알기 전부터 사귀었던 애인, 아야네는 니시자와에게 결혼하자고 말하고 니시자와는 단호히 거절한다. 아키미 역시 이시카와와의 결혼을 취소하고 니시자와와 아키미가 만나고 있다는 사실을 안 아야네는 아키미를 만나 그를 포기하라고 한다. 아야네의 부탁을 받은 니시자와 아버지 역시 아야네와의 결혼을 추진하고 아야네는 이시카와와 손을 잡고 그 둘을 떨어뜨려 놓으려고 하는데...,,,,,,,,,,,,,,,,,,,,,,,,,,,,
2014,133503,정의본색,,,김보성, 김구라, 윤형빈,답답한 대한민국의 시청자들 가슴을 시원하게 뻥 뚫어줄 대국민 헌신 봉사 프로젝트,,,,,,,,,,,,,,,,,,,,,,,,,,,,,,
2014,122603,정자왕 3D,코미디,이공락,두문택, 조시 호, 요시자와 아키호,터치 모이라는 필명을 가지고 있는 '첸'(두문택)은 지방 신문의 성인 섹션에서 에로소설을 쓰며 생계를 유지하는 작가이다. 하지만 성인 섹션이 폐지되면서 마지막 생활 수단을 잃게 되자 친구들과 일본으로 건너가 AV를 찍기로 한다. 영화 촬영 중 남자배우의 갑작스런 트러블로 배우를 대신해 첸이 투입되고 첸이 등장한 AV는 남자가 당하는 장르라는 새로운 장르를 만들어내면서 폭발적인 인기를 끌게 된다.  홍콩으로 돌아간 첸은 자신이 찍은 비디오가 언론매체를 통해 이슈로 다뤄지면서 얼굴이 알려지게 된다. 홍콩에 더이상 머물 수 없게 된 첸은 결국 일본으로 건너가 AV배우로서의 활동을 시작하게 되는데....    과연, 그는 AV배우로서 성공할 수 있을까?,,,,,,,,,,,,,,,,,,,,,,,,,,,,,
2014,121503,정재형의 프랑스 가정식,,,정재형,파리지앵'하면 떠오르는 남자!  작은 피아노 앞에서 가장 큰 존재감을 드러내는 남자  가요계를 넘어 예능계까지 접수한 팔방미인 정재형! 그가 올리브에 온다!    지금까지 음악의 神이었다면  이제는 요리 요정이라고 불러달라 하는 그!  파리 유학시절 온몸으로 부딪히며 터득한 프랑스 가정식을 소개한다.    프랑스 요리는 도전하기에 복잡하고 어렵다?!  편견과 오해를 깨기 위해 정재형의 노하우가 녹아있는 요리법을 소개하고  낯선 불어 요리 용어와 메뉴 판을 쉽게 읽는 방법을 전수한다.,,,,,,,,,,,,,,,,,,,,,,,,,,,,,,,,
2014,122067,젖은 입술,,쿠마시로 타츠미,에자와 모에코, 아이카와 케이코, 아와주 고,목재상에서 일하는 가네오는 사장의 딸 사치코와 애인 사이지만, 그는 점점 사치코에게 얽매이기 싫어진다. 내키지 않는 데이트 후, 가네오는 콜걸을 불러 기분전환을 하려 한다. 가네오는 스낵바에 나타난 요코를 보자 한눈에 반하는데, 그는 자신에게 매정한 요코에게 더욱 빠져든다. 가네오는 사치코를 속이고 목재상에서 도망쳐 나와 요코의 아파트에서 둘만의 시간을 보내는데, 갑자기 또 다른 남자가 찾아온다. 구마시로가 영화감독으로서의 재능을 보이기 시작한 초기작. 이후 로망 포르노 장르의 대표 걸작들이 줄줄이 탄생한다.,,,,,,,,,,,,,,,,,,,,,,,,,,
2014,130702,제3의 눈 써드아이,,,서경석,불시에 발생하는 범죄 현장을 목격하거나, 누군가의 일탈을 기록하고, 또 때로는 우리가 맞닥뜨리는 역사의 한 순간을 생생한 기록으로 남기는 제 3의 눈, 써드 아이!  사람의 눈으로 보지 못 하는 장면을 생생하게 기록하는 써드 아이는 때때로 우리가 미처 알지 못하던 숨은 진실을 밝혀주기도 하는데!  이들이 기록한 다양한 영상을 통해 우리 사회의 사건 사고 속에 숨겨져 있는 '숨은 이야기'를 재해석하고 사회를 바라보는 새로운 시선을 제안하는 프로그램!  써드아이에 담긴 '대형 사건 뒤에 숨겨진 기묘한 이야기'로 사건을 재구성하고 그 동안 공개되지 않았던 <cctv>의 24시간을 공개하는 한편, 시민이 직접 촬영한 써드 아이 영상, 그 뒷 이야기를 만나봄으로서 우리 사회 곳곳에서 포착된 놀랍고도 흥미진진한 이야기를 이제 전격 공개하고자 한다!</cctv>,,,,,,,,,,,,,,,,,,,,,,,,,,,
2014,129761,제4 이노베이터,드라마,한명구,정라모, 전주연,무역회사에 근무하는 싱글 맘 영미(전주연)는 3대째 이어져온 빈곤한 생활의 종지부를 찍고 싶은 생각이 늘 잠재하고 있던 중, 일본엔화가치가 한국 원화가치의 4배라는 신문기사를 보고 어렵게 기회를 만들어 일본으로 진출하게 된다.   본인처럼 자식들이 등록금이 없어서 학교를 고만두는 일은 없어야 한다는 다짐과 용기를 가지고 혼자의 힘으로 국제적인 시장을 개척해 나간다. 냉혹한 비즈니스세계에서 말보다는 행동이 먼저라는 강한 정신으로 매섭게 일하는 영미지만 한국의 어머니(전원주)와 형제들에겐 언제나 착하기만 하다. 우여곡절 끝에 아이들을 무작정 일본으로 데리고 온 절박한 영미에게 늘 도움을 주는 일본인 후지타상(독고영재)은 큰 인복이다.  한국으로 돌아오게 된 영미는 일본에서 철도 선진기술을 습득하여 고급 엔지니어로 사업에 참여하게 된다. 고국으로 돌아와 자신의 기술을 이전하려고 마음 먹었던 영미에게는 곧 외압의 압력이 다가오게 된다. 안전은 둘째치고, 빠른 개통을 원하는 관련자들과 부딪혀 영미에게는 큰 시련이 찾아오게 되는데…,,,,,,,,,,,,,,,,,,,,,,,,,,,,,
2014,100985,제로법칙의 비밀,판타지, SF,테리 길리엄,크리스토프 왈츠, 맷 데이먼, 틸다 스윈튼,컴퓨터 천재 코언 레스(크리스토프 왈츠)는 연산 시스템 회사인 맨컴에서 일하며 매일 똑같은 삶을 살고 있다.  어느 날 삶의 의미를 깨우쳐줄 특별한 전화를 받지만 실수로 그 전화를 끊어버리고  다시 걸려올 특별한 전화만을 기다리며 사는 그에게 출퇴근은 너무 고통스럽기만 하다.  코언은 몸이 불편하다는 이유를 대며 재택근무를 신청하지만  담당 의사(벤 위쇼)의 진단 결과 아무 이상이 없는 것으로 밝혀져 단박에 거절당한다.   그러던 중 우연히 맨컴의 회장(맷 데이먼)을 만나 미스터리한 제로법칙 프로젝트를 제안 받는다.  그는 재택근무를 하는 조건으로 프로젝트를 맡고  회사에서 파견한 상담전문가 쉬링크-롬(틸다 스윈튼)의 도움을 받으며 프로젝트를 수행해나간다.   하지만 프로젝트가 진행될수록, 코언은 극한의 심리적 압박감을 느끼게 되는데…   존재의 이유를 찾기 위해 나선 코언,  과연 그는 기다리던 의문의 전화를 받을 수 있을까?,,,,,,,,,,,,,,,,,,,,,,,,,,,
2014,128235,제보자,드라마,임순례,박해일, 유연석, 이경영,“제가 줄기세포를 연구하는 이유는  난치병 환자들에게 희망이 되기 위해서 입니다.”  세계 최초로 인간배아줄기세포 추출에 성공한  ‘이장환’ 박사의 연구 결과가 국민적인 관심사로 떠오르고 있는 가운데  PD추적 ‘윤민철’ PD는 익명의 제보자로부터 한 통의 전화를 받게 된다.    “전 아무런 증거도 없습니다.  그래도 제 말을 믿으시겠습니까?”  얼마 전까지 ‘이장환’ 박사와 함께 줄기세포 연구를 해오던 ‘심민호’ 팀장은  ‘윤민철’ PD에게 논문이 조작되었다는 사실과 함께  줄기세포 실험 과정에서 벌어진 비윤리적 행위에 대해 양심 선언을 하게 된다.     “이 방송 꼭 내보낼겁니다.”  제보자의 증언 하나만을 믿고 사건에 뛰어든 ‘윤민철’ PD는  ‘이장환’ 박사를 비판하는 것은 국익에 반하는 것이라는  여론과 언론의 거센 항의에 한계를 느끼게 되고,  결국 방송이 나가지 못하게 되는 위기에 처하게 되는데…    대한민국을 뒤흔든 줄기세포 스캔들의 실체가 밝혀진다.,,,,,,,,,,,,,,,,,,,,,,,,,,,,,
2014,124918,제시카&크리스탈,,,제시카, 크리스탈,제시카와 크리스탈 자매의 일상을 밀착 취재한 리얼리티 프로그램,,,,,,,,,,,,,,,,,,,,,,,,,,,,,,,
2014,98481,제이슨 스타뎀의 홈프론트: 가족을 지켜라,액션, 범죄, 스릴러,게리 플레더,제이슨 스타뎀, 제임스 프랭코, 위노나 라이더,갱단에 잠입해 위험한 임무를 완수한 비밀 요원 ‘필’은 은퇴 후, 9살 딸과 함께 조용한 작은 마을로 이사해 새로운 삶을 시작하기로 한다. 하지만 그의 딸이 학교에서 그녀를 괴롭히는 소년을 응징해 교내에 큰 소동을 일으키게 되고, 이 사건을 계기로 ‘필’은 소년의 부모이자 마을의 범죄 조직과 연루된 이들의 주목을 받게 된다. 이후 마을의 오래된 경관과 조직은 그의 일거수일투족을 감시하는가 하면 호시탐탐 ‘필’과 그의 딸에게 위협을 가하는데…     과연 그는 위험천만한 이 마을로부터 무사히 딸을 지켜낼 수 있을까?,,,,,,,,,,,,,,,,,,,,,,,,,,
2014,72627,제인 구달,다큐멘터리,로렌츠 크나우어,제인 구달, 안젤리나 졸리, 피어스 브로스넌,20여 년 전 돌연 자신의 모든 업적과 개인적인 삶을 포기하고  지구 환경보호에 뛰어든 그녀의 열정과 용기,  그리고 그녀를 지지하는 이들이 들려주는 가슴 뜨거운 이야기…    당신의 삶을 변화시킬 놀라운 이야기가 펼쳐진다!,,,,,,,,,,,,,,,,,,,,,,,,,,,,,
2014,129764,제자, 옥한흠,다큐멘터리,김상철,권오중, 성유리, 옥한흠,<광인, 옥한흠>  그는 미쳤던 사람이었다. 복음에 미쳤고, 한 사람, 한 사람을 살리기 위해 미쳤다. 주일 설교를 위해 30시간 이상을 준비했고 스스로 준비되기 위해 노력했다.    <제자, 옥한흠>  그는 예수님의 제자였다. 교회는 세상에서 부름 받은 하나님의 백성인 동시에 세상으로 보냄 받은 그리스도의 제자였다. 그래서 스스로 표현하기를 골병이 들 때까지 보냄 받은 제자로서의 삶을 살았다.    <아버지, 옥한흠>  그는 마지막에 울었다. 예수님이 보고 싶어 울었고, 아내와 자녀들에게 미안해서 울었다. 그리고 마지막 병실에서 성도들을 위해 울었다.    옥한흠 목사는 한국 개신교에서 한경직 목사 이후로 가장 존경받는 인물로 알려져 있다. 그는 제자훈련으로 잘 알려져 있다. 대형교회 목사로서 누릴 수 있는 모든 것을 배설물로 여겼을 뿐 아니라 한 영혼을 위해 최선을 다한 목사로 통한다. “나는 내 주변에 있는 분들을 비교대상으로 삼은 적이 없다. 나의 비교대상은 사도 바울이고 초대교회 교인들이다. 그들과 비교하면 내가 무엇을 자랑할 것이 있겠는가.” ’제자, 옥한흠’을 한 단어로 요약한다면 비교 대상이 달랐던 사람이었다. 한국교회가 왜 세속화 되었을까? 그것은 항상 주변을 보니까 그렇다고 할 수 있다. 따라서 우리가 보아야 할 대상은 초대교회 교인이고 초대교회에서 말씀대로 살았던 사람이어야 한다. 스스로를 초대교회 교인들과 비교하면서 살면 어떻게 한국교회가 세속화 될 수 있겠는가. <제자, 옥한흠>을 보면 우리의 비교대상이 달라질 수 있을 것이다.,,,,,,,,,,,,,,,,,,,,,
2014,113164,조,드라마,데이빗 고든 그린,니콜라스 케이지, 타이 쉐리던,알콜 중독에 전과 기록을 가지고 있는 57세 '조'(니콜라스 케이지)는 벌목 일꾼들의 관리자로 과거를 잊고 새로운 삶을 시작한다.     어느 날, ‘조’의 일터에 낯선 15세 소년 ‘게리’(타이 쉐리던)가 찾아와 일자리를 요구하고, ‘게리’에게 묘한 동질감을 느낀 ‘조’는 그를 지켜보기 시작한다. 어린 나이임에도 불구하고 어른스럽고 믿음직스러운 ‘게리’에게 ‘조’는 점차 신뢰가 가기 시작한다.    어느 날, 게리가 아버지의 모진 학대 속에 동생을 지키기 위해 고군분투 한다는 사실을 알게 된 ‘조’.   늘 즉흥적인 삶을 살아온 ‘조’에게 불우한 환경 속에서도 강한 생활력과 의지를 가진 소년 ‘게리’는 놀랍기만 하다. 아버지에게 맞아 피를 흘리며 자신을 찾아온 ‘게리’를 ‘조’는 성가신 일에 얽히고 싶지 않다며 차갑게 밀어낸다.   조용히 살고 싶던 ‘조’는 애써 ‘게리’를 모른 채 하지만, 결국 ‘게리’의 든든한 조력자가 되어주기로 결심한다.    힘겨운 생활 속에서 서로의 든든한 버팀목이 되어주며 위안을 얻는 두 남자 ‘조’와 ‘게리’.   함께여서 더 이상 무서울 것 없는 이들에게 감당하기 어려운 시련이 찾아오는데…,,,,,,,,,,,,,,,,,,,,,,,,,,,
2014,111100,조난자들,미스터리, 스릴러,노영석,전석호, 오태경,여행이 스릴러가 된다!    홀로 깊은 산속 주인 없는 펜션을 찾아온 허세 여행자 ‘상진’은 우연히 동네 청년 ‘학수’를 만나 그에게 도움을 받게 된다. 하지만 ‘학수’가 갓 출소한 전과자라는 사실을 알게 되면서 지나치게 친절한 그가 부담스럽기만 하다. 게다가 펜션 주변을 어슬렁거리는 위협적인 사냥꾼, 다짜고짜 하룻밤만 묵게 해달라는 무례한 사람들과 마주치며 괜한 짜증과 왠지 모를 위협을 느낀다.    그날 밤 폭설로 인해 ‘상진’은 낯선 사람들과 함께 펜션에 고립되고, 설상가상 손님 중 한 명이 피를 흘린 채 시체로 발견된다. 누가 살인자인지 모르는 상황에서 ‘상진’과 수상한 사람들 간의 오해와 의심은 점점 쌓여만 가고, 뒤가 구린 듯한 경찰의 등장으로 의문의 살인 사건은 알 수 없는 결말을 향해 치닫게 되는데...,,,,,,,,,,,,,,,,,,,,,,,,,,,
2014,93739,조선미녀삼총사,코미디, 액션, 드라마,박제현,하지원, 강예원, 가인,죄명 불문! 상대 불문!  완벽한 검거율을 자랑하는 조선 팔도 최고의 현상금 사냥꾼이 나타났다!  으뜸가는 미모와 버금가는 무공을 갖춘 실력파 리더 만능검객 진옥(하지원),    돈 되는 일이라면 무엇이든 접수하는 푼수떼기 주부검객 홍단(강예원),  말보다 주먹이 앞서는 시크한 막내, 터프검객 가비(가인).  사라진 십자경을 찾아달라는 왕의 밀명을 받게 된 삼총사.  이제 그들의 손에 현상금이 아닌 조선의 운명이 걸렸다!    “특명! 위기의 조선을 구하라!”,,,,,,,,,,,,,,,,,,,,,,,,,
2014,122559,조선총잡이,드라마,김정민, 차영훈,이준기, 남상미, 전혜빈,조선의 마지막 칼잡이가 총잡이로 거듭나 민중의 영웅이 돼가는 과정을 그린 감성액션로맨스,,,,,,,,,,,,,,,,,,,,,,,,,,,,,
2014,103797,족구왕,드라마, 코미디, 멜로/로맨스,우문기,안재홍, 황승언, 정우식,이름: 홍만섭, 나이: 24세. 신분: 식품영양학과 복학생. 학점: 2.1, 토익 점수: 받아본 적 없음. 스타일: 여자가 싫어하는 스타일. 여자 친구: 있어본 적 없음.   다시 읽어봐도 답 안 나오는 스펙의 주인공 만섭. 지금 당장 공무원 시험에 뛰어들어도 모자랄 판에 캠퍼스 퀸 안나에게 첫눈에 반하질 않나, 총장과의 대화 시간에 족구장을 만들어달라고 하질 않나 아주 그냥 ‘족구 하는 소리’만 하고 있다.   그런데 의외로 퀸카 안나가 요즘 남자애들 같지 않은 만섭의 천연기념물급 매력에 관심을 보이고, 만섭은 급기야 안나의 ‘썸남’인 ‘전직 국대 축구선수’인 강민을 족구 한판으로 무릎 꿇리기에 이른다. 이 사건으로 만섭은 ‘그저 그런 복학생’에서 순식간에 캠퍼스의 ‘슈퍼 복학생 히어로’가 되고, 취업준비장 같이 지루하던 캠퍼스는 족구 열풍에 휩싸인다. 학생들의 열화와 같은 관심 속에서 드디어 시작된 캠퍼스 족구대회! 누가 봐도 허술해 보이는 외인구단 만섭 팀은 복수심에 불타는 강민이 속한 최강 해병대팀을 이기고 사랑과 족구 모두를 쟁취할 수 있을까?    단 한편의 특급 코미디! 사랑과 족구를 그대에게 바친다!,,,,,,,,,,,,,,,,,,,,,,,
2014,53082,존 라베 - 난징 대학살,전쟁, 드라마,플로리안 갈렌베르거,울리히 터커, 다니엘 브륄, 스티브 부세미,제 2차 세계대전 당시 독일 지멘스사 지사장인 존 라베는 중국에서 수력발전 설비를 운영하고 있었다. 그러던 중 일본이 만주를 점령하게 되고 지멘스사에서는 그를 본국으로 돌아오라고 한다.   존 라베의 환송식이 있던 날 갑작스런 일본군의 공습이 시작된다. 존 라베는 중국인 직원들을 회사 안으로 피신시키고 동맹국인 일본의 잔인한 살상에 안전 지대를 만들어 중국인들을 살리기 위해 노력하는데…  난징 대학살 당시 25만 명이 넘는 중국인들을 피난시킨 독일 사업가 ‘존 라베’의 감동 실화!,,,,,,,,,,,,,,,,,,,,,,,,,,,,,
