year,code,title,genre,directors,actors,story,,,,,,,,,,,,,,,,,,,,,,,,,,,,,,,,
2014,19436,007 북경특급 2,코미디, 액션,주성치, 곡덕소,주성치,옛날 중국에선 황제의 보위를 위해 비밀 훈련을 받은 네 인물을 뽑아 보룡일족이라고 불렀다. 보룡일족 네 사람인 공, 희, 발, 제 네사람 중 공, 희, 제는 무술에 관한한 나라안의 최고 귀재였지만 발만은 무술에는 문외한이다. 원래 지방의 의사였던 발은 머리를 짜내 황제에게 바칠 발명품들을 만들어냈다. 암행어사 마패모양의 자석 방어기구와 황제를 위한 초대형 선풍기가 그것. 그러나 황상은 그를 중히 여기지 않고, 다만 발에게 신분을 숨기고 민심을 살피는 임무를 주는데……,,,,,,,,,,,,,,,,,,,,,,,,
2014,129765,1000 : 최후의 전사들,액션, 모험, 드라마,아칸 사타예브,아실칸 톨예포프, 아얀 우테부르겐,칭기즈칸 제국을 재건하려는 준가 족은 카자흐 민족을 학살하고 폭정을 일삼는다.    가족이 몰살당하고 마을이 불태워지는 것을 목격한 사르타이는 7년 뒤 용맹한 청년으로 장성하여  검술 실력을 갈고 닦으며 복수를 다짐한다. 사르타이는 카자흐의 독립을 위해 뜻을 같이하는 청년들을 모아 '천 명의 전사들 '이라는 결사대를 조직하는 한편, 친구의 질투와 배신, 안타까운 사랑과 희생을 겪으며 강인한 전사로 성장한다.     마침내 준가 족을 몰아내기 위한 결전의 날,   사르타이와 ‘천 명의 전사들’은 3만 명의 준가 족 대군에 맞서 역사적인 아니라카이 전투에 나서는데...,,,,,,,,,,,,,,,,,,,,,,,,,,
2014,120699,100인의 뷰티온,,,,민감하고 까다로운 여자의 뷰티고민.  스토리온이 먼저 체험하고 리뷰한   진짜 뷰티 솔루션을 제시한다!    트렌디한 스토리온의 뷰티토커 100인!   그녀들과 함께 뷰티고민을 나누고,  전문가가 제안하는 뷰티 솔루션을 100인이 미리 체험하고 리뷰 한   생생하고 믿을 수 있는 진짜 뷰티 솔루션이 찾아옵니다.     스토리온 과 함께 꿀피부에 도전하세요!,,,,,,,,,,,,,,,,,,,,,,,,,,,,,,,
2014,134204,100인의 선택 - 최고라면,,,이창민, 정주리, 파비앙,5명의 스타가 일일 셰프가 돼 각 지역의 특산물과 라면을 조합한 '최고의 라면 레시피'를 만드는 프로그램,,,,,,,,,,,,,,,,,,,,,,,,,,,,,,
2014,123547,100초 전[戰],,,김진표,다양한 세대의 실력파 보컬리스트들이 자신을 숨긴 채 출연해 그 가수가 갖고 있는 인기, 이미지 등의 차별 없이 오로지 노래로만 대중들의 평가를 받는 가수들의 보컬 전쟁 프로그램,,,,,,,,,,,,,,,,,,,,,,,,,,,,,,,
2014,115240,10분,드라마,이용승,백종환, 김종구, 정희태,방송사 PD시험을 본 ‘호찬(백종환)’은 결과를 기다리며 곧 지방 이전할 공공기관 ‘한국콘텐츠센터’의 6개월 인턴사원으로 입사한다. 정사원 못지않게 허드렛일은 물론 야근에 부서 주말등산까지 동행하여 성실성을 인정받는다. 어느 날 갑작스런 TO로 직원채용공고가 나자, 부장과 노조지부장의 부추김에 호찬도 응시를 한다. 사무실 직원들은 이미 호찬의 채용을 당연시하고 호찬 역시 그 동안 정리해둔 PD시험준비 자료까지 여자친구에게 넘겨주면서 안정된 직장으로의 입성을 고대한다. 옴~~~마? 그런데 이게 웬일? 빽으로 엉뚱한 여직원이 입사한다. 노조지부장은 노조차원에서 문제 삼겠다며 인수 인계를 말리고, 다른 직원들도 낙하산인 신입에게 비협조적일 줄 알았으나~ 정규직과 비정규직의 차이가 이런 것이었던가! 신입은 놀라운 친화력으로 사무실 분위기를 좌지우지하며 호찬이 한낱 인턴이었음을 뼈저리게 깨닫게 한다. 설상가상 신입은 준비부족으로 부서의 중요한 프리젠테이션을 망쳐놓고 호찬에게 잘못을 돌리고, 이 일로 사무실은 풍비박산이 난다. 갑작스런 신입의 퇴사에 부장은 호찬에게 정규직을 제안하는데… 단 10분 동안 운명을 결정해야 한다!! 슬픈데 완전 웃기고, 남 얘긴데 폭풍공감 되는 바로 당신의 이야기가 지금 시작된다!,,,,,,,,,,,,,,,,,,,,,,,,,,
2014,121071,12년만의 재회 : 달래 된, 장국,드라마,김도형, 윤재원,이소연, 남궁민, 김시후,2002년 월드컵 당시 고3 커플이었던 준수와 장국은 하룻밤 불장난으로 임신이 되고, 그로 인해 풍비박산이 난 두 집안이 12년 만에 다시 재회하게 되는 에피소드를 그린 드라마,,,,,,,,,,,,,,,,,,,,,,,,,,,
2014,129791,15소년 표류기:해적섬을 탈출하라,애니메이션, 모험, 가족,나카무라 류타로,마츠모토 리카, 토요사키 아키, 오노 카린,심해 탐사선 아틀란티스호를 제작한 회사의 아들인 부함장 레몬은 친구들과 함께 아빠몰래 아틀란티스호를 타고 시범운행을 하던도중 불의의 사고로 탈출선을 타고 탈출하지만 뜻하지 않게 아무도 모르는 섬으로 표류하게 된다. 그 섬은 전파가 통하지 않는 곳이지만 어떻게든 그 곳을 탈출하려고 갖은 방법을 다 써보지만 허사임을 알게 된다. 한편 한 무리의 해적들도 우연히 같은 곳으로 표류를 하게 되며 먼저 그 섬에 도달한 15소년 일행을 발견하고는 그 섬을 탈출하기 위해 15소년을 이용하고자 공격을 감행한다. 과연 그들은 무사히 그 섬을 빠져나갈 수 있을 것인가…,,,,,,,,,,,,,,,,,,,,,,,,,,,,
2014,120052,1789 바스티유의 연인들,공연실황, 뮤지컬,정성복,루이 들로르, 카미유 루, 로드 자누와,오랜 기근과 귀족들의 횡포가 극에 달한 1789년 프랑스 파리. 시민들은 사치와 향락에 젖어 나라의 재물을 탕진하는 왕비 ‘마리 앙투아네트’와 절대왕정 ‘루이 16세’에 반기를 든다.   소작농인 아버지의 부당한 죽음에 분노한 ‘로낭’은 복수를 다짐하며 누이 ‘솔렌’과 파리로 향하고, ‘조르주 당통’, ‘카미유 데뮬랭’, ‘로베스피에르’를 만나 평민 혁명가로 거듭난다. 한편, 왕실 가정교사인 ‘올람프’는 왕비의 비밀스런 밀회를 도와주려다 우연히 현장에 있던 로낭을 끌어들이게 된다. 몸에 지닌 유인물이 순찰 중이던 경찰에게 발각되어 철창 신세가 된 로낭.     혁명의 불길이 더욱 거세지는 가운데, 대립되는 진영에 선 젊은 두 영혼은 점점 더 깊은 사랑에 빠지고, 결국 올람프는 로낭을 구하기 위해 바스티유 감옥으로 뛰어드는데…,,,,,,,,,,,,,,,,,,,,,,,
2014,102431,18 : 우리들의 성장 느와르,느와르, 드라마,한윤선,이재응, 차엽, 이익준,영화를 좋아하는 평범한 고등학생 `동도(이재응)`는 같은 반의 소위 `잘 나가는` 친구 `현승`을 만나면서 새로운 무리의 친구들과 어울려 다니게 된다. 영화 속 주인공처럼, 누구나 한 번쯤 꿈꿔온 폼 나는 인생을 살아보려는 동도. 하지만 현실은 영화처럼 멋지지도, 파란만장하지도 않다. 자잘한 오해가 쌓여가는 상황 속에서 친구들의 사이마저 조금씩 어긋나기 시작하고, 동도는 자기도 모르는 새 큰 싸움에 휘말리고 마는데…    2014년 제 19회 팜 비치 국제영화제 초청,,,,,,,,,,,,,,,,,,,,,,,,,,
2014,100026,1월의 두 얼굴,스릴러,호세인 아미니,오스카 아이삭, 커스틴 던스트, 비고 모텐슨,여름의 끝, 아테네에 휴가차 온 체스터와 콜레트. 아테네 신전을 거닐던 그들에게 호감을 느끼며 접근한 여행 가이드 라이달. 아테네에서의 마지막 밤을 즐기려던 부부에게 나타난 낯선 남자를 죽이게 된 체스터는 사건을 은폐시키려 하지만 라이달에게 들키고 만다. 아테네를 빠져 나가기 위해 도움이 절실한 그들에게 라이달은 손을 내밀게 되고,세 사람 사이에 묘한 의심과 긴장감 속에 여행이 시작되는데..,,,,,,,,,,,,,,,,,,,,,,,,,,,,
2014,134240,2014 KBS 가요대축제,,,이휘재, 택연, 윤아,,,,,,,,,,,,,,,,,,,,,,,,,,,,,,,
2014,134603,2014 KBS 연기대상,,,서인국, 박민영,,,,,,,,,,,,,,,,,,,,,,,,,,,,,,,,
2014,134239,2014 KBS 연예대상,,,신동엽, 유희열, 성시경,,,,,,,,,,,,,,,,,,,,,,,,,,,,,,,
2014,133507,2014 MAMA,,,,"음음음음악으로 하나 되는 아시아 최고의 뮤직 시상식 Mnet Asian Music Awards.  <mnet asian="""" awards="""" music="""">는 1999년 영상음악대상으로 시작해 2000년 MMF(Mnet Music Video Festival)", 2004년 MKMF(Mnet KM Music video Festival)를 거쳐 대한민국 음악 산업의 성장과 함께 꾸준히 진화해온 대한민국 대표 음악 시상식입니다.    2009년 MAMA를 기점으로 연말 음악 시상식을 뛰어넘어 ‘아시아 대표 음악 축제’의 첫 출발을 알렸으며, 2010년 첫 해외 개최지 마카오에서 성공적으로 개최된 이후, 2011년 싱가포르, 2012년, 2013년 홍콩으로 이어지며 명실상부 아시아 최고의 음악 축제로 자리잡았습니다.    MAMA는 아시아, 유럽, 북미, 오세아니아 4대 대륙에 동시에 방송되며 전 세계에 K-POP의 위상을 높이고, K-POP 열풍을 확산하는데 앞장서고 있습니다.    다양한 문화, 다른 언어를 가진 전 세계의 아티스트와 팬들이 음악으로 하나되는 축제의 무대, 2014 MAMA! 지금 전 세계가 주목합니다.</mnet>,,,,,,,,,,,,,,,,,,,,,
2014,133506,2014 MAMA 레드카펫,,,블락비, 방탄소년단,본 시상식 전 진행되는 MAMA 레드카펫에서는 화려한 셀러브리티들의 등장과 함께, 다른 레드카펫 행사에서는 볼 수 없었던 아티스트들의 특별한 무대가 더해진다.,,,,,,,,,,,,,,,,,,,,,,,,,,,,,,
2014,134605,2014 MBC 가요대제전,,,김성주, 전현무,,,,,,,,,,,,,,,,,,,,,,,,,,,,,,,,
2014,134238,2014 MBC 방송연예대상,,,김성주, 김성령, 박형식,,,,,,,,,,,,,,,,,,,,,,,,,,,,,,,
2014,134602,2014 MBC 연기대상,,,신동엽, 최수영,,,,,,,,,,,,,,,,,,,,,,,,,,,,,,,,
2014,139430,2014 SBS 대기획 달과 바다,다큐멘터리,장원준,,바다 생물을 키우는 8할은 “달”이다.  지구의 2/3를 차지하는 바다. 바다는 하루에 두 번씩 밀물과 썰물을 반복하며 바다 속을 훑고 지나간다. 이 거대한 물살은 수많은 먹이를 실어 나르며 바다 생물들을 먹여 살린다. 그리고, 달이 차고 기울기를 반복할 때마다 바다는 그에 맞춰 변한다. 그리고, 그에 맞춰 바다 생물들은 산란을 하고 생을 마감하기도 한다. 이처럼 달의 변화는 수많은 생물들의 생존과 삶의 역사를 만들어 왔다.    달, 바다, 그리고 인간  인류가 바다와 관계를 맺기 시작한 그 옛날부터, 사람들은 달의 모양을 보고 바다로 향했다. 한달을 주기로 차고 기울기를 반복하는 달의 모양은 바다에게 보내는 일종의 신호다. 보름달 무렵이면 바다 물은 높이 차올랐다 수 천 킬로미터나 멀리 밀려나간다 이때에 맞춰 어부들은 물빠진 갯벌로 나가거나, 먼 바다로 향한다. 오징어배와 갈치잡이배는 달이 사라지는 그믐 무렵에 바다로 향한다. 달은 바다를 움직이고 인간은 움직이는 바다에 맞춰 살아왔다. 바다와 인간이 공존하는 삶의 방식, 그 이면에는 우주의 신비가 함께 한다.,,,,,,,,,,,,,,,,,,,,,,,,,
2014,134604,2014 SBS 연기대상,,,박신혜, 이휘재, 박서준,,,,,,,,,,,,,,,,,,,,,,,,,,,,,,,
2014,134601,2014 SBS 연예대상,,,이경규, 성유리, 배성재,,,,,,,,,,,,,,,,,,,,,,,,,,,,,,,
2014,134241,2014 가요대전 SUPER5,,,닉쿤, 정용화, 송민호,세계 최고의 K-POP 아티스트들이 총출동하는 스펙터클한 음악 축제의 탄생!     2014 , SBS 가요대전 - SUPER5   올 한해 트렌드와 핫 키워드를 담은 5개의 크리에이티브하고 폭발적인 무대가 펼쳐진다!  한층 업그레이드된 공연 구성과 라이브무대로 새로운 브랜드 가치를 가진,  세계적인 쇼에 여러분을 초대합니다!,,,,,,,,,,,,,,,,,,,,,,,,,,,,
2014,128804,2014 나는 가수다,,,효린, 플라이 투 더 스카이,화려한 보컬리스트들의 무대를 볼 수 있는 추석특집 프로그램,,,,,,,,,,,,,,,,,,,,,,,,,,,,,,,
2014,120511,2014 나도 별 Idol Battle,,,데니안,2014 실력 있는 아이돌들의 매력 발산 프로젝트. 12시간 동안 일어나는 신인 아이돌들의 리얼배틀! 양보는 없다! 패배도 없다! 매회 신인 아이돌 두 팀은 아침에 눈을 뜬 순간부터 시작해 상대 팀이 준 미션 등의 치열한 배틀을 하는 리얼리티 프로그램,,,,,,,,,,,,,,,,,,,,,,,,,,,,,,,,
2014,133513,2014 드라마 페스티벌,드라마,,,경쟁력 있는 젊은 감독과 신인, 기성작가의 만남을 통해 실험적인 9편의 드라마를 선보이는 프로그램,,,,,,,,,,,,,,,,,,,,,,,,,,,,,,,
2014,131482,2014 드라마 페스티벌 - 가봉,,장준호,서예지, 허정도, 정호근,딸의 결혼식을 앞둔 한 여자가 30여 년전 자신이 일했던 곳을 찾아와 과거를 회상하게 되면서 일어나는 이야기를 다룬 드라마,,,,,,,,,,,,,,,,,,,,,,,,,,,,,,
2014,131511,2014 드라마 페스티벌 - 기타와 핫팬츠,,,한승연, 김다현, 김영훈,과거에 갇혀 지내던 기타리스트 태주와 현재 상황을 돌파하고픈 아이돌 안나의 이야기를 다룬 드라마,,,,,,,,,,,,,,,,,,,,,,,,,,,,,,
2014,129376,2014 드라마 페스티벌 - 오래된 안녕,,김희원,장혁, 장나라, 고두심,죽음을 앞둔 전 부인을 살리기 위해 시간 여행을 떠나게 된 남편의 이야기를 다룬 드라마,,,,,,,,,,,,,,,,,,,,,,,,,,,,,,
2014,131435,2014 드라마 페스티벌 - 원녀일기,,,오상진, 김슬기, 채수빈,조선시대 노처녀의 혼인에 대한 고민을 담은 청춘멜로사극 드라마,,,,,,,,,,,,,,,,,,,,,,,,,,,,,,
2014,129139,2014 드라마 페스티벌 - 터닝포인트 ,,,이종혁, 신다은, 김재경,만년 재연배우 염동일이 우연히 톱스타 광팬의 목숨을 구하며 인생 첫 스포트라이트를 받게 되는 이야기,,,,,,,,,,,,,,,,,,,,,,,,,,,,,,
2014,131448,2014 드라마 페스티벌 - 하우스, 메이트,,,윤현민, 남규리, 고보결,아내와 친구로부터 배신당한 깊은 상처로 힘들어하는 남자와 그 남자의 앞에 어느 날 등대처럼 나타나 길잡이가 되어주는 여자의 이야기를 그린 드라마,,,,,,,,,,,,,,,,,,,,,,,,,,,,,
2014,129371,2014 드라마 페스티벌 - 형영당 일기,,이재진,이재윤, 임주환, 이원근,좌포청 종사관인 철주가 쇠락한 기방에서 독살된 채 발견된 젊은 남자의 시신을 수사하게 되면서 일어나는 이야기,,,,,,,,,,,,,,,,,,,,,,,,,,,,,,
2014,125723,2014 미스 섹시백,,,,대한민국 최고의 뒤태 미녀를 찾아라!   2014 Miss Sexy Back 선발대회,,,,,,,,,,,,,,,,,,,,,,,,,,,,,,,,
2014,127716,2014 베를린 필하모닉 발트뷔네 콘서트,공연실황,,구스타보 두다멜,‘숲의 무대’라는 의미를 가진 베를린의 발트뷔네는 유럽에서 가장 매혹적인 야외 원형극장 중 하나이며, 매년 베를린 필하모닉의 여름콘서트가 개최되는 곳이기도 하다. 전통적으로 한 시즌을 마무리하는 공연인 발트뷔네 야외 콘서트는 매년 6월 마지막 일요일에 약 2만여 명의 관중과 함께 한다. 올해는 구스타프 두다멜의 지휘로 차이코프스키가 셰익스피어의 연극, 템페스트와 로미오와 줄리엣에서 영감을 받아 작곡한 교향곡 판타지아와 서곡 판타지를 선보이다. 세 번째 곡은 요하네스 브람스의 교향곡 1번으로 차이코프스키의 음악과는 전혀 다른 매력을 느낄 수 있다.     프로그램    표트르 일리치 차이코프스키 | 템페스트, 교향적 환상곡 / 로미오와 줄리엣, 환상 서곡  Piotr Ilyich Tchaikovsky | The Tempest, Symphonic Fantasy after Shakespeare / Romeo and Juliet, Fantasy Overture after Shakespeare    요하네스 브람스 | 교향곡 제 1번  Johannes Brahms | Symphony No. 1 in C minor     레너드 번스타인 | 왈츠 디베르디멘토  Leonard Bernstein | Divertimento, Walzer 왈츠 디베르디멘토    조아키노 로시니 | 윌리엄 텔 서곡 - 알레그로 비바체  Gioacchino Rossini | William Tell Overture - Allegro Vivace     파울 링케 | 베를린의 공기  Paul Lincke | Berliner Luft,,,,,,,,,,,,,,,,,,,,,,,,,
2014,122030,2014 베를린 필하모닉 유로파 콘서트,공연실황,,다니엘 바렌보임,베를린 필하모닉의 창립일을 기념하며 시작된 유로파 콘서트는 발트뷔네 콘서트와 더불어 베를린 필하모닉을 대표하는 양대 이벤트로 수많은 음악애호가들의 열렬한 사랑을 받고 있다. 1991년부터 매년 5월 1일 유럽의 명승지를 순회하는 유로파 콘서트는 그 동안 프라하, 마드리드, 런던, 피렌체, 상트페테르부르그, 베르사이유, 스톡홀름, 베를린, 이스탄불, 리스본, 아테네, 부다페스트, 모스크바, 나폴리, 비엔나 등의 유럽 주요 도시를 순회하며 연주해 왔다. 2014년 베를린에서 열리는 유로파 콘서트는 다니엘 바렌보임이 지휘를 맡는다. 그동안 클라우디오 아바도(1991,1994,1996,1998,2000, 2002), 다니엘 바렌보임(1992, 1997), 베르나르트 하이팅크(1993, 1999), 주빈 메타(1995), 마리스 얀손스(2001), 피에르 불레즈(2003), 사이먼 래틀(2004, 2005) 등이 베를린 유로파 콘서트의 지휘자로 선정되었다.    프로그램  Otto Nicolai ············· Overture to Die lustigen Weiber von Windsor (The Merry Wives of Windsor  오토 니콜라이 ············· 윈저의 즐거운 아낙네들  Edward Elgar ············· Falstaff, symphonic study in C minor, Op. 68  에드워드 엘가 ············· 팔스타프 C minor, Op. 68  Piotr Tchaikovsky ············· Symphony No. 5 in E minor, Op. 64  표트르 차이코프스키 ············· 교향곡 5번  오케스트라: 베를린 필하모닉 (Berliner Philharmoniker)  콘서트홀: 베를린 필하모니아 (Berliner Philharmonia)
2014,118645,2014 베를린필하모닉 신년음악회,공연실황,사이먼 래틀,,베를린 필하모니아홀에서 울려 퍼지는 흥겨운 리듬의 무곡과 피아노 협주곡.,,,,,,,,,,,,,,,,,,,,,,,,,,,,,,,,
2014,126522,2014 브라질월드컵 특집,,,,공은 어디로든 굴러간다. 하지만 감독은 그 공의 방향을 안내하고, 선수는 공을 직접 다루며, 팬들은 그 공의 움직임을 본다. 축구는 이 둥근 공을 둘러싼 전쟁이다.,,,,,,,,,,,,,,,,,,,,,,,,,,,,,,
2014,124924,2014 빈필하모닉 여름음악회,,,크리스토프 에센바흐, 랑랑,빈필하모닉 여름음악회는 매년 5월 말 여름의 시작을 알리며, 오스트리아 빈의 가장 대표적인 건축물이자 로코코 양식의 최대 걸작이라 불리는 쉔부른 궁전 앞에서 펼쳐진다.   조명과 별빛이 하나의 장관을 이루며 시민과 관광객 등 10만여 명이 함께 즐기는 지상 최대의 클래식 여름음악회이다. 올해는 마에스트로 크리스토프 에센바흐가 지휘하고, 랑랑이 특별게스트로 출연한다.,,,,,,,,,,,,,,,,,,,,,,,,,,,,,
2014,118646,2014 빈필하모닉신년음악회,공연실황,다니엘 바렌보임,,빈 신년음악회는 오스트리아의 대표적인 관현악단인 빈 필하모닉 오케스트라가 매년 1월 1일 정오에 빈 음악협회 대강당에서 개최하는 음악회로, 정식 명칭은 빈 필하모닉 오케스트라 신년음악회(Neujahrskonzert der Wiener Philharmoniker)입니다.   빈필하모닉 오케스트라 2014년 신년음악회의 지휘자는  '다니엘 바렌보임’입니다. 2009년에 이어 2번째로 신년음악회의 지휘자로 선정되어 2014년 1월1일 기품있고 섬세한 음악을 들려 줄 예정입니다.,,,,,,,,,,,,,,,,,,,,,,,,,,,,,,,
2014,122407,2014 소치 동계올림픽 특집 - 고마워요 김연아,다큐멘터리,,,2014 소치 동계올림픽 김연아를 주인공으로 한 다큐멘터리,,,,,,,,,,,,,,,,,,,,,,,,,,,,,,,,
2014,122408,2014 소치 동계올림픽 특집 - 아디오스 퀸연아,다큐멘터리,,,2014 소치 동계올림픽 김연아를 주인공으로 한 다큐멘터리,,,,,,,,,,,,,,,,,,,,,,,,,,,,,,,,
2014,130907,2014 슈퍼모델선발대회,,,한고은, 최기환, 유이,SBS 슈퍼모델선발대회 23주년, '변화와 도전'의 역사. 올해로 23주년을 맞이하는 슈퍼모델 선발대회! 동시에 스물세 번의 변화와 도전의 역사를 간직한 패션 버라이어티 축제. 이제는 모델 선발대회를 넘어 수많은 스타와 각계 엔터테이너를 배출해낸 사실, 원조 모델 선발대회로서의 위용과 지난 발자취, 그리고 올해 대회의 기대와 염원을 담은 본격 예고, 지금부터 시작!,,,,,,,,,,,,,,,,,,,,,,,,,,
2014,73430,2014 지구 최후의 날,SF, 스릴러,테리 커닝햄,스티븐 볼드윈, 에이미 프라이스-프랜시스,평화로운 나날이 지속되던 지구. 달에 미처 감지하지 못한 소행성이 충돌해 소행성의 잔해들이 달무리를 이루는 장관을 바라보던 중 잔해 조각 중 지구 중력에 이끌려 들어온 운석이 떨어지게 되자 우주 과학 연구소와 우주 과학자 라나 게일 박사 사이에 앞으로 지구에 벌어질 일에 관한 논쟁이 벌어진다. 한편 공사 부지의 건물 폭파 전문팀을 이끄는 존은 볼티모어에 떨어진 운석의 피해 부지 정리를 돕기 위해 나서는데...,,,,,,,,,,,,,,,,,,,,,,,,,,,,,,
2014,134809,2014 트로트 대축제,,,임백천, 홍진영,국내 톱 성인가수들이 총출동하는 트로트 무대,,,,,,,,,,,,,,,,,,,,,,,,,,,,,,,
2014,91192,300: 제국의 부활,액션, 드라마, 전쟁,노암 머로,에바 그린, 설리반 스탭플턴, 로드리고 산토로,BC 480년 페르시아의 '크세르크세스' 황제는 100만 대군으로 그리스를 향해 진군하고.  육지에선 스파르타의 왕 '레오니다스' 가 이끄는 300명의 전사들이 싸우는 동안, 같은 시기 그리스의 장군 '테미스토클레스' 는 '아르테미시아' 가 이끄는 엄청난 규모의 페르시아 해군과 살라미스 해협에서 부딪히게 되는데...,,,,,,,,,,,,,,,,,,,,,,,,,,,
2014,109941,3인의 사기단: 진범을 찾아라,범죄, 코미디, 드라마,시나가와 히로시,후지와라 타츠야, 나카시마 미카, 다나카 코키,인생 역전을 위해 은행 털이를 성공시킨 악당 세 명," 카바레 클럽 ""허니 바니""의 점장 슈우(후지와라 타츠야)", 보이 코지(타나카 코키), 단골손님 켄상(코스기 류이치)는 은행을 털어 손에 넣은 1억 6천만 엔을 3분의 1씩 서로 나누기 일보직전! 욕심에 점점 눈이 멀게 된 세 명은 각자의 몫을 조금이라도 늘리고 싶어하면서 꼬리에 꼬리를 무는 배반과 사기극이 시작된다. 설상가상 갑자기 나타난 자비라고는 눈꼽만큼도 없는 사채업자 ‘할멈’과 이 모든 상황을 통제실에서 지켜보고 있는 허니 버니 클럽 사장 ‘하마’. 그들 역시 1억 6천만 엔을 강탈하기 위해 이 말도 안 되는 사기극에 동참하게 되는데… 과연 1억 6천만 엔을 손에 거머쥘 자 누가 될 것인가!,,,,,,,,,,,,,,,,,,,,,,,,,
2014,86387,4명의 암살자,스릴러,스탠리 J. 오젤,미겔 페레, 윌윤리, 메르세데스 레나드,최고의 실력을 가진 청부살인업자인 마커스, 일라이, 코딜리아, 체이스가 홍콩의 한 호텔에서 모임을 갖는다. 이들에겐 해결해야할 일이 있었다. 이들이 ‘그분’이라고 일컫는 보스가 일라이, 코딜리아, 체이스를 보내 마커스에 대한 책임을 추궁하게 한 것이다. 마커스는 싱가폴에 사는 부부를 처리하기로 했지만 여자를 죽이지 못하고 살려둔 것이다. 보스가 전화하기로 한 시간은 밤 10시. 그때까지 일라이와 마커스, 코딜리아는 옛이야기도 하면서 식사를 한다. 화기애애한 분위기는 계속되지 못한다. 소외감을 느낀 다혈질인 체이스의 우발적인 행동으로 코딜리아가 죽게 되고 그 와중에 일라이는 지병으로 쓰러진다. 체이스는 마커스에게 고문을 가하며 위협하지만 묶인 손을 푼 마커스와 체이스가 혈투를 벌이고 결국 마커스는 체이스를 죽인다. 깨어난 일라이의 도움으로 마커스는 그가 살려서 보호해왔던 여자와 함께 새로운 인생을 시작하려 하는데....,,,,,,,,,,,,,,,,,,,,,,,,
