year,code,title,genre,directors,actors,story,,,,,,,,,,,,,,,,,,,,,,,,,,,,,,,,
2014,134222,라스트건맨,액션, 범죄,나단 프랭코스키,릭 크로포드, 마티 맥과이어, 콜린 서튼,아일랜드 벨파스트. IRA는 자유를 수호하기 위한 군 조직이었지만 마약판매와 테러리스트 훈련을 일삼는 국제 범죄조직으로 변질되었다. 미키는 마약거래를 하던 중, 이유도 없이 장애자를 죽이려던 동료 머서를 죽이게 된다. 조직에게 쫓기게 된 미키는 LA로 가서 새로운 삶을 시작하려 하지만 여자 친구 니나의 오빠 지미로 인해 또다시 마약거래에 연루되어 어쩔 수 없이 지미를 도와주어야 하는 상황에 몰린다. 하지만 일이 해결되기는커녕 점점 더 꼬여가기만 하더니 무자비한 마약거래 조직은 지미와 마약단속반 위장요원까지 죽이게 되고 미키만 겨우 빠져 나온다. 하지만 험난한 미키의 인생은 여기서 그치지 않는다. 죽였다고 믿었던 머서가 LA까지 와서 니나를 납치하고 미키를 부르는데...,,,,,,,,,,,,,,,,,,,,,,,,,,,,
2014,94766,라스트베가스,코미디,존 터틀타웁,마이클 더글라스, 로버트 드 니로, 모건 프리먼,어느 날, 32세 연하 애인과의 결혼을 전격 발표한 빌리(마이클 더글라스)!  인생 마지노선에서 사고친 절친을 축하하기 위해 58년산 우정을 자랑하는 패디(로버트 드니로), 아치(모건 프리먼) 그리고 샘(케빈 클라인)이 라스베가스에 모였다!    노후연금을 건 카지노 한판은 물론, 비키니를 입은 쭉빵미녀들의 풀장 콘테스트에 신나는 음악과 술이 있는 댄스 클럽, 대미를 장식할 최고급 펜트 하우스 총각파티까지!  인생 제대로 놀 줄 아는 무적의 4인방 꽃할배들의 레알 우정 투어가 시작되는데…  과연 할배들에겐 무슨 일이?,,,,,,,,,,,,,,,,,,,,,,,,,,
2014,127721,라이벌 매치 - 압도적 7,,박세진,컬투,누가 앞서는지 누구나 궁금해하지만, 아무도 알려주지 않았던 두 가지를 놓고, 7개 항목으로 완벽 비교 분석하는 신개념 라이벌 토크쇼,,,,,,,,,,,,,,,,,,,,,,,,,,,,,,
2014,122094,라이브 프롬 스페이스,다큐멘터리,론 드 모라에스,릭 마스트라치오, 코이치 와카타, 마이클 J. 마시미노,세계 최초로 지구의 표면으로부터 400km 높이에 위치해 있으며 초당 7.9km를 이동하는 약 1천억 달러 규모의 스튜디오, 바로 국제우주정거장(이하 ISS)에서 생방송으로 진행되는 <라이브 프롬 스페이스(원제: Live From Space)> <라이브 프롬 스페이스>는 90분마다 지구를 한 바퀴 돌고 있는 국제 우주 정거장(이하 ISS)과 휴스턴 소재의 NASA 우주 비행 관제 센터를 오가며 진행된다. ISS와 우주 비행 관제 센터로부터 독점 제공된 영상과 라이브로 생생하게 전해지는 우주의 풍경이 비교할 수 없는 경이로움과 감동을 선사한다. 2시간 동안의 생방송에서 우주에서 바라본 도시의 불빛과 오로라, 그리고 천둥번개와 유성에 이르는 지구의 아름다운 광경 뿐만 아니라 우주인들이 몇 달간 체류하며 일하고, 생활하는 우주정거장의 생생한 모습까지 그대로 공개된다.,,,,,,,,,,,,,,,,,,,,,,,,,,,
2014,129196,라이어 게임,,김홍선,이상윤, 김소은, 신성록,총상금 100억 원이라는 돈 앞에 놓인 인간의 다양한 군상을 담은 반전 심리 드라마,,,,,,,,,,,,,,,,,,,,,,,,,,,,,,
2014,89992,라이프 오브 시몬,드라마, 전쟁,리사 오린,빌 스카르가드, 잔 조세프 리퍼스, 카타리나 슈틀러,스웨덴의 시골소년 시몬은 유대계 소년 이삭과 그들의 부모를 만나 책과 음악을 접하며 새로운 세계에 눈을 뜨며 성장한다. 하지만 평온도 잠시, 2차 세계대전이 발발하면서 유대인 탄압이 시작되고 두려움에 떨던 시몬의 부모는 그가 유대계 입양아였던 사실을 말해준다. 충격에 빠진 그는 자신의 핏줄을 찾아 전쟁의 한가운데로 위태로운 긴 여정에 나서는데…,,,,,,,,,,,,,,,,,,,,,,,,,,,,
2014,99809,랄프 스테드먼 스토리: 이상한 나라의 친구들,다큐멘터리,찰리 폴,조니 뎁, 랄프 스테드먼, 헌터 S. 톰슨,[라스베가스의 공포와 혐오] [이상한 나라의 앨리스] 삽화를 비롯해 위험수위를 넘나드는 파격적인 작품으로 전 세계를 놀라게 한 천재 아티스트 ‘랄프 스테드먼’. 지독한 두려움에 압도 당하면서도 평생 그림을 무기 삼아 세상을 더 나은 방향으로 바꾸고자 노력했던 그의 강렬한 작품 세계가 조니 뎁의 내레이션을 통해 스크린에 펼쳐진다!,,,,,,,,,,,,,,,,,,,,,,,,,,,,,,
2014,120078,랑랑 라이브 인 런던,공연실황,크리스찬 커트 바이스,랑랑,클래식 음악계의 슈퍼스타, 천재 피아니스트 ‘랑랑’의 런던 로열 알버트 홀 공연 실황. 대중들이 가장 사랑하는 두 작곡가, 모차르트와 쇼팽의 최고 걸작을 담았다. 영국 최고의 공연장으로 인정받는 5,300석 규모의 로열 알버트 홀이 티켓 오픈 48시간 만에 전석 매진되며 랑랑의 스타 파워를 증명, 클래식계에 이례적인 센세이션을 일으킨 특별한 공연이다. 당대 최고 작곡가들과 건반의 황제 랑랑의 화려한 만남! 현란한 화성과 우아한 클라이맥스, 파워풀한 건반 플레이로 5천 명의 기립박수를 이끌어낸 열정과 감동의 무대, 그 생생한 현장을 스크린을 통해 만난다.,,,,,,,,,,,,,,,,,,,,,,,,,,
2014,125040,랜드 오브 베어스,다큐멘터리,기욤 뱅상,마리옹 꼬띠아르 ,러시아 동쪽에 위치한 야생의 땅, 캄차카 반도.  사람이 발길이 닿지 않는 이 광활한 자연은 불곰들이 지배하는 영역이다.  길고 추운 겨울, 굴속에서 몇 달 동안 먹지도 못한 채 겨울잠을 자는 20,000마리의 곰들은   봄이 되면 하나둘씩 밖으로 나와 자연을 만끽하고, 그 동안 줄어든 체중을 다시 늘리기 위해  먹을 것을 찾아 나선다. 한겨울에도 온천수 덕분에 파릇파릇한 풀들이 돋아나는 간헐천 계곡에서 풀과 식물뿌리로 겨우 허기진 배를 채우고, 봄을 지나 여름이 되면 먼 바다에서 수천 킬로미터를 건너 온 연어들을 만난다.,,,,,,,,,,,,,,,,,,,,,,,,,,,
2014,127340,램페이지 2 - 워싱턴 심판의 날,액션, 범죄, 스릴러,우베 볼,브렌단 플레처, 로슬린 먼로, 마이크 도퍼드,3년 전, 세상에 대한 분노로 대규모 학살을 일으키고 자취를 감춘 ‘빌’이 돌아왔다.   ‘빌’은 대규모 폭탄과 총기를 가지고 방송국 WK7으로 향한다.  ‘빌’ 그 곳에서 방송국 사람들을 인질로 뉴스 앵커 ‘칩’에게 인질을 구할 방법을 알려주는데…    과연, 인질들은 무사할 수 있을까?  ‘빌’ 그의 광기를 확인하라!,,,,,,,,,,,,,,,,,,,,,,,,,,
2014,54370,램페이지 : 더 테러리스트,액션, 범죄, 드라마, 스릴러,우베 볼,브렌단 플레처,대학에 진학하지 않고 부모님과 함께 생활하는 ‘빌’은 독립하라는 부모님의 권유에도 아랑곳 하지 않는다. 지속적으로 독립을 권유하는 부모, ‘빌’의 요구를 들어주지 않고 고집만 부리는 카페 직원, 직장 상사의 불만과 허풍에 가득 찬 친구 ‘에반’까지… 이런 자극들이 ‘빌’의 분노를 폭발시키게 된다.   어느 날, ‘빌’은 대학을 진학하겠다며 부모님에게 한없이 자랑스러운 아들의 모습을 보여 준 뒤, 그 누구도 상상하지도 못할 만큼 끔찍한 일을 벌이고야 마는데…    충격의 총기난사 사건!  그 끝을 확인하라!,,,,,,,,,,,,,,,,,,,,,,,,,
2014,122028,러버스 가이드,다큐멘터리,케니 레이,캐시, 닉, 재스민,세계적인 성교육 베스트 셀러 ‘러버스 가이드’ 20주년 기념판!   당신과 파트너의 오감을 사로잡고 인생에 새로운 활력을 불어넣어 줄 12단계 섹스 가이드!,,,,,,,,,,,,,,,,,,,,,,,,,,,,,,
2014,128807,러브 싱크로,,,전현무,100% 똑같은 DNA는 아니더라도 90% 이상 일치하는 닮은 외모에 가슴 설레는 매력까지 지닌 이들이 펼치는 상상을 초월하는 신개념 러브 데이팅 쇼,,,,,,,,,,,,,,,,,,,,,,,,,,,,,,,,
2014,119993,러브 인 메모리2 - 아빠의 노트,드라마,박선재,정웅인, 윤주희, 윤소희,죽음을 앞둔 아빠가 아내와 딸에게 이별을 준비하는 감동적인 가족 드라마,,,,,,,,,,,,,,,,,,,,,,,,,,,,,,
2014,120041,러브 인 비즈니스클래스,코미디, 멜로/로맨스,알렉상드르 카스타그네티,루디빈 사니에, 니콜라스 베도스,탑승객 그 남자(앙트완)의 이야기  오늘도 여러 여친(?)들과의 아쉬운 작별, 새로운 변호사 사무실 면접을 위해 헐레벌떡 비행기에 탑승했다. 그런데 이게 왠 일? 내 옆자리에 3년 전 여친인 질투의 화신 줄리(루디빈 사니에 분)가 앉아있는 것. 무슨 말부터 해야 할까? 지난 이야기를 꺼냈다. 그녀는 들으려 하지 않는다. 함께 하는 6시간이 수많은 여친들과의 하룻밤보다 짜릿할 것 같다.^^    탑승객 그 여자(줄리)의 이야기  주말에 있을 내 결혼식, 약혼자를 만나기 위해 서둘러 파리행 비행기에 올랐다. 꼼꼼한 남친은 내 덜렁댐까지 챙겨 일거수일투족을 포스트 잇에 남겨둘 정도로 자상(?)하다. 덕분에 늦지 않고 비행기에 탑승했다. 그런데 이게 왠 일? 내 옆자리에는 3년 전 남친인 바람둥이 앙트완(니콜라스 베도스 분)이 앉아있는 것이 아닌가? 이미 나에겐 결혼할 남자가 있고 지난 과거 이야기 따위 듣고 싶지가 않다.  함께 하는 6시간이 지옥 같을 것 같다.T.T    “승객 여러분, 불규칙한 애정기류로 기체가 흔들릴 수 있으니  모두 안전벨트를 착용해 주시기 바랍니다.”,,,,,,,,,,,,,,,,,,,,,,,,,,,
2014,107370,러브, 로지,멜로/로맨스,크리스티안 디터,릴리 콜린스, 샘 클라플린,어릴 때부터 모든 것을 함께 겪어온 단짝 로지와 알렉스는 고등학교 졸업 후 영국의 작은 고향마을을 떠나 미국 보스턴의 대학에 함께 가기로 약속한다. 하지만 서로의 감정을 숨긴 채 각자 다른 파트너와 간 졸업파티에서 한 순간의 실수로 전혀 다른 삶을 살게 된 두 사람. 미국에서 계획대로 인생을 설계해 나가는 알렉스와 달리 로지는 꿈을 접은 채 고향인 영국의 호텔에서 일한다. 몇 년 후, 보고 싶다는 알렉스의 연락을 받은 로지는 다시 한번 희망을 품고 보스톤으로 향하지만 이미 알렉스의 옆에는 다른 여자가 서있는데…    끝없이 엇갈리는 12년의 사랑.  우리, 언제쯤 사랑인 걸 알까요?,,,,,,,,,,,,,,,,,,,,,,,,,,,,
2014,90923,러브, 비하인드,코미디, 드라마,리 톨랜드 크리거,라시다 존스, 앤디 샘버그, 일라이저 우드,완벽한 운명이라고 믿으며 결혼에 성공했지만 6년 만에 별거 상태가 되어버린 부부 셀레스티와 제시. 하지만 둘은 여전히 함께 사는 것은 물론 급기야 서로를 소울메이트라 칭하며 애정표현에도 변함이 없다.   물론 섹스는 절대 금기란 조항만 지킨다면!  어느 날 낭만적인 분위기에 취해 함께 밤을 보내게 된 셀레스티와 제시! 둘은 서로 떨어져 지내는 게 좋겠다고 선언하지만 날이 갈수록 허전한 마음과 서로를 향한 마음이 끝나지 않았음을 알게 되는데... 그러나 완벽하게 남이 된 그들 앞에 둘의 관계를 흔드는 누군가 나타나는데...,,,,,,,,,,,,,,,,,,,,,,,,,,,,
2014,123001,러브멘토,멜로/로맨스,신혜성,서리슬, 유재근,로맨틱 성인 소설가를 꿈꾸는 연애 경험 없는 작가 지망생 예나는 팬션 카페에서 일을 하며 틈틈이 글을 쓴다. 우연히 자신이 일하는 팬션 카페에서 롤모델 상현을 만나게 되고 만취한 상현을 부축하고 가던 중 지나가던 사람과 시비가 붙게 되어 상현은 손을 크게 다치게 된다. 예나는 자신을 보호해 주려다 다친 상현을 위해 청소부터 소설 원고 타이핑 하는 일까지 최선을 다해 도와준다. 그러던 어느 날, 상현은 예나의 미완성 소설을 보게 되고 소설을 완성시키기 위한 문학적 멘토가 되기로 결심하는데……,,,,,,,,,,,,,,,,,,,,,,,,,,,,,,
2014,103807,러브배틀,드라마,자크 드와이옹,사라 포레스티에, 제임스 시어리,베일에 싸인 여자가 아버지의 장례식에 참여하기 위해 아버지가 살던 곳으로 향한다. 아버지에 대한 분노와 그리움으로 혼란 속에 있던 그녀는 옆집에 살고 있던 옛 연인과 마주치게 된다. 혼란스런 상황에서 남자는 여자에게 연인관계를 다시 시작하자고 설득하고, 여자는 그 제안을 받아들이게 되지만 분노로 가득 찬 그녀는 어쩔 줄 모른다.   둘은 점점 가까워지며, 남자는 여자의 내면에 품고 있던 가족에 대한 분노를 끄집어내기 시작한다. 사랑인지 싸움인지 모를 격렬한 몸싸움을 벌이며, 둘은 내면에 가지고 있던 분노와 증오 그리고 사랑이라는 감정을 서로에게 폭발시킨다.  그들의 육체적 행위의 농도는 짙어져 가고, 폭력적 행위는 점점 그 둘 사이를 연결하는 중요한 고리가 되는데…,,,,,,,,,,,,,,,,,,,,,,,,,,,
2014,121716,러브포텐 - 순정의 시대,드라마, 멜로/로맨스,배성진,이성열, 남지현, 클라라,모태 솔로 주인공이 퀸카의 마음을 얻기 위해 순정을 바치는 모습을 그린 이야기,,,,,,,,,,,,,,,,,,,,,,,,,,,,,
2014,126368,러시: 스트리트 레이서,액션, 범죄,올렉 페센코,알렉세이 차도프, 마리나 알렉산드로바, 엘비라 볼고바,갓 제대한 스테판은 아버지가 하던 자동차 정비소를 동생과 함께 운영하던 중 아름다운 카티야를 만나게 되고 그녀의 소개로 길거리 레이싱을 즐기는 다른 친구들을 만나게 된다. 하지만 녀석들의 우두머리인 도커의 꾐에 넘어가 빚을 지게 되고 그걸 갚기 위해 어쩔 수 없이 차량 도난에 가담하게 된다. 도커의 전 여자친구였던 카티야와 도커와 함께하는 다른 친구들 역시 어떤 형태로든 빚을 지고 있다는 것을 깨달은 스테판은 도커를 따돌리려고 하지만...  한편, 도로의 무법자들 때문에 골머리를 썩던 경찰은 대대적인 작전을 통해 놈들을 체포하려고 하나 계획은 실패하고 오히려 농락당하며 성과를 전혀 내지 못한다. 그러던 중 경찰인 카티야의 아버지가 차량 도난 사건 뒤에 더 큰 범죄 조직이 있다는 것을 알게 되고, 조직의 흔적을 쫓기 시작하는데...,,,,,,,,,,,,,,,,,,,,,,,,,,,
2014,81353,런어웨이 걸,코미디, 드라마,데릭 마티니,클로이 모레츠, 블레이크 라이블리, 에디 레드메인,알코올중독자 엄마, 백수한량 아빠와 함께 ‘네브라스카’ 깡 촌에 살고 있는 13세 소녀 ‘룰리’는 자신의 인생이 불행하고 고달프다고 생각한다. 어느 날, 엄마가 다른 남자와 집을 나가버리고, 아빠마저 홧김에 떠나버리자 혼자 남게 된 ‘룰리’는 TV광고를 보고 ‘라스베가스’로 가기로 마음 먹는다. 옷 몇 벌과 지도, 생일선물로 받은 권총 한 자루를 가방에 넣고 나선 길에서 ‘룰리’는 우연히 같은 방향으로 가던 ‘에디’의 차를 얻어 타게 된다. 하지만 그와 동행한지 얼마 안돼 말싸움으로 차에서 내리게 된 ‘룰리’는 이번엔 젊고 예쁘지만 어딘가 비밀을 간직한 듯한 ‘글렌다’의 차를 얻어 타게 되는데…,,,,,,,,,,,,,,,,,,,,,,,,,
2014,123034,런어웨이걸의 정사,멜로/로맨스,아사오 마사히로,아오야마 로라, 니시 코이치로,주인공 마키는 야쿠자 조직에서 비밀리에 거래되는 돈을 훔쳐 연인 아키오와 멀리 떠나 둘이서 평화롭게 살고자 하는 꿈이 있다. 한편 야쿠자의 간부 아와츠는 조직의 자금 7억을 잠시 빼돌려 한국 조폭들과 거래를 하기 위해 아키오에게 운전을 시켜 이동하다가 복면을 한 강도들(마키와 켄지)의 습격을 받아 돈 가방을 털린다. 아키오는 당장 돈을 쓰면 의심을 받을 수 있으니 잠시 동안 류진산에 묻어두고자 산에 오르지만 친구인 켄지의 배신으로 목숨을 잃고, 켄지 역시 마키에 의해 죽임을 당한다.   한편, 류진산은 과거 731 부대가 비밀리에 연구를 하던 곳으로 좀비들이 들끓는 곳, 돈도 잃고 부하도 잃은 아와츠는 친구이자 킬러인 카리바를 고용해 마키를 찾아낸 뒤 그녀를 앞세워 돈 가방을 찾으러 다시 류진산을 오르는데 좀비들의 공격이 시작되는데...,,,,,,,,,,,,,,,,,,,,,,,,,,,,
2014,111527,런치박스,드라마, 멜로/로맨스,리테쉬 바트라,이르판 칸, 님랏 카우르, 나와주딘 시디퀴,매일 아침 인도 뭄바이에서는 5천여 명의 도시락 배달원이 부인들이 만든 점심 도시락을 남편의 사무실에 배달한다. 중산층의 평범한 주부 일라는 소원해진 남편과의 결혼생활에 활력을 불어넣고자 평소보다 더욱 맛있는 점심 도시락을 준비한다. 그러나 그녀의 특별한 점심 도시락이 정년 퇴임을 앞둔 중년의 외로운 회사원 사잔에게 잘못 배달되고 만다. 도시락을 받은 사람에 대한 일라의 호기심은 커져가고, 도시락이 다른 사람에게 배달된다는 사실을 알리는 대신, 도시락 안에 편지를 넣는다. 그렇게 시작된 도시락 편지를 통해 두 사람의 일상은 위안과 활력을 얻는다. 두 사람의 관계는 어느새 친구관계를 넘어 사랑의 감정으로 발전되어 커다란 혼란에 빠지게 되는데……,,,,,,,,,,,,,,,,,,,,,,,,,,,
2014,99094,레고 무비,애니메이션, 액션, 코미디,필 로드, 크리스 밀러,윌 페렐, 리암 니슨, 알리슨 브리,배트맨, 슈퍼맨, 원더우먼, 인어공주, 초록닌자,1980몇년 우주인, 미켈란젤로, 미켈란젤로 닌자거북이, 2002 NBA 올스타 등등  이들 마스터 빌더 사이에서 희망으로 선택된 평범한 미니피겨!  그의 작고 노란 손에 레고 세계의 운명이 달렸다!,,,,,,,,,,,,,,,,,,,
2014,106332,레드카펫,멜로/로맨스, 코미디,박범수,윤계상, 고준희,섹드립의 황제 조감독 진환(오정세), 할리우드를 능가하는 19금 CG계의 감성변태 준수(조달환), 입사하자마자 감춰왔던 음란마귀의 본색을 드러낸 엘리트 출신 막내 대윤(황찬성), 그리고 이들을 이끄는 19금계의 순정마초 감독 정우(윤계상).   백전 백승 무적의 시스템으로 19금계의 흥행 불패 신화를 새로 쓰고 있는 영화 제작사 ‘꼴’사단에게 떨어진 미션! “TOP 여배우를 캐스팅하라!”      자타공인(?) 흥행여신 정은수(고준희)를 전격 캐스팅한 어벤져스 군단은 은수와 함께 NEW 프로젝트를 시작한다. 하지만, 경력 10년 차 베테랑으로 여자에 대해서라면 더 이상 궁금할 것도 없었던 정우의 호기심을 제대로 자극한 은수 덕분에 시작부터 이들 사이엔 므흣야릇(?)한 썸의 분위기가 감지 되는데…,,,,,,,,,,,,,,,,,,,,,,,,,,
2014,120067,레디액션 청춘,드라마,김진무, 박가희, 주성수,동해, 남성준, 김우린,<소문> 김진무 연출  “너 정말 혜리 동영상 봤어?”  학생 회장 선거 발표 당일 ‘정우’(이동해)는 여자친구 ‘혜리’의 임신 사실을 알게 되고, 학교에는 ‘혜리’의 섹스 동영상이 돌고 있다는 소문이 돈다. 곧이어 ‘정우’는 ‘햄릿’이라는 아이디를 가진 익명의 누군가로부터 동영상을 찾아내지 않으면 ‘혜리’의 임신사실을 전교에 퍼뜨리겠다는 협박문자를 받는다.  ‘정우’는 소문이 진짜 일리 없다고 생각하면서도 그런 말도 안 되는 소문을 퍼뜨린 장본인이 누구인지 그리고 ‘햄릿’은 또 누구인지 밝혀내려고 동분서주한다. 소문이 점점 미궁 속으로 빠져들면서 감정을 조절하지 못하게 된 ‘정우’는 결국 가까운 친구마저 믿지 못하고 사람들 앞에서 숨겨왔던 불안한 감정을 터뜨린다.    <훈련소 가는 길> 박가희 연출  “제발 군대 좀 가자! 쫌!!”  논산훈련소 입소를 해야 하는 ‘만재’(정해인)는 팔에 깁스까지 하는 노력 끝에 여자친구 ‘승아’(남지현)의 배웅을 받는데 성공한다. 그러나 우연히 ‘만재’의 고등학교 동창 ‘종구’(구원)를 차에 태우게 되면서 일이 꼬이기 시작한다. ‘종구’는 과거 ‘만재’에게 빵셔틀을 시켰던 전적이 있지만 현재는 이 시대 대표적 잉여, 고졸 백수 신세다. 게다가 지금 ‘종구’는 동네 양아치에 쫓겨 무작정 군대로 도망가던 중이다. 입소 전날 훈련소 앞에 도착해 ‘승아’와 오붓한 밤을 보내려던 ‘만재’의 계획은 수포로 돌아가고 급기야 ‘승아’의 차가 고장이 나면서 이들은 하룻밤을 길거리에서 보내게 된다.  과연 이들은 제 시간에 무사히 입대할 수 있을까?    <세상에 믿을 놈 없다> 주성수 연출  “돈 어딨어? 아까 굴다리 밑에 숨겼냐?”  인터넷으로 만난 20대의 세 젊은이는 개인 정보를 공유하지 않는다는 조건으로 서로를 이교수, 김사장, 박의원이라 부르며 지방의 작은 은행을 터는데 성공한다. 그들은 계획대로 인근 산 속의 폐가로 숨어들어 은행 강도에 썼던 옷가지들을 태우고 총을 묻는 등 증거를 인멸한 뒤 역할에 따라 정해진 비율대로 돈을 나눈다.  하지만 성공의 기쁨도 잠시, 기대보다 적은 액수에 김사장과 박의원은 실망하게 되고 급기야 휴대폰으로 확인한 은행강도 뉴스의 피해액과 차이가 나자 서로에 대해 의심하기 시작한다.    <플레이 걸> 정원식 연출  “세상에는 참 개념 없는 X들이 많아.”  도시 외곽에 위치한 A여자 상고. 회장 ‘고은’(서은아)을 중심으로 ‘혜영’, ‘보라’, ‘주희’는 학교를 휘어잡고 있는 일진 패거리 ‘플걸(play girl)’의 간부 멤버이다. ‘플걸’에는 16년째 매년 수학여행 때마다 전통적으로 내려오는 연례행사 ‘심판의 밤’이 있다. 수학여행의 밤이 되면 멤버들이 모여 플걸 회장의 심판으로 1:1 원터치 대결로 그녀들의 서열을 정한다. 그리고 일종의 ‘개념 없는 년(개년)’들의 리스트인 ‘개년록’에 올라 있는 아이들을 데리고 와 심판하는 것이다.  그런데 얼마 전에 전학 온 ‘연주’가 개년록에 등장하면서 심판의 밤은 이상하게 흘러가기 시작하고 그날 밤 잊을 수 없는 그녀들만의 통과의례가 펼쳐진다.    [2014년 제4회 홍콩한국영화제 개막작],,,,,,,,,,,,,,,,,,,,,
2014,122022,레디액션! 폭력영화,액션,정재웅, 최원경, 김도경,민호열, 오성근, 장우진,#1. Extreme <민호가 착하니 천하무적>   “도대체 저한테 왜 그러신 거예요?”  외딴 시골, 외근 후 서울로 향하던 ‘민호’는 길을 잃고 마을을 헤매다 동네 양아치들과 막장커플에게 돌연 무차별 폭행을 당한다. 그들을 향한 착하디 착한(?) 민호의 반격이 시작되는데…    #2. REAL <메이킹 필름>   “XXX야, 줄 풀어. 줄 풀라고!”  허름한 방, 밧줄로 온몸이 묶인 남자와 복면을 쓴 정체 모를 남자가 언성을 높이고 있다. 갖은 욕설과 비난이 계속되던 중, 급기야 복면 남자가 억눌러왔던 분노를 참지 못하는데…    #3. BITTER <나의 싸움>   “이기는 자가 강한 것이다”  한적한 동네 뒷골목, 어린 시절부터 유약했던 고등학생 ‘도경’은 강해지겠다는 일념으로 동네를 주름잡는 불량 일진회에게 겁 없이 대결을 신청하는데…,,,,,,,,,,,,,,,,,,,,,,,
2014,106298,레바논 감정,스릴러, 드라마, 멜로/로맨스,정영헌,최성호, 김진욱, 장원영,어머니의 첫 기일을 맞이한 헌우는 비어있는 지인의 집에 당분간 머물며 마음을 추스르고 유품을 정리하기로 한다. 1년이라는 시간이 지났음에도 어머니를 지키지 못했다는 사실에서 오는 슬픔과 분노는 여전히 그를 괴롭힌다. 어느 날 여자의 비명소리가 눈 쌓인 산동네의 적막을 깨고, 소리의 진원지를 찾아간 헌우는 산 중턱에서 노루 덫에 걸려 쓰러져있는 여자를 발견해 거처로 데려와 보살핀다. 서로의 이름도 알지 못하면서 하루 만에 묘한 유대감을 느끼기 시작한 그들 앞에 갑작스레 기이하고 공포스러운 사내가 나타나 여자를 데려가려 드는데…,,,,,,,,,,,,,,,,,,,,,,,,,,,
