year	code	title	genre	directors	actors	story	
1993	12280	이노센스	스릴러	존 D. 패터슨	메리 크로스비, 짐 맥도널드	사랑했던 남편의 학대로부터 남성 혐오 증세를 얻은 미녀 캐시(Kathy: 메리 크로스비 분)는 결국 남편을 향해 권총을 겨누며 이렇게 소리친다. "누구든 절대로 내몸에 손대지 못해" 캐시는 결국 정신병원에 입원된다. 한편, 십대소녀 안젤라(Angela: 아만다 위스 분)는 광신도인 아버지와 주유소를 운영하며 정신병원 근처마을에서 살고있다. 아버지는 안젤라에게 꼭 소년처럼 옷을 입고 남자같이 행동하도록 강요한다. 그러나 안젤라는 청순하고 매력적인 여인이 되길 바라며 경찰관 봅(Bob Appling: 앤드류 스티븐스 분)을 남 몰래 사랑한다. 봅은 다정하고 안젤라에겐 항시 동정적이었다. 어느날, 안젤라 아버지는 갑자기 세상을 떠난다. 홀로 슬픔에 젖어있는 안젤라. 상태가 호전되던 캐시는 발작적으로 남자 간호사를 살해하고 병원을 탈출한다. 뭔가에 이끌려 안젤라의 집에 온 캐시는 안젤라 엄마가 생전에 입던 옷으로 갈아 입는다. 쇼핑에서 돌아온 안젤라는 죽은 엄마와 닮은 캐시를 보고 놀란다. 캐시는 엄마의 사촌이라고 말하고 둘은 곧 친해진다. 캐시로부터 안젤라는 소녀답게 되는 여러가지를 배우며 행복에 젖어든다. 그러나 행복은 잠깐, 캐시에겐 남자로부터의 자기보호 본능과 안젤라를 보호해야한다는 강박관념이 솟구쳐 주유소에 오는 남자를 살해하기 시작했고, 안젤라는 자기도 모르게 캐시를 돕는다. 그러나 캐시의 정체를 의심하고 봅에게 알려주려 하지만. 이미 이성을 잃은 정신이상자와의 숨바꼭질은 혼란스럽게 전개된다. 이 영화는 성적 피해자인 여성과 가해자인 남성간의 그 당위성을 제시해준다.
1993	13450	이스트 L.A 스토리	범죄, 드라마	테일러 핵포드	제스 보레고, 벤자민 브랫, 엔리크 카스틸로	파코(Paco: 벤자민 브래트 분)와 크루스(Cruz: 제시 보레고 분)는 사촌인 미클로(Miklo: 다미안 차파 분)와 LA의 멕시코계 미국인 지역인 치카노에서 성장한다. 파코는 거리의 부사인 반면 크루스는 예술적 재능의 소유자이다. 미클로는 혼혈아로 흰 피부와 푸른 눈 때문에 치카노 세계에서 받아들여지지 않아 치카노 일원이 되려고 애쓴다. 셋은 죽을 때까지 우정을 지킬 것을 서약한다. 어느날 크루스는 캘리포니아주 미술 작품 심사에서 1등을 하나 경쟁 조직인 트레스 푼토스의 습격으로 척추가 부러진다. 다음날 보복을 하기 위해 적의 두목 스파이더(Spider: 레이 오리엘 분)를 모욕하나 스파이더는 총을 피코에게 쏘고, 이를 본 미클로가 스파이더를 사살하나 자신도 중상을 입는다. 그후 미클로는 감옥에 가고, 여기서 몬타나(Montana: 웬니크 캐스틸로 분)라는 치카노가 두목인 '라온다'라는 조직을 알게 된다. 그리고 라온다에 가입한다. 얼마후 몬타나의 충고로 모범수가 되어 가석방 된 그는 바른 생활을 하려하나 바깥세상은 더 썩어있었다. 미클로는 크루스의 빚을 갚기 위해 강도 계획에 합류한다. 그러나 한 치카노의 밀고로 경찰이 출동 그중 한명은 파코이다. 결국 두사람은 총을 잡고 마주친다. 미클로가 도망치자, 갈등하던 파코는 그의 다리를 쏜 뒤 체포, 미클로는 다시 수감된다. 얼마 후 라온다 단원들은 흑인들을 꺾고 마약시장을 장악할 것을 주장하나 몬타나는 끝내 반대한다. 몬타나는 흑인 두목과 협상, 양측이 화해하도록 주선할 것을 약속한다. 이를 위해 몬타나는 다른 감옥을 방문하려고 지휘를 미클로에게 맡긴 후 떠난지만 그 다음날 흑인의 칼에 맞아 숨진다. 범인은 자신이 보나 피데의 메시지를 받았다고 주장하나, 보나피데는 그것이 모함이라 강조한다. 백인조직 두목들을 전멸시킨 라온다 당원은 흑인 두목들도 모두 살해한다. 교도소 장은 라온다의 해체를 결심한다. 두목들과 마지막 회의를 여는 자리에서 미클로는 이 사실을 시련의 기회로 전환시킬것을 당부한다. 한편 크루스는 마약 중독에서 벗어나 치카노의 꿈을 그린 대형 벽화를 완성하고 이것을 피코에게 보여준다. 그림앞에서 둘은 춤을 추며 화해하는데...
1993	22694	이혼녀		조우진	윤정아, 유진영, 윤철형	대학 동창생인 혜자, 정희, 지연은 부부 동반으로 파티를 열기로 하고 별장으로 간다. 그러나 뜻하지 않게 건달패인 동현 일당에게 남편들이 보는 앞에서 강간을 당하고 만다. 이 사건으로 부부생활은 파탄에 빠지고 이혼 직전까지 몰고간다. 별거 생활에 들어간 혜자, 정희, 지연은 그날의 악몽에서 벗어나고자 제나름대로 애를 쓰지만 가정 파괴범들이 저지른 끔찍한 상황에서 오는 후유증을 벗어나지 못하고 정희가 자살하고 만다. 충격적인 일련의 사건이 계속 벌어지자 혜자는 무의미한 생활을 벗어나고자 혼자 여행을 떠나보지만 뭇 남자들의 끊임없는 유혹 속에서 곤혹스런 나날을 보낸다. 그러나 혜자는 남편과 딸의 뜻밖의 방문을 계기로 다시 가정으로 돌아가기로 하고 긴 방황을 끝맺는다.
1993	13329	인터셉터	액션	마이클 콘	주겐 프로크노, 앤드류 디보프, 엘리자베스 모어헤드	전투기 시험 조종사 월필드 대위(Capt.Christopher Winfield: 앤드류 디보프 분)는 터키에서 장비 이상으로 시험비행에 실패한 후 스텔스기 두대를 실은 미군 수송기 편으로 귀국길에 오른다. 필립스(Phillips: 조젠 프로크노 분)를 두목으로 한 국제적인 범죄조직이 스텔스기를 노리고 치밀한 계획을 세운다. 이들은 수송기의 교신 암호를 알아내고 공중급유를 위해 접근하는 유조기를 되돌려 보낸 후 자기들이 공중급유기로 위장하여 수송기에 탑승, 승무원들을 한명씩 제거하며 스텔스기를 탈취하려고 한다. 수송기에 손님으로 편승하던 월필드는 이들과 대결한다. 범인들은 승무원을 모두 살해하고 여조종사 모건(Maj. Janet Morgan: 엘리자베스 모리헤드 분) 한 명만 남긴 채 자신들이 원하는 방향으로 항로를 바꾼다. 그러나 월필드와 악당들이 대결하는 동안 비행기가 충격을 받아 추락하게 된다. 필립스는 스텔스기를 타고 탈출한다. 월필드도 나머지 스텔스 한대를 타고 추격, 치열한 공중전 끝에 악당 두목 필립스를 격추시키고 불시착한 수송기를 찾아 구사일생으로 살아남은 모건을 구조한다.
1993	90067	일과 사랑	드라마	정문수	한혜숙, 이영하, 노주현	
1993	12761	일도경성		홍금보	홍금보, 관지림, 조장군	청조말, 중국은 개혁과 보수의 양 파벌의 암투로 국가마저 흔들릴고 있었다. 개혁파의 거두 강공의 초청을 받아 중국 동북부에서 중국개혁을 지휘하기 위해북경으로 향하던 남사동은 우연한 기회에 수도경비군의 원세계와 대만에서 흑기군으로 활약하던 왕오를 만나 동행하게 된다. 그러나 일단 북경에 도착한 남사동은 원세계가 보수세력의 군사 지휘자라는점을 알고 서먹한 관계가 된다. 왕오는 담소동과 강공의 후원으로, 개혁파의힘이 될 인력을 기르기 위한 도장을 개설한다. 무술을 열성적으로 좋아하는 보수파 예천왕은 무술이 출중한 왕오를 끌어들이려고 하지만 뜻을 이루지 못한다. 황제를 앞세운 개혁파와 왕비를 앞세운 예천왕 일파와 보수파 세력의 대립은마침내 왕비폐위를 둘러싸고 위기를 맞는다. 개혁의 성패는 원게계가 이끄는신식군대 수도경비사단의 향배에 달렸다. 남사동은 열성적으로 원세계를 끌어들이려 했으나 실패, 결국 사형내의 이슬로 사라지고, 왕오도 원세계의 칼에세상을 떠난다. 이렇게 개혁을 꿈꾸던 중국은 한 세대전으로 되돌아가게 한다.
1993	92464	일월	드라마	최길규	홍리나, 이아로, 박인환	
1993	51500	일지매	드라마, 액션	조중현	장동건, 김동현, 염정아	
1993	44492	자매들	드라마		양미경, 이주경, 홍리나	아침 시간대 주시청층인 삼사십대 여성들을 위한 여성 드라마 <자매들>은 각기 다른 성격과 가치관을 지닌 다섯 자매들의 이야기를 통해 해를 거듭해온 여성의 문제를 차분히 꼽씹어보게 해줄 것이다.여자란 무엇인가? 여자의 삶이란 남자에게 종속될 수밖에 없는가. 결혼이란 또 무엇인가? 결혼의 참다운 의미는 어디에 있는가. 행복이란 과연 환상에 불과한 것인가. 세상에 인류가 생겨나면서부터, 남성과 여성이라는 두 개의 성이 이 땅위에 공존하게 되면서부터, 어쩌면 여자들은 숙명적으로 이러한 숙제들을 떠맡고 살아야만 했는지도 모른다. 할머니의 할머니의 또 그 할머니 때부터 차곡차곡 안으로 다져오고 쌓아온 한의 무게, 21세기를 눈앞에 둔 최첨단의 오늘을 살아가는 요즘 여성들도 이러한, 해를 거듭해온 진부한 숙제들에 대해서는 좀처럼 명쾌한 해결책을 찾아내지 못하고 있는 게 사실이다. 올 가을 MBC 프로그램 개편과 함께 시청자들에게 선보일 새 아침 드라마 <자매들>에서도, 이러한 해묵은 숙제들에 대한 여성의 갈등, 고통, 번민, 그리고 희망들이 그 답을 찾아 몸부림칠 것이다. “드라마는 우선 재미가 있어야 되는 거 아닙니까? 재미있게 보고 난 뒤에 감동까지 줄 수 있다면 연출로 신 더 바랄 게 없죠. <자매들>은 아침 드라마입니다. 그리고 여성 드라마죠. 드라마를 보면서 ‘그래 맞아, 어쩜 저렇게 내 얘기 같을까. 세상에 저럴 수가 있어’ 라며 고개를 끄덕거리게 할 수만 있다면 일단 성공한 것이라고 생각합니다. 가장 자연스럽게 시청자들과 만날 수 있는 드라마, <자매들>은 바로 그런 드라마가 될 겁니다.” 여성 문제에 대해 유달리 많은 관심을 가져온 중견 연출가 김지일은 이번 새 아침 드라마를 통해 여성들의 삶을 탄탄한 구성으로 그려나갈 계획이다. 이번 드라마에서는 우리의 드라마 사상 보기 드물게 두 개의 원작을 하나의 드라마로 엮어내고 있는데. 김진옥 원작의 <북두칠성>이 주인공 정남이를 둘러싼 가족들의 얘기를 꾸려가고 있다면, 유덕희가 지은 <그대 잠 속의 나의 꿈>은 주인공 정남이의 생애를 보여주게 된다. 정남이의 어머니 서 씨는 딸만 다섯을 낳고 또다시 여섯 번째 딸을 낳다가 그만 세상을 떠난다. 아들을 못 낳아 시어머니와 시집 식구들로부터 구박과 천대만 받고 살다 죽은 어머니의 무덤가에서 어린 다섯 자매는 절대 시집 같은 건 가지 않겠노라고 맹세를 한다. 그러부터 이십 년 후, 어머니 기일을 맞아 자매들은 다시 어머니 무덤 앞에 모였다. 삼십대 중반인 큰언니 말숙(양미경 분)은 언어학 조교수로 무역회사 부장인 남편 석현(정동환)과 딸 미지, 그리고 시부무와 함께 산다. 결국 시간의 차이만 있을 뿐, 어머니가 걸었던 길을 똑같이 가고 있다는 자각을 한 말숙은 어머니가 자신의 운명에 순응했던 것과는 달리 새로운 출발을 위해 남편과의 결별을 선언한다. 둘째언니 말녀(이주경)는 건설회사 차장인 남편 병섭(남성훈)과의 사이에 아들 민석을 두고 있다. 평범한 주부의 삶을 살아오던 그는 어느 날 남편의 오랜 외도를 알게 되고 방황 끝에 자살을 기도하나 미수에 그친다. 결국 남편이 데리고 들어온 은지를 자기 딸로 입적 시키고 다시 주부의 자리로 돌아간다. 넷째 기남(엄정화)은 여고를 겨우 졸업하고 호텔 경리로 일하고 있다. 동거중인 남자 강동수(최성준)와 티격태격 늘 싸우며 살지만 아이도 갖고 나름대로 행복하게 살아간다. 막내인 제남(원지선)은 대학 졸업반으로 자식들 중 유일하게 아버지와 함께 살고 있다. 언니들과 따로 떨어져 사는 동안 전형적인 신세대로 성장한 제남은 오렌지족 애인 진태(김진만)와 함께 자유로운 생활에 대해 늘 불만을 갖고 있지만 자매들 중 둘 사이가 가장 가깝다. 성격도 사는 모습도 갖가지인 자매들 사이에 구심점 역할을 하는 것이 주인공인 셋째 정남(홍리나)이다. 정남은 이십대 후반의 방송작가인데, 잡지사 기자로 일할 때 만난 신문기자 민규(차광수)와 동거 중이다. 이십 년 전의 맹세대로 결혼도 안 하고, 아이도 낳지 않고 오로지 자기 성취를 이루며 살다가 홀가분하게 죽겠다는 것이 그의 원칙이다. 그와 결혼하자던 첫사랑 동민(김성일)과 헤어지게 된 것도 바로 그 원칙 때문이었다. 언니, 동생들의 일로 늘 휩쓸리며 살아가던 정남은 어느 날 의사로부터 암에 걸렸다는 충격적인 선고를 받게 되고 비로소 민규와 진정한 의미의 결혼식을 올리게 된다. 새 아침 드라마 <자매들>은 이렇게 진부한 이야기이다. 그러나 여태껏 있어왔고, 앞으로도 계속될 여자들의 이야기이다. 그래서 아프지만 여자들 스스로가 뒤돌아보고 짚어보고 더듬어보기를 게을리해서는 안 되는 이야기이기도 하다. “생각 같아서는 원작대로 하고 싶었어요. 원작에서는 일곱 자매가 다 죽는데, 여자의 운명이랄까, 여자들의 감동적인 삶이 그대로 나타나 있죠. 그런데 너무 드라마틱하잖아요. 이제는 뭔가 현실적으로 여성 문제에 대한 돌파구도 찾아야 하고…” 다섯 여성들의 삶을 통해 시청자들 스스로 자신의 삶에 대해 되돌아보는 시간을 가질 수 있다면 그것으로 충분하다고 연출자 김지일은 말한다. 사실 뭔가 뚜렷한 메시지를 가지고 있는 시대물이나 역사물에 비해 일상적인 생활이나 사랑을 그리는 멜로 드라마나 생활 드라마가 더 어렵다는 게 연출자들의 공통적인 생각이다. 사랑이나 생활은 누구나 해보는 것이고 그 감정이 어떤 것인지 구체적인 경험들을 가지고 있기 때문에 시청자들의 공감을 얻어내기가 그렇게 말처럼 쉬운 것은 아닐 것이다. 연출자 김지일이 내심 고민하는 것도 바로 이런 이유에서이다. 저녁도 아닌 아침 시간, 모든 것이 부산하게 살아 일어나기 시작하는 때에 시청자들을 텔레비전 앞에 붙잡아두고 이야기 속으로 빠져들게 해야 한다는 것이 연출자로선 보통 일이 아니다. “제가 여자였으면 훨씬 더 좋았을 텐데 말입니다. 아무리 잘 이해하려 해봐야 남성은 여성에서 타성인 것은 틀림없지 않습니까, 각색자도 남자이고… 아무튼 지금 심정으론 여자들의 시각에서 여자들의 입장에서 보고 느끼려고 애쓰고 있습니다. 우리는 다만 문제를 제기하는 것뿐이겠죠. 여성의 성 차별 문제나 고부간의 갈등 등의 여성 문제는 결국 여성들 스스로가 풀어갈 수밖에 없으니까요. 다만 그 상황을, 그 현실을 우리는 소박하게 보여줄 뿐입니다.” 너무나 평범한 우리들의 이야기이기 때문일까. <자매들>은 연기자 역시도 우리들과 친숙한 이들이 많이 눈에 띈다. 큰언니 역에는 순박하면서도 억척스러운 연기로 시청자들에게 자연스레 다가서고 있는 양미경이, 그리고 주인공 정남 역에는 요즘 한창 상승세를 타고 있는 맑은 눈의 연기자 홍리나가 맡아 열연한다. 그 외에도 정동환, 남성훈 등 개성 있는 연기자들이 <자매들>의 생애를 훨씬 더 실감나게 끌어갈 것이다. 10월 18일 아침 9시부터 매일 25분씩 방송될 새 아침 드라마 <자매들>. 우리는 그 속에서 어느 누구의 특별한 이야기가 아닌 우리 모두의 평범한 삶을 만나보게 될 것이다. 그래서 이 다섯 자매들을 사랑하지 않을래야 않을 수 없도록 만들어버릴지도 모르는 일이다. (홍보실 출판부 / parkjh1990@naver.com)
1993	13698	잠복근무 2	코미디, 스릴러, 범죄, 액션	존 바담	리차드 드레이퓨즈, 에밀리오 에스테베즈, 로지 오두넬	검찰과 경찰은 범죄단 두목의 재판에서 증인으로 나오기로 예정되어 있는 루 여사를 안가에서 보호하고 있다. 구속된 범죄단 두목은 루 여사의 증언이 없으면 증거불충분으로 풀려나게 된다. 범죄조직으로 청부받은 살인자 토니는 루 여사가 숨어있는 안가를 공격하여 폭파시킨다. 그러나 현장을 조사한 해스릭 검사는 루 여사의 시체를 찾지 못하여 그 여자가 죽었다는 확신을 못가진다. 그런데 해스릭 검사는 범죄조직에게 매수되어 루 여사를 죽이도록 협조해 주었던 나쁜 검사다. 한편 시애틀 경찰소속으로 위장근무의 명수인 크리스 형사와 그의 파트너 빌 형사는 어느 살인범을 잡지만 다른 사람이 크리스 형사의 총으로 살인범을 쏘아 죽이는 바람에 곤경에 처한다. 크리스는 결혼하지 않고 사는 동거녀 마리아로부터 절연을 선고 받고 후회하지만 마리아는 집을 나간다. 검찰은 행방을 감춘 루 여사가 시애틀 근방 휴양지 섬에 있는 오하라씨 부부의 집으로 전화를 걸었던 증거를 잡는다. 검찰에서 나온 여검사 지나는 그 옆집에서 위장근무를 하면서 관찰하기로 작전을 세우고 크리스와 빌에게 같이 근무할 것을 명령한다. 그 집에 휴양차 들어온 가족처럼 위장한 지나는 크리스의 두번째 부인으로 빌은 크리스의 아들로서 위장하여 지나가 데리고 온 개 아치와 함께 그 집에서 위장근무를 시작하는데. [스포일러] 이들은 밤낮으로 루여사가 있는 것 같은 오하라 부부의 집을 감시한다. 그들은 오하라 부부를 식사에 초대하여 집을 비우는 동안 빌이 그 집을 침투하여 도청장치를 설치하고 나오다가 그 집에 숨어 있던 루여사에게 공격당하고 체포된다. 루여사는 자신을 죽이러 온 악당인 줄 알고 빌을 바다에 빠트려 죽이려 한다. 크리스와 지나의 도움으로 빌은 간신히 살아난다. 루여사가 살아 있다는 것을 안 해스릭 검사는 범죄조직이 루여사를 죽이도록 하기 위하여 루여사를 데리러 병원으로 간다. 루여사의 요청으로 오하라 부부의 집에 잠시 있는 동안 살인자 토니가 루여사를 죽이러 가는 모습을 발견한 크리스와 빌은 총격전을 벌인다. 토니는 범죄단과 내통하는 검사 해스릭을 죽이고 지나를 인질로 잡지만 크리스와 빌의 활약으로 악당을 죽이고 지나를 구한다. 쓸쓸한 집으로 돌아온 크리스는 집으로 돌아와 있는 마리아를 발견하고 청혼을 하면서 둘은 행복한 해후를 한다.
1993	28112	재세추혼		양소웅	여량위, 정칙사, 황광량	홍남인, 소도, 소선 3형제는 일확천금의 한탕을 꿈꾸고 홍콩으로 간다. 그곳에서 무차별 살인과 탈취를 일삼던 도중 경관 따웨와 대치하게 된다. 따웨는 이들 삼형제와 총격전 끝에 소도와 소선을 사살한다. 맏형 남인은 경찰에 끌려가면서 복수를 다짐하는데. 같은 시기 때웨의 부인은 쌍둥이를 순산한다. 경관 생활 중 처음으로 사람을 죽인 따웨는 계속적으로 소도와 소선의 환영을 경험하는데. 더욱 어린 쌍동이들은 따웨를 아버지라 부르지도 않으며 그의 신발에 도마뱀을 넣어두거나 고막을 찧어 버리는 등 잔인한 행동을 일삼는다. 아이들의 몸에 악마가 들어갔다고 생각하는 따웨는 그들을 죽이려하지만 아내는 이를 필사적으로 막는다. 한편 경찰에 수감되어 있던 남인은 경관의 눈알을 뽑고 손가락을 입으로 잘라버린뒤 탈출에 성공, 따웨를 찾아간다.
1993	12501	잭 더 베어	드라마, 코미디	마샬 허스코비츠	대니 드비토, 로버트 J. 스타인밀러 주니어	잭(Jack Leary: 로버트 제이 스타인밀러 쥬니어 분)은 심야 공포쇼 사회자인 아빠(John Leary: 대니 드비토 분)와 5살 난 동생과 함께 사는 12살의 예민한 소년. '곰돌이 잭'이란 노랠 불러주던 엄마가 돌아가시고 난 뒤부터 달라진 아빠 때문에 잭은 몹시 속이 상하다. 몇달 전, 부부싸움 끝에 집을 나간 엄마가 교통사고로 돌아가시자 괴로움 때문에 자주 술을 마시던 아빠는 어느날 TV에 나와 이웃에 사는 노만(Norman Strick: 게리 시니즈 분)이란 사람에게 공개적으로 욕을 퍼붓는 실수를 저지른다. 노만은 나찌와 백인 우월주위를 신봉하는 인물. 이일로 노만과 잭네 집안은 싫어하는 사이가 된다. 한편 아빠의 변화에 불만을 느끼던 잭은 점점 성격이 난폭해져가고 이는 사랑하는 가족에 대한 과격한 행동으로 나타난다. 잭은 학교에서 캐런이라는 여자친구도 생기고 아빠는 캐런을 초대해 즐거운 시간을 갖는다. 할로윈날 밤 노만이 인종차별을 지지하는 주 의원을 위해 헌금하라고 하자 존은 거절한다. 그날밤 존은 TV에서 그 사실을 밝힌다. 다음날 노만의 개가 독살되는 사건이 생긴다. 존때문에 개가 죽었다고생각하는 노만이 딜란을 유괴하는 사건이 있던 날 밤 잭은 또 엄마의 꿈을 꾸고 엄마에게 공연히 섭섭한 행동을 했던 자신을 뉘우친다. 다행히 딜란은 숲속에서 발견되었지만 그 충격으로 말을 못하게 된다. 존이 술때문에 휴직하게 되자 잭의 외조부모가 잭과 딜란을 LA로 데려간다. 아빠가 걱정돼 몰래 집으로 돌아온 잭에게 그날 밤 다가온 노만, 잭을 뒤쫓던 노만은맹견 우리 속으로 떨어지고 만다. 존은 마음을 고쳐먹고 다시 일을 시작한다. 딜란도 돌아오고 다시 함께 모여 살게 된 세 식구는 힘차게 새 출발을 한다.
1993	13490	전신		홍금보	유덕화, 매염방, 종진도	연나라의 13황자는 아우인 14황자에게 황위를 찬탈당해 마선아의 호위를 받으며 도망치다. 착하고 인정 많은 어촌 젊은이 소비 덕에 목숨을 구한다. 14황자는 반역을 도모하는 13황자를 죽이기 위해 그가 숨은 어촌까지 자객을 보내고 13황자는 소비와 마선아를 난릉왕에게 보내 도움을 요청한다. 자객에 의해 일행과 흩어진 소비는 난릉왕의 무남독녀 월아와 생사를 뛰어넘으며 정이 들고 마침내 13황자를 만나지만 이미 둘은 사랑에 빠지고 마는데…
1993	13123	정글북	가족, 모험, 애니메이션	울프강 라이트만	필 해리스, 세바스티안 캐보, 조지 샌더스	키플링의 유명한 모험 소설을 볼프강 레이터맨이 이끄는 디즈니의 애니메이터들에 의해 새롭게 태어난 만화 영화. 못된 호랑이 쉬어칸이 정글에 돌아왔다는 소문이 퍼지자 늑대들은 모글리의 안전을 위해 그를 인간 세계에 돌려 보내기로 한다. 그래서 충실한 보호자 바기라 표범과 함께 모글리는 긴 여정을 떠난다. 카아라는 굶주린 비단뱀의 유혹으로부터 도망쳐 코끼리 군단속에 휩싸이기도 했던 모글리는 태평스런 곰을 만나 아주 가까운 친구가 된다. 모글리는 독수리와는 친구이지만 호랑이와는 적인 질투심 많은 원숭이왕에 의해 납치되는데.
