year	code	title	genre	directors	actors	story	
1993	27909	로보워		브루노 마테이	렙 브라운, 캐서린 힉클랜드, 멜 데이비슨	인간 로보트 오메가 1호. 그는 최고의 게릴라 였던 마틴 우드링의 두뇌와 컴퓨터가 결합, 극비리에 만들어진 전투요원이다. 그러나 실전에 투하되어 중앙 기억 장치의 고장으로 아군을 공격하게 되는데. 급기야 특수요원으로 구성된 '사생결단'이 오메가 1호를 찾기위해 섬에 파견된다. 그러나 모두 오메가의 전법에 휘말려 죽음을 당하고 소령과 유엔봉사자로 병원에 근무차 왔던 버지니아만이 살아 남는다. 소령은 살인무기 오메가1호의 머리부분이 자신의 친구였던 마틴 우드링이라는 사실을 알고 경악을 금치 못하는데.
1993	11817	로보캅 3	SF, 액션, 범죄	프레드 덱커	로버트 존 버크, 낸시 알렌, 질 헤네시	가까운 미래의 디트로이트, 국제협력단체 OCP는 도시를 장기 계획하에 슈퍼 메트로폴리스, 즉 델타 시티로 건설할 계획으로 한 구역을 전쟁 구역으로 만들어버린다. 그러나 헌신적인 순찰경이었으나 순직 후 사이보그로 개조되어 악과 대항하는 임무를 담당하고 있는 로보캅은 무고한 시민을 보호라려 한다. 로보캅은 순진무구한 아이들의 도움까지 받아가면서 난민들과 함께 반란군을 조직하여 악과 대항하면서 그가 잊고 있었던 인간의 감정이 되살아나기 시작한다. 반란 시민군의 여성 리더인 바사(Bertha: CCH. 파운더 분)는 시민에 저항할 것을 호소하면서 게릴라전을 이끈다. 부모와 헤어진 10살박이 천재 컴퓨터 소녀 니코(Nikko: 레미 라이안)도 반란 시민군에 구조되어 연락책을 담당하게 된다. 이러한 비상 사태로 메트로 웨스트 분서의 최고 경찰 로보캅 머피(RoboCop: 로버트 존 버크 분)와 그의 동료 여경찰 루이즈(Anne Lewis: 낸시 앨렌 분)가 출동하게 된다. 로보캅은 반란 시민군을 추격하는 도중 루이즈가 갱들에게 습격당하는 것을 알게 되어 입력되어 있는 명령과는 반대로 루이즈를 구출한다. 옴니사의 치안 담당 중역은 명령에 반대로 행동한 로보캅의 감정회로를 완전히 개조해 옴니사에 저항치 못하도록 라자라스 박사(Dr. Marie Lazarus: 질 헨네시 분)에게 회로수리를 요청한다. 그러나 박사의 배려로 로보캅은 감정의 삭제에서 벗어난다. 또다시 로보캅과 루이즈는 소란 상태의 시가지에 출동한다. 교회에 있는 집없는 사람들을 지키려고 한 루이즈는 10대 갱단의 두목 맥더게트(McDaggett: 존 캐스틀 분) 일당의 총격으로 목숨을 잃는다. 이때 로보캅은 옴니사에 반격할 수 없다는 스템에 손상을 입어 반란시민군의 지하 아지트로 운반된다. 그러나 니코의 연락으로 급히 달려온 라자라스 박사가 로보캅의 기능을 회복시키고 지령도 해제해 준다. 이때 일본기업 카네미츠(Kanemitsu: 마코 분)로부터 파견된 최신형 사이보그 '오토모'가 반란군의 지하 아지트에 침입한다. 그러나 로보캅은 격렬한 싸움 끝에 '암건'을 사용하여 오토모를 파괴해버린다. 한편 거리에서는 옴니사의 처리방식에 반발한 경찰들이 반란군과 합세하고 진압군들과 대치상태를 이룬다. 로보캅은 비행용 제트팩을 장착하고 옴니사로 날아가 새롭게 출연한 두 사이보그와 사투를 벌인다. 그러나 멕더게트는 옴니사 건물에 폭탄을 설차 로보캅과 인질이 된 니코와 라잘스 박사 등을 통째로 살해하려한다.
1993	15214	로빙화	가족, 드라마	양립국	황곤현, 이숙정	미술에 재능을 지닌 고아명은 아주 가난한 집안의 태생으로, 가난 때문에 많은 시간을 그림과 접할 기회가 없다. 그러나 그가 다니는 학교의 젊은 남자 미술 선생님은 상상력이 풍부한 그의 그림을 좋아하고 그의 재능을 높이 산다. 어느날 학교측은 전국 미술대회에 파견할 대표를 뽑기 위해 미술 대회를 여는데, 미술 선생님은 그를 참가하도록 적극 추천한다. 하지만 다른 선생님들은 막대한 권력을 행사하는 이 고을 이장 아들을 추천, 결국 그가 참가한다. 이윽고 아명이 했으면 1등했을 것임에도 불구하고, 2등에 당선되자 선생님이 크게 기뻐한다. 이에 선생님은 사직서를 내고 대북으로 돌아가면서 아명이 그린 그림 중에 하나를 가지고 간다. 아명은 끝내 병으로 죽고 얼마 후 선생님은 그 그림을 출품하여 입상, 국제 대회에서도 최우수상을 받는다. 이 소식을 접한 마을 사람들은 크게 기뻐하지만 이미 아명은 세상을 떠난 지 오래이다.
1993	13578	론리 하트	스릴러	앤드류 레인	에릭 로버츠, 비벌리 단젤로	3년간 끈질기게 다이어트 프로그램에 참석한 덕분에 날씬한 몸매를 되찾은 알마는 외로운 생활에서 벗어나고픈 일념으로 펜팔을 신청한다. 그렇게 해서 알게된 프랭크는 부동산 투자를 한다는 아주 매력적인 인물. 정신없이 그에게 빠져든 알마는 자신의 전재산을 그에게 투자하지만 곧 그가 사기꾼이라는 사실을 알게 된다.  돈 보다는 사랑 때문에 그를 찾아갔던 알마는 결국 그와 운명을 함께 하기로 결심하고 그의 사기 행각을 돕는다. 그러나 그 일을 고마워하기는 커녕 그녀가 보는 앞에서 다른 여자를 끌어들여 버젓이 사랑을 나누는 프랭크. 질투심으로 미칠 지경이 된 알마는 교묘히 그 여자를 불러들여 자신과 프랭크가 함께 샤워하는 장면을 보게 한다. 격분한 그녀가 언성을 높이자 당황한 프랭크는 엉겁결에 그녀를 죽이고 마는데. 한편 프랭크에게 사기 당한 다른 여자의 의뢰로 프랭크를 뒤쫓고 있던 사립 탐정 애린은 알마가 그와 함께 있음을 알게 되자 알마의 할머니를 설득, 그녀의 방을 뒤져 한가지 단서를 찾아낸다. 그러나 그녀가 그 곳을 찾았을 땐 이미 살인을 저지른 프랭크와 알마가 피닉스로 도피한 후였다. 불안감 때문에 신경쇠약에 걸린 알마가 친구에게 건 전화를 토대로 그들의 행방이 드러나는데.
1993	13945	리썰 캅	액션	존 헤스	토머스 이안 그리피스, 랜스 헨릭슨, 제임스 얼 존스	시카고 마약 단속경찰인 테리 멕케인(Terry McCain: 토마스 이안 그리피스 분)은 일에 열중한 나머지 지나친 폭력을 자주 사용한다. 어느날 멕케인은 동료 프랭키(Frankie Hawkins: 토니 토드 분), 딜란과 함께 마약거래 현장을 급습한다. 이번이야말로 디마르코(Sal DiMarco: 버트 영 분)를 감옥에 보낼 좋은 기회라고 판단한 멕케인은 현장에서 체포한 디마르코의 부하를 심하게 다룬다. 그 결과 병원에서 또다시 과잉 폭력으로 인정받아 디마르코는 무죄 방면되고 서장인 데블린(Devlin: 랜스 헨릭슨 분)은 멕케인의 거친 성격을 탐탁치 않게 생각한다. 한편, 디마르코는 마역거래 현장에서 3백만달러를 잃어버리고 맥케인과 프랭키, 딜란을 의심한다. 그는 딜란을 없앤 뒤 차례로 프랭키와 맥케인을 죽이려 한다. 이윽고 프랭키마저 죽고나자 복수를 결심한 맥케인은 서장의 묵시적 동조하에 디마르코를 죽이려 하지만 비겁한 그의 모습에 환멸을 느끼고 차마 죽이지는 못한다. 그러나 다음날 디마르코는 시체로 발견된다. 갑자기 맥케인은 살해 용의자로 쫓기게 되고 뜻밖의 검은 음모를 알게 된다.
1993	14069	리얼 맥코이	드라마, 액션, 범죄, 스릴러	러셀 멀케이	킴 베이싱어, 발 킬머	은행 강도로 6년동안 감옥에서 보낸 여죄수 캐런 맥코이는 가석방되어 사회로 복귀, 아들을 찾아 새로운 삶을 시작하려 하나 다른 여자와 살고 있는 남편은 아들을 내주지 않는다. 여기서 예전의 두목이었던 잭이 아들을 납치 캐런을 협박하여 다시 은행을 털도록 시킨다. 할 수 없이 은행을 털게 된 캐런은 우연히 만난 바터와 함께 고도의 기술을 이용해 은행을 털고 잭 일당을 함정에 빠뜨린 뒤 무사히 아들을 구출한다.
1993	14160	리틀 빅 히어로	드라마, 코미디	스티븐 프리어스	더스틴 호프만, 지나 데이비스, 앤디 가르시아	야심만만한 여기자 게일(Gale Gayley: 지나 데이비스 분)은 방송 기자상을 수상하기 위해 뉴욕의 시상식에 참석하러 갔다가 돌아오는 길에 비행기 추락 사고를 당한다. 이곳을 지나가던 버니(Bernie Laplante: 더스틴 호프만 분), 그는 이혼한 후 작은 공장에 다니며 소매치기, 장물거래 등을 부업삼아 살아가는데 그의 신조는 '남의 눈에 띄지않게 조용히 사는 것'. 그가 비행기 승객을 구해 준 것도 자의가 아니고 그저 우연한 '실수'일 뿐이었다. 그 다음날 버니는 길에서 우연히 고물차를 태워준 존(John Bubber: 엔디 가르시아 분)에게 자신의 무용담을 들려준 뒤 구두 한 짝을 그에게 주고 간다. 한편 게일은 폭발하는 비행기에서 자신을 구해준 신비의 영웅을 찾기 위해 백만달러의 포상금을 내건다. 밤이었고, 사고로 혼란했기 때문에 얼굴을 못본 것이다. 주인공이 남긴 유일한 증거는 구두 한짝. 수많은 사람들이 구두를 들고 방송국으로 몰려들었고, 결국 진짜 구두를 갖고 있는 버니는 졸지에 영웅이 된다. 그는 마치 성직자 같은 솜씨로 사람들을 매료시켰고, 게일의 사랑까지 받는다. 하지만 버니가 나타날까봐 점차 초조해 지기 시작한다. 그런 와중에 버니는 게일을 구해줄 때 훔쳤던 그녀의 신용카드를 팔다가 경찰에 체포되고 직장에서 해고 당한다. 그리고 감옥까지 가게 되는데, 그는 마지막으로 아들 조이(Joey: 제임스 마디오 분)에게 전화를 하게 되지만 그저 건달로만 생각하는 전처 때문에 할 말도 다 못한다. [스포일러] 한편 게일은 카드을 듣고 버니를 찾아가지만, 꿈에도 자신을 구해준 사람임을 믿지 않는다. 두 사람이 언쟁을 하고 있을 때 TV뉴스에서 존의 투신자살기도 소식이 들려온다. 양심의 가책을 못 이긴 존이 게일에게 모든 사실을 적은 편지 한통을 남기고 호텔 난간에 올라간 것이다. 게일은 존이 그저 한끼를 해결하기 위해 자신의 카드를 훔쳤다가 이것이 버니에게로 들어가 결국 협박에 못이겨 자살을 기도했으리라 짐작하고 버니를 끌고 현장으로 달려 간다. 수 많은 사람들이 가슴 졸이며 지켜보고 있는 가운데 버니는 게일의 만류를 뿌리치고 홀로 난간으로 올라가 존과 대면하게 된다. 그리고 버니는 현명하게 대처, 그를 영웅으로 그대로 두고 자신은 아들의 학비만 받아내도록 협상한다. 이때 버니가 떨어질 뻔하나 존이 구하게 되어 영웅심을 발휘한다.
1993	16867	마더스 보이	스릴러	이브 시몬느	제이미 리 커티스	아내 쥬드(Jude: 제이미 리 커티스 분)가 세 아들과 자신을 버리고 가출한지 3년, 로버트(Robert: 피터 갤러거 분)는 아이들이 다다니는 학교 교감인 콜린(Callie: 조안 휠리-킬머 분)과 사랑에 빠져, 결혼 날짜를 정할 단계에 와있다. 아아들은 물론, 쥬드의 어머니 리디아(Lydia: 바네사 레드그레이브 분)조차 콜린을 친딸처럼 사랑해서, 축복 받은 결혼이 될것이라고 생각했는데, 느닷없이 아내가 나타나 아이들과 남편을 되찾겠다고 선언한다. 로버트는 변호사를 내세워 대처하지만, 법적인 권리가 있는 아이들과의 면회 조차 막을수는 없다. 악랄한 쥬드는 아이들을 회유해서 콜린과 로버트를 갈라놓는 작전을 펼친다. 쥬드는 금력을 동원해서, 순식간에 아이들을 손아귀에 넣고 열두살인 아들 케스(Kes: 루크 에드워즈 분)를 통해 콜린을 괴롭힌다. 쥬드는 목적은 곧 정의였다. 자기 목적에 어긋나는 존재는 자기 친어머니일지라도 제거해 버리는 주의였다. 케스를 통해 어머니를 계단에서 떨어뜨려 사경을 헤메게 한 쥬드는, 이번에는 케스를 통해 콜린이 로버트 곁을 떠나도록 밀어 부친다. 그러나 콜린을 괴롭히던 막내 아들 벤(Ben: 조이 짐머만 분)이 다쳐, 작전은 차질을 가져오고, 사슬에서 풀려난 콜린이 벤을 병원으로 옮기던 중, 콜린을 노리고 자동차 사고를 일으키게 했던 쥬드는, 스스로 판 함정에 목숨을 잃는다. 로버트의 가정은 다시 한번 평화가 돌아온다.
1993	27885	마루타 2 - 살인공창		하지강	주강, 양완정, 온문응	2차대전 막바지. 끔직한 내용의 인체 실험을 해오던 만주의 관동군, 제731부대는 일본군 대본영의 명령으로 다른 부대보다 한발 앞서서 철수를 준비한다. 그것은 일본인들의 눈으로 보기에는 731부대에서 행한 일들이 끔직했음을 알고 그 증거를 미리, 완전히 없애자는 계획인 것이다. 명령을 받은 731 부대장 카메다 대령은 실험실장 이시이 대령과 의논한 후 731 부대에 수용돼 있는 마루타로 불리는 생체 실험용 만주인, 한국인, 중국인들을 모조리 사살하고 실험시설을 폭파한 후 특별열차편으로 일본을 향해 출발한다. 그 열차 안에는 일반 내과의사로 근무하던 여의사 호우와 환자들이 탔는데 호우는 자신의 환자들을 국경까지만 돌보겠다고 하나 이것마저도 비밀 누설을 두려워하는 일본인에 의해 억류된다. 비밀누설을 우려한 카메다 대령의 엄격한 통제로 누구도 접근을 못하며 열차는 한중국경을 향해 달린다. 그러나 아무리 통제를 해도 사태를 알 길이 없는 불안감과 그에 따른 지휘부의 불만으로 내부충돌이 일어나는데.
1993	62516	마리 부인의 정사	드라마, 멜로/로맨스		예르지 스투	
1993	13966	마음의 심연	코미디, 멜로/로맨스, 드라마	엘리즈오 수비엘라	다리오 그란디네티, 산드라 발레스테로스	아르헨티나의 젊은 시인 올리베리오(Oliverio: 다리오 그란디네티 분)는 삶과 죽음, 그리고 여자와 복잡하게 얽힌 삶 속에서 시를 쓰며, 보헤미아적인 나날을 살아가는 오늘의 젊은이다. 시만으로는 생활이 어려운 그는 가끔 떠오르는 아이디어를 광고회사에 팔곤하지만, 그렇게 들어온 돈은 곧 또 창녀에게로 간다. 올리베리오는 사랑의 환희로 허공에 떠올라, 함께 나르는 여자를 찾아 평생을 살아왔다고 해도 과언이 아니다. 그러던 그가 부에노스 아이레스를 떠나, 몬테비데오에 갔을때, 우연히 한 창녀를 만난다. 안나(Ana: 산드라 발레스테로스 분)라는 이름의 그 창녀는, 올리베리오를 안은채 하늘을 나를 수 있는 여자였다. 그러나, 여지껏 그가 여자들을 날지 못한다는 이유로 버렸듯, 이번에는 안나가 올리베리오를 버린다. 올리베리오가 아무리 발버둥을 쳐도, 안나는 눈하나 깜짝하지 않는다. 마침내, 안나는 올리베리오를 뒤에 남긴 채 떠나버린다.
1993	12542	마지막 액션 히어로	판타지, 모험, 액션	존 맥티어난	아놀드 슈왈제네거	영화 관람을 하던 대니(Danny Madigan: 오스틴 오브라이언 분)는 극장 영상기사 할아버지로부터 받은 마법 카드의 힘으로 영화 화면 속으로 빨려들어간다. 악당들이 판치는 영화 장면 속에 자신이 서 있는 것이 아닌가. 그것도 가장 좋아하는 액션 영웅 잭 슬레이터(Jack Slater/Himself: 아놀드 슈왈츠네거 분)가 나오는 &amp;lt잭 슬레이터&amp;gt 시리즈 제4탄. 슬레이터는 &amp;lt더티 해리&amp;gt의 해리 켈러핸 형사 같은 인물로, 폭력범들에게 폭력으로 응징하는 그런 영화 속의 인물이다. 대니는 잭의 파트너가 되어 사건을 해결하러 다니게 되는데, 범인의 얼굴과 사건의 발단을 이미 스크린을 통해 보아서 알고 있다. 그래서 대니는 슬레이터가 범인을 추적하는데 결정적인 도움을 준다. 하지만 슬레이터는 자기가 영화 속에 들어왔다고 주장하는 대니를 실성한 소년으로 여긴다. 그러던 와중에 대니의 신비한 극장표가 적의 수중으로 넘어간다. 그 표를 이용해 현실 세계로 넘어간 악당들을 쫓아 슬레이터와 대니도 현실로 넘어온다. 그들은 "The Last Action Hero"의 시사회에 참석하기로 되어있는 아놀드 슈왈츠제네거를 찾아가고, 마침내 악당들을 처치한다. 슬레이터는 자기가 허구의 인물이라는 사실도 알게 되고 대니는 상처를 당해 죽어가는 슬레이터를 살리는 유일한 방법은 그를 영화 속으로 들여보내는 수 밖에 없다고 판단, 표를 이용해 그를 다시 영화 속으로 들여보낸다.
1993	11847	말콤 X	드라마	스파이크 리	덴젤 워싱턴	극우 백인 우월주의자들의 횡포에 시달리다 결국 목숨까지 잃은 행동주의 목사의 아들로 태어난 말콤 엑스(Malcolm X: 덴젤 워싱톤 분)는 흑인들에 대한 백인들의 편견 속에서 보스턴의 뒷골목을 전전하며 살아간다. 말콤의 어머니는 자긍심이 강한 여성이나 그녀의 어머니가 백인한테 당한 결과가 자신이었기에 백인을 증오하고 흑인 얼(Earl Little: 토미 홀리스 분)을 택했다. 말콤은 어느 날 우연히 댄스 파티에서 만난 백인 여자 소피아와 눈이 맞아 방탕한 생활 속으로 더욱 깊이 빠져 들어간다. 흑인 폭력배 인디안 아치 밑으로 들어간 말콤 엑스는 소피아, 친구 소티(Shorty: 스파이크 리 분) 등과 함께 남의 집에 들어가 도둑질을 하다 붙잡혀 법원에서 8년에서 최고 10년형을 언도받고 감옥에 갇히는 신세가 된다. 그러나 감옥에서 만난 흑인 회교 경건주의자 베인스의 소개로 당시 흑인들의 희망처럼 떠오르고 있던 이슬람교의 한 지파의 교주인 엘리야 무하마드를 알게 되어 깊은 감동을 받은 나머지 이슬람교에 귀의하여 출감 후 특유의 언변과 속에서 끓어오르는 울분의 토로로 엘리야 무하마드의 가르침을 전파하고 백인들에 대한 저항 운동을 이끄는 회교 행동주의 전도사로 변신한다. 말콤 엑스의 인격과 신앙심, 그리고 언변에 이끌려 많은 소외된 흑인들이 엘리야 무하마드 밑으로 구름떼처럼 몰려들고 말콤 엑스는 참한 흑인 아가씨 베티(Betty Shabazz: 안젤라 바셋 분)를 만나 결혼을 하고 두 아이의 아버지가 되기까지 한다. 교세가 점점 확장되는 가운데 엘리야 무하마드가 소외된 흑인들의 신앙을 이용하여 사리 사욕을 채우고 여자 관계가 복잡하며 부를 축적하는 데에만 관심이 많다는 이상한 소문이 떠돌자 이를 믿지 않던 말콤 엑스는 자기 눈으로 직접 그 소문이 사실이었음을 확인하고 깊은 실의에 빠져 성지 메카로 순례를 떠난다. 다시 미국으로 돌아온 말콤 엑스는 엘리야 무하마드 추종 세력의 끊임없는 협박에 시달리면서도 이슬람교의 근본 교리와 백인들에 대한 저항 운동을 계속하다 마침내 엘리야 무하마드의 행동 대원들인 암살자 벤자민(Benjamin 2X: 쟌 라마르 분)과 윌리엄 X(William X: 마이클 게스 분)가 말콤의 가슴에 기관총을 발사한다. '아프로-아메리칸 말콤은 이미 수년전부터 니그로가 아니었다'는 나레이션이 길게 이어지는 속에 그의 생애가 스쳐지나간다. '그가 뿌린 한알의 씨앗은 다시 싹이 틀것을 확신한다.'는 나레이션과 낡은 국민학교 교실, 말콤 X의 생일을 알려주며 위대한 아프로 아메리칸의 생애를 알려주는 교사와 꼬마들.
1993	19591	매춘 3	에로	유진선	박진영, 한영수, 김경진	평범한 대학생이었던 이현은 아버지가 암흑 조직에 많은 부채를 안고 세상을 떠나자 빚 대신 조직이 운영하는 룸싸롱의 호스티스가 된다.시간이 흘러 이현은 아버지의 빚을 모두 갚을 무렵 암흑조직에서 목숨을 건 탈출을 감행, 부녀자 교육원에 입소한다. 그 곳에서 처지가 비슷한 유미, 서라, 혜민을 만나 친하게 되고, 6개월 후 같은 날 퇴소한다. 특별히 갈 곳이 없는 그들은 혜민이 알고 있는 동해안의 어느 싸롱을 가게 되는데, 이현은 그곳에서 건실한 청년 상원을 만나 사랑을 느끼지만 자신과는 어울리지 않는다고 생각하여 자신의 처지를 고백하고 만다. 그래서 이현은 술집을 경영해 돈을 모으고, 자식에 대한 한이 맺힌 유미는 고아원생들을 돌보기로 한다. 그러나 평화로운 생활도 잠시 주위의 동종업계의 훼방이 시작되고, 암흑조직은 협박과 회유로 포섭하려 든다.
1993	11706	맥스와 제레미	범죄, 드라마, 스릴러	클레어 디버스	필립 느와레, 크리스토퍼 램버트	전직 살인청부업자로 위엄을 지니고 유복한 삶을 사는 막스(Robert 'Max' Maxendre: 필립 느와레 분)는 어느 날 무일푼으로 건달 생활을 하고 있는 제레미(Jeremie Kolachowsky: 크리스토퍼 램버트 분)를 만나 호감을 갖게 된다. 권태로움과 쓸쓸함에 익숙해있던 그에게 제레미는 활력과 생기를 불어 넣어 준다. 그러나 이 젊은이는 바로 다름아닌 막스를 죽이라는 임무를 띤 살인청부업자이다. 막스는 둘의 만남에 만족해 하면서도 때로는 당혹해 하며 그를 자신 곁에 두기로 결심한다. 자신과 그와의 인연이 우연이 아닐지 모른다는 의심을 가지면서. 어느 날 한 암흑가 대부가 초대한 점심에 그는 제레미와 동행하게 되고 마피아 대부를 죽이라는 사건을 맡게 되는데 여기에 제레미를 끌어들인다. 줄곧 동행하면서 막스에게 정을 느끼기 시작한 제레미는 결국 그를 죽이려는 계획을 포기한다. 그 결과 둘은 막스를 없애려는 세력의 추적을 받게 된다. 그리고 이 둘 사이에는 평생 막스를 쫓다가 은퇴를 앞둔 늙은 형사 알메다가 뛰어들지만 여전히 충분한 근거가 없어 그를 체포하지 못하고 있다. 고독한 막스는 점차로 제레미에 대해 부성애 같은 보호본능을 갖게 된다. 누가 먼저 상대방을 죽일 거라는 문제는 무의미해지고 이제 둘은 한 사람이 상대방을 죽일 생각을 포기하고, 다른 한 사람이 그 살인을 멈추게 할 생각을 포기함으로써 서로를 감싸게 된다. 결국 두 사람은 경찰들에게 쫓겨 기차를 타고 도주를 하게 되는데, 서로의 운명의 아이러니에 씁쓸해 하며 정감 있는 미소를 주고 받는다.
