year	code	title	genre	directors	actors	story	
1993	13292	스위치 2	코미디, 드라마	크리스토퍼 몽거	줄리 월터스, 아드리안 패스더	미국인 은행원 제럴드(Gerald Tilson/Geraldine: 에드리안 패스다 분)는 아내와 두 아이를 두고 행복하게 살고있다. 뿐만 아니라 그는 일본의 자동차업계의 수백만불에 달하는 은행 예치로 진급도 빠르고 운이 좋은 사람으로 모두의 부러움을 사고 있다. 그러던 어느날, 그의 침대에서 여자 내의가 발견되고 제럴드는 집에서 쫓겨난다. 한편, 지긋지긋했던 결혼 생활을 청산한 모니카(Monica: 줄리 월터스 분)는 큰 집을 혼자 감당할 수 없어 하숙을 하기로 한다. 그녀는 이사온 제럴드를 보고 강한 이끌림을 느낀다. 그녀는 제럴드가 자신을 피하자 배신감을 느끼나, 그의 고백을 듣고 그를 이해하려 노력한다. 그가 여자옷을 입고 싶어 한다는 것이었다.모니카는 그가 여자옷을 입고 아름다운 여자 제랄딘의 모습으로 바뀐 것을 보기 전까지는 혼란스럽고 당황스러웠다. 회사에서 제럴드와 CJ(C.J.: 고든 케네디 분)는 그들의 보스인 마일즈(Miles Millichamp: 폴 프리맨 분)가 일본회사와의 거래를 비밀리에 조사하는 것을 알게 된다. 그러는 동안 제럴드와 모니카의 관계는 좋아진다. 제럴드는 회사가 위기에 빠졌을때 마일즈의 부정한 거래를 폭로 하려한다. 그러나 여장을 한 제럴드가 교통위반으로 걸리는 바람에 마일즈는 그를 해고하고 실의에 빠진 제럴드는 모니카에게 헤어질것을 말한다. 마일즈의 부정한 거래가 성사되려는 순간 여장을 한 제럴드와 모니카가 주주 총회에 나타나 극적으로 마일즈의 음모를 막아내고 제럴드의 거래가 이루어지게 한다.줄거리 2. 은행의 컨설팅 부서에서 기업경영 자문역을 맡고 있는 제럴드(Gerald Tilson/Geraldine: 애드리안 패스다 분)는 아내와 자녀까지 둔 정상적이고 유능한 30대 남성. 그러나 그는 본능적으로 여자 옷을 입고 싶어하는 취미를 갖고 있지만 사회의 눈이 무서워 드러내놓고 그 취미를 즐기지 못한다. 그것을 병으로 여기고 괴로워하던 그는 최면술사를 찾아가고, 여자 옷을 태우는 등 취미를 고치려고 애를 쓰지만 번번이 허사로 돌아간다. 여행에서 돌아온 부인은 여자 옷이 즐비한 침실을 보고 오해를 해 그를 집에서 쫓아낸다. 호텔을 전전하던 제럴드는 하숙을 하게 되고, 하숙집 여주인인 40대 이혼녀 모니카(Monica: 줄리 왓터스 분)와 가까와진다. 모니카는 제럴드의 여장하는 욕구를 이해해주고 있는 그대로를 사랑한다. 한편 은행에서 일본의 자본을 유치해 유능한 인재로 꼽힌 제럴드는 그를 경계하는 상사 마일즈(Miles Millichamp: 폴 프리맨 분)의 음모로 회사에서 쫓겨나게 된다. 실직한데다 여장을 한 채 과속으로 달리다 교통경찰한테 걸려 남자임이 드러나 곤욕까지 치른 제럴드는 삶의 의욕을 잃고 자포자기 상태에 빠진다. 그러나 모니카는 그에게 여장 욕구는 정상적인 취미일 뿐이라며 협력해서 상사의 음모를 파헤치자고 제안한다. 모니카와 함께 다른 컨설팅회사 여직원 제럴딘으로 분장한 그는 은행에 나타나 아내 이름으로 부당 이득을 취하려던 마일즈의 음모를 밝혀낸다. 여장 취미 덕분에 상사의 악덕을 파헤치는데 성공한 제럴드는 모처럼 모니카와 행복한 웃음을 짓는다.소개글. 남자는 남자 옷을, 여자는 여자 옷을 입어야 한다는 인간의 뿌리깊은 고정관념에 일격을 가하는 재미있는 영국 영화. 20명의 남자 중 한명꼴로 여장을 하고 싶은 욕구를 갖고 있다는 사실을 근거로 여장 취미를 가진 남자의 시련과 성공을 보여줌으로써 틀에 박힌 인간의 편견과 고정관념에 대해 새로운 발상의 전환을 암시하고 있다.
1993	12225	스케치	범죄, 미스터리, 스릴러	페든 파파마이클	제프 파헤이, 숀 영, 프랭크 맥래	패션 업계의 거장 토미 실버(Tommy: 로버트 듀박 분)는 그의 사무실에서 미모의 여인과 정사를 나눈 후 깊은 잠에 빠지다, 범인의 총에 의해 살해된다. 도망치던 범인은 여직원 데이지(Daisy: 드류 베리모어 분)와 순간적으로 마주치고 차후 그녀는 연쇄적으로 일어나는 살인 사건의 유일한 목격자가 된다. LA 경찰의 몽타쥬 전문가 잭(Jack: 제프 파헤이 분)은 살인범의 얼굴을 그려내니, 그것은 바로 그의 사랑하는 부인 레이안(Rayanne: 숀 영 분)이었다. 충격과 절망 속에 몽타쥬를 숨기고 대신 그는 가공의 인물을 그려 상관인 데이빗에게 넘긴다. LA 경찰내에서 스케치 아티스트로 불릴만큼 잭은 90%의 완벽에 가까운 만큼 인물을 그려내는 몽타쥬 전문가이다. 부인을 위해 모든 사실을 숨기기로 결심하나, 그후로도 계속 부인은 외간 남자들과 불륜의 관계를 맺어가고 그 사실이 잭에게 알려진다. 사기와 배반으로 얼룩진 부인에 대한 실망으로 잭은 긴 여행길에 오르나 그에겐 예술가로서의 양심적 가책에 의한 좌절로 알콜중독자인 폐인의 길을 걷게 된다. 한편, 그의 동료 밀톤 윌러는 그를 돕기로 한다. 잭의 부인의 주위 환경을 차례로 접하기 시작한다. 한편 경찰은 몽타쥬를 토대로 수사를 벌여 실버 패션의 전속사진사 제인 옥슨를 체포하고 억지자백을 받아낸후 그에게 살인죄를 뒤집어 씌운다. 부인을 위해 비밀을 지켰던 잭은 제인옥슨의 하소연을 듣고 괴로워 한다. 그러나 그녀는 모든 사실을 부인하고 오히려 부부간의 사랑만 더욱 두터워져 가고 사건은 미궁 속으로 빠져든다. 그런 와중 목격자인 데이지가 살해되자 잭은 자신이 직접 수사에 뛰어든다. 잭은 실버가 살해된날 그의 섹스 파트너가 리즈였다는 사실을 알고 그녀를 추적한다. 그녀로부터 죽은 실버가 코네일과 짜고 실버패션을 파산신고 낸후 엄청난 사기극에 비밀의 전모를 알아낸다. 마침내 실버패션 공장에서 잭, 코네일, 레이안이 마주치고. 무장한 경찰들이 공장을 에워싸고 마침내 코네일은 레이안의 총에 살해되고 잭과 레이안은 부부간의 사랑을 또다시 확인하게 된다.
1993	18136	스타 트렉 - 스페이스 나인 TV 시리즈	SF, 드라마, 전쟁	린 어벌조노이스, 코레이 알렌, 레자 배디이	에이버리 브룩스, 린 어벌조노이스, 니콜 드 보아	
1993	13492	스테이 튠	코미디, 판타지	피터 하이암스	존 리터, 팜 도버	평범한 미국의 소시민 가정인 네이블씨 가족, 아버지 로이 네이블(Roy Knable: 존 리터 분)은 TV만 보지 않는다면 좋은 사람이지만 그럴 때는 드물다. 그는 배관설비 외판원이지만 일은 신통치 않다. 집에 와서는 TV앞에 붙어서 그 세계에 빠져 버린다. 부인과 애들도 상관없이 TV앞에 엉덩이를 붙이고 산다. 헬렌 네이블(Helen Knable: 팜 도버 분)은 경영학 석사를 얼마전에 따냈고 직장에서도 승진 가도를 달리고 있다. 하지만 아무리 애써도 남편을 TV앞에 떼어낼 수는 없다. 아들 대릴(Darryl: 데이비드 톰 분)과 대릴의 누나 다이안(Diane: 헤더 맥코브 분)은 친구네 집에 하룻밤 자러간다. 그사이 엄마 아빠 사랑이 다시 불붙을 수 있도록 변화를 기대한 것이다. 하긴 변화가 오긴 온다. 집에 돌아온 아이들은 커다란 TV만이 을씨년스럽게 집을 지키고 있는것을 발견한다. 게다가 뒤뜰에는 엄청나게 큰 안테나가 서있다. 대릴은 TV를 보다가 화면안에서 부모를 발견한다. TV안에 빨려들어가서 666개의 채널을 돌며 끔찍한 여행을 하는 것이었다. 로이가 섣부른 계약을 해서 대마왕 스파이크(Spike: 제프리 존스 분)의 TV 지옥으로 끌려들어간 것이다. 네이블 부부가 이 채널들 속에서 24시간을 견뎌낸다면 살아날 수 있지만, 그렇지 않으면 끝장인 것이다. 로이와 헬렌은 기지와 영기와 체력, 모든 것을 동원해서 버텨낸다. 하지만 그들을 구해낸 건 그들의 아이들이다.
1993	16463	스토리 오브 O 2 - 르네의 사생활 2	드라마, 멜로/로맨스	에릭 로샹	마누엘 드 블라스	팸브로크는 상원의원에 출마할 계획으로 이미지 쇄신을 위해 부인, 딸, 아들을 데리고 '오'양의 집으로 은신하려 가는데 그의 라이벌이며 사업가인 보터웨그는 그를 파면시키기 위해 '오'양의 미모를 빌려 그의 성생활을 공개할 계획을 세운다. 그에게 채용된 '오'는 팸브로크 부인, 아들, 딸에게 성적인 경험을 하게 하고 팸브로크도 유혹하지만 그가 원하는 것을 주지않은 채 그를 안달하게 만든다. '오'는 비록 채용되어 일을 하지만 돈이 목적이 아니라 한 나라를 이끌고 나갈 의원에 출마할 팸브로크의 정신 상태와 자기만을 아는 이기주의, 성적으로도 불건전한 그의 본모습을 가족들에게 보여주고 스스로 출마를 포기하도록 하는 것이 의도였다. 후에 팸브로크 외에 그의 부인과 딸, 아들은 그러한 '오'에게 고마워하며 모두 팸브로크를 떠나고 만다.
1993	16203	스트라이킹 디스턴스	액션, 미스터리, 범죄, 스릴러	로우디 헤링톤	브루스 윌리스	톰(Tom Hardy: 브루스 윌리스 분)은 강력계 형사이다. 경찰국장인 아버지 빈스(Vince Hardy: 존 마호니 분), 삼촌 닉(Nick Detillo: 데니스 파리나 분), 그리고 사촌 지미(Jimmy Detillo: 로버트 패스토렐리 분)와 대니(Danny Detillo: 톰 시즈모어 분)가 같은 길을 가고 있다. 지미와 파트너가 되어 활동하던 중 톰은 지미가 용의자에게 폭력을 가한것을 증언하여 지미는 유죄 판결을 받는다. 이로 인해 톰은 동료들로부터 배신자 취급을 받는다. 한편 여자들만 납치해 교살하는 사건이 잇따라 발생하는데 범인은 경찰에 전화를 걸어 '빨간 꼬마 가수'란 노래를 들려주곤 한다. 톰은 이 사건이 경찰 내부에 있다고 생각한다. 어느날 아버지와 함께 용의자를 추적하던 중 사고가 일어나 톰은 부상을 입고 아버지는 죽게 된다. 지미의 선고공판이 있던날 지미는 투신자살을 하고 경찰은 톰의 아버지를 살인범으로 검거하지만 톰은 진범이 따로 있다고 생각한다. 세월이 지나 강력계를 떠난 톰은 수상 경찰 구조반에서 일을 한다. 대니가 돌아온 후 또다시 여인들의 시체가 강에서 발견된다. 희생자는 모두 톰과 관계를 가진 여인들이었다. 톰은 2년전의 사건과 지금의 사건이 동일범이라 생각하고 여자 경찰인 조(Jo Christman: 사라 제시카 파커 분)와 함께 수사를 착수한다. 조는 톰의 입장을 이해하게 되면서 그를 사랑하게 된다. 톰을 궁지에 몰세우려는 청문회에서는 그를 옹호하는 발언을 한다. 그날밤 살인범은 그녀를 납치한 후 톰에게 알린다. 시체가 발견된 장소를 연구하던 톰은 어릴때 놀던 오두막을 찾아낸다. 그곳에 범인인 대니가 있다고 판단하였지만 거기에는 2년전에 죽은 지미가 있었다. 모든 것은 정신이상 증세가 있는 지미의 범행이었고 아들의 범죄를 감싸려던 삼촌의 실수로 아버지가 살해되었던 경위를 듣는다. 지미는 설득하는 닉마저 살해하고 달아나지만 추적해온 톰과 사투끝에 최후를 맞이한다.
1993	13264	스트리트 나이트	액션, 드라마, 범죄	앨버트 매그놀리	제프 스피크먼	미국의 어느 도시, 그 도시의 패권을 놓고 싸우는 암흑가 조직의 두 보스인 흑인계의 에이브 볼과 라틴계의 씨스코가 화해한 후, 도시는 평화로워진다. 그러나 어느 날 그 휴전 협정이 깨진다. 한쪽에 조직원 4명이 살해되는 사고가 생기도, 반대쪽에서 두 명을 보복 살해하므로, 도시는 다시 긴장에 휩싸인다. 전직경관으로, 근무 중 인질범 사건으로 죄책감을 싸여 경찰을 떠나 자동차 정비업을 하는 배러트는 우연히 이 두 파의 싸움의 소용돌이에 말려든다. 배러트의 친구인 여의사 레베카의 남동생으로 암흑가 조직에 관계있는 카를로스가 실종된 것이다.  배러트는 두 파를 다 만나 카를로스의 행방을 알아보는 과정에서 이상한 점을 발견한다. 두 파가 맛붙어 싸울만한 감정이 아닌 것이다. 그럼에도 계속 양파의 부하들이 죽어간다. 배러트는 제3세력이 있음을 알고 그 정체를 파헤친다. 결과는 의외였다. 후랭클린이라는, 베러트와는 함께 근무 한적이 있는 전직 경관이 두목으로 상당한 조직이 나타난 것이다. 그들은 전부가 전직 경관이었다. 게다가 그들은 하나같이 지문을 없애고 수술로 얼굴도 바꿨다는 사실이다. 민원경관 출신답게, 베러트는 그들의 목적을 알아낸다. LA 제일의 보석상을 털 계획을 세우고 준비를 했으나, 깡패들의 휴전으로 경찰이 민생업무에 집중해서 보석강도에 위험이 따르기 때문에, 경찰이 암흑가 쪽으로 쏠리게 하자는 것이 그들의 목적이었다. 그러나 그 사실을 알았을 때는 이미 범행이 시작된 것이었다. 이에 베러트는 적진으로 침투해 들어가 일대혈전을 벌인 후, 카를로스를 구출하고, LA에 다시 평화를 가져다 준다.
1993	13320	스펌 뱅크	코미디	조지 밀러	쉘리 롱, 코빈 번슨, 래리 밀러	TGC 기업의 말단 사원 쟈크(Zach Shepard: 코빈 번슨 분)는 오직 일밖에 모르는 순진한 노총각. 만년 말단인 그에게 승진의 기회가 찾아온다. 부사장인 봅이 스트레스를 이기지 못하고 국립 정신 병원에 입원하는 바람에 부사장 자리가 공석이 된 것이다. TGC 사장 J.F(J.F. Hughes: 맷 클락 분)는 쟈크에게 적자 상태에 있는 방계 회사, 호바트의 은행을 흑자로 전환시키면 승진시켜 주겠다고 약속한다. 부푼 꿈을 안고 호바트의 작은 은행에 도착한 쟈크. 그러나 이게 웬일? 그것은 다름아닌 정자 은행이었다. 평범한 은행으로 예상했던 쟈크에겐 기절 초풍할 노릇이었으나, 이제와서 물러설 수도 없는 일. 실적을 올리지 못하면 파면되는 것이다. 이윤 추구에만 급급한 쟈크와, 그동안 이 은행을 운영하며 마을 사람들을 위해 헌신적으로 일해 왔던 인공 수정 전문의 그레이스 박사(Dr. Grace Murdock: 셜리 롱 분)는 첫날부터 사사건건 부딪히기만 한다. 정자 은행을 하나의 봉사 기관으로 생각하고 있는 이상주의자 그레이스와는 달리 쟈크는 은행의 재정 상태를 흑자로 돌리려 머리를 짜낸다. 어느날 쟈크에게 기상천외한 아이디어가 떠오른다. 정자 예치를 늘리기 위한 정자 콘테스트를 개최하는 것이다. 상금은 10만달러. 호바트시는 콘테스트의 열기로 들끓기 시작한다. 한편 그레이스는 쟈크와 일하는 사이, 겉보기와는 다른 그의 순진성과 인간적인 매력에 차츰 끌리게 되고, 도시 생활속에서 굳어버린 쟈크의 마음 또한 그레이스의 따뜻한 마음씨에 봄눈 녹듯 녹아버린다. 그러나 쟈크의 콘테스트 계획 때문에 다시 두사람의 관계는 냉전상태로 돌입한다.
1993	13104	슬리버	스릴러	필립 노이스	샤론 스톤, 윌리엄 볼드윈, 톰 베린저	뉴욕 슬리버 건물, 7년 동안의 결혼 생활을 청산하고 칼리(Carly Norris: 샤론 스톤 분)는 아파트 '슬리버'로 이사한다. 결혼 생활로 자신의 삶을 허비했다는 것에 대해 자책감마저 느끼는 그녀는 이제 단지 가벼운 애인이 아닌 진정한 관계를 갈망한다. 그러나 새로운 시작에 대한 기대는 곧 불길한 예감으로 바뀌고 만다. 입주하자 마자 칼리는 그녀가 의문의 투신 자살을 한 전입주자 나오미(Naomi Singer: 앨리슨 맥키 분)와 외모가 흡사하다는 말을 듣는다. 칼리는 나오미의 죽음이 슬리버 건물의 세번째 죽음이라는 것을 알게 된다. 그러던 중 뉴욕 대학에서 강의를 하는 거스(Gus Hale: 킨 커티스 분)가 샤워 중에 넘어져 죽음으로써 그녀의 의혹은 더욱 커지게 된다. 같은 아파트 입주자인 잭(Jack Lansford: 톰 베린저 분)은 칼리에게 접근해 오지만 칼리는 그가 귀찮기만하다. 그는 오히려 지크(Zeke Hawkins: 윌리암 볼드윈 분)에게 빠져드는데 지크가 나오미의 애인이었다고 하고 지크는 잭이 나오미의 애인이었다고 주장한다. 혼란에 빠진 칼리는 바이다(Vida Warren: 폴리 월커 분)와 얘기해 보려고 하나 바이다는 살해되고 만다. 바이다의 살해 현장에 있던 잭은 체포되는데 지크의 모함이라고 주장하지만 그에게 불리한 증거가 속출한다. 지크는 자신이 건물의 주인임을 고백한다. 칼리는 지크가 카메라로 입주자들의 사생활을 지켜 보았음을 알고 충격을 받는다. 집에 온 칼리는 잭을 발견한다. 잭은 지크의 모함을 주장하며 지크가 17세때 죽은 엄마의 사진을 보여준다. 그녀는 칼리와 너무 닮았는데 그녀도 거스와 같이 샤워 중에 넘어져 죽었다는 것이다. 잭은 칼리를 시켜 지크를 칼리의 집으로 유인한다. 진범을 가리는 다툼은 몸싸움으로 발전하고 칼리의 오발로 잭이 죽는다. 칼리의 아파트 키를 잭이 갖고 있음을 알고 그녀는 잭이 살인범이었을 거라는 확신을 굳힌다.
1993	13139	슬리핑 독스	범죄	찰스 핀치	딜란 맥더못, 찰스 핀치, 샤론 스톤	헐리웃 중심가에 사는 무명 작가 브루스(Bruce Simmons: 딜란 맥더못 분)는 집세는 밀리고 돈은 들어올 데가 없어 궁지에 몰린다. 브루스는 비록 무명 작가이긴 하지만 자기 나름대로의 긍지와 자부심이 있으며 끊임없이 명예를 추구하는 작가이다. 생활고에 이르자 그는 궁여지책으로 중개업소에 취직을 하지만 6개월째 실적을 올리지 못하고 있다. 그는 대리인이자 연인이었던 아름답고 섹시한 세레나(Serena Black: 샤론 스톤 분)를 찾아가 사정하지만 그녀는 냉담할 뿐이다. 이제 도움을 청할 사람은 아무도 없다. 브루스는 마지막으로 부동산 중개업소의 사장이 팔아보라고 맡긴 저택에 들어가 살기로 한다. 그러나 브루스는 곧 그 집이 몇 해 전 세상을 떠들썩하게 했던 일명 '캐롤 살인 사건'이 있었던 곳으로 팔릴 가능성이 거의 없다는 것을 알게 된다. 살인 사건에 대한 사람들의 관심에 브루스의 상상력은 이상하게 발휘된다. 그는 대중소설의 소재가 될만한 사건에 대해 더 많은 것을 알고 싶어하며 세레나도 그를 부추긴다. '살인 일기'라는 제목으로 상업 소설을 쓰기 시작한 브루스는 이 섬뜩한 이야기에 자신의 영혼과 주체성을 잃어가면서 몰두하게 된다. 이즈음 에디(Eddie Hale: 톰 시즈모어 분)라는 남자가 나타나 방을 구하고 둘은 한 집에 살기 시작한다. 우연히 에디는 케롤 살인 사건을 배경으로 한 브루스의 원고를 잃고 자기도 도움을 주겠다고 한다. 같이 일을 시작한 후, 브루스는 사건에 대해 너무 자세히 알고 있으며 살인자의 마음을 이해하는 투로 말하는 에디를 신기하게 보기 시작한다.
1993	12393	시스터 액트	코미디, 범죄, 뮤지컬, 액션	에밀 아돌리노	우피 골드버그	리노의 카지노에서 삼류 가수로 일하는 들로리스는 우연히 암흑가의 거물인 빈스의 범죄 현장을 목격한다. 잡히기만 하면 당장 목이 비틀릴 이 꾀꼬리는 그 순간부터 쫓기는 신세가 된다. 경찰에 신고한 들로리스는 증인이 될 것을 약속하고 보호를 받는데, 경찰에서는 그 누구도 상상할 수 없는 곳, 외부와 단절된 수녀원에 들로리스를 숨긴다. 하지만 들로리스는 이렇게 답답한 곳에서 지내느니 차라리 밖에서 쫓기다 총에 맞는게 훨씬 속편한 심정이다. 결국 엄격하기 그지없는 원장 수녀의 감시 아래서 들로리스는 은신이라기 보다는 감화소에 들어온 심정으로 매일 매일을 말썽으로 채우고 있는데, 어느날 그녀의 손에 성가대의 지휘봉이 넘겨졌고, 결국 성가대와 수녀원 전체, 아니 카톨릭 전체가 뒤바뀌는 운명에 이른다!
1993	12918	시애틀의 잠 못 이루는 밤	멜로/로맨스, 코미디, 드라마	노라 에프론	톰 행크스, 멕 라이언	아내를 먼저 떠나보내고 실의에 빠진 ’샘’은아들 ‘조나’와 함께 시애틀로 이사 한다.   한편, 완벽한 남친 ‘월터’와의 결혼을 앞둔 '애니'는가족들에게 그를 소개하고 집으로 돌아오던 밤,새 엄마가 필요하다는 깜찍한 라디오 사연을 보낸 '조나'와아내와의 행복했던 추억을 잊지 못하는 '샘'의 이야기를 우연히 듣게 된다. 방송 이후 폭발적인 인기와 함께'잠 못 이루는 시애틀씨'라는 애칭을 얻게 된 '샘'그의 진심 어린 사연에 푹 빠진 '애니'는그가 자신의 운명의 짝이라는 강렬한 이끌림을 느끼게 되고결국 '샘'과 '조나'를 만나기 위해 시애틀로 향하는데...과연 크리스마스의 로맨틱한 기적을 만날 수 있을까?
1993	11949	시티 레인져	액션, 범죄, 드라마, 서부	마이클 프리스, 에릭 노리스, 크리스찬 I. 나이비 2세	척 노리스, 클레런스 길야드 주니어	
1993	11964	시티 오브 조이	드라마	롤랑 조페	패트릭 스웨이지	수술실 한 소녀가 위독한 상태로 있고 주치의 맥스(Max Lowe: 패트릭 스웨이즈 분)가 열심히 심장 맛사지를한다. 그러나 소녀는 숨을 거둔다. 슬픔과 무력감에 맥스는 수술실을 나온다. 하사리(Hasari Pal: 옴 푸리 분)는 아내 칼마(Kamla Pal: 샤바나 아즈미 분)와 딸(Amrita Pal: 에이샤 다커 분), 그리고 두 아들(Shambu Pal: 산투 초우두리 분 / Manooj Pal: 임란 바드사 칸 분)을 데리고 캘커타에 도착했다. 사기꾼에게 넘어간 일가는 모든 것을 잃고 뒷골목에서 밤을 보낸다. 같은 시각에 맥스는 실의 속에 캘커타에 도착한다. 이 도시에서 공허한 마음을 매꾸려하고있었다. 그러나 캘커타의 참혹한 현실이 맥스를 비웃듯이 엄습해 왔다. 가족을 위해 몸을 파는 푸미아와의 만남, 그리고 폭력. 맥스는 거리의 대부 아들 아쇼카(Ashoka: 아트 말릭 분)에게 매를 맞고 돈을 빼앗긴다. 다음날 아침, 맥스는 초라한 오두막집에서 눈을 뜬다. 거기는 가장 가난한 사람들이 모여사는 '아난드 니가르'(기쁨의 도시)로, 볼란티아에서 환자를 진료하고 있는 진료소였다. 진료소의 경영자 조안 바실(Joan Bethel: 폴린 콜린스 분)은 그에게 일손을 도와달라고 부탁한다. 그러나 자포자기 한 맥스는 이를 거절하고, 전날밤 도와준 하사리에 도움으로 호텔로 돌아온다. 하사리는 릭샤꾼으로 일하게 되고 시티 오브 조이에 있는 오두막집에 살림을 꾸민다. 며칠후, 맥스는 아쇼카를 발견하고 전날의 행위에 항의하려하나 오히려 경찰한테 저지당했다. 대부의 힘은 경찰에게까지 미치고 있었던 것이다. 조안은 맥스를 다시 설득한다. 패스포드를 잃어 버려 돌아갈 수도 없게 된 맥스는 도와주기로 결심한다. 그러나 진료소가 궤도에 오르자 대부 가타쿠(Godfather/Ghatakr: 시아만난드 자랑 분)로부터 진료소 보호료까지 더 요구한다. 이를 거부하자 아쇼카의 보복이 시작된다. 하사리는 이에 대항하고 그의 외침이 커질수록 슬럼가의 주민들도 하나 둘 아쇼카에 대항한다. 아쇼카 일당은 모든 반란의 근원인 맥스를 공격한다. 미국으로 돌아가라는 그들을 등뒤로 하고, 그의 발길은 이제는 자신의 전부인 진료소로 향한다. 그러나 기쁨의 도시에 재난이 온다. 용서 없이 폭우가 쏟아지고, 거리는 대홍수 속으로 매몰되어 간다. 물에 잠긴 맥스를 구해주는 하사리 일행. 그순간,전혀 다른 인생을 살아온 두 사나이들의 영혼이 손을 잡게 되었던 것이다.
