year	code	title	genre	directors	actors	story
1996	17686	주어러	드라마, 스릴러	브라이언 깁슨	데미 무어, 알렉 볼드윈	무명 조각가이며 한 아이의 어머니인 애니 레이드(Annie Laird: 데미 무어 분)의 단조로운 일상에 작지만 특별한 일이 생긴다. 마피아 보스 보파노의 살인 혐의 재판에서 배심원으로 봉사해 달라는 '신선한 자극'을 제의 받은 것. 애니는 '따분하다'고 느끼는 일상에서부터 잠시 벗어나 볼 수 있고 아들에게 책임감과 국가에 대한 사명감을 '시범' 보이고 싶었다. 그러나 이 제의를 수락하는 순간 그녀의 삶 전체가 위험에 빠져든다. 배심원단을 구성하기 위한 선정 과정에서 애니는 재판장과 피고인측 변호사는 물론 자신의 모습을 노출시키지 않은 채 예리한 눈으로 그녀를 주시하는 마피아 해결사로부터도 적임자로 선택된다. '선생'(Teacher: 알렉 볼드윈 분)이라 불리는 이 사나이는 보파노계 마피아 조직에서 사건을 '정리'하고 '해결'하는 인물로서 보파노가 신임하는 킬러이다. 그는 마치 백마탄 왕자처럼 애니 앞에 등장한다. 거액의 현금으로 애니의 작품을 사들이면서 미술품 수집가의 모습으로 나타난 그는 지적이고 유창한 화술의 소유자였다. 애니는 아주 오랜만에 사랑에 대한 기대감으로 부푼다. 그의 정체를 안 애니는 그의 접근 의도를 알았을 때 마치 강간을 당하고도 너무나 수치스러운 나머지 경찰에 신고하지 못하는 강간 피해자의 심리처럼 깊은 내면적 충격을 경험한다. 그는 도청장치 설치 및 감시 테크닉에 탁월한 실력을 가진 인물로 이번 재판에서 배심원인 애니를 위협해 보파노가 무죄임을 평결 내리도록 협박한다. 은밀하면서도 매우 집요하게, 그리고 가끔은 아주 악랄하게. 애니가 아들과 함께 마피아의 검은 손아귀로부터 안전할 수 있는 유일한 길은 살인혐의로 기소된 범인에게 무죄 평결을 내리는 길 뿐이다. 그러나 베일에 가리워진 채 애니를 배후 조종하는 선생은 애니에게 광적으로 집착하면서 그 선에서 게임을 끝내려하지 않는데.
1996	17440	쥬만지	모험, 판타지, 가족, 액션, 코미디	조 존스톤	로빈 윌리엄스, 커스틴 던스트, 데이빗 알란 그리어	1969년. 커다란 공장을 운영하는 아버지를 둔 12세 소년 알랜 패리쉬(Young Alan: 아담 한-바이드 분)는 어느날 친구 사라(Young Sarah: 로라 번디 분)와 함께 공장의 신축 공사장에서 이상한 북소리를 듣고 나무로 만들어진 이상한 게임판을 발견한다. 이 게임을 하던 알랜은 그만 게임의 마법에 의해 게임판 속으로 흔적도 없이 사라진다. 1995년. 주디(Judy Shepherd: 크리스틴 던스트 분)와 피터(Peter Shepherd: 브래드리 피어스 분)는 교통사고로 부모를 여의고 고모와 함께 살기 위해 왠지 값이 싼 커다란 집으로 이사온다. 어느날 고모가 직장으로 출근하고 난 뒤, 두 아이는 먼지 쌓인 다락방에서 들려오는 이상한 북소리를 듣는다. 공포와 호기심이 뒤섞인 채 다락방으로 올라간 주디와 피터가 찾아낸 것은 바로 쥬만지 게임판. 호기심 많은 주디가 게임판에 새겨진 지시에 따라 주사위를 던지는 순간, 갑자기 게임판에서 이제껏 본적 없는 괴조류떼가 튀어나와 물건들을 닥치는대로 부수어대기 시작한다. 놀란 주디와 피터는 뒤늦게 후회하지만 이미 사태는 엎지러진 물. 당황하는 주디와 피터 앞에 26년전 쥬만지 게임을 하다가 게임판 안에 갇혀버린 알랜 패리쉬(Alan Parrish: 로빈 윌리암스 분)가 나타나면서 주디와 피터는 이것이 단순한 게임의 수준을 넘어서는 초현실적인 것임을 깨닫고 전율한다. 이제 알랜은 26년이라는 잃어버린 세월을 찾기위해, 주디와 피터는 자신들이 무심코 저지른 장난의 결과를 되돌려 놓기 위해 게임판 앞에 앉는다. 이 세사람에 더해 알랜이 수소문끝에 찾은 26년전의 친구 사라(Sarah Whittle: 보니 헌트 분)가 합류한다. 그러나 좀체로 게임의 끝은 보이지 않고, 게임판에서 나온 동물들은 주디와 피터의 집뿐 아니라 온 마을 전체를 휘젓기에 이른다. 급기야 주디와 피터의 집은 정글로 변하고 쏟아지는 폭우속에 떠내려가던 네 사람은 운명을 건 마지막 주사위를 던진다.
1996	17497	지독한 사랑	멜로/로맨스, 드라마	이명세	강수연, 김갑수, 김학철	강수연과 <태백산맥>, <금홍아 금홍아> 등에서 호연한 김갑수가 연인으로 출연하는 멜러물. 관객은 10만 정도. 지방 도시의 시인과 기자를 다루고 있기에, 촬영의 70%는 부산을 중심으로 이루어졌으며, 양수리 세트장 내부에 세가지 특징적인 바닷가 세트를 만들어 실제 바다에서 촬영하지 못했던 금칩 모래 바람과 초록색 창틀에 반사된 석양의 바다장면 등을 촬영하기도 했다. 양수리 세트장 내의 바다 재현을 위해서 15톤 트럭 4대 분량의 물과 모래, 금가루, 은가루 등이 조달되었으며, 바다에 비치는 다양한 하늘빛을 표현하기 위해 세가지(맑은 하늘, 흐린 하늘, 밤 하늘) 배경이 사용되었다.시인과 그의 시평을 쓴 기자로 처음 만난 영민과 영희는 처음 마주쳤던 눈빛에서부터 서로에 대한 사랑의 감정을 읽게 된다. 너무 사랑해서, 서로를 떠날래야 떠날 수가 없게 된 두 사람은 부산 다대포앞 모래사장 근처에 허름한 셋방을 얻어 살림을 차리고, 지독한 사랑과 그 뒤에 닥쳐오는 냉엄한 현실을 함께 치러내기 시작한다. 매일 아침 사랑하는 사람과 한 이불 속에서 눈을 뜨고, 여자의 물 젖은 스타킹을 드라이기로 말리는 가난한 행복.
1996	17495	지붕 위의 기병	드라마	장-폴 라프노	올리비에 마르티네즈, 줄리엣 비노쉬	19세기 오스트리아의 침약으로 나라를 잃은 이탈리아인들은 인근 프랑스에 근거지를 마련하고 독립운동을 지속한다. 기병대장 앙젤로도 조국을 위해 군자금 모집에 나서는데, 프랑스에 있는 쥬세페를 찾아가는 도중 콜레라로 죽어가는 수많은 사람들을 목도하게 된다. 앙젤로는 어느 마을을 지나가다 주민들의 오해로 쫓기는 신세가 되어 마을의 지붕 위에 숨어 있다가 어느 저택으로 숨어든다. 그곳에서 귀부인 폴린의 도움을 받는데, 그 후 앙젤로는 군자금을 전하기 위해, 폴린은 남편을 만나기 위해 이탈리아로 향하다 길에서 우연히 만나게 된다.
1996	17200	진짜 사나이	액션, 코미디	박헌수	권해효, 서미경	나, 강철보다 단단하고 화산보다 더 뜨거운, 절대로 이 땅에 속해있지 않는 최후의 인디언 추장같은 진짜 사나이. 그러나 자동차 세일즈 교육원에서 재교육을 받는 불쌍한 사나이. 어느날 시동이 걸린채 서있는 원장의 차의 유혹을 뿌리치지 않았다. 언제나 꿈꾸던 진짜 사나이가 될 기회가 찾아온 것이다. 목력같이 희고 샘물보다 더 맑은 아름다운 그녀. 그래서 장차 왕비보다는 여왕이 될 꿈이 있는 그녀. 하지만 지금, 트럭 운전사들이 잘 모이는 희쭈그레한 휴게소에서 냄비 우동을 팔고 있는 그녀. 정의를 위해 물불을 가리지않는 진짜사나이가 폼나게 나타나 어려움에 빠진 그녀를 구하고 표표히 사라지던 날, 그녀는 아줌마의 고함소리를 뒤로하고 진짜사나이와 함께 바람처럼 떠났다. 진짜사나이와 그녀는 지긋지긋한 영업소와 우동집에서 탈출하였다. 정의와 법의 수호자 경찰 라이방을 따돌리고 톨게이트에서 납세의 의무도 거부하였다. 그들은 멈춤이 없이 바람처럼 이 땅의 끝까지 달려갔으며 천정이 터지고 바닥이 무너지도록 섹스도 하였다. 진짜 사나이와 그녀는 악당 빨노파의 차와 부딪히게 된다. 악당 빨노파는 자신들을 무시하는 두목 망치의 총을 빼앗아 달아나던 중이었다. 갑작스런 라이방의 싸이렌 소리에 놀라 허겁지겁 도망가는 빨노파. 위기에 벗어난 진짜사나이와 그녀는 뒤바뀐 빨노파의 차를 타고 다시 달린다.
1996	17398	채널 식스 나인	코미디	이정국	신현준, 홍경인, 최선미	제하(신현준 분)는 방송국 PD출신의 정보밀매업자로 뉴스나 신문에서는 보여주지도, 말하지도 않는 사회의 구석구석에 카메라를 들이대는 일을 하고 있다. 그러던 중 안검사(송금식 분)의 의뢰로 컴퓨터 바이러스 프로그램을 만드는, 자칭 ‘어둠의 메사아’라는 해커를 추적하게 되고 그 과정에서 바이러스 프로그램 속의 모델 미니를 발견하게 된다. 미니(최선미 분)는 자신의 아름다운 육체를 자랑하고 싶어하는 노출광이자 에로배우 지망생으로 자신도 모르는 사이에 자신이 영상이력서가 무단사용된 것을 알고 제하의 일에 적극 협조한다. 제하는 천방지축인 미니와 함께 추적을 계속하여 마침내 해커인 석기를 찾아내는데 성공한다. 범법자임은 분명하나 흥미롭고 천재적인 인물 석기, 한편 안검사는 결정적인 순간에 제하를 따돌리고 혼자 석기를 체포하려 한다. 이 사실을 알게 된 제하는 미리 석기 일행을 빼돌려 버린다. 서로를 몰랐던 이 세 사람은 졸지에 한배를 타게 되면서 세상을 깜짝놀라게 할 포르노 채널 ‘식스나인(69)’을 만드는데.
1996	24339	처녀 길들이기	코미디	페르난도 콜로모	안토니오 반데라스, 후안 에차노브, 베로니카 포쿼	추사(Chusa: 베로니카 호르크 분)와 자미토(Jaimito: 후안 에차노브 분)의 생업은 마약밀매. 대규모의 조직적인 것은 아니고 그냥 길에서 적당히 사고 파는 조무래기 마약상들이다. 이들의 친구 알베르토(Alberto: 안토니오 반데라스 분)는 근무태만의 대명사 같은 경찰관. 대낮에도 걸핏하면 추사의 집에 들러 정사를 벌이기 일쑤다. 추사는 어느날 한 가출 소녀를 꼬드겨 데려온다. 질과 항문에 마약을 숨기는 방법으로 세관의 눈을 피해 국경을 넘는 추사는 한번에 밀반입할 수 있는 마약 운반량을 늘리기 위해 여동업자가 펄요하다고 판단한 것. 하지만 알고보니 이 가출 소녀 엘레나(Elena: 아이타나 산체스 지온 분)는 정말 처녀였고 처녀막이 질 중간에 가로막혀 있는 탓에 마약을 그다지 숨겨 놓을 수가 없다. 이 장애물을 제거해주기 위해 자미토가 나서지만 조루인 그는 번번이 실패하고, 시큰둥해하던 알베르토가 추사의 강요에 못이겨 이 처녀 길들이기라는 대업에 나선다. 숫처녀를 길들이는데 힘과 시간이 많이 걸린다며 사양했던 알베르토는 엘레나의 신비스러움에 빠져들고 그녀에게 깊은 사랑을 느끼는데.
1996	33299	천공의 에스카플로네	애니메이션	타케이 요시유키, 요시모토 타케시, 카와모토 쇼고	사카모토 마아야, 세키 토모카즈	96년 4~9월에 걸쳐 동경 TV에서 방영되었던 총26편의 애니메이션 시리즈. 마크로스의 메카디자이너로 유명한 카와모리 쇼지(그는 96년 '켄지의 봄'이라는 작품으로 그 연출 솜씨를 인정받은 바 있으며, 국내 영화 잡지 '씨네 21'에서는 차세대 일본 애니메이션을 이끌어 갈 주역으로 오시이 마모루 <공각 기동대>, 안노 히데아끼 <신세기 에반겔리온> 그리고 카와모리 쇼지를 꼽았다.)의 원작으로, '건담 F-91''엄마는 소학교 4학년'을 제작한 아카네 카즈키와 '로도스 도전기' 'X'의 캐릭터 디자이너인유키 노부테루 등 화려한 스텝진으로 화제를 모았었다. 이 애니메이션은 여느 메카 애니메이션과는 달리, 메카의 조종사가 아닌 한 여고 생을 주인공으로 한 독특한 메카 환타지 작품이다.'사람과 사람의 서로를 믿는 힘','사랑하는 사람을 생각하는 마음'이라는 테마로 단순한 소년 로보트 만화가 아닌,순정 만화와 메카 만화의 결합이라는 이색적인 장르를 만들어낸 것이다. 근래 지나치게 상업적인 모습을 보이고 있는 일본 TV애니메이션 속에서, 개성 적이면서도 평범하여 친근감을 느낄 수 있는 신선한 캐릭터들을 등장시키고, 작품을 만들겠다며 제작비를 아끼지 않음으로써 카와모리는 모험을 감행했다. (카와모리는 애초에 이 작품으로 돈을 벌겠다는 생각은 버렸다고 밝혔으며, 그가 총 감독을 맡았던 마크로스 플러스는 이 작품을 만들기 위한 돈을 마련하기 위한 것이었다고 말할 정도였다.) 결국 이 모험은 상업적인 면에서 실패를 겪게 되었다. 오타쿠(만화 등을 현실 세계로 살고 싶어 하거나 자기 자신만의 세계에 지나 치게 몰입하여 현실 세계에의 참여를 소홀히 하는 사람.애니 시장을 석권하기 위 해서는 이들을 사로잡아야 한다) 들의 취향에 맞는 만화가 아니었던 것이다. 그러나 이 작품 자체는 좋은 평가를 받았으며, 카와모리 쇼지 자신도 일본 애니를 이끌어 가는 선두 주자들 중 한 사람의 자리를 명실공히 획득하는 계기가 되었다.'천공의 에스카플로네'는 충분히 애니 역사상 한 획을 그었다고 할 수 있는 것이다. 에스카플로네의 세계는 지구와 하늘 사이의 공간에 존재하는 또하나의 세계의 가이아라는 행성이다. 가이아에는 인간과 수인(짐승인간)이 공존하고, 드래곤과 각종 괴물들이 살아가고 있는 환타지의 세계인 것이다.천공의 에스카플로네는 가이아를 배경으로, 평범한 한 소녀와 두남자간의 사랑 이야기를 기본으로 운명에 대한 이야기를 다루고 있는 다소간은 복잡한 내용의 작품이다. 그러나 화려한 색체와 아름다운 그림은 이러한 설정을 크게 신경쓰지 않더라도 화려하게 화면 가득 펼쳐진다. 에스카 플로네 도입부. 고교 1학년생의 생기 발랄한 여학생인 간자키 히토미는 어느날 육상부 훈련도중에 불가사의한 환상을 보게 된다. 그것은 하늘과 지구 사이에 떠있는 거대한 로봇의 군단이 싸움을 하고 있는 다른 세계의 모습이었다. 그리고 다음날 히토미는 운명의 날을 맞게 된다. 꿈이 그녀의 인생을 바꾸어 놓은 것이다. 꿈에서 보았던 파넬리아 왕국의 왕자 반 파넬이 거대한 용과 함께 현실의 히토미 앞에 나타난 것이다.히토미의 조언 덕에 반은 드레곤을 물리치고 에너지스트를 손에 넣었다. 에너지스트는 반이 왕이 되기위해서 필요한 신비한 에너지가 깃든 광석이다. 빛의 기둥이 그녀와 반을 가이아라고 불리우는 반이 살고 있던 곳으로 인도하였다. 에너지스트를 손에 넣은 반의 대관식날. 히토미는 또다른 꿈을 통해서 거대한 보이지 않은 자이바흐 제국에서온 가이메레프 알사이데스가 마을을 파괴하는 것을 보았다. 그리고 꿈은 현실로 드러났다. 특수 장비인 스텔스 망토를 걸친 알사이데스가 파네리아 왕국을 침공한 것이다. 반은 에너지스트을 이용해서 수호신 에스카플로네를 깨워낸다. 반은 그 일  할 수 있는 유일한 사람이었던 것이다. 반,히토미,그리고 에스카플로네는 파넬리아 왕국을 정복하려는 자이바흐 제국에 맞서 싸운다. 이들의 싸움은 행성 가이아만이 아니라, 전 우주의 운명을 결정하는 싸움이다. 그리고 그들의 사랑 이야기가 지금 시작되고 있다. (네이버 오픈 지식 발췌)
1996	14220	철마류-가두살수	액션	조로강	견자단, 우마, 주비리	러시아와 결탁하고 백성들을 괴롭히는 악당 옥면호를 처지하기 위해 철마류와 고수들은 옥면호의 가면극에 잠입하지만 실패하게 되고 결국 신분을 감추고 살아간다. 그렇게 철마류가 사라진 5년 후, 옥면호에게 아버지를 잃은 여식 설민이 고가에 살수를 고용한다는 소문이 퍼지고 강호에서 이름 난 고수들이 모인다. 철마류를 찾던 설민 앞에 평범한 고아 소춘이 가짜 행세를 하며 나타나고, 소춘은 돈만 챙겨 옥면호의 편에 붙는다. 한편, 옥면호가 무기를 사들인다는 것을 알고 세력 확장을 우려해 모습을 드러낸 진짜 철마류. 철마류가 나타나자 한 뜻으로 모여 옥면호를 없앨 계획을 하는 사람들. 이들은 힘을 모아 모두의 적인 옥면호를 처지하려 하는데...
1996	38121	첫사랑	드라마	이응진, 김종창	배용준, 이승연, 최수종	효경 (이승연), 찬혁 (최수종), 찬우 (배용준), 신자 (이혜영) 등 청춘남녀들의 첫사랑 이야기와 그에 얽힌 이야기. 96년 KBS를 통해 총 66회 방영. 마지막회는 65.8%라는 전대미문의 시청률을 기록했다.극장 간판을 그리는 가난한 화가를 아버지로 둔 찬우와 찬혁은 서로 형제지간이다. 이후 형인 찬혁이 효경을 만나 좋아하게 되고, 어린 시절 효경을 좋아했던 찬우는 그걸 보고 자신의 사랑을 포기한다. 그런데, 효경의 아버지는 그들 형제의 아버지가 일하는 극장의 사장이었던 것. 그러나, 찬혁과 효경의 사랑은 쉽지만은 않고 결국 찬혁은 효경의 아버지 때문에 불구가 되고 만다. 이후 찬우는 형을 위해 복수를 다짐하고, 복수를 위해 명문대까지 그만 두고 거물 회장 밑으로 들어가는데..
1996	17742	체인 리액션	액션, 스릴러, 드라마	앤드루 데이비스	키아누 리브스, 모건 프리먼	시카고 대학 실험실. 과학자와 기술자들이 세계를 뒤흔들어 놓을 과학적 성공을 이룩해낸다. 수년간 땀을 쏟으며 끈질기게 연구에 몰두한 결과, 이들은 물을 원료로 사용하여 에너지 고갈을 염려할 필요가 없을만큼 무한정으로 생산해낼 수 있는 에너지이자 공해율 0%인 무색 무취의 강력한 에너지를 생산해낸다. 이들의 실험이 성공하던 날, 대학생 기술자 애디 카살리비치(Eddie Kasalivich: 키아누 리브스 분)와 릴리 싱클레어(Dr. Lily Sinclair: 레이첼 와이즈 분)는 암살 협박을 받게 된다. 이들의 연구 결과가 공식적으로 발표되기 직전, 실험실은 대폭발에 휩싸여 날아가버리고 과학자인 버클리 박사(Dr. Alistair Barkley: 니콜라스 루달 분)가 살해되고 중국계 루 첸 박사(Lu Chen: 트지 마 분)는 실종된다. 버클리 박사는 자신의 연구업적을 무료로 제공할 계획이었으나 공해 예방의 혁명적인 연구 결과가 공개되기도 전에 살해 된 것이다. 거듭되는 살인과 하이테크 스파이전의 연쇄 반응에 휘말린 애디와 릴리는 안타깝게도 폭파및 살인 용의자의 누명을 쓰고 도망자 신세가 된다. 6명의 FBI요원들은 시카고에서 위스콘신까지 이들을 뒤쫓는 추격전을 펼치고 애디와 릴리는 이 폭발 음모의 배후가 누구인지, 그리고 어떤 세력들이 자신들의 대체 에너지 연구를 저지하려고 하는지, 자신들의 목숨이 걸린 위기 속에서 그 음모를 풀어나간다.
1996	17193	축제	드라마	임권택	안성기, 오정해, 한은진	{흔히 말하는 노인들의 치매증이라는 것은 자신이 살아온 지난 날의 생애를 오늘에서 옛날로 다시 한번 살아가는 일이었다. 노모가 이미 40년에 돌아가신 아버지를 찾으실 때는 두 분이 한참 새 살림을 일구고 있을 무렵으로, 시어머니 저녁상 걱정을 할 때는 당신이 갖 시집오신 젊은 새 색시 시절로, 그리고 보퉁이를 싸들고 집을 나서실 때는 시집도 오기전의 그 아득한 처녀적으로... 그렇듯 자꾸 옛날로 돌아가고 계신 때문이다.} 40대의 유명작가 이준섭(안성기 분)은 시골에 있는 노모가 돌아가셨다는 연락을 받는다. 준섭의 도착에 따라 장례가 시작되고 시집와서 지금까지 시어머니를 모셔온 준섭의 형수는 그 시어머니의 죽음에 그동안 고생해온 자신의 설움이 은근히 복받친다. 5년이 넘게 노망을 앓아온 87세 할머니의 죽음은 상가에 온 사람들을 그리 슬프게는 하지 않는다. 더러는 노골적으로 호상이라는 것을 드러내는 사람들도 있다. 어머니의 죽음을 놓고 조금씩 생기던 가족간의 갈등은 13년전 집돈을 훔쳐 가출한 준섭의 이복조카 용순(오정해 분)이 나타나면서 깊어진다. 요란한 복장과 천연덕스런 행동... 용순은 자신을 좋게 생각하지 않는 이복언니 형자(홍원선 분)와 대판 싸우고 상가를 나간다. 모친상을 통해 준섭의 문학세계를 재조명하는 기사를 쓰러운 기자 장혜림(정경순 분)은 용순에게 따라붙어 이런저런 질문으로 은근히 용순의 부아를 돋구고 용순이 어릴 적 계모와 이복 형제들의 틈바구니에서 자신을 사랑해 준 할머니에게 깊은 애정을 갖고 있음을 알고 사회적으로 출세를 했으면서도 직접 어머니를 모시지 않은 삼촌 준섭에 대해 적의를 갖고 있다는 것도 알아낸다. 장례의 둘째날... 염습과 성복으로 시작된다. 가족들이 준비한 상복을 입는동안 용순은 자신이 직접 준비해온 어디에 서 있어도 눈에 띄는 호사스러운 상복을 입는다. 장혜림은 전날 마신 술이 깨지 않은 몸으로 취재하느라 분주하고 준섭의 친구들은 바다로 나가 낚시를 즐기고 산일을 맡은 우록 선생은 와서 어른들과 묘한 신경전을 벌이고. 본격적으로 문상객들이 밀려든다. 밤이 되면서 여기저기 노름판이 벌어지고 조의금을 슬쩍해서 노름을 계속하는 사람, 윷놀다 끝내 싸우는 사람들. 갖가지 해프닝들로 상가는 소란스러운데 그 와중에 소리하러 온 소리꾼은 만취해서 실려나가고 하는 수 없이 새말의 소리로 초경이 시작된다. 초경 이경 삼경을 지내는 것은 발인 전날밤을 보내는 이 지방의 풍습이다. 그러나 초경에서 삼경으로 가면서 사람들은 술에 취하고 점점 노골적인 놀이판으로 변한다. 만취한 용순은 앙칼진 목소리로 이 놀이판에 찬물을 끼얹는데. 발인날, 상여를 메기로 한 서울패들은 읍내 여관에서 늦는다. 그러면서도 준섭은 일을 진행시키는데 상여가 나가고 용순은 장혜림이 건네준 준섭의 동화를 보는데.
1996	14055	충무로 돈키호테	코미디, 드라마	최용호, 김정용	조형기	1950년대 사회, 경제적으로 암울했던 시대, 헐벗고 굶주림속에 뒷골목의 부랑아 생활을 하며 소년 시절을 보낸 임화수는 극장의 잡일을 하며 장래 그 극장의 주인인 디겠다는 야심을 품고 성장한다. 성년이 되어 투전판을 전전하던 임화수는 재력가 손중록을 만나게 되며 그의 도움으로 극단을 세우고 그의 신임을 얻어 조카 사위가 된다. 한편 어린 시절 형님으로 모시던 차인섭(눈물의 곡절)을 만나 자신의 형님으로 채용하며 숙명적인 두사람의 만남이 이루어진다. 정치와 주먹의 힘을 모아 날로 아성을 떨치는 동대문 사단의 대부 이정재는 세력 확장을 위하여 유지광을 흡수하고, 정치계의 거물인 경무대 곽영조와 함세하여 주먹과 정계의 검은 그림자를 드리운다. 한편 제일극장을 인수한 임화수는 평화극장으로 개관하고, 영화사업에도 뛰어들어 영화계와 정치계에 독보적인 임화수 바람을 일으킨다. 또한 처세술에 뛰어난 임화수는 여배우들을 미끼로 곽영주에게 접근하여 이기붕의 부통령 선거에도 가담하고 정치권력을 한층 더 높이며, 문화부장관이라는 명패에 욕심을 낸다. 그 무렵 부통령 선거에 낙선한 이기붕 의장의 불편해진 심기가 임화수, 이정재, 유지광의 숨통을 조이고 끝내는 패배를 설욕하겠다는욕심으로 부정선거를 모의하기에 이른다. 급기야는 이 사건으로 인하여 4.19 학생의거의 도화선이 된다. 임화수의 사주를 받은 유지광은 조직폭력배까지 동원하여 부정서거를 규탄하는 학생들의 시위에 테러를 행사하게 되고 3.15 부정 선거와 연류하여 수감된다. 5.16 군사 혁명이 일어나며 혁명재판부로 이송된 임화수, 이정재, 유지광, 곽영주 등은 사형을 선고받고 1961년 12월 21일 임화수와 곽영주는 한날 한시에 태어나 파란만장했던 인생을 쓸슬히 사형대에서 함께 마감한다.
