year	code	title	genre	directors	actors	story
1996	25502	스필	액션, 스릴러	알란 A. 골드스타인	브라이언 보스워스, 레아 핀센트	세균전을 대비한 극비 프로젝트를 수행 중이던 군사 연구소에서 예기치 않은 사고가 발생, 두명의 연구원이 죽고 만다. 그 상황을 목격한 연구원 알렉스(Alex Bur: 패트릭 갈리간 분)는 자신들이 살상용 화학무기를 개발해낸 사실을 알고 분노한다. 고위층까지 연루된 이 사건을 폭로하려다 살해되고 마는 알렉스. 세계 각국의 정상이 한자리에 모이는 '국제 환경 회담'이 개최될 써멜 웰즈 국립공원. 주변 지역을 점검하던 대통령 경호실장 켄 페어차일드(Ken Fairchild: 브라이언 보스워스 분)는 피를 흘리며 쓰러져 있는 캠핑족들을 발견한다. 미처 그들을 안전한 곳으로 옮기기도 전에 켄 자신도 감염되어 의식을 잃고 쓰러진다. 정체불명의 바이러스에 의해 삽시간에 국립공원 일대는 죽음의 사각지대로 변해버리고 마는데, 일명 베타약제로 불리는 이 치사율 100%의 바이러스 누출 사건을 은폐하기에 혈안이 된 군사 연구소에서는 아직 살아있는 임시 병동의 환자들을 차례로 살해한다. 또한 공원 경비대로 위장한 일급 킬러들을 파견, 위험을 느끼고 격리 병동에서 탈출한 켄 일행을 뒤쫓는다. 한편, 대통령은 비밀리에 세균전을 대비한 연구를 계속해 왔다는 보좌관 에릭의 고백에 충격을 받지만, 자신의 자리를 지키기 위해 예정대로 환경회담을 감행하기로 한다. 알렉스가 죽기 직전 보내온 극비 문서를 통해 사건의 전모를 알게 된 뉴욕 트리뷴지의 기자 리오(Leo Burns: 척 샤마타 분)는 단서를 찾던 중 완벽하게 사건을 은폐하려는 스케인스 소령(George Skanz: 데이비드 폭스 분)에 의해 살해되고 만다. 정신없이 추적대를 피해 다니던 켄과 로레인(Larraine Keller: 레아 핀센트 분)은 지하로 흘러들어간 베라약제가 지하 수로를 통해 대통령과 세계 고위 인사들, 그리고 만여명의 시민이 모이게 될 환경회담 개최 장소의 간헐천에서 뿜어져 나온다는 사실을 알고 경악한다. 뜨거운 온천수가 베타 약제 바이러스의 해독작용을 한다는 사실을 발견한 이들은 공원의 무기고에서 훔친 다이나마이트로 온천수를 폭파시킨다. 위기일발의 순간, 대틔령 이하 모두를 구한 켄은 리오가 남긴 서류를 통해 이 엄청난 사건의 배후가, 대통령 보좌관 에릭이었음을 알아내고 대통령에게 항의하지만, 자신의 재선을 염려한 대통령은 조용히 무마시킬 것을 종용한다. 그러나 켄은 진실을 밝히려다 먼저 죽어간 이들을 위해 이 사실을 폭로한다.
1996	17766	슬리퍼스	드라마	베리 레빈슨	케빈 베이컨, 로버트 드 니로, 더스틴 호프만	뉴욕의 뒷골목, 헬스 키친(Hell's Kitchen). 갱단이 판을 치고 부모들에게 보살핌을 받지 못하는 아이들이 있다. 이곳에서 풋풋한 그들만의 우정을 쌓아 가는 네명의 꼬마. 별명이 세익스인 로렌조(조셉 페리노 분)와 마이클(브래드 렌프로 분), 존(조프 위그도어 분), 토미(조나단 터커 분). 이들은 성당에서 바비 신부를 돕는 복사로, 거리에서는 갱단 두목이며 레스토랑 주인인 킹 베니(비토리오 개스먼 분)를 따르는 꼬마 갱스터로 즐거운 소년 시절을 보낸다. 어느날, 그들의 인생이 송두리째 바꾸어 버리는 사건이 터진다. 장난으로 시작한 일이 어처구니 없게도 한 남자를 죽음 직전까지 몰고가는 사건으로 변한 것이다. 9개월에서 18개월의 형을 선고받은 네명의 소년들은 윌킨스 소년원에 수감되고 그곳에서 모든 악연의 끈은 엮어지기 시작한다. 아예 습관이 되어버린 구타, 독방 감금, 최루탄과 향정신성 약제 투여, 그리고 아무도 생각지 못한 어린 소년들에게 가해지는 간수들의 성폭행. 간수 녹스(케빈 베이컨 분)의 '룰(Rule)'이란 외침은 우리의 마음 속에 커다란 반감을 불러 일으킨다. 고통과 수치심 속에서 14년의 세월이 흐르고 그들 중 어느 누구도 윌킨스 소년원에서의 충격을 잊지 못한 채 청년이 되었다. 신문기자가 된 세익스(제이슨 패트릭 분), 이제 막 법학 학위를 따 검사가 된 마이클(브래드 피트 분), 지난날의 기억에서 헤어나지 못한채 마약과 폭력의 세계에 빠져 버린 존(론 엘다드 분)과 토미(빌리 크래덥 분). 우연히 레스토랑에서 녹스와 마주친 존과 토미는 이제는 늙어버린 그 잔인하고 악랄했던 간수 녹스를 사람들이 보는 앞에서 죽여버린다. 이제 14년을 다짐한 그들의 복수가 펼쳐지고, 바비 신부와 킹 베니의 고용인 변호사 대니 스나이더(더스틴 호프만 분)가 이들을 돕게 되는데.
1996	17763	시티 홀	드라마, 스릴러	해롤드 벡커	알 파치노, 존 쿠삭, 브리짓 폰다	뉴욕시의 시장보좌관인 케빈 칼혼(Kevin Calhoun: 존 쿠삭 분)과 같은 젊은 이상주의자에게 있어서 삶이란 정의와 진보를 향한 것이지만, 시장 존 파파스(Mayor John Pappas: 알 파치노 분)와 같은 정치적 숙련가에게는 회색빛 그림자 안에서 벌어지는 게임에 불과한 것이다. 루이지애나 출신의 젊고 똑똑한 시장 보좌관 케빈 칼혼은 시민들의 마음을 사로잡은 가장 인기있는 지도자이며, 차기 민주당 대통령 후보를 노리는 시장 존 파파스와 거대한 뉴욕시의 오염과 빈곤, 매일 흘러넘치는 범죄들을 절묘한 협력으로 능숙하게 처리해나간다. 그러던 어느 비오는 날 아침, 경관 산토스(Detective Eddie Santos: 네스터 세라노 분)와 마약 밀매자 티노(Tino Zapatti: 래리 로마노 분)의 총격전으로 경관과 마약 밀매자 그리고 6살난 흑인 아기가 살해되는 사건이 벌어, 이 일로 시청의 메카니즘은 흐트러지기 시작한다. 사건은 점점 많은 의혹을 낳게 되고, 경관 유가족 보호 위원회 변호사로 일하는 메리벳(Marybeth Cogan: 브리짓 폰다 분)은 칼혼과 파트너가 되어 이 잔인한 사건 뒤에 숨겨진 진실을 밝혀내려 한다. 한편, 브루클린 카운티의 민주당 지도자이자, 막강한 정계 막후 조종자인 안셀모(Frank Anselmo: 대니 에이엘로 분)는 마피아 보스 폴 자파티(Paul Zapatti: 안소니 프란시오사 분)를 찾아가 마피아는 물론 배우 조종자들이 피해를 입지 않도록 손을 써달라고 부탁한다. 칼혼과 메리벳은 마피아 보스의 조카 비니(Vinnie Zapatti: 엔젤 데이비드 분)로부터 결정적인 정보를 제공하겠다는 연락을 받지만 비니는 변사체로 발견된다. 사건과 관련된 사람들이 죽는 살인 사건이 계속되고 존경하던 시장 존 파파스도 관련되어 있음을 알게되는데.
1996	58113	신고합니다		김용규	이휘재, 구본승, 차인표	
1996	17754	신부의 아버지 2	가족, 코미디	찰스 샤이어	스티브 마틴, 다이안 키튼, 마틴 숏	사랑하는 딸을 시집보내고 난 뒤, 한동안 허전함을 극복하지 못했던 '신부의 아버지' 조지 뱅크스(George Banks: 스티브 마틴 분)가 마침내 마음의 평정을 되찾았다. 비록 머리카락은 벌써 백발이 되었지만 야구 모자를 쓰고 지붕없는 스포츠카를 몰고 다니는 그는 사랑하는 아내 니나(Nina Banks: 다이안 키튼 분), 12살짜리 아들 매티(Matty Banks: 키어란 컬킨 분)과 함께 중년의 만족스럽고 안락한 생활을 즐긴다. 그의 딸 애니(Annie Banks-MacKenzie: 킴벌리 윌리암스 분)와 사위 브라이언(Bryan MacKenzie: 조지 뉴번 분)은 여피족으로서 각자의 일을 즐기며 행복하게 살아가고 있다. 어느날 애니와 브라이언이 양가의 부모님 앞에서 자기들은 곧 엄마, 아빠가 될거라고 발효한다. 온가족이 얼싸 안고 기뻐하지만 조지는 멍한 표정이 된다. 벌써 할아버지라니. 늙어가고 있다는 사실에 갑자기 서글퍼진 조지는 헬스 클럽에서 운동을 하고 머리를 염색한다. 그리고 18년 동안 살았던 낡은 집을 팔고 바닷가 콘도로 이사 가서 다시 한번 멋지게 살아보자고 니나를 설득한다. 집은 너무 쉽게 팔렸고 새 주인은 10일 안에 집을 비우는 조건으로 15,000 달러를 이사 비용으로 준다. 10일 후, 정든집을 떠나기 직전 조지와 애니는 뒷마당에서 옛날을 회상하며 농구를 한다. 이사갈 집을 미처 구하지 못했기 때문에 여행을 떠나는 사위 브라이언의 부모님 집으로 거처를 옮긴다. 그런데 니나의 건강 상태가 안 좋은 것 같아 병원 진찰을 받는데 뜻밖에 임신했다는 통보를 받는다. 애니는 8월 말에, 니나는 9월 초에 출산하게 된 것이다. 조지는 현기증이 일기 시작한다. 왜냐하면 자신이 할아버지가 되기엔 아직 젊지만 아빠가 되기엔 너무 늙었다고 믿기 때문이다. 기뻐하기는 커녕 크게 당황하는 조지를 보며 니나는 노산에 대한 불안감과 함께 외로움에 몹시 화가 난다. 조지는 어제 이사 나온 집 앞을 지나가다 때마침 집이 헐리려고 하는 것을 목격한다. 아기를 낯선 바닷가 콘도가 아닌, 구석구석 자기의 손 때가 남아있는 정든 집에서 길러야 한다고 깨달은 조지는 10만불을 더 얹어주며 하룻만에 다시 구입한다. 니나에게 옛집의 열쇠를 쥐어주며 사과한다. 6개월 후, 애니와 니나는 떠벌이며 호들갑장이인 프랭크 애글호퍼(Franck Eggelhoffer: 마틴 쇼트 분, 1편의 결혼식 및 피로연 이벤트 업자)를 불러 들여 성대한 베이비 샤워(아이가 태어나기전 미리 축하하는 파티)를 갖는다. 그리고 애글호퍼에게 아기방을 증축하는 일도 맡긴다. 그러던 어느날 애니는 아기를 낳고 두달 후 좋은 조건을 제시해온 보스톤의 새 직장으로 옮겨야 한다고 알린다. 애니가 더 가까이 살기를 원했건만 오히려 멀리 떠나가게 된 것이다. 9월 초, 애니의 출산 예정일이 늦어져 브라이언은 잠시 출장을 떠났고, 애니는 친정에 와 있게 된다. 이때부터 조지는 두 임산부의 시중 들기에 바빠지고 매일밤 산기를 느낀다고 착각하는 애니 때문에 병원에서 꼬박 지새우는 고생이 시작된다. 니나와 애니는 낮동안 휴식을 취할 수 있지만 조지는 또 출근을 해야 한다. 애기방 공사로 와 있는 애글호퍼는 두 만삭의 산모에게 운동을 시키는 등 여러모로 적극 돕는다. 마침내 애기방도 아름답게 완성된다. 하지만 48시간 동안 잠을 자지 못한 조지는 수면제를 먹고 인사불성이된 것처럼 꾀병을 앓는다. 바로 그때 애니는 진짜로 진통을 겪기 시작하고 애글호퍼는 시체같이 늘어진 조지까지 차에 싣고 급히 병원으로 달려간다. 조지는 병원에 도착해서야 잠에서 깨어난다. 그런데 니나의 진통도 시작되고 엄마와 딸은 나란히 붙어있는 두 개의 분만실에 각각 들어간다. 브라이언도 돌아오고 애니는 순조롭게 자연분만을 한다. 그러나 나이가 많은 니나는 제왕절개 수술을 받는다. 그리고 잠시 후, 밖에서 초조히 기다리던 조지의 양팔엔 갓 태어난 둘째 딸과 손자가 각각 안긴다. 두 아기의 얼굴을 바라보며 조지는 더할나위 없는 행복을 느낀다. 갓난 딸의 이름은 애기를 받아 준 젊고 유능한 여의사의 이름인 메간(Dr. Megan Eisenberg: 제인 아담스 분), 손자는 할아버지 이름을 물려받아 조지가 된다. 이윽고 두달 후, 조지는 보스톤으로 떠나가는 애니 가족을 배웅하며 낙옆지는 집 앞길에서 망연자실 서 있는다. 그러나 그를 일깨운 메간의 옹알이 소리. 그제야 조지는 정신을 차리고 애니가 선사한 작은 크기의 농구공을 메간에게 보여준다. "아가야, 네 언니에게 가르쳐 줬던 온갖 농구 트릭들을 너한테도 몽땅 가르쳐 줄께" 조지의 딸에 대한 지극한 사랑이 다시 메간에게서 피어 오르기 시작한다
1996	24130	신탐마루	코미디, 드라마	장지성	유청운, 종려시	삼각관계를 다룬 애정 드라마. 유청운은 경찰이며 자신의 상관인 여경 오영장에게 호감을 갖고 있다. 여경인 오영장은 남자같은 차림새에 터프한 방법으로 범인을 체포하곤 한다. 이러한 오영장에게 반한 유청운은 오에게 여러가지 방법으로 접근을 하지만 번번히 퇴짜를 맞는다. 오가 퇴짜를 놓는 이유는 그녀가 레즈비언으로 애인인 종려제와 같은 생활을 하고 있기 때문이다. 어느날 사무실에서 사랑을 나누고 있던 둘을 우연히 목격한 유청운은 깜작 놀라게 된다. 며칠을 방황하던 유청운은 자신은 계속 오를 좋아할 것이라고 고백한다. 이때부터 오와 종려제 그리고 유청운과의 이상한 삼각관계가 지속된다. 그들 셋은 항상 함께 다니며 즐겁게 지낸다. 여기에 유청운의 친구인 오진우마저 끼어들어 4명은 친구가 된다. 오진우도 오에게 호감을 가지며 오도 유청운에게 호감을 가지게 된다. 그러던 어느날 오와 유청운 종레시 셋은 여행을 하기로 하였지만  오의 사고로 둘만 가게된다. 유청운은 종려제의 매력에 빠져 그녀를 사랑하게 된다. 그 사실을 알게된 오와 종려제 그리고 유청운은 전형적인 삼각관계에 빠진다.
1996	17677	싸일런트 트리거	액션, 드라마, 스릴러	러셀 멀케이	돌프 룬드그렌	저격수로 어떤 집단에 고용되어 있는 왁스맨. 오랜 전투 경험으로 요인 암살이나 전쟁때에는 최고의 실력을 발휘하는 그에게 신참 파트너 클레그가 따라붙는다.  미모의 여성 클레그는 첫 살인때부터 자신을 지키준 왁스맨과 파트너이자 또 하나의 적수. 알 수 없는 고용주로부터 명령을 하달받고 그 명령에 따라 암살을 하는 그들에게 새로운 임무가 주어진다. 어느 비오는 밤, 고층 건물 옥상에서 4마일 밖에 접근한 표적을 사살하는 일. 잔혹한 킬러들에게는 다른 인간관계는 완전히 메말라 있으며, 파트너로 일하게 되더라도 절대로 상대방을 믿을 수는 없는 상황이다. 이미 오랜 살인의 시간들속에서 괴로워하던 왁스맨은 이 사건을 마지막으로 은퇴를 생각하고, 왁스맨으로부터 그의 전문적인 지식과 경험들을 전수해온 클레그 역시 이 지긋지긋한 살인 현장에서 벗어나고 싶어한다. 전쟁은 그런 것이었다. 죽어가는 상대방은 그저 표적이기 때문에 쏘아야 했고, 그들의 이름이나 얼굴은 중요하지 않았다. 이런 전쟁속에서 편집증에 걸려버린 왁스맨.  서로 여러번의 사투에서 목숨을 구해준 경험은 있지만, 서로를 견제하고 의심해야만 하는 사이가 되어 마지막 임무에 참여한다. 왁스맨과 클레그의 첫 만남때처럼 왁스맨은 명령을 무시한 채 저격을 일부러 포기하고, 고용주는 클레그에게 왁스맨을 살해하라는 명령을 내리지만, 그들은 이제 이런 사투를 뒤로 하고 새 생활을 찾기로 결심한다. 그러나 그들에게 뜻밖의 방해자가 나타난다. 그들의 마지막 임무가 행해지는 건물의 경비로 잠복하고 있던 클라인은 다름아닌 그들의 숨겨진 고용주. 여지껏 자신이 원해왔던 대로 왁스맨을 처치했다고 생각하지만 왁스맨은 구사일생으로 살아남아 클레그와 함께 더 이상은 살인을 하지 않고도 살 수 있는 새로운 세계를 향해 떠난다.
1996	17466	씨클로	범죄, 드라마	트란 안 훙	레 반 록, 양조위, 트란 누 엔 케	사고로 죽은 아버지의 뒤를 이어 씨클로를 운전하는 18세의 소년(Cyclo: 르 반 록 분). 사람들 사이에 그는 그저 씨클로 보이로 통한다. 자전거 바퀴를 수리하는 할아버지, 구두를 닦는 여동생, 집안 살림을 도맡아 하는 누나(Sister: 타란 누 옌케 분). 이들 세 사람과 함께 도시 빈민구역에 사는 소년은 고달픈 삶 가운데서도 호치민 시를 누비며 꿈을 키워간다. 그러나 소년은 유일한 생계수단인 씨클로를 건달패에게 빼앗긴다. 빌린 씨클로의 대여료 조차 갚을 수 없는 그에게 씨클로 주인은 대여료를 갚는 대신 자신의 수하에 있는 갱 조직에서 일할 것을 요구한다. 처음엔 마지못해 이들에게 협조하던 소년은 차츰 약간의 눈속임만으로도 손쉽게 돈을 버는 범죄 세계에 빠져들어 간다. 마침내 시인(Poet: 양조위 분)이 속해있는 갱 조직에 본격적으로 가담하면서 소년은 빠른 속도로 범죄의 소용돌이에 휘말린다. 가난과 절망이라는 갑갑한 현실에서 벗어나기 위해 범죄의 길을 택한 인물 시인은 소년의 누나를 사랑하지만 한편으로는 그녀에게 매춘을 알선하고 있다. 그러나 소년의 누나는 시인에 대한 순수한 사랑 때문에 그가 알선하는 매춘을 거부하지 않는다. 오히려 그녀는 현실 속에서 괴로워하는 시인을 따뜻한 시선으로 감싸준다. 한편 겉잡을 수 없이 자신을 끌어당기는 범죄 세계의 힘을 피부로 느낀 소년은 죽은 아버지의 비참한 모습을 꿈에서 본 후 갱 조직에서 빠져 나오기 위해 발버둥친다. 소년의 이런 모습을 보며 괴로워하던 시인은 자신이 알선한 매춘으로 소년의 누나가 순결을 잃자 급기야는 화염 속에 몸을 내던진다. 두 사람의 사랑은 예정된 파국으로 치닫고 소년은 마지막 마약 운반을 위해 클로의 핸들을 잡는다. 트란 안 홍 감독이 연출하고 그의 아내이자 여배우 트란 누 엔-케가 주연한 베트남 영화. 95년 베니스영화제에서 황금사자상을 수상했다. 하지만 베트남 정부는 이 영화가 베트남 사회의 혼란과 부정적인 면을 부각시켰다며 상영 금지시키기도 했다.
1996	17441	아기공룡 둘리 - 얼음별 대모험	애니메이션, 가족, 코미디, 모험, 뮤지컬	김수정, 임경원	박영남, 이인성	어느 날 남극의 거대한 빙산 한 조각이 한강으로 흘러 들어온다. 이 빙산 조각 속에는 억만년 전에 멸종된 아기 공룡이 갇혀 있었으니, 이름하여 둘리. 가사 상태에서 깨어난 둘리는 그 모습을 드러내고, 그날부터 소시민 고길동씨 집에서 머물게 된다. 호기심 많고, 말썽꾸러기인 둘리로 인해 고길동씨 집은 하루도 맘 편할 날이 없다. 거기에 설상가상으로 자칭, '공포의 젖꼭지' 희동이, 외계인 도우너, 아프리카의 귀부인 타조 또치, 가수지망생 마이콜까지 등장. 이들의 말썽은 날이 갈수록 기상천외, 대담무쌍해지고 고길동씨의 분노는 하늘을 찌른다. 계속해서 고길동에게 당하는 둘리 일행은 도우너의 타임 코스모스를 타고 빨리 어른이 되기 위해 미래로 여행하기로 결심한다. 하지만 타임 코스모스의 작동 실수로 우주의 미로속에 던져지고 만다. 우주에서 방황하던 둘리 일행은 우주핵층을 만나면서 위기를 맞게 된다. 한편 로프에 매달려온 길동이는 떨어져 우주 한복판에서 방황하다 우주 핵층에게 계속 쫓긴다. 그러던 중  가시고기를 만나 우주를 지배하려는 바요킹의 존재를 알게 된다. 죽은 영혼들만이 갈 수 있는 얼음별에 착륙한 둘리 일행은 바요킹의 부하들로부터 추격을 당하고 희동과 마이콜, 고길동은 바요킹에게 붙잡히고 만다. 둘리 일행의 도움으로 그들을 구해내고 둘리는 옛 여자 친구인 공실이를 만나 엄마가 수정체 속에 갇혀 있다는 사실을 알게 된다. 바요킹과 맞서 싸우는 둘리 일행. 길동과 희동의 할약으로 바요킹은 폭파된다. 엄마와 감격스런 재회를 하는 둘리. 둘리는 엄마와 함께살며 어른이 되고 싶지만, 엄마는 둘리가 자신의 일을 할 수 있으니 이제 둘리는 어른이라고 말해준다. 다음에 만날 날을 기약하는 둘리와 엄마. 둘리는 엄마를 은하계에 남겨둔 채 아쉬움을 가득 안고 지구로 돌아온다. 똑같은 일상이  다시 반복되지만 우리의 둘리는 웃음을 잃지 않고 엄마를 향한 희망을 소중히 간직한다.
1996	46938	아기와 나	애니메이션	오모리 타카히로	야마구치 카페이, 사카모토 치카, 미야모토 미츠루	
1996	17903	아름다운 비행	가족, 모험, 드라마	캐롤 발라드	제프 다니엘스, 안나 파킨	여행 중이던 에이미(Amy Alden: 안나 퍼킨 분)는 교통사고로 엄마를 잃고 아버지 토마스(Thomas Alden: 제프 다니엘스 분)와 10년 만에 만나 다시 고향을 찾는다. 엄마를 잃은 슬픔과 좁혀지지 않는 아빠와의 거리 사이에서 에이미의 작은 방황이 시작된다. 학교 수업이 있을 시간, 개발업자들의 횡포로 속이 훤히 드러난 늪 주위를 거닐던 에이미는 미처 부화하지 못 야생 거위알을 발견한다. 조심스럽게 집으로 옮겨진 거위알들은 에이미의 따뜻한 손길 속에서 귀여운 새끼 거위들로 태어난다. 세상에서 가장 먼저 본 에이미를 어미새로 알고 있는 거위들은 오로지 에이미의 곁에서 쉬거나 그녀의 행동만 따라한다. 서로 엄마가 없는 상황에서 에이미는 이제 16마리 거위의 작고 소중한 엄마가 된다. 야생거위를 집에서 키우는 것은 불법이라며 경관이 찾아오자 에이미의 아빠는 거위들에게 나는 법을 가르치기로 한다. 어차피 이 거위들은 철새이기 때문에 추위가 몰아치기 전, 따뜻한 남쪽으로 이동을 해야하기 때문이다. 하지만 에이미만 따르는 거위들에게 아빠의 경비행기는 그저 덩치 큰 물체로밖엔 보이지 않는다. 할 수 없이 아빠는 에이미를 위한 또 하나의 경비행기를 만들고 하루 하루 어려운 실습을 익혀간다. 철새 서식지의 개발 착수 공사가 발표되자 에이미네는 서둘러 비행을 준비한다. 개발 업자가 발표한 날짜에 철새들이 도착하지 않으면 그나마 있던 보금자리까지 잃게 되는데.
1996	17229	아마게돈	애니메이션, SF	이현세	최불암, 이병헌	{먼 옛날, 별과 별이 하나씩 모습을 갖춰가던 시절, 은하계로부터 600만 광년이나 떨어진 안드로메다 성운에서는 고도의 문명이 완성되고 있었다. 그들은 새로운 생명체를 만나기 위해 오랜 기간 생물이 존재할 수 있는 18만 6천개의 항성계를 샅샅이 뒤져나갔다. 원시적인 진화의 현장은 목격했지만 그들이 원하는 문명의 세계는 어디에도 없었다. 그들은 문명을 창조하기로 결심했다. 18만 6천개에 달하는 항성계에서 가장 진화 가능성이 높은 9999개의 항성계가 대상으로 선정됐으며, 고유 넘버 ‘오메가 파이 8988’, 까마득한 훗날 ‘지구’라고 불리게 될 이 혹성도 그 대상지 중 하나였다.}먼 옛날, 은하계로부터 600만 광년 떨어진 안드로메다 성운에는 상상 할 수 조차 없는 고도의 문명이 완성되고 있었다. 문명의 발달은 삶의 파괴로 이어지고 그들은 새로운 돌파구를 얻기 위해 또 다른 우주 생명체를 찾아 나설 계획을 세운다. 그러나 그들은 문명을 찾을 수는 없었다. 우주에는 오직 몇 개의 원시 혹성만이 있을 뿐이었다. 그래서 그들은 문명을 창조하기로 결심한다.9999개의 초자아 컴퓨터가 전우주에 뿌려지고. 먼 훗날 지구라 불리울 이 혹성에는 8988이라는 고유 번호를 받은 컴퓨터가 투하된다. 우주 저쪽 끝에는 감마 6666이. 서기 2157년, 고도의 과학력을 자랑하는 외계 조직 '이드'가 지구를 침입한다. 지구가 멸망 위기에 처하자 그때까지 남극 바다 밑에 숨어 있던 아틀란티스의 후예 '엘카'는 초자아컴퓨터 델타 8988의 도움으로 지구를 구할 수 있는 마지막 인물을 찾는다. 그는 1996년 오혜성. 엘카 특수요원 마리는 그를 미래로 데려갈 임무를 띠고 혜성을 찾아온다. 혜성의 존재를 알게 된 '이드' 역시 킬러를 보내는데.
1996	65652	아빠는 시장님	코미디	주병대	변우민, 이경진, 박주미	지방자치시대 민선시장을 소재로 한 코미디 시트콤.
