year	code	title	genre	directors	actors	story
1996	25368	라이프 인 레드	범죄, 드라마, 멜로/로맨스	파벨 룽긴	벵상 뻬레	프랑스인 작곡가 필립 로빙은 동경에서 파리로 가던 중 모스크바에서 환승할 비행기를 놓치고 우연히 금발의 러시아 미녀 옥산나를 만난다. 옥산나와 모스크바를 배회하며 술에 취한 채 밤을 지샌 필립은 다음날 낯설고 불길한 기운이 감도는 방에서 깨어난다. 그의 옆에는 덩치 큰 사내가 서 있었는데 그는 바로 옥산나의 아버지이자 러시아 마피아의 대부인 파파였다. 필립은 몇번의 탈출을 시도하지만 모두 실패하고 결국 파파의 요구대로 그의 사기극에 동참하기로 한다.  필립은 파파가 지은 직물공장의 프랑스인 투자자 행세를 함으로써 몽고계 거물의 돈을 빼앗는다. 그러나 사기그가의 전말이 들통나게 되고, 몽고계 거물은 화해의 대가로 필립의 목숨을 요구한다. 그렇지 않으면 두 파벌사이에 전면전이 일어날 상황에까지 다다른다. 옥산나의 간청에도 불구하고 파파는 필립의 희생으로 간단히 일을 처리하길 원한다. 필립을 사랑하게 된 옥산나는 필립을 도와 이웃 나라로 탈출을 시도한다. 천신만고 끝에 프랑스에 도착한 필립과 옥산나는 물랭루즈에서 행복한 밤을 보낸다. 그러나 그들 앞에는 또다시 자신의 영역에서 벗어난 것을 노여워하는 파파의 손길이 뻗쳐오는데.
1996	17874	랜드 앤 프리덤	전쟁, 드라마	켄 로치	이안 하트, 로사나 파스토르, 이시아 볼레인	1994년 영국 리버풀의 한 시영 공립 주택. 한 노인이 심장마비로 병원 후송 중 앰브런스 안에서 사망한다. 그날밤 그의 유품을 정리하던 손녀는 낡은 가방 하나를 발견한다. 오래된 편지뭉치, 스페인 내란에 관한 신문 스크랩, 청춘의 할아버지와 그분의 동지들이 무장을 한 채 찍은 '1936년 바르셀로나'라는 문구가 쓰인 옛 사진들과 붉은 리본으로 말라붙은 흙을 싸둔 손수건, 그리고 스페인 공화파를 옹호하며 모임을 선전하는 삐라가 들어있다. 1936년 리버풀의 모임에서 한 스페인 시민군이 노동자들의 참전을 독려하는 열정적인 연설을 한다. 그는 프랑코의 스페인 공화정부에 대한 반란상황을 설명하면서, 유럽의 민주정부들의 도움을 거부하고 국제 노동자들의 참여를 호소한다. 그의 호소에 감동된 데이빗은 약혼녀 키티에게 프랑코와 싸우기 위해 스페인에 가겠다고 한다. 그는 실업수당을 받고 배고픈 시위를 하는 영국에서의 생활에 염증이 난 것이다. 변화를 원하는 그를 키티는 마지못해 보낸다. 스페인을 가로지르는 기차안에서 데이빗은 '품(POUM)'혁명당을 찾아가는 프랑스인 베르나르와 여러 시민군들을 만나게 된다. 그들은 군사훈련을 받기 위해  한 훈련캠프에 배속된다. 거기서 그들은 메이트라는 불같은 젊은 여인이 캠프의 규율에 반항하는 장면을 목격하고 충격을 받는데.
1996	17725	랜섬	스릴러, 드라마	론 하워드	멜 깁슨, 르네 루소, 게리 시나이즈	미국 4대 항공사인 엔디버 항공사의 사장이자 재력가로 성공의 상징이며 아메리칸 드림을 실현시킨 톰 멀른(Tom Mullen: 멜 깁슨 분)은 언제나 매스콤의 주목을 받고 있다. 또한 그의 성공을 상징적으로 보여주는 그의 아내 케이트 멀른(Kate Mullen: 르네 루소 분)은 뉴욕시의 초.중등학교 과학발명품 경연대회 회장을 맡고 있다. 과학 발명품 경연대회가 있던 날, 톰과 케이트의 외아들인 숀(Sean Mullen: 브롤리 놀테 분)이 유괴범에게 납치되고 숀의 몸값으로 2백만 달러를 요구받게 된다. 유괴사건이 발생하자 톰의 아파트에는 수사전담반이 구성되고 FBI요원 호킨스(Agent Lonnie Hawkins: 들로리 린도 분)가 그 책임을 맡게 된다. 수사팀과 아버지의 갈등이 커지는 한편 톰은 FBI의 만류에도 불구하고 아들을 구하겠다는 일념으로 2백만 달러를 준비해 약속된 장소에 나간다. 그러나 접선하기로 했던 범인 중 1명이 매복된 특전반(SWAT)에 의해 현장에서 사살되면서 아들을 찾으려던 기대와 범인을 체포하려던 FBI의 1차 작전은 무산되어 버린다. 구출 작전이 실패하자 설령 몸값을 준다한들 숀을 구하기는 힘들 것이라고 판단한 톰은 범인을 꼭 잡겠다는 생각으로 공개 수사를 결심한다. 톰은 2백만 달러를 몸값대신 유괴범의 목에 현상금으로 걸겠다고 생방송으로 선언해 버린다. 그러자 범인은 오히려 톰의 아내를 유인하여 물리적인 보복을 가하고 몸값을 안주면 숀의 목도 칼로 그어 버리겠다는 경고를 남긴다. 아내까지 피해를 당해버린 톰은 FBI의 경고와 설득을 뿌리치고 다시 방송 카메라 앞에 서서 유괴범과의 사생결단을 선언하며 현상금을 4백만달러로 올려놓는다. 톰의 분노와 의지를 읽고 몸값을 받아내기가 글렀다고 판단한 범인은 새로운 음모를 시도한다. 즉 동료 유괴범들을 신고하여 영웅으로 둔갑해 현상금 4백만 달러를 몸값대신 보상금으로 챙기려는 것이다. 범인이었음을 전혀 눈치채지 못하는 톰과 아내 케이트 그리고 구출된 숀은 오히려 감사와 포옹으로 범인을 환영하는데.
1996	17192	러브 스토리	드라마	배창호	배창호, 김유미	늦여름의 어느 오후, 인테리어 코디네이터인 김수인은 여러 모습의 사람들로 북적대는 벼룩시장에서 괴짜 영화감독 하성우와 우연히 맞부딪친다. 예민한 감성의 소유자이며 완벽주의에 가까울 정도로 매사 철저한 수인에 비해 몇해째 작업을 쉬고 있는 하성우는 일상생활에는 무신경해 보일 정도로 털털한 성격을 가진 노총각. 첫 만남부터 서로의 모습에 매력을 느끼고 두사람의 관계는 성우의 적극적인 프로포즈에 의해 매일매일의 데이트로 이어진다. 가을이 깊어갈 무렵 수인과 성우는 평화로운 지리산 농가로의 여행길에 오르고 남자를 받아들이기까지 좀더 진지한 준비가 필요하다고 생각하는 수인 때문에 각자 다른방에서 밤을 보낸다. 그러나 옆방에 잠들어 있을 성우의 존재감으로 뒤척이던 수인은 성우와의 사랑에 대해 너그러워지는 자신을 발견하고는 비로서 편안한 마음으로 잠자리를 함께 하게 된다. 하지만 정작 문제는 지금부터. 수인을 소유했다는 만족감에서 비롯된 기쁨에 사로잡힌 성우의 무신경한 농담과 격식을 갖추지 않은 구혼은 수인의 예민한 자존심을 흔들어 놓고 성우는 성우대로 수인의 날카로운 반응에 몹시 언짢아진다. 시간이 흐르고 다시 홀로 서있는 자신들의 모습을 들여다보게 된 수인과 성우는 '사랑'의 신성한 의미를 되새기며 서로를 그리워하고 있음을 깨닫지만 재회란 그리 쉽지 않다. 결국 주체할 수 없는 감정에 이끌린 성우는 초겨울 새벽길을 달려 수인의 집앞에 이르고 지난날 보다 더 큰 사랑으로 맺어지기를 원하고 있는 서로의 모습을 확인한다. 수인의 따스한 손에 처음으로 그녀의 방에 초대된 성우는 평생의 반려자가 되어 줄 것을 청하고 헤어져 있는 동안 성우에 대한 깊은 애정과 믿음을 갖게 된 수인은 그의 청혼을 받아들이고 앞으로 펼쳐질 인생에서 사랑과 우정을 함께 나눌것임을 약속하며 포옹한다.
1996	17793	러브 앤 A. 45	드라마	C.M. 토킹톤	길 벨로우스, 르네 젤위거, 로리 코크레인	범죄를 저지른 두 남녀의 도피 행각을 그린 영화. 전과자인 와티는 사람을 해치기를 원치 않는, 어찌보면 인간미가 있는 좀도둑이다. 그에게는 비슷한 처지의 스탈린이라는 여인이 있으며 그녀를 끔찍이 사랑한다. 사랑스런 그녀에게 결혼반지를 사주기 위해 마약업자에게 빚을 지고만 그는 그 돈을 갚으려고 어느날 밤 친구 빌리와 편의점을 털기로 한다. 마약 상용으로 몹시 흥분한 가운데 그 가게 점원에게 얼굴을 보이게 된 빌리는 당황한 나머지 그녀를 죽이고 말았고 급히 그 자리를 피한 와티와 빌리는 서로에게 책임을 전가하며 말다툼을 한다. 와티로 인해 감옥에 가게 되었다고 믿는 빌리의 난폭함은 친구를 죽이려 하는 지경에 까지 이르고 이를 벗어나기 위해 필연적으로 그를 죽일 수밖에 없었던 와티. 일이 크게 벌어진 것을 깨달은 와티는 집으로 돌아와 스탈린에게 함께 도망가자고 하며 청혼한다. 이에 반색을 하는 그녀. 그러나 미처 짐을 챙겨 떠나기도 전에 현상금 사냥꾼이 찾아와 편의점의 살해자는 보안관의 딸이자 자신의 조카라며 범인을 잡기만 하면 죽이겠다고 협박한다. 광적인 그들의 횡포에 스탈린은 그들을 쏘아 죽이고 도피길에 오른다. 한편 이들이 떠나는 동안 매스컴에서는 이들 미남 미녀가 벌인 살인 행각이 일제히 알려지고 일대 센세이션을 불러일으킨다. 멕시코로 가는 길에 자신의 부모에게 들린 스탈린은 자신의 결혼을 알리고 서로 기뻐한다. 오랜만에 만난 이들은 식사를 함께한 후 행복에 겨운 신혼부부는 허니문을 떠난다. 스탈린과 와티가 멕시코로 향하는 동안 상처를 급히 치료한 빌리는 복수를 다짐하며 머리에 해괴한 문신을 새기는데, 거머리같은 마약업자의 하수인 두명이 그를 찾아온다. 와티의 행방을 캐물으며 더욱 강한 흥분제를 주사한 두 악당. 집요한 그들의 완력에 못이겨 함께 찾아 나서기로 한 빌리는 스탈린의 부모집으로 향한다. 이미 와티와 스탈린이 떠난 후에 도착한 이들 일당은 스탈린의 부모를 처참히 고문하고 죽인다. 그 와중에 총상을 입은 두 하수인을 죽이는 빌리. 그는 다만 자신이 직접 와티를 없애고 싶었을 뿐이다. 다시 추격은 시작된다.
1996	17765	레드 로즈 화이트 로즈	드라마	관금붕	조안 첸, 예위칭	세계적인 중국계 작가 장애령의 원작을 영화화한 작품으로, 1930년대의 중국을 배경으로 남자와 여자의 관계에 관한 스토리. 젠 바오가 파리의 한 창녀에게 동정을 잃는다. 그러나 사창가에서 가진 불쾌한 성경험은 젠 바오의 인생에 고통스런 오점을 남긴다.  이 경험 이후로 젠 바오는 자신의 일생에 대해서는 물론 그를 둘러싼 사람들의 삶에 대해서도 주인이 되겠노라 결심한다. 젠 바오는 친구의 아내에게 향한 불륜의 열정과 사회적 의무 그리고 도덕적 책임감 사이에서 괴로워하는, 모순에 찬 인물이다. 영국에서 유학한 '붉은 장미'는 서양인의 고지식함과 자신감을 모두 겸비한 여성으로서 남자들로 하여금 애간장 타게 만드는 열정적인 여자이다. 사랑하지 않는 남편 제홍로부터 구속을 느끼고 있던 붉은 장미는 남편과 친구 사?? 남편이 출장가 있는 동안 하숙을 들어온 젠 바오와 열애에 빠진다. 그러나 그녀가 남편인 제홍과 이혼하겠다고 고백하는 순간 젠 바오는 붉은 장미를 버리고 떠난다. 젠 바오는 흰 장미와 결혼한다. 흰 장미는 지나칠 정도로 과민한 여자이다. 그리고 완벽한 여자가 되고 싶어하는 여자이다. 그런 흰 장미로부터 거리감을 느낀 젠 바오는 술과 여자를 탐닉한다. 그러자 흰 장미는 스스로를 화장실 안에 감금함으로써 남편의 부도덕성과 불결함으로부터 해방되고 싶어한다. 이런 과정에서 흰 장미는 재단사와 내밀한 관계를 맺음으로써 자신을 서서히 남편 아닌 다른 남자에게 욕정을 불태우는 열정적인 여자 즉, 붉은 장미로 만들어 간다. 붉은 장미를 추억하던 젠 바오는 어느날 우연히 전차안에서 그녀와 마주친다. 그러나 한때 자신이 소유했던 붉은 장미는 이미 그녀가 재혼한 남자에게 정숙한 아내인 흰 장미가 되어 있었다. 이 사실을 깨달은 젠 바오는 떠나가는 그녀의 뒷 모습을 바라보며 흐느낀다.
1996	25690	레드 타겟		존 소그렌	채드 맥퀸, 마이클 매드슨, 록산나 잘	왕년의 자동차 경주 선수 짐(Jim, Stunt Driver: 채드 맥퀸 분)은 카센터에서 일하면서 좀도둑으로 돈을 훔치다가 범죄 조직의 두목 켈러(Keller: 잔-마이클 빈센트 분)에게 들키게 된다. 이 약정 때문에 짐은 켈러를 위해 래리의 집에서 차를 훔쳐다 준다. 켈러는 다시 거액을 주겠다며 다른 차를 찾아오라고 한다. 세차장에서 만난 여자 친구 잼(Gem: 로사나 잘 분)은 짐에게 분명 차에 엄청난 가치의 물건이 숨겨져 있을테니 켈러에게 차를 넘기지 말라고 설득하자 짐도 생각을 달리한다. 켈러가 자기를 죽이려 하자 짐은 래리에게 차를 넘겨주겠다는 거래를 맺고 켈러와 래리를 서로 싸우게 만들 계획을 세운다. 그러던 중 뒤쫓는 차를 따돌리러다가 충돌 사고가 발생하는데, 짐은 화염에 쌓인 차 안에서 숨겨진 다이아몬드를 발견해낸다. 짐과 만나기로 한 장소에서 맞대면한 래리와 켈러가 서로 다이아몬드를 내놓으라면서 싸우고 있는 동안 짐과 젬은 유유히 도시를 떠난다.
1996	17875	로미오와 줄리엣	드라마, 멜로/로맨스	바즈 루어만	레오나르도 디카프리오, 클레어 데인즈	정열의 도시 베로나, 태양의 열기가 가득한 이 도시에서 두 가문 몬태규가와 캐플릿가는 끝없이 혈투를 벌인다. 어느 날 캐플릿가의 파티에 몰래 참석한 몬태규가의 로미오는, 아름다운 줄리엣을 만나 첫눈에 사랑에 빠진다. 로미오와 줄리엣은 부모 몰래 결혼식을 올리고, 이 결혼이 두 가문의 화해를 가져다 줄 거라 믿은 신부는 그들을 축복한다. 그러나 싸움에 휘말려 줄리엣의 사촌 티볼트를 죽이게 된 로미오가 베로나에서 추방당하게 되고, 줄리엣은 그녀를 좋은 가문에 강제로 결혼시키려는 부모를 피해 수면제를 먹고 죽은 것처럼 가장하는데..
1996	17790	롱 키스 굿나잇	스릴러, 액션	레니 할린	지나 데이비스, 사무엘 L. 잭슨	뉴저지의 한적한 전원도시. 평범한 가정 주부이자 귀여운 딸의 엄마, 그리고 유치원 교사이기도한 사만다 케인(Samantha Caine: 지나 데이비스 분)은 자신의 과거를 전혀 기억하지 못하는 기억 상실증 환자. 그녀가 기억하는 것은 오직 한가지, 8년전 근처 바닷가에서 2개월된 아이를 임신한 상태로 발견되었다는 사실 뿐이다. 그러나 크리스마스 분위기가 한창인 12월, 우연히 당하게된 교통사고를 계기로 희미한 기억의 필림들이 사만다의 의식 속으로 떠오르고, 왠지 모르는 불안함을 느낀 사만다는 사립 탐정 헤네시((Mitch Henessey: 사무엘 L. 잭슨 분)에게 자신의 과거를 조사해 달라고 의뢰한다. 크리스마스를 하루 앞둔 날, 흰눈 속에 울려퍼지는 캐롤의 고요함을 찢고, 평화롭던 사만다의 집에 괴한이 침입한다. 구사일생으로 목숨을 건진 사만다는 엄습해오는 기억과 집안에서 벌어진 일련의 사태가 심상치 않음을 깨닫고, 헤네시와 함께 직접 자신의 과거를 찾아 나선다. 이 과정에서 사만다는 자신이 찰리 발티모어(Charly Baltimore)라는 이름을 가진, 고도의 살인 훈련을 받은 비밀 요원이며 무기 암거래 조직의 보스를 암살하는 임무를 수행하다 실패해 절벽 아래의 바다로 떨어졌다는 사실을 알게 된다. 한편, 사만다가 방해물로 나타나자 조직과 결탁한 CIA 고위층은 킬러를 시켜 사만다를 습격하고, 사만다의 딸 캐트린(Caitlin: 이본느 지마 분)을 납치한다. 무서운 음모가 도사리고 있는지도 모르는 채, 해네시와 함께 딸을 찾아 조직의 비밀 기지로 잠입한 사만다는 딸과 함께 냉동창고에 갖히게 되고, 조직은 '허니문 작전(밀월 여행)'이라 이름 붙인 대규모 테러를 시작하려 한다. 마침내, 사건의 전모를 알게 된 사만다는 냉동창고를 가까스로 탈출해 분노의 대반격을 가한다.
1996	18699	리차드 3세	드라마, 전쟁	리처드 론크레인	이안 맥켈런, 아네트 베닝, 크리스틴 스콧 토머스	1930년대 영국, 수많은 피를 부른 시민 전쟁은 왕의 암살로 끝이 난다. 전쟁에서 승리한 요오크카의 맏이 에드워드(King Edward: 존 우드 분)는 왕위에 오르고 모두가 이를 축하하는 파티가 열린다. 그러나 에드워드 왕권에 불만을 품은 유일한 인물이 있었으니, 이는 다름 아닌 에드워드의 막내 동생 리차드 글로쎄스터(Richard III: 이안 맥컬린 분)였다. 리차드는 바라보는 거울마저 비웃을 정도로 볼품없이 못생긴 얼굴과 말라 비틀어진 듯 움추려든 왼팔, 곱사 등을 가진 신체적 불구자이다. 허나 그는 세기를 뛰어넘는 뛰어난 언변과 권모술수, 탁월한 리더쉽, 유머감각으로 모든 열등감을 뛰어넘은 카리스마적 인물이다. 또한 그는 신체적으로 불구자일 뿐 아니라 내면 세계까지 악마성으로 철저히 무장한 신이 만든 최악의 불량품이다. 그의 피해 의식은 세상을 악으로 지배하고야 말겠다는 정권욕으로 바뀐다. 천하를 지배하고자 했던 리차드는 권력욕의 화신일 뿐 아니라 정념의 화신이기도 하다. 그는 자신이 원하는 여자는 모두 자신의 소유로 만들어야했고 마음에 두고 있던 앤(Lady Anne: 크리스틴 스콧 토마스 분)을 얻기 위해 시민전쟁 동안 앤의 남편을 처참히 죽인다. 리차드는 남편의 영안실에서 오열을 토하고있는 앤을 달콤한 유혹으로 자신의 아내로 맞게 된다. 결국 그녀는 자신이 가장 저주하던 사람의 아내가 되어 자신의 저주를 자신이 맞게 되는 비참한 인생으로 접어들게 되는데. [스포일러] 리차드는 자신의 집권에 방해가 되는 사람들을 하나씩 제거해 나갈 계획을 세운다. 맨처음 희생자는 자신의 정치적 야심에 걸림돌로 여기는 큰 형 클러랜스(Clarence: 니젤 호손 분)를 탑에 가두어버린다. 클러랜스를 탑에서 풀어주라는 에드워드 왕의 명령을 중간에서 가로챈 후 자신의 심복 타이렛(Tyrell: 에드리언 둔바 분)을 시켜 살해해 버린다. 이 충격으로 왕 에드워드는 운명을 맞게 되고. 다음 희생자는 막후 세력을 장악하기 위해 미국에서 온 엘리자베스(Queen Elizabeth: 아네트 베닝 분) 오빠 리버스(Rivers: 로버트 다우니 주니어 분). 그는 정부와 정사 중 리차드에 의해 비참하게 살해된다. 또한 리차드는 어린 승계자 웨일즈 왕자(Prince of Wales: 마르코 윌리암슨 분)와 웨일즈의 동생 제임스도 탑에 가두어 살해한 후 호민관의 지위에 오른다. 그런 다음 카리스마적인 리차드를 추앙하는 무리들에 의해 ‘리차드 3세’로 추대됨으로써 그의 숙원인 제왕의 자리에 서게 된다. 그러나 새로운 왕, 리차드 3세에 반대하는 세력은 점점 더 거세게 밀려온다. 한편 색마 리차드는 엘리자베스 여왕을 설득해 그녀의 딸(Princess Elizabeth: 케이트 스티븐슨-페인 분)과 결혼하려 하나 자신과 숙명의 대결자 헨리 리치몬드(Richmond: 도미닉 웨스트 분)에게 빼앗기고 만다. 결국 ‘이기기 전엔 죽어도 물러서지 않는다’던 리차드는 민의의 대변자, 헨리 리치몬드가 이끄는 군대에 도전을 받아 불길 속에서 추락하는 비참한 최후를 맞는다.
1996	32454	립스틱 짙게 바르고	드라마	석도원	오수비	아버지에 대한 갈등과 증오를 가진 찬이는 폭력조직 두목의 정부였다가 도망 나온 하영을 우연히 만나 하룻밤을 보낸다. 두목의 부하들이 하영을 찾아오고 찬이는 그녀에게서 어머니와 같은 사랑을 느끼고, 립스틱을 선물한다. 하영이 결국 두목에게 잡히자 찬이가 구타를 당한다. 하영을 구하기 위해 그의 친구 준이는 친구들과 나타나고 두목은 하영을 두고 떠난다. 하영과 찬이는 다시 만나고 미래에 대한 자신들의 막막함을 이야기한다.
1996	25608	마네킨 피스		프랭크 반 파셀	안제 드 보엑	전차 운전수 쟌(Jeanne: 안체 데 보엑 분)은 해리(Harry: 프랭크 베크루이센 분)라는 젊은 청년을 태운다. 해리는 드니즈라는 여자의 아파트에 방을 구하고, 식당에 접시닦기로 취직을 한다. 쟌이 같은 아파트에 살고 있는 걸 아는 해리. 해리는 쟌을 자기 집으로 초대하고, 쟌은 설레는 마음으로 거길 간다. 맛 있는 음식, 로맨틱한 분위기 쟌의 설레임이 사랑으로 기울어지고, 사랑한다는 느닷없는 말에 쟌이 기쁨을 느끼려할 때, 해리는 자신이 가족에게 했던 말이 그것이 마지막이었음을, 자신의 소년 시절의 사고를 쟌에게 이야기해준다. 쟌의 마음은 격정적인 사랑으로 가득차 내달리고, 해리는 사랑하는 이를 잃을까 두려움에 조심스럽기만 하다. 그러던 어느날, 해리는 자신이 모은 돈으로 그녀가 갖고 싶어했던 금빛구두를 선물하고, 즐거운 피크닉에서 쟌은 해리에게 참지 못하고 사랑을 고백하고 만다. 대답이 없는 해리, 화가난 쟌은 돌아가 해리와는 냉전이 벌어진다. 쟌은 해리의 사랑의 고백을 끌어내기 위해 갖은 수단을 쓰고, 밤마다 그가 일하는 댄스 홀에 가서 금빛구두를 신고, 딴 남자와 춤을 추며 해리를 자극하기 시작하는데.
1996	17794	마이크로코스모스	다큐멘터리	클로드 누리드사니, 마리 페렌노우	크리스틴 스콧 토머스, 자크 페렝	착륙 - 구름으로부터 초원까지의 숨막히게 급강하는 카메라. 풀의 정글 - 이상한 거주자들과의 첫 번째 근접조우. 첫 아침 - 떠오르는 태양을 머금은 거대한 고무풍선 같은 이슬방울들. 벌과 꽃들 - 양귀비 꽃가루를 모우는 벌. 벌의 겹눈에 비친 양귀비 꽃들. 샐비어 사이를 날아다니며 자연스럽게 꽃가루를 분배하는 벌. 무당벌레 - 무당벌레 잠에서 깨어난다. 진딧물을 포식하는 무당 벌레. 그러나 진딧물 무리를 지키려는 개미들에게 쫓기는 무당 벌레. 달팽이의 사랑 - 이끼 침대위에서 뜨겁게 뒤얽힌 두 마리의 달팽이. 거미의 덫 - 무당 거리 잠복근무 중 이상무. 명주실 같은 실을 뿜어 메뚜기를 말아 버린다. 따뜻한 한낮 - 정오, 한낮의 열기 속에서 곤충들의 붕붕거림이 절정에 이른다. 꽃은 시들고 땅은 갈라진다. 작열하는 태양 아래, 나방애벌레들의 1열 종대 행군이 벌어진다. 번데기가 되기 위해 자신들을 묻을 장소를 찾아가는 것이다. 성지를 찾아가는 순례자들처럼. 갑자기 2열 종대로 헤쳐모엿. 근처 풀밭에서 수확한 씨앗들을 지하 창고로 옮기는 개미 농군들.마른 땅 위에선, 성스런 소똥구리가 똥경단을 굴린다. 하늘의 거인, 꿩에게 공격을 받는 개미탑. 연못 - 거대한 잠자리들의 짜릿한 곡예비행. 2인 1조 공중교미. 소금쟁이들이 펼치는 수면위의 피겨스이팅. 물의 장막 아래선, 물거릭가 표면에서 만들어낸 거품으로 잠수종을 만든다. 뇌우 - 하늘에서 퍼붓는 물의 융단 폭격에 시달리는 곤충들. 폭풍우 그친 후 - 마침내 미래의 여왕, 날개달린 개미들이 혼례 비행을 위해 이륙을 감행한다. 격투를 벌이는 커다란 사슴벌레 두 마리. 밤 - 나비들, 호박벌들이 자신들의 나무 위 침실에서 안식을 맞는다. 때는 바야흐로 야행성 곤충들이 잡에서 깨너날 때. 이탈리안 귀뚜라미, 각종 나방들. 두번째날 - 안개가 걷히고, 연못의 수면으로부터 물의 요정이 등장해 모기로 변한다. 날이 새자 도처에서 인간의 소음들이 출몰 마이크로코스모스의 단꿈을 삼켜버린다. {날이 밝고, 사람들의 소음이 곤충들의 단잠을 깨운다. 숲속의 작은 생명체는 평생과도 같은 하루를 시작하기 위해 기지개를 켠다. / "인간의 가장 건강한 삶은 자연과 더불어 사는 것이다." - 생 틸 데르 -}
