year	code	title	genre	directors	actors	story
1996	51506	1.5	드라마	이관희	심은하, 신현준, 정우성	미국 한인 교포 1.5세대 이야기.
1996	17985	101 달마시안	코미디, 가족	스티븐 헤렉	글렌 클로즈, 제프 다니엘스	컴퓨터 게임 디자이너인 로져(Roger: 제프 다니엘즈 분)에게는 퐁고라는 이름의 멋진 달마시안이 한마리 있다. 아침이면 커피도 뽑아주고, 잠도 깨워주는 퐁고는 로져에게 둘도 없는 친구이자, 가족으로, 퐁고를 모델로 삼은 게임을 만들기도 했다. 달마시안을 납치하려는 개도둑 놈들을 혼내주는 게임이다. 하지만, 게임의 상품력을 측정하는 꼬마는 개도둑이 별로 밉지 않다는 이유로 퇴짜를 놓았다. 실망한 로져가 공원에서 휴식을 취하는 동안 퐁고는 옆에 앉아 지나가는 개들과 인사를 나누고 있었다. 앗, 그런데, 저쪽에서 늘씬하게 뻗은 달마시안 암컷이 한 마리 지나간다. 그녀의 이름은 퍼디. 첫 눈에 마음을 빼앗긴 퐁고는 로져가 자전거에 올라타자마자 그를 끌고 쏜살같이 퍼디의 뒤를 쫓았다. 영문을 모르는 로져는 퐁고를 멈추려하지만, 아무리 소릴쳐봐도 개 귀에 경 읽기고, 급기야는 공원 연못에 빠지고 만다. 화가 머리끝까지 난 로져가 퐁고를 묶어 데려 가려는데, 웬 아가씨가 앞을 차로막는다. 자신의 개라는 것이다. 정신을 차리고 살펴보니, 정말 암컷 달마시안이었고, 퐁고는 잠시 후 언덕 넘어서 태연히 달려오는 것이었다. 아가씨의 이름은 아니타(Anita: 조엘리 리차드슨 분), 퍼디의 주인으로, 퐁고와 퍼디는 이미 서로 정이든 눈치였다. 하지만, 퐁고 때문에 온갖 망신을 다 당한 로져는 다짜고짜 퐁고를 끌고 집으로 향했다. 그랬더니, 이번엔 퍼디 아니타를 태운 자전거를 끌고서 화급히 그들의 뒤를 쫓기 시작했다. 사색이 된 아니타. 그녀 역시 연못에 빠지고서야 질주를 멈출 수 있었다. 아니타의 집에서 젖은 옷을 함께 말리던 두 사람은 서로에게 호감을 갖게 되고, 마침내는 결혼에 골인했다. 퐁고와 퍼디도 부부의 연을 맺은 것은 당연지사. 그런데, 이들 견공 커플의 결합을 몹시 반가와하는 이가 있었으니, 아니타가 일하던 패션회사의 사장 크루엘라 드빌(Cruella De Vil: 글렌 클로즈 분)이었다. 동물원의 호랑이 가죽을 벗겨 옷을 만들 만큼, 열렬한 모피광인 코루엘라는 아니타가 무 심코 스케치해본 달마시안 무늬의 코트에 욕심이 생긴 나머지, 새끼 달마시안들의 가죽을 모아 모피 코트를 만들 작정이었다. 퐁고와 퍼디가 귀여운 새끼 101마리를 낳던 날, 크루엘라는 아니타의 집으로 쳐들어와서 새끼들을 팔라고 하는데.
1996	17758	12 몽키즈	SF, 드라마, 스릴러	테리 길리암	브루스 윌리스, 매들린 스토우, 브래드 피트	서기 2035년 미래의 인류는 바이러스 감염으로 인해 99%가 멸망하고 소수의 생손자들은 지상에서의 생활을 포기한 채 지하 세계에서 생활하게 된다. 감옥에 수감되어 있는 제임스 콜(James Cole: 브루스 윌리스 분)은 자원 임무를 띠고 지상으로 나가게 되고 그곳에서 사자와 여러 동물들이 배회하는 것을 보며 '12 몽키즈'란 단체의 마크를 보게 된다. 탐사업무를 끝내고 돌아온 제임스에게 일련의 과학자들은 그에게 인류의 지상회복을 도와준다면 완전 사면을 해주겠다고 제의한다. 결국 그는 시간을 거슬러 올라가 바이러스가 퍼지게 된 1996년으로 보내진다. 그러나 어떤 착오로 인해 1990년으로 보내지고 그곳에서 경찰을 부상입히는 등 말썽을 피워 정신 병원에 수감된다. 그는 곧 인류가 바이러스에 의해 멸망할 것이라고 설득하지만 아무도 그의 말을 믿으려 하지 않았다. 그의 담당의사인 캐서린 레일리(Dr. Kathryn Railly: 매들린 스토우 분) 박사는 그를 치료하면서 어디서 본 것 같은 느낌을 갖는다. 그리고 제임스와 같은 병동에 수감되어 있는 제프리 고인즈(Jeffrey Goines: 브래드 피트 분)라는 사람은 부친이 대단히 유명한 바이러스 연구학자로 아버지에게 연락이 닿으면 언제든지 나갈 수 있다고 큰소리 친다. TV를 통해 인간들의 폭력을 본 제임스는 혼잣말로 인류가 멸망을 자초한 것이라고 말하자 제프리는 그에 동조하며 인류는 바이러스 같은 것으로 망해야 한다고 말한다. 제임스는 제프리의 도움으로 탈주하지만 다시 붙잡혀 감옥에 수감 도중 미래로 돌아간다. 과학자들이 제시한 자료를 통해 제프리가 12 몽키즈라는 단체의 주요 인물임을 알아내어 제임스는 다시 1996년으로 보내진다. 그러나 실수로 1910년대의 프랑스 전쟁터로 떨어져 위기를 맞게 된다. [스포일러 주의] 위기의 순간 그는 다시 1996년으로 보내지고 6년만에 레일리 박사를 만나게 된다. 제임스는 자신의 말을 믿지 않았던 그녀에게 1914년 전쟁터에서 자신이 위기에 순간에 찍혔던 사진으로 진실에 대한 확신을 주지만 레일리 박사의 납치 사건으로 경찰의 추격을 받는다. 제임스가 미래에서 다시 돌아왔을 때 제프리 일당이 한 일은 동물원에 갇혀있던 동물들을 풀어놓는 장난에 불과하다는 것을 알게 된다. 바이러스를 확산시킨 진짜 범인은 제임스가 어려서부터 꿈에서 보아왔던 제프리 부친의 조수라는 것을 알게 되어 공항을 탈출하려던 그를 막으려 한다.
1996	17198	1996 뽕	드라마	김동명	예지원, 조형기	강원도 철원 용담이란 마을에 노름꾼 김삼보(최종원 분)란 위인이 살고 있는데 그는 언제나 투전판을 쫓아 팔도를 제집같이 떠도는 지라 집이랍시고 석달에 한번 넉달에 한번 찾아올까 말까 한 그런 뜬구름 잡는 위인이다. 그 김삼보에게 안협집(예지원 분)이란 계집이 있다. 안협집이 비록 몸은 귀하게 태어나진 못하였으나 인물이 남달리 고운 점이 있다. 그러나 가난한 촌구석에서 아무렇게나 자란 터라 먼저 안 것이 돈이었다. 십오륙세적 참외 한개에 정조를 빌린 것이 원인이 되어 돈만 있으면 서방도 있고 먹을 것, 입을 것이 다 있지 하는 굳은 신조가 생겨 목숨 말고는 무엇이든지 제공하여 부끄러울 것이 없는 그런 계집이다. 안협집이 처음 이 마을에 들어왔을 때는 혼자 지낼 수가 없어 자연 이집저집 품방아도 찧고 김도 매주며 잔일을 하여 주며 얻어 먹다가 차츰 쌀말이나 피륙 지전을 받고 몸을 내주는 처지가 되어 지금은 동네 남정네란 남정네는 다 한번씩 후려내게 되었다. 참다못해 분개한 아낙네들이 작당을 하여 동네에서 판박아 놓은 화냥년인 안협집을 내쫓으려 하지만 워낙 제잘못에 대한 개념이 없는 계집인데다 사내란 사내는 모두들 한번쯤 안협집의 배를 건넌 처지라 실패하고 만다. 뒷집에 누에를 함께 치는 신씨란 할미가 살고 있는데 그집에 힘이 장사인 삼돌이(조형기 분)란 머슴놈이 있다. 놈이 원래 음흉하여 안협집을 한번 후리기 위해 갖가지 방법을 다 동원하지만 어찌된 일인지 이 머슴놈에게만은 절대로 몸을 허락하지 않는다. 안협집이 정조가 헤프기로 유명한 대신 또 매몰스럽기로 유명하여 한번 마음에 들지 않는 것은 죽어도 막무가내라 맘에 드는 서방질은 부정한 일이 아니고 죄가 아니고 모독이 아니지만 맘에 없는 사내와 그것을 하는건 부정한 일이요 죄요 모독이었다. 하다 하다 실패하고 열이 뻗친 머슴놈은 어느날 집이랍시고 기어든 삼보에게 안협집의 행실을 다 꼬아 바치게 되고 큰 싸움이 벌어져 온 동네를 떠들썩하게 하는 촌극이 벌어진다. 다음날 아무일도 없었던 듯 계집은 노잣돈에다 밑천 푼까지 주어 배송을 하고 삼보는 울며 겨자 먹기로 한숨을 쉬며 다시 개나리 봇짐을 지고 훨훨 길을 떠난다. 안협집은 언제 돌아올지 모르는 그를 떠나 보내며 또다시 얼굴에 화장을 하고 언제나처럼 공청 사랑에서 잠을 잔다.
1996	30297	7악동	가족, 코미디, 모험	임선	신준호, 정태우, 윤동원	젊음의 열기가 가득한 문화의 광장 중앙에 자리잡고 있는 미니 패스트푸드점에서 아르바이트를 하고  있는 7악동은 모두 고아 출신으로 본인들이 학비를 벌어 공부를 하는 용기있는 아이들이다. 또한 공원의 이벤트인 캐릭터 쇼에 참가하여 타이거 가면을 쓰고 무술시범과 노래, 춤으로 공원을 찾는 아이들에게 즐거움을 주는 7악동을 어린이들은 타이거 7형제라 부른다. 공원에서 나쁜 짓을 일삼는 불량배와 폭주족, 소매치기에 대항해 두번 다시 나쁜 짓을 못하도록 교화시키는 것, 또 어린 소년 소녀들을 납치해 날치기, 앵벌이, 소매치기 등 범죄행위를 시키는 조직단 일망타진도 7악동의 몫이다. 그리고 7악동은 심장병으로 죽어가는 고아원 동생 지숙을 살리기 위해 산악 자전거대회에 출전, 목숨건 레이스를 벌려 우승 상금으로 지숙을 살려내는 진정한 용기를 보여 주기도 한다. 결국 7악동은 경찰청에서 용감한 어린이들로 선정되어 명예 경찰 임명장을 받는다.
1996	17862	7층	스릴러	이안 배리	브룩 쉴즈	광고 대행사의 대주주인 남편이 유언 한마디 없이 갑자기 죽자 케이트 플레처(Kate: 브룩 쉴즈 분)는 엄청난 빚과 회사의 주식지분 그리고 수리가 덜 끝난 대형 아파트만을 물려 받는다. 동업자인 비비엔(Vivian: 린다 크로퍼 분)으로부터 배신당한 그녀는 자신의 아파트에 들어온 일본인 컴퓨터 전문가 미쓰루(Mitsuru: 마사야 카토 분)에게 애정을 느끼고 의지한다. 어느 날 비비엔이 처참하게 의문의 살해 당하고 케이트는 점점 미쓰루가 매우 위험한 정신질환자라는 것을 깨닫는다. 미쓰루는 오래 전에 죽은 자신의 누나 나오코(Naoko: 미키 오이카와 분)의 기억으로부터 벗어나지 못한 채 억제할 수 없는 폭력을 휘두른 것이다. 미쓰루는 자신이 좋아하는 케이트를 보호하는 수단으로 폭력을 휘두르고 미쓰루 기억 속의 나오코는 자신의 소유물이라 생각하는 남동생을 다른 여자에게 뺏기지 않기 위해 미쓰루의 폭력성을 부추긴다. 미쓰루의 비밀을 알아버린 케이트는 미쓰루에 의해 자신의 아파트에 감금된다. 이제 미쓰루의 누나 나오코는 그의 강박관념과 기억을 조종하며 케이트와 그녀 주변의 인간들에 대한 엄청난 복수를 음모한다. 그러나 한때 비비엔과 작당해 케이트를 회사에서 쫓아낸 존의 도움으로 케이트는 복수에 사용 되려던 미쓰루의 컴퓨터를 파괴해 버림으로써 자신을 구하고 나오코의 기억으로부터 미쓰루를 벗어나게 한다. 그러나 미쓰루는 끝내 자신의 컴퓨터, 그 컴퓨터 속에 내장되어있던 누나 나오코의 데이터들과 죽음 속으로 몸을 던진다.
1996	33140	96 옐로우하우스		김정철	민복기, 소비아, 신성하	명자, 말순, 진희는 저마다 한과 과거를 갖고 밤의 거리 옐로우 하우스에서 남자들을 잡고 실랑이를 벌인다. 진희는 한강에서 자살하려고 서서 지난 일을 생각한다. 어촌 마을 횟집 딸로 부러울게 없이 자란 진희는 어느날 카메라맨 태일을 만난다. 탤런트를 시켜준다며 유혹하는 태일에게 속아 순결을 잃은 진희는 곧 속았다는 사실을 알고 터미널에서 서성이다 똥개를 만난다. 그리고 밤의 여인이 되어 옐로우 하우스에서 지내다가 급기야 한강으로 오게 된 것이다. 마침 이곳을 지나던 은경은 진희를 구해 자기가 일하는 룸살롱으로 데려와 같이 일하는 보영과 함께 진희를 정성껏 간호한다. 한편 은경은 출세를 위해 자신을 버리고 회장딸과 결혼했지만 성격차이로 이혼한 철민을 만난다. 어머니가 임종하면서 은경을 찾아 용서를 빌고 잘 살라고 유언했다며 전하지만, 은경은 이를 거절하고 돌아선다. 하지만 은경,보영,진희는 굳게 살아갈 것을 맹세했지만 어느날 진희는 다시 똥개에게 잡혀가고 만다. 진희가 배신한 걸로 알고 있던 은경과 보영은...
1996	18829	LA 탈출	액션, 모험, SF, 스릴러	존 카펜터	커트 러셀	술, 담배, 마약, 총기소지, 여자와 심지어는 육식까지도 금지된 21세기의 미국. 종신 재임하게 된 미국 대통령은 아예 자신의 고향으로 백악관을 옮겨버리고, 지진으로 영토에서 분리된 LA를 미국 본토로부터 분리시켜 범법자나 반정부 단체들을 가두어 버려 LA는 무법 천지가 된다. 이때 대통령의 딸이 L.A.의 갱단 두목 쿠에르보 존슨에게 포섭되어 대통령의 블랙박스를 훔쳐 그에게로 가버린 사건이 발생했는데, 그 블랙박스 안에는 전세계의 전원을 차단시킬 수 있는 리모콘이 들어 있었다. 이에 정부는 반정부 세력의 신화로 존재하던 범법자 스네이크(Snake Plissken: 커트 러셀 분)에게 열 시간 후에 사망하는 바이러스를 주사 한 후 그에게 주어진 시간내에 블랙박스를 찾아올 것을 명령하고, 블랙박스와 해독제 주사를 교환하는 조건을 내건 것이다. L.A.에서의 작업은 처음부터 쉽지 않은데, 계속해서 생체 이식수술을 해서 살아가는 사람들이 있는 병원, 10초내로 10점을 따지 않으면 죽어야하는 농구 시합 등 여러 차례의 죽을 고비를 넘긴 그는 허쉬(팜 그리어 분)를 만나게 된다. 여장을 하고 있는 허쉬는 그가 예전부터 믿고 지내던 사람이었는데, 허쉬의 행글라이더를 이용해 스네이크는 결국 블랙박스를 손에 넣게 된다. 가까스로 대통령 관저에 도착한 스네이크가 리모콘을 건네주자 대통령은 제3 세계의 전원을 차단하기 위한 암호를 입력한다. 그러나 그가 건네준 리모트 컨트롤은 가짜였는데.
1996	90088	가슴을 열어라	드라마	최종수	정준호, 박소현, 이효정	노총각 태민과 귀여운 성격의 다영이가 결혼하는 과정을 그린 드라마
1996	64916	간이역	드라마		이혜은, 원영, 이영애	
1996	92138	강력반	드라마	박성수	박근형, 정보석, 김정균	범죄실태와 수사과정을 통해 잃어버린 삶의 미덕을 찾는 드라마
1996	17461	거미의 계략	미스터리	베르나르도 베르톨루치	지울리오 브로지, 피포 캄파니니, 프랑코 지오바넬리	아토스 마냐니(Athos Magnani, father and son: 기우리오 브로지 분)는 이탈리아 중부의 한 작은 마을 출신으로 반 파시즘 운동의 지도자로 기억되는 전설적인 영웅이다. 그는 오페라에 참석한 무솔리니를 암살하려는 음모를 계획했다가 오히려 파시스트들에 의해 암살당했다고 알려져 있다. 아토스가 죽은 지 30년이 지났지만 그의 고향에서는 그에 관한 이야기가 끊이질 않는다. 어느 날 한 젊은이가 이 도시를 방문하기 위해 기차에서 내린다. 그는 바로 아토스 마냐니의 아들로 그는 아버지를 쏙 빼어 닮았다.(실제 영화에서도 1인 2역을 함) 아토스의 아들이 이 도시를 다시 찾은 이유는 30년 전에 아버지의 정부였던 드라이파 부인(Draifa: 알리다 발리 분)이 그를 불렀기 때문이다. 드라이파는 아토스의 아들에게 아버지를 암살한 범인을 찾아내라고 말한다. 그는 아버지의 애인이었던 드라이파 부인을 비롯해서 코스타(Costa: 티노 스코티 분), 라조리(Rasori: 프랑코 기오반넬리 분), 가이마찌(Gaibazzi: 피포 캄파니니 분) 등 아버지와 가장 절친했다고 하는 세 사람, 그리고 아버지를 기억하고 있는 마을 사람들을 만나 30년 동안 묻혀 있던 아버지의 죽음에 대한 비밀을 파헤쳐 나간다. 이 과정에서 아토스의 아들은 아버지가 살해되는 과정에서 절친한 누군가의 밀고가 있었다는 사실을 밝혀낸다. 아토스의 아들은 그 밀고자가 아버지와 같이 음모를 꾸민 세 친구 가운데 한 사람이라는 생각을 굳히지만 비밀을 밝혀나가는 과정에서 생각지도 않았던 진실을 알게 된다. 그것은 밀고자는 바로 아토스 마냐니 자신이었고, 친구들에게 그 사실을 들킨 아토스가 친구들에게 자신이 암살당한 것처럼 꾸며 달라고 부탁했던 것이다. 결국 사람들이 말하는 아토스 마냐니의 영웅담은 자신의 반역 사실을 숨기기 위한 아버지 자신이 꾸민 일이었던 것이다. 아토스의 아들은 이러한 과거의 진실을 밝히면서 자기 자신의 정체성에 대한 실존적 고민에 빠져든다.
1996	18722	걸 식스	코미디, 드라마	스파이크 리	테레사 랜들, 아이제이아 워싱턴, 스파이크 리	헐리우드 스타를 꿈꾸는 흑인 여성 주디(테레사 랜들 분)는 영화 오디션마다 번번히 떨어진다. 그것은 이번에도 마찬가지. 음흉해 보이는 감독(타란티노)이 그녀에게 상의를 벗으라고 요구하자 그녀는 배우가 되겠다는 꿈을 포기하고 생활비를 마련하기 위해 직장을 찾아나선다. 거리에서 전단을 뿌리는 등의 아르바이트를 하다 결국 좌절한 주디는 폰 섹스업계로 진출한다. 타인의 환상을 채워준다는 점에서 배우와 다를 바 없다는 생각으로 주디는 6번 아가씨가 되어 전화를 통해 뭇남성을 신음하게 만든다. 뛰어난 연기와 재능으로 얼마되지 않아 다른 동료들을 물리치고 최다의 고객을 확보하게 된 주디. 때로는 에이프릴로 때로는 에스메랄다로 자신의 정체를 바꿔가면서 취향도 다양한 남성들의 대리욕구를 충족시켜 나간다. 한편 같은 아파트의 옆집에 사는 그녀의 남자친구 지미(스파이크 리 분)는 그녀가 그런 직업에 만족하고 영화배우의 꿈을 포기한  것을 질타하며 그녀에게 계속 따끔한 충고를 하고 전남편은 그녀의 섹시한 변화에 놀라며 다시 그녀와 합치게 되길 바란다. 하루하루 능숙한 서비스를 하던 주디는 점차 자신이 하고 있는 일에 대해 가치관의 혼란을 갖게 되고 실의에 빠지게 된다. 배우로서의 능력에 대한 자신감이 생긴 그녀는 자신의 인생을 다시한번 새출발할 것을 결심하는데.
1996	17770	겟 쇼티	액션, 코미디, 드라마, 범죄	베리 소넨필드	존 트라볼타, 진 핵크만, 르네 루소	칠리 팔머(Chili Palmer: 존 트라볼타 분)는 마이애미에서 모모(Momo: 론 카라바소스 분)라는 보스를 모시고 있는 갱단의 일원이다. 그는 영화를 너무 좋아해서 보스 모모가 극장을 팔려고 할때 그 자신이 극장을 운영해 옛날의 걸작 영화들을 상영하고 싶어했다. 칠리는 갱단내의 다른 보스를 모시고 있는 본즈(Ray "Bones" Barboni: 데니스 파리나 분)라는 자와 항상 다툼이 있었는데 어느날 둘은 서로 티격태격하다가 총격전까지 벌이게 된다. 보스인 모모가 그의 생일 파티 때 심장마비로 쓰러지자, 칠리는 본즈가 모시고 있는 보스의 수하로 들어간다. 서로간에 감정이 좋지 않았던 본즈와 칠리, 칠리가 자신의 수하로 들어오자 본즈는 칠리에게 세탁업을 하는 리오(Leo Devoe: 데이비드 페이머 분)라는 자가 빛진 돈을 갚지 않고 죽었으니, 그에게 가서 돈을 받아오라 하고 받아오지 못하면 알아서 채우라고 협박한다. 칠리는 리오의 아내(Fay Devoe: 린다 하트 분)에게 실은 리오가 죽은게 아니라 보험금을 타기 위해 죽은 척해서 혼자 도망쳤다는 소식을 듣게 된다. 그 길로 칠리는 리오의 뒤를 쫓아 라스베가스로 가게 된다. 그곳에서 리오가 로스엔젤레스로 갔다는 것을 알게 되고 라스베가스 도박장 사장으로부터 해리 짐(Harry Zimm: 진 핵크먼 분)이라는 영화제작자의 빚도 받아달라는 부탁까지 받는다. 해리를 찾아간 칠리는 해리와 함께 캐런(Karen Flores: 르네 루소 분)이라는 여배우를 만나게 되고, 그들 셋은 칠리의 구상이 영화로 만들어도 될만한 것이라고 동의한다. 그러나 해리는 라스베가스 사장에게 빚진 것 외에도 보우(Bo Catlett: 델로이 린도 분)라는 마약업자에게도 빚진 것이 있어 협박을 받고 있었는데 해리는 칠리에게 그들을 떼달라고 부탁한다. 하지만 해리의 다음 영화인 '미스터 러브'의 대본을 본 보우는 다시 영화에 투자하길 원하지만 칠리가 방해가 되서 그를 제거하려 한다. 그러나 나중에는 오히려 보우가 칠리의 꾐에 넘어가 죽음을 당하게 된다. 결국 돈 한푼없이 헐리웃으로 날아온 칠리지만 그 대담함과 지혜로 헐리웃 스튜디오까지 소유하는 유명한 제작자의 대열에 오르게 된다.
1996	18705	고스트 맘마	판타지, 드라마, 코미디	한지승	최진실, 김승우	사랑의 줄다리기라면 최고의 자부심을 갖고 사는 지석과 인주 부부. 크리스마스 축제를 벌인다며 음주와 고성방가죄로 벌금을 물어야 했을 정도로 이들 부부에게 있어 하루 하루의 시간은 그야말로 행복 그 자체다. 더구나 고통과 환희 속에서 얻은 아들 다빈이의 재롱은 새로운 행복의 양념이 된다. 그러던 어느날 지석이 두고 간 서류를 가져다 주기 위해 그의 사무실로 향하던 인주의 차가 덤프트럭과 충돌, 다행히 다빈이는 무사하지만 인주는 끝내 목숨을 잃는다.인주에 대한 그리움과 죄책감으로 자살을 기도하는 지석 앞에 얼핏 인주의 모습이 비친다. 사고가 나던 날 입었던 옷차림 그대로 지석의 이름을 되뇌이는 인주. 인사도 못하고 떠났던 지석을 찾아 정말로 돌아온 것이다. 이 순간부터 지석은 유령 아내와 신방 아닌 신방을 꾸미게 된다. 오로지 지석만 볼 수 있고 만질 수 있다는 색다른 로맨스의 시작. 다시 돌아온 인주로 인해 지석의 삶은 활기를 되찾는다. 하지만 인주의 몸은 어차피 죽은 영혼일 뿐, 어느새 둘 사이에는 서로 보듬어 줄 수 없는 일들이 나타나기 시작한다.사람이 아닌 유령으로서 한계를 느낀 인주는 지석과 다빈이를 위해 다른 누군가가 필요하다는 것을 깨닫는다. 인주는 자신을 대신할 사람으로 지석의 회사 동료인 은숙을 결정짓고, 유령이기에 가능한 따뜻하고 애절한 작은 소동들을 일으키며 지석의 마음을 돌리려 한다. 지석과 주호의 사우나 광경을 훔쳐보는가 하면 여자와 호텔로 들어간 지석을 혼내주는 등 자신의 본 마음을 숨기고 사랑하는 남편에게 새 아내를 얻어주는 일이 결코 쉽지 만은 않은데.
1996	17746	고스트 앤 다크니스	액션, 드라마, 모험, 스릴러	스티븐 홉킨스	마이클 더글라스, 발 킬머, 존 카니	19세기 말, 아프리카 대륙은 서구열강이 힘을 겨루는 장소였다. 영국, 프랑스 독일 등은 대륙을 선정하기 위해 아프리카를 가로지르는 철도 만들기 경쟁을 시작했다. 1896년 영국은 다른 나라에 앞서 아프리카를 점령하기 위해 인도에서 근무하던 존 패터슨 대령(John Patterson: 발 킬머 분)을 소환한다. 교각을 만드는 엔지니어로 능력을 발휘해온 존은 아프리카의 오지 사보에 다리를 놓으라는 임무를 받고 미지의 대륙을 향한다. 6개월 뒤 아이를 낳을 아내(Helena Patterson: 에밀리 모티머 분)를 뒤로 한 채 아프리카에 도착한 존은 낯설고 아름다운 대륙의 모습에 매혹된다. 그러나 사보에 도착한 존은 곧 이번 임무가 만만치 않은 일임을 직감한다. 그중 식인 사자의 존재는 큰 골칫덩이였다. 존은 희생자가 있던 다음날 밤 문제를 깨끗이 해결한다. 단 한발로 사자를 처치해버린 것이다. 그러나 정작 사건은 이제부터 시작이다. '고스트'와 '다크니스'라 불리는 두 마리 식인 사자는 매일밤 피의 축제를 벌이고 사람들은 두려움에 떨며 그들을 '악마'로 믿게 된 것이다.
