year	code	title	genre	directors	actors	story
2022	206638	사랑할 땐 누구나 최악이 된다	멜로/로맨스, 드라마, 코미디	요아킴 트리에	레나테 레인스베, 앤더스 다니엘슨 리, 할버트 노르드룸	의학을 공부하던 스물아홉 율리에는 자신이 진짜 원하는 걸 찾아 세상으로 나온다.파티에서 만난 만화가 악셀과 사랑에 빠진 율리에,하지만 삶의 다른 단계에서 만난 두 사람은 각자 다른 걸 원했고 조금씩 어긋난다.“내 삶에서 조연 역할을 하는 것 같아…” 율리에는 인생의 다음 챕터로 달려나간다.
2022	207756	사선		안세진	최철호	코로나19로 누군가는 수혜를 받고 누군가는 피해를 받고있는 양면적 모습코로나19의 양면성을 이용해 편법으로 돈을 버는 사람들계속해서 늘어나는 N차감염과 누군지 알 수 없는 감염자들, 그리고 감염을 숨기는 일부 사람들또한 수도권과 비수도권의 다른 방역단계로 인해 편법으로 늘어나는 N차 감염자들이들을 위해 이타적인 마음으로 자신을 희생하는 구급대원들의 모습자신만을 위해 사는 이기적인 사람들과 남을 위해 사는 이타적인 구급대원들의 대조적 모습을 그린 영화
2022	210832	살수	액션	곽정덕	신현준, 이문식, 김민경	거스를 수 없는 운명 앞에 놓인 조선 최고의 살수 이난의 이야기를 그린 액션 사극
2022	214691	살아오름: 천년의 동행	애니메이션, 드라마	안재훈		‘살아가기’ 보다 ‘살아내기’로하루하루가 고단한 스물다섯 살 청년 ‘청단’.우연히 알게 된 천 살 먹은 회화나무 정령 ‘혼’ 덕에자신을 사랑하는 ‘살아오름’의 시간을 만난다.
2022	208833	삼국지 관운장: 청룡언월도	무협, 액션	대예림	관지빈, 육수명, 송 진	천하를 호령하던 삼국 최고의 명장 ‘관우’가오나라의 침략에 의해 죽음을 맞이하고,그의 청룡언월도마저 오나라 장수 ‘반장’의 손에 들어간다.이 모든 것을 눈앞에서 지켜본 ‘관우’의 아들 ‘관흥’은오나라에 대한 피맺힌 원한을 품게 되고,촉나라 황제 ‘유비’가 이끄는 이릉대전을 앞두고 복수의 칼날을 갈기 시작하는데….삼국지 제일 명장의 비기를 찾아가장 거대한 운명의 전투를 만나라!
2022	208846	서바이벌리스트	액션, 스릴러	존 키스	조나단 리스 마이어스, 존 말코비치, 제나 리 그린	전 세계 문명이 파괴된 코로나 팬데믹 1년 6개월 후.가족을 지키지 못한 죄책감에 사로잡힌 전직 FBI 요원 ‘벤’은스스로를 고립시킨 채 가족농장을 요새 삼아 홀로 살아남았다.한편, 난민 수용소에서 유일하게 살아남아 탈출한 생존자 ‘사라’를 바이러스 면역 항체를 보유한 인류의 해답이라 여긴 ‘아론’ 무리는 그녀를 이용해 새로운 세상을 열겠다는 목표 아래 그 뒤를 쫓는다.  은신처를 찾아 ‘벤’에게 온 ‘사라’를 지키기 위해그는 자신의 무기와 FBI 기술을 총동원해 그들을 포위한 ‘아론’에 맞서 대적하는데…
2022	215791	서울괴담	공포	홍원기	김도윤, 봉재현, 서지수	어두운 터널을 홀로 지날 때의 두려움옆집에서 들려오는 의문의 소리중고 가구에 얽힌 미스터리다른 사람을 향한 그릇된 질투복수, 저주, 욕망에서 시작된 죽음보다 더한 공포의 실체가 찾아온다!
2022	199666	선데이리그	코미디	이성일	이성욱, 이순원, 오치운	한때는 국가대표급 유망주, 지금은 그저 동네 축구교실 코치인 준일.꼰대 마인드와 게으른 코칭으로 해고 직전인데, 곧 이혼까지 당할 기세다.그런 준일에게 정규직 전환을 대가로 거부할 수 없는 미션이 주어지는데!바로 오합지졸 ‘철수축구단’의 아마추어 풋살대회 본.선.진.출.준일은 초단기간 안에 ‘풋’과 ‘살’을 1도 모르는 김사장, 최씨, 박씨를G성과 SON 급으로 변신시켜야 하는데… 오 마이 풋살!축.덕. 어른이들의 꿈줄과 밥줄을 건‘선데이리그’가 시작된다!
2022	209785	성덕	다큐멘터리	오세연		10대 시절을 바쳤지만 스타에서 범죄자로 추락한 오빠! 좋아해서 행복했고 좋아해서 고통받는 실패한 덕후들을 찾아 나선X성덕의 덕심 덕질기를 담은, 2022년 실패 없을 올해의 최애작!성덕
2022	204159	성적표의 김민영	드라마	이재은, 임지선	김주아, 윤아정	기숙사 생활을 하며 삼행시 클럽을 만들어 고등학교 생활을 함께 지낸 김민영, 유정희, 최수산나.영원할 것 같았던 그들의 우정도 졸업과 동시에 각자의 다른 생활 속에서 관계가 소원해진다.다른 지역에서 대학을 다니는 민영이 갑자기 정희를 집으로 초대하고,정희는 기쁜 마음으로 민영을 찾아가지만,자신의 기말 성적을 정정하느라 바쁜 민영에게 정희는 안중에도 없다.정희는 ‘그럼에도 불구하고’ 민영을 기다린다.과연 정희와 민영은 다시 예전으로 돌아갈 수 있을까?
2022	213750	세라비: 다섯 번의 기적	코미디, 드라마, 멜로/로맨스	줄리앙 람발디	레아 드루케, 조시앙 발라스코, 니콜라스 모리	나라의 명예가 걸린 위성 발사를 앞둔 만삭의 CEO,아내의 곁을 지키기 위해 800킬로미터를 달려가는 남편,데이팅 앱에서 만난 남자의 아이를 혼자서 낳으려는 미혼모,출산 당일 아버지의 갑작스런 죽음 소식을 들은 남자,아이를 갖고 가정을 이루려는 동성 커플까지!정신 없이 유쾌하고눈물 쏙 빠지게 행복한미라클 D-day!믿어보세요, 당신의 힘을 그리고 인생을!
2022	215455	세븐틴 파워 오브 러브 : 더 무비	다큐멘터리	오윤동		2021년 열린 온라인 콘서트 ‘POWER OF LOVE’의 감동이스크린으로 다시 펼쳐진다!5연속 밀리언셀러, 빌보드 200 2주 연속 차트인, 오리콘 차트 정상을 꿰차며매번 새로운 역사를 써 내려가는 글로벌 아티스트 SEVENTEEN의 첫 번째 영화!풍성한 퍼포먼스부터, 13인 멤버들의 속마음 인터뷰,과거와 현재 그리고 캐럿과 함께 그려나갈 미래를 담은 다채로운 코멘터리까지 전부 담았다!세상의 모든 사랑을 담아 캐럿에게 보내는 SEVENTEEN의 무비 러브레터!
2022	213501	섹슈얼파티	멜로/로맨스	미겔 앙헬 비바스	아마이아 살라망카, 미구엘 안겔 무노즈	대학교수 후안호는 여자 친구 셀레스떼에게 결혼을 며칠 앞두고 차인 상태이다. 후안호의 학교 제자인 니콜라스는 후안호가 이용을 당했다고 주장하면서 자신에게 좋은 성적을 주면 여자 친구 셀레스떼를 되찾게 해주겠다고 제안을 한다. 하지만 간단해 보이던 계획이 셀레스떼가 섹시한 여 작가 재즈와 사랑을 나누며 꼬이게 되고 후안호의 다른 제자인 시장 딸 레베카도 니콜라스의 계획에 동참한다. 레베카는 후안호가 자신의 전부가 되길 바라며 셀레스떼와의 재결합을 방해하기 위해 무슨 짓이든 하려한다. 음모와 거짓말, 성적 긴장의 복잡한 게임을 담고 있는 이 이야기의 끝은 무엇일까?
2022	215451	섹스 스캔들	드라마, 멜로/로맨스	마리아 사도프스카	줄리오 베루티, 파울리나 갈라즈카, 카타르지나 피구라	에미는 자신의 꿈을 위해 기회가 있을 때마다 주저 없이 돌진하는 야심찬 여자다.그렇게 은밀한 세계에서 전문적인 에스코트가 된 에미.어느 날, 중동의 어느 잘생긴 부자의 초대를 받아 에미는 미스 폴란드, 섹시 스타 및 모델을 모아화려한 파티에 참석한다. 아름다운 여성들과 잘생긴 남성들, 그들만의 호화로움과 사치 속에서도발적인 스캔들이 벌어진다.
2022	213503	섹스 앤 퓨리	멜로/로맨스, 드라마	앨리 하파살로	로라 비른, 로리 틸카넨	기성 문화에 맞서 젊은 에너지로 문화를 바꿔보려는 두 작가 ‘잉카’와 ‘유하나’뜨거운 사랑을 나눔과 동시에 서로의 뮤즈가 되어 각자의 글을 써 내려간다.그렇게 사랑을 키워가던 중 ‘잉카’의 책은 베스트셀러가 된 반면 여전히 책을 완성하지 못한 ‘유하나’는 열등감에 휩싸여 삐뚤어진 사랑 표현을 하고.계속 타오를 것 같던 두 사람의 관계에 금이 가기 시작한다..
2022	201848	센티그레이드	스릴러, 드라마	브렌던 월쉬	제네시스 로드리게스, 빈센트 피아자	눈 떠보니 차 안에 갇힌 부부!출산을 앞둔 소설가와 그의 남편,노르웨이의 추운 지방에서 폭설을 만나?차가 얼어버린 눈 속에 갇혔다!차의 시동은 걸리지 않고 전화기 배터리는 방전되었다.아무리 소리쳐도 도와줄 사람의 기척은 느껴지지 않는다.영하 40도를 오가는 극한의 날씨와 얼마 남지 않은 식량.....설상가상 만삭인 소설가는 진통까지 느끼는데...과연 그들은 이 최악의 상황에서 살아남을 수 있을까?
2022	154156	셀링 이소벨	범죄, 스릴러	루돌프 뷔텐다흐	프리다 패럴, 가브리엘 오즈, 매튜 마스든	가족과 함께 평범하고 행복한 생활을 보내던 필라테스 강사 ‘이소벨’평소처럼 카페에서 휴식을 취하던 중 파격적인 조건의 모델 제의를 받는다.낯선 사람의 파격적인 조건이라 의심은 되었지만거절하기엔 너무 좋은 조건이라 카메라 테스트를 받으러 약속된 장소407호에 들어가게 되는데..
2022	213508	셧 인	스릴러	D.J. 카루소		죽은 할머니의 오래된 집을 정리하고 떠나려던 '제시카' 앞에불청객인 마약 중독자 전 남편과 그의 친구 ‘새미’가 들이닥친다.마약에 취해 과격해 진 남편은2평 남짓한 창고 안에 그녀를 가둬버리고떠난 줄 알았던 범죄자 '새미'까지 다시 돌아와그녀의 유일한 희망인 아이들을 위협하기 시작하는데…감금 72시간 째,아이들을 지키고 싶다면무슨 수를 쓰더라도실패없이 탈출해야 한다!
2022	214564	셰터드	스릴러, 범죄	루이스 프리에토	카메론 모나한, 릴리 크루그, 프랭크 그릴로	외딴 집에 사는 부유한 그는 완벽한 미모와 섹시한그녀를 만나고 격정적인 밤을 보낸다.다친 그를 간호해주는 그녀에게 점점 빠져들고어느새 그는 모든 정보와 재산을 하나씩 빼앗긴다.자신의 집에 감금된 것을 깨달았을 때,이미 가족까지 인질이 되었는데…그녀에게 물렸다!절대 벗어날 수 없다.
2022	208841	소리없는 추격자	미스터리, 멜로/로맨스, 범죄	마리아노 바로소	레오노르 와틀링, 미구엘 앙겔 실베스트르	장래가 촉망되는 판사인 에바는 수년 동안 자신의 직업에만 전념했다. 정의를 굳게 믿으며 어디에서 왔든 양보하려 하지 않는다. 어느 날 스트리퍼의 살인 사건이 일어나고 그녀는 사건의 목격자, 피해자의 남자친구, 로코, 기꺼이 도와주려는 다정하고 다정한 지골로와 만나 단서를 얻으려 한다. 이로인해 에바는 자신의 신원에 대한 몇 가지 단서를 제공해야 하지만 꽁꽁 숨겨진 에바의 비밀은 아무도 알지 못하는데...
2022	194197	소방관	드라마	곽경택	곽도원, 주원, 유재명	2001년 홍제동 화재 사건을 바탕으로, 누구보다 용감했던 소방관들의 이야기를 다룬 휴먼 실화극
2022	212159	소설가의 영화	드라마	홍상수	이혜영, 김민희	여소설가가 잠적한 후배의 책방으로 먼 길을 찾아옵니다.그리고 혼자 타워를 오르고 영화감독 부부를 만나고 공원을 산책하다 여배우를 만나게 되고,여배우에게 당신과 영화를 만들고 싶다 설득을 합니다.둘이 분식집에서 뭘 먹고, 다시 찾게 되는 후배의 책방에서 술자리가 깊어지고여배우는 취해 잠이 드는데…
2022	209727	소피의 세계	드라마	이제한	김새벽, 곽민규, 아나 루지에로	우연히 여행 블로그 속에서 자신의 사진을 발견한 수영.그곳에는 2년 전 만난 여행자 소피가 한국에서 머문 나흘의 기록이 있다.수영은 소피의 일기를 통해 최악의 시기를 버티던 남편 종구와의 일상을 새롭게 바라본다.그때는 알 수 없었던 감정과 사실이 이해될, 것도 같다.소피가 써 내려간 세계 속에서다투고 울고 웃었던 우리는 어떤 마음을 남겼을까?2022년 봄에서 2020년 가을로,서로의 안부를 묻는 일상으로의 여행이 시작된다!
2022	212095	수퍼 소닉2	애니메이션, 액션, 모험, 코미디, 가족, 판타지, SF	제프 파울러	제임스 마스던, 짐 캐리, 벤 슈와츠	도시의 악당들을 물리치며 바쁘게 지구를 지키고 있는 초특급 히어로 ‘소닉’.버섯 행성으로 쫓겨나 ‘소닉’에게 복수를 계획하던 천재 악당 ‘로보트닉’은 엄청난 힘을 지닌 신비의 에메랄드를 차지해 세상을 지배할 야망을 꿈꾸며 지구로 돌아온다! 최강 파워로 업그레이드된 ‘로보트닉’과 강력한 펀치 파워 ‘너클즈’의 공격에 속수무책으로 당하던 ‘소닉’은 하늘을 나는 꼬리를 가진 귀여운 파트너 ‘테일즈’의 도움으로 위기를 모면하게 되는데…초특급 히어로 소닉과 테일즈 VS 너클즈와 천재 악당 로보트닉새로운 질서로 세계를 정복하려는 최강 빌런에 맞선 거대한 대결이 시작된다
2022	208140	수프와 이데올로기	다큐멘터리	양영희		일본인 사위를 극구 반대하던 부모님.엄마는 오사카로 처음 인사 오는 일본인 사위를 위해터질 만큼 속을 꽉 채운 닭 백숙을 정성껏 끓입니다.내게는 이해할 수 없는 것 투성이지만남편에겐 그저 신기할 뿐인 내 가족.어느 날, 엄마는 누구에게도 말하지 못했던고향 제주도의 기억을 들려줍니다.이제는 점점 잊혀져 가는 아픈 기억을 안고사위가 끓인 닭 백숙을 먹고태어나 처음으로 함께 제주도에 갑니다.“서로 생각이 달라도 밥은 같이 먹자”우리는 식구(食口)입니다.
2022	212872	수호무적	액션	서예화		명나라 가정제 32년, 왜구가 동남 연해 지역에 쳐들어오고,이를 대적하기 위해 명나라의 병장국은 신식 무기 ‘비몽포’를 제작하기로 한다.병장국에 책임자로 임명된 ‘노기’는 3년의 노고 끝에 ‘비몽포’를 완성하지만,혼란한 상황 속에서 자신의 가족은 물론 동료까지 무참히 살해되고 만다.가까스로 목숨을 부지한 ‘노기’는 가족과 동료들을 죽인 왜구에게자비 없는 피의 복수를 시작하게 되는데…
2022	213414	슈퍼 후?	코미디, 액션, 가족	필리프 라슈	필리프 라슈, 줄리앙 아루티, 타렉 보달리	프랑스 박스오피스 2주 연속 1위 &amp; 6주 연속 TOP10 기록!끝이 보이지 않는 긴 무명 생활 끝에운 좋게 히어로 무비 <배드맨>의 주인공 역에 캐스팅된조금은 모자라지만 착한 배우 ‘세드릭’.신나게 코스튬까지 맞추고 촬영장으로 향하던 중,‘세드릭’은 갑작스러운 교통사고를 당하고 만다.사고로 모든 기억을 잃은 ‘세드릭’은수트를 입은 자기 모습을 보고는진짜 슈퍼 히어로로 착각하게 되는데…교통사고로 모든 기억을 잃은 무명 배우!의식을 되찾았더니 슈퍼 히어로가 되어 있다?
2022	218749	스마일	미스터리, 공포	파커 핀	소시 베이컨, 제시 어셔, 카일 갈너	기괴한 미소를 지으며 자신의 눈 앞에서 목숨을 끊는 환자를 목격한 정신과 의사 ‘로즈’.그날 이후로 ‘로즈’의 일상에 설명할 수 없는 끔찍한 일들이 잇따라 발생한다.일상을 덮친 공포에 발버둥치던 ‘로즈’는 이전에도 자신과 같은 일을 겪은 사람들이 있었고그들 모두 끔찍한 죽음을 피할 수 없었다는 사실을 알게 된다.시시각각 다가오는 죽음에서 벗어나기 위해 사투를 벌이던 ‘로즈’는잊고 싶던 과거와 마주하게 되는데…“너도 곧 웃게 될 거야”
2022	210265	스크림	공포, 미스터리, 스릴러	맷 베티넬리-올핀, 타일러 질렛	멜리사 바레사, 제나 오르테가, 잭 퀘이드	잔혹한 살인 사건으로 우즈보로 마을이 충격에 휩싸인 지 25년이 지난 후,고스트 페이스를 한 새로운 살인마가 다시 십대들을 노리면서마을의 어두운 비밀이 다시 수면 위로 떠오르는데...
2022	189137	스텔라	코미디, 드라마	권수경	손호준, 이규형, 허성태	막다른 인생 제대로 한 번 달려본 적 없는 차량담보업계 에이스 ‘영배’(손호준). 보스 ‘서사장’(허성태)이 하룻밤 맡긴 슈퍼카가 절친 ‘동식’(이규형)과 함께 감쪽같이 사라지고 영배는 범인으로 몰려 서사장 일당에게 쫓기기 시작한다. 믿을 사람 하나 없고, 도망칠 곳도 없는 그의 앞에 나타난 건 바로 1987년식 오래된 자동차 ‘스텔라’.최대 시속 50km, 남은 시간은 3시간…유일한 희망인 스텔라와 함께 보스의 슈퍼카를 반드시 찾아야만 한다!
2022	183115	스톰보이	가족	숀 시트	핀 리틀, 제이 코트니, 제프리 러쉬	외딴 해변가에 아빠와 단둘이 살고 있는 ‘마이클’.무차별적인 사냥으로 어미를 잃은 아기 펠리컨 세 마리를 발견하고, 마을 원주민 ‘핑거본’의 도움으로 아기 펠리컨들의 집사 생활을 시작한다. 그러던 어느 날, 폭우로 바다에 빠진 아빠를 펠리컨 ‘퍼시벌’이 구하게 되고이 사건이 매스컴에 관심을 받기 시작하자펠리컨 사냥꾼들이 다시 해변가로 몰려드는데…어느 날 찾아온 가장 특별한 ‘새’상! 끝까지 지켜 줄게!
2022	221038	스파이더맨: 노 웨이 홈 '펀버전'	액션, 모험, SF	존 왓츠	톰 홀랜드, 젠데이아 콜먼, 베네딕트 컴버배치	‘미스테리오’의 계략으로 세상에 정체가 탄로난 스파이더맨 ‘피터 파커’는하루 아침에 평범한 일상을 잃게 된다.문제를 해결하기 위해 ‘닥터 스트레인지’를 찾아가 도움을 청하지만뜻하지 않게 멀티버스가 열리면서 각기 다른 차원의 불청객들이 나타난다.‘닥터 옥토퍼스’를 비롯해 스파이더맨에게 깊은 원한을 가진 숙적들의 강력한 공격에‘피터 파커’는 사상 최악의 위기를 맞게 되는데…
2022	213542	스파이형 모델	SF	김영일	주종혁, 이아주, 장현동	취업준비생 형우는 우연히 어떤 남자의 지갑을 찾아준다. 그런데 이 남자 이상하다.병약해 보이는 얼굴은 피투성이고, 지갑엔 엔화가 들어있다.다음날 형우가 또 발견했을 때, 건달 두 명이 이 남자를 쫓아 으슥한 곳으로 들어간다.잠시 후 다가가 보니 건달들은 피투성이가 돼서 쓰러져 있고, 의문의 남자는 흔적도 없이 사라졌다.결국 형우는 그 남자를 찾으러 가고, 상상조차 못한 세계로 한발짝씩 들어간다.
2022	207921	스펜서	드라마	파블로 라라인	크리스틴 스튜어트	왕비가 되지 않고 자신의 이름을 찾기로 결심한 다이애나 왕세자비의 새로운 이야기
2022	194842	스프링 블라썸	드라마	수잔 랭동	수잔 랭동, 아르노 발로아	“이번에 맞이한 봄은 어딘가 달라요”반복되는 일상에 싫증이 난 수잔은극장 앞에서 연극배우 라파엘을 만난다함께 음악을 듣고 산책을 하며조금씩 가까워지는 두 사람모든 것이 따분했던 수잔에게설렘과 함께 첫 번째 봄이 찾아오기 시작했다
2022	209007	스피드 : 레이스 1	액션	진혁선	쿤링, 주걸륜, 범일신	레이싱 게임 세계 랭킹 1위, 잭게임 안에서는 누구보다 전략적이고 빠르지만,현실에서는 단 한 번도 도로 위에서 멋지게 달려본 적이 없다. 리그 최초 여성 프로레이서, 릴리한때 전설이었던 팀 라이온스의 부활을 꿈꾸지만, 무리한 경기를 펼치다 부상을 당하고 만다. 자신을 대신할 레이서를 찾던 릴리는 잭을 팀에 영입하고 잭은 실제 레이싱 경기에서도 실력을 발휘하기 위해 훈련을 이어가지만, 팀은 분열되고 경쟁팀의 견제도 점점 심해지는데…
2022	200762	승부	드라마	김형주	이병헌, 유아인	스승과 제자이자, 라이벌이었던 한국 바둑의 두 전설인 조훈현(이병헌)과 이창호(유아인)의 피할 수 없는 승부를 그린 영화
2022	212080	시대혁명	다큐멘터리	주관위		2019년, “범죄인 인도 법안”을 체결하여 독재 정권의 막을 연중국에 대해 홍콩의 모든 시민들은 분노하고 저항했다.<시대혁명>은 독재를 하려는 세력과 자유와 민주주의를 원하는시민들 사이에서 벌어진 전쟁의 기록이다.
2022	208558	시라노	멜로/로맨스, 뮤지컬, 드라마	조 라이트	피터 딘클리지, 헤일리 베넷, 켈빈 해리슨 주니어	사랑을 대신 써주는 남자 시라노!여기, 10명의 남자와 싸울 용기는 있지만 평생을 사랑해 온 한 여자에게 고백할 용기만큼은 없는 작은 시인이 있다.그가 사랑한 여자는 바로...진실된 사랑을 찾는 여자 록산!"아이들은 사랑이 필요하고, 어른들은 돈이 필요해."라고 말하는 시대. 하지만, 록산은 진짜 사랑을 원한다.그런 그녀 앞에 눈부신 남자 크리스티앙이 나타나고, 두 사람은 첫 눈에 반하고 마는데…사랑의 시를 빌려 쓴 남자 크리스티앙!록산을 향한 뜨거운 마음을 표현할 줄 모르는 그는 시라노가 대신 써준 편지로 그녀에게 마음을 전하기 시작한다.지금부터, 엇갈린 사랑의 노래로 전하는 화려하고 아름다운 로맨스가 펼쳐진다!
2022	213415	시맨틱 에러: 더 무비	멜로/로맨스	김수정	박서함, 박재찬	컴공과 '아싸' 추상우의 완벽하게 짜인 일상에 에러처럼 나타난 안하무인 디자인과 '인싸' 장재영,극과 극 청춘들의 캠퍼스 로맨스가 스크린으로 펼쳐진다!
2022	196991	시크릿 카운터		신지 아라키	나카무라 토모야, 이시바시 시즈카, 타치바나 에리	돈이 없나요? 갈 곳이 없나요? 살아갈 의지를 잃었나요?우리 마을로 오세요! 모두를 환영합니다~힘들게 일하지 않아도 의식주 평생 보장!들어오는 것도, 나가는 것도 당신의 자유예요하지만 깨닫게 될 겁니다. 이곳을 떠날 필요가 없다는 걸!
2022	207761	신 에반게리온 극장판	애니메이션	안노 히데아키, 츠루마키 카즈야, 나카야마 카츠이치	오가타 메구미, 하야시바라 메구미, 미야무라 유코	미사토가 이끄는 반네르프 조직 ‘빌레’는 코어화로 붉게 물든 파리 구시가에 있다. 기함 AAA 분더에서 선발대가 강하하여, 남겨져 있던 봉인주에 안착한다. 복원 작전의 작업 가능 시간은 고작 720초. 결사의 작전 수행 중 ‘네르프’의 EVA가 대량으로 무리를 이루고 접근하여, 마리의 개(改) 8호기가 요격을 개시한다. 한편 신지, 아스카, 아야나미 레이 (가칭) 세 사람은 일본의 대지를 떠돌고 있다…….
2022	213558	신데렐라	공연실황	메트오페라		의붓어머니의 구박 속에서 살던 신데렐라가 요정의 마법으로 궁중 무도회에 참가하여 왕자를 만나는 내용의 <신데렐라> 이야기를 다룬 오페라 실황물
2022	151748	신들의 분노	액션	레흐 마예브스키	조쉬 하트넷, 존 말코비치, 샬롯 램플링	세계 최고의 부호 ‘타우로스’(존 말코비치)는 더 큰 부를 축적하기 위해고대신들이 잠들어 있는 성지 ‘신들의 계곡’을 훼손하는 개발 계획을 세운다.한편 ‘타우로스’의 전기 소설을 집필하는 작가 ‘에카스’(조쉬 하트넷)는'타우로스'의 대저택에서 벌어지는 수상한 사건들을 목격하고 그를 쫓는다.부를 넘어 모든 것을 가지려 기행을 일삼던 ‘타우로스’는 끝내 신들의 영역을 침범하고,이를 막으려는 ‘에카스’의 노력이 무색하게 고대신들이 깨어나는 상상초월의 대재앙이 시작되는데…신을 거역한 순간, 인류의 모든 것이 무너진다!
