year	code	title	genre	directors	actors	story
2008	62390	비투스	드라마	프레디 M. 무러	브루노 강쯔, 테오 게오르규	박쥐보다 예민한 청각과 내로라하는 명인들 못지않은 피아노 실력, 다섯 살에 불과한 소년임에도 온갖 난해한 학문을 공부하는 비투스는 마치 다른 행성에서 온 것만 같다. 비투스의 부모는 아들의 빛나는 미래를 꿈꾸며 아들이 피아니스트가 되기를 바란다. 그러나 천재소년 비투스가 좋아하는 것은 그의 괴짜 할아버지와 함께 보내는 시간이다. 하늘을 날고 싶고, 평범한 어린 아이가 되고 싶은 비투스. 결국 극적인 반전을 통해 비투스는 자신이 원하는 삶의 주인공이 된다. 추천 코멘트. 부모의 기대와 달리 평범한 아이가 되고 싶어하는 천재소년에 대한 이야기로 탄탄한 스토리라인과 배우들의 열연으로 잔잔한 감동을 전해주는 작품. 실제 천재적 재능으로 유명한 테오 게오르그가 비투스를 연기했으며 &amp;lt베를린 천사의 시&amp;gt 등으로 우리에게 친숙한 브루노 간츠가 괴짜 할아버지로 오랜만에 얼굴은 보인다. 엔딩 씬의 오케스트라 협연을 비롯, 영화전반에 흐르는 피아노 선율도 이 영화의 매력. (제천국제음악영화제)
2008	45257	비트 더 드럼	드라마	데이빗 힉슨	주니어 싱고, 마리 트왈라	수상한 병이 마을을 강타한 후, 고아가 된 어린 소년 ‘무사’. 무엇이 사랑하는 아버지와 마을 사람들을 죽이고 있는지 그 진실을 찾기 위해, 그리고 삼촌을 만나기 위해,,,  ‘무사’는 대도시로 길을 떠난다. 소년의 아버지가 죽어가면서 어린 아들에게 남긴 마지막 선물-부족의 드럼과 함께.
2008	69103	빅 시티	가족, 모험, 서부, 코미디	드자멜 벤살라	로렁 도이치	인디언 토벌단으로 모든 어른이 떠나고 12살이 안된 아이들만 남은 미국 서부의 작은 마을 ‘빅시티’. 마을을 제대로(?) 지켜내기 위해 아이들은 각자의 부모가 하던 역할을 맡기로 한다. 살롱 집 아들은 돈 없는 손님을 내 쫓고 은행장 아들은 비밀 번호를 잊은 손님의 돈을 가로챈다. 그 중 가장 뛰어난 기량을 보이는 시장의 아들인 ‘화이트’는 부잣집 아들과 한패가 되어 은행과 상점을 차지하려 한다. 지독한 개구쟁이들을 부하로 뽑아 시민들을 속일 기막힌 사기 계획을 준비하는 ‘화이트’일당. 그러나 ‘화이트’일당의 횡포와 사건들을 의심하기 시작한 카우보이 ‘웨인’, 여교사 ‘로빈슨’, 흑인 청소부 ‘제퍼슨’, 살롱의 여가수 ‘니콜’은 이들의 비열한 음모를 밝혀내려 하는데. 한편 사고를 당한 ‘데보라’를 구해준 인디언 추장의 아들 ‘와피티’가 ‘화이트’일당에게 오히려 당하면서 화가 난 인디언 소년들의 대대적인 습격이 벌어진다. 과연 이들은 ‘빅시티’를 어른들만큼 멋지게 비열한 도시로 만들어갈까, 아니면 바보처럼 올바르고 착한 곳으로 전락시킬까? 영화제 소개글. 조지 오웰의 ‘동물 농장’과 미국의 웨스턴 장르가 섞인 듯한 독특한 스타일의 영화. 1880년대 미국 서부의 작은 마을, 어른들은 인디언의 공격에 대항하기 위해 사라지고 아이들만이 남아 스스로 마을을 지키며 살고 있다. 살아나갈 방법을 고민하던 아이들은 선거를 통해 정부를 구성하고, 유대인 은행장, 중국인 식료품 상점 주인, 프랑스인 매춘부, 이탈리안 사장 등 부모의 직업과 역할을 대신하기로 하는데…
2008	67453	빨간 풍선	드라마, 가족	허우 샤오시엔	줄리엣 비노쉬, 시몽 이떼아뉘	허우 샤오시엔과 줄리엣 비노슈의 만남으로 기대를 모은 작품. 알베르 라모리스의 단편 &amp;lt빨간 풍선&amp;gt(1956)를 모티브로 했다. 목소리 연기자 수잔과 아들 시몽, 시몽을 돌보는 대만 출신 영화학도 송팡의 이야기를 통해 동서양을 초월한 인간관계를 조명하는 통찰력이 돋보인다. 파리에 살며 중국 정통 인형극을 제작, 연기하는 전문직 여성 수잔(줄리엣 비노쉬)은 일곱살 짜리 아들 시몽을 둔 이혼녀. 일에 있어서는 확실하게 자기 자리를 잡은 그녀이지만 집안일이나 이웃 간에 벌어지는 일상다반사에는 마냥 서투르기만 하다. 그런 그녀의 아들 시몽 역시 삶이 어수선하기는 마찬가지. 가끔 하늘을 둥둥 떠다니며 잡힐 듯 결코 잡히지 않는 ‘빨간 풍선’이 유일한 친구이던 시몽에게 어느 날, 특별한 사건이 생겼다. 중국 유학생 송팡이 새로운 베이비 시터로 온 것이다!
2008	38247	사과	멜로/로맨스, 드라마	강이관	문소리, 김태우, 이선균	7년 사귄 남자에게 7초 만에 차였다! “그래 오늘은 그만 만나고, 내일 다시 만나자!” 사랑 앞에 솔직하고 적극적인 현정. 그녀에게는 7년을 만나도 매일이 설레는 남자친구 민석이 있다. 가족들도 친구들도 당연히 결혼할 사이라 여겼던 두 사람. 하지만 수없이 사랑한다 말했던 7년 간의 긴 연애는 “내가 점점 없어지는 것 같아”라는 민석의 한 마디로 너무나 쉽게 끝나버렸다. 다른 남자와의 결혼! “난 결혼하고 나서 자기를 더 사랑하게 되는 것 같아!”그 무렵 현정의 주위를 맴돌며 수줍게 고백하는 남자 상훈이 다가온다. 재미는 없지만 순수함에 끌리는 이 남자. 변치 않을 것 같은 상훈의 사랑에 마음을 연 현정은 결혼을 결심하고, 결혼 후 그에 대한 사랑은 커져만 간다. 다시 돌아온 첫사랑! “우리 이러는 게 말이 되니?”항상 사랑을 확인하고 싶은 현정. 하지만 좀처럼 속내를 드러내지 않는 상훈의 답답한 말과 행동에 둘의 오해와 갈등은 깊어지고, 그런 현정 앞에 한 번도 잊은 적이 없었다며 첫사랑 민석이 불쑥 나타나는데… 2008년, 연애와 결혼에 대한 가장 솔직한 리얼 토크 생활스캔들 &amp;lt사과&amp;gt
2008	50573	사랑과 전쟁: 열두 번째 남자	드라마, 코미디	곽기원	이주나, 이정훈	홧김의 맞바람으로 11명의 남자를 만난 당찬 주부의 안방 스캔들을 도발적으로 그린 작품.
2008	65563	사랑보다 황금	모험, 액션, 코미디, 멜로/로맨스	앤디 테넌트	케이트 허드슨, 매튜 맥커너히, 도날드 서덜랜드	1초라도 빨리 헤어지고 싶은 커플(케이튼 허드슨, 매튜 매커너히)이 바다에 숨겨진 보물을 찾기 위해 작전상 화해를 하면서 벌어지는 소동을 그린 로맨틱 코믹 어드벤처. 보물사냥꾼인 핀(매튜 매커너히)과 재벌의 호화선박에서 일하는 테스(케이트 허드슨)는 모든 연인이 그러했듯 한때는 열렬히 사랑했지만 이젠 단 1초라도 빨리 헤어지고 싶어 안달이 난 결별 위기의 커플. 어느 날, 언제나처럼 바다 속을 헤매며 보물을 찾아 다니던 핀이 전설로만 전해지던 ‘바다 속 어딘가 잠자고 있는 18세기 스페인 여왕의 보물’ 잔재를 발견한다. 아직 테스와 헤어지기 싫었던 핀은 함께 보물을 찾자고 제안하고, 황금이라는 말에 솔깃한 테스는 보물찾기에 따라 나서는데…
2008	69288	사랑의 추구와 발견	드라마, 판타지, 코미디	헬무트 디틀	모리츠 블라이브트로이, 알렉산드라 마리아 라라	2007 캠브리지 국제영화제 출품작. 작곡가 미미와 실의에 빠진 여가수 비너스는 운명적으로 다리 위에서 아름다운 사랑의 시작을 연출한다. 그들은 이별을 하기 전까지 7년을 사랑하며 싸우며 살았다. 비너스가 성공한 여가수가 되었을 때 두 사람은 서로 갈등을 겪고 헤어진다. 결별 이후, 그들은 서로가 사랑하는 하나의 삶을 잃어 버렸다는 것을 알고 고통스러워한다. 오랜 시간이 흐른 후, 짧은 해후를 하게 되는 미미와 비너스, 그들은 스스로가 택한 자신의 운명을 가슴 아파한다. 디지털 시대의 “사랑”을 현대적인 그리스 신화의 삽화로 한층 재미를 이끌어 낸 사랑 영화.
2008	51753	사랑해, 울지마		김사현, 이동윤	이유리, 이정진, 오승현	미수는 스키를 타러가자고 조르는 현우에게 스키복도 없거니와 백수라서 가기 싫다고 한다. 현우는 그런 미수에게 애교를 부리며 계속해서 함께 가자며 꼬드긴다. 영민은 서영에게 약혼식에 앞서 맞춰 놓은 약혼반지를 끼어준다. 서영네 집안 수준에 맞추지 못한 것을 미안해하는 영민에게 서영은 불만 없다며 행복해한다. 한편, 미수는 결국 스키용품을 사러 백화점에 간다. 물건을 사고 나오는데 알고 지내는 선배가 아르바이트 자리를 제안하고, 반가운 소식에 흥분한 미수는 정신없이 뛰다가 맞은 쪽에서 통화를 하며 걸어오는 영민과 부딪히는데...
2008	49932	사조영웅전 2008	액션	이국립	임의신, 류시시, 원홍	흥미진진한 줄거리와 무협의 진수를 한 곳에 녹여내고, 어벙한 곽정과 아리따운 황용의 러브 스토리를 사랑스럽게 그려낸 드라마
2008	36450	산타와 스노우맨 3D: 세기의 대결	애니메이션	존 A. 데이비스	조나단 윈터스, 벤 스타인, 빅토리아 잭슨	
2008	45129	삼국지 - 용의 부활	전쟁, 액션, 드라마	이인항	유덕화, 홍금보, 매기 큐	잦은 내전으로 인해 수많은 국가로 나눠진 중국 대륙. 촉나라의 비천한 신분으로 태어난 조자룡은 뛰어난 지략과 용기로 조조가 이끄는 위의 대군으로부터 혈혈단신 어린 유비의 아들을 구해 용맹함을 떨친다. 영웅으로 추앙받으며 오호장군의 자리까지 오른 조자룡은 삼국을 통일하려는 마지막 왕의 뜻을 받들어 일생일대 마지막 전투를 위해 진군하는데...위나라의 1만 군대가 단 한 명이었던 조자룡에게 패하는 것을 무력하게 지켜봐야 했던 조조의 손녀 조영. 천하를 얻기 위한 야심으로 똘똘 뭉친 그녀는 북벌을 위해 봉명산으로 향하는 조자룡을 잡기 위해 위험한 계략을 꾸미는데... 이제 삼국 통일의 위업을 달성하기 위해 목숨을 건 마지막 전쟁을 준비하는 노장 조자룡과 그를 잡기 위해 수단과 방법을 가리지 않는 위나라의 여장부 조영의 마지막 대결이 시작된다.
2008	66233	새드 배케이션	드라마, 가족	아오야마 신지	아사노 타다노부, 오다기리 죠, 이시다 에리	중국으로부터의 밀항자 인수를 돕던 켄지(아사노 타다노부)는 배 안에서 아버지를 잃은 소년 아춘을 돌보기 위해 그를 데리고 도망친다. 켄지는 5살에 어머니로부터 버림받고, 충격으로 정신병을 앓던 아버지가 자살한 불우한 과거의 소유자. 11년 전, 살인사건에 휘말린 소꿉친구 야스오의 동생 유리(츠치 카오리)와 함께 살고 있다. 지적 장애자인 유리 그리고 순수한 아춘과의 생활은 켄지에게 이전엔 맛볼 수 없었던 안정감을 안겨주었다.‘마미야 운송’이라는 작은 운송회사엔 다양한 과거를 안고 있는 사람들이 모여있다. 버스납치사건의 피해자인 코즈에(미야자키 아오이). 사채업자에게 쫓기고 있는 고토(오다기리 죠), 자격을 박탈당한 의사등 하나같이 타인에게 일정한 거리를 두고 살고있는 사람들. 그러던 어느 날 운명이 이끄는 것처럼 켄지는 ‘마미야 운송’의 사장의 대리운전을 맡게 된다. 차를 몰고 ‘마미야 운송’에 도착한 켄지는 그곳에서 5살에 자신을 버린 어머니(이시다 에리)와 만나게 되는데…
2008	47789	색시몽 리턴즈			에브둘레바 자밀라, 정소영, 채은정	Episode 01 - 늑대와 춤을. 우즈베키스탄에서 온 길다.. S의 지령을 들고 주리와 강해가 있는 분식집으로 합류한다. HD라는 이니셜과 함께 성추행 사진을 지령으로 받은 탐정단 삼총사는.. 길다의 제안으로 홍대 Hot - Dog 클럽을 즐기러 가게된다. 그곳에서 외국인 남자들과 한국여자들이 부비부비 끈적한 춤을 추고 있는 모습과.. 최근 외국인에게 몹쓸짓을 당해 잠적한 한 여성에 대한 얘기를 우연히 들으며.. 강해와 주리는.. 사건의 윤곽을 느끼게 된다. 그러나.. 범인을 잘못짚어 무식하게 주먹부터 나가고만 강해.. 주리와 함께 클럽에서 쫓겨나게 되고.. 난감하던 찰나.. 퇴색되가는 클럽문화에 염증을 느끼던 지수를 만나며.. 사건의 실태를 파악하게 된다. 그러나 여전히 사건의 단서조차 잡지못한 주리와 강해.. 이 때 S의 조언이 투입되고.. 그런데.. 이번엔 DH라는 알 수 없는 이니셜이 적혀있을 뿐.. 더욱 미궁속에 빠진다. 한편 클럽내 모든 남성들의 시선을 한몸에 받으며 섹시한 춤을 선보이는 길다.. 역시 모든 여성들의 선망의 대상인 재미교포 다니엘과 한눈에 사랑에 빠지고.. 그와 어울리며 브로커 역할을 하던 클럽매니저의 행각과.. 일부 외국인들의 음란한 행태를 접하게 되는데... Episode 02 - 금지된 장난. 남학생들로 북적이는 분식집에.. S로부터 택배가 날아든다. 그 안에는 지령인 씨디와 진행비가 들어있고.. 씨디엔.. 여대 기숙사에서 성폭행을 당하는 몰래카메라 영상이 흘러나온다. 직접 대학 기숙사로 잠입수사에 나서는 탐정단.. 신음소리가 흘러나오는 경비실앞에서 이상한 낌새를 느끼고 경비를 추궁하지만.. 경비 역시.. 기숙사 몰카 씨디들을 수집해 자체조사중이었고.. 이를 계기로 기숙사에서 범인에게 당한 여학생이 한둘이 아님을 알게된다. 경비의 도움으로 최초 피해자 수연을 만나게 된 탐정단.. 조심스레 범인의 단서를 찾고자 접근해보지만.. 수연은 그런일 없다며 불쾌해한다. 그러다 몰카가 돌고있다는 강해의 말에 충격받은 수연은.. 뒤늦게 탐정단을 찾아와.. 사실은 남자친구 현준의 요구대로 한것임을 실토한다. 그렇다면 나머지 피해자들은 무엇인가?
2008	68947	샤인 어 라이트	다큐멘터리	마틴 스콜세지	믹 재거, 키스 리차드, 찰리 왓츠	아카데미 감독상에 빛나는 마틴 스콜세지 감독과 살아있는 락의 전설 롤링 스톤즈. 두 거장들의 열정이 만난 라이브 무비 &amp;lt샤인 어 라이트&amp;gt는 2008년 베를린 국제 영화제 개막작으로 선정된 화제작. 롤링 스톤즈는 20대의 꽃 미남 밴드로 데뷔하여 반세기 동안 멈추지 않는 라이브 무대를 선사하며 최고의 위치에 오른 거장 락 밴드이다. 그들과 오랜 인연을 맺어 온 영화계의 거장 마틴 스콜세지 감독은 롤링 스톤즈의 무대와 삶을 고스란히 영상으로 담아내기 위해 극도의 애정과 심혈을 기울였다. 영화 &amp;lt샤인 어 라이트&amp;gt 중 공연 부분은 롤링 스톤즈가 기네스북 사상 최고의 수익을 기록한 Bigger Bang Tour (비거 뱅 공연)의 일부로 뉴욕에 위치한 전설적인 비콘 극장에서 열렸던 공연이다. 감독은 관객에게 마치 VIP좌석에서 공연을 관람하는 것 같은 느낌을 전달하기 위해 아카데미 수상 촬영 감독을 대거 동원하여 총 16대의 카메라와 50만 피트의 필름을 사용해 그 스케일과 열기를 담아 내었다. 또한, 사운드 역시 악기 하나의 움직임과 숨소리까지 잡아내는 장인 정신으로 작업하였다. 세상에서 가장 뜨거운 라이브 무비 &amp;lt샤인 어 라이트&amp;gt는 열정을 찾고 싶은 사람이라면 절대 놓치지 말아야 할 영화이다.
2008	69467	서양골동양과자점 앤티크	드라마	민규동	주지훈, 김재욱, 유아인	단 것이라면 질색하면서 손님이 대부분 여자라는 어이없는 이유로 케이크 가게를 오픈한 엉뚱한 사장 ‘진혁’ (주지훈). 뜬금없이 한적한 주택가 골목에 자리잡은 것도 모자라 몇 백만 원짜리 앤틱 식기에 케이크를 담아 내오고 새벽 2시까지 영업을 하는 별난 케이크숍 ‘앤티크’를 차린 후, 진혁은 케이크의 맛을 책임져줄 인물로 천재 파티쉐 ‘선우’ (김재욱)를 영입한다. 그런데 선우는 하필이면 고교시절 진혁에게 사랑을 고백해왔던 껄끄러운 동창생! 거기다 누구나 첫눈에 반하게 만드는 ‘마성의 게이’로 180도 변신해 끊임없이 남자 문제를 일으키는 통에 몇 달째 직원조차 구하기 힘들다. 결국 선우의 케이크 맛에 홀딱 반한 케이크광 ‘기범’이 주방 보조이자 견습생으로 들어오고, 진혁을 도련님이라고 부르며 그림자처럼 따라다니는 진혁의 보디가드 ‘수영’ (최지호)이 서빙을 맡게 된다. 네 남자가 모여 마침내 본격적인 영업을 시작한 앤티크. 그런데 이 네 남자, 멀쩡한 겉모습들과는 달리 무언가 수상하다!? 마성의 게이로 이름을 날리며 남자들과는 거침없이 복잡한 연애를 즐기는 선우가 어찌된 일인지 여자 앞에만 서면 벌벌 떠는 심각한 여성공포증이 있고, 곱상한 외모와는 달리 몹시 거친 성격의 기범은 알고 보니 최연소 동양챔피언이었던 전직 복서. 게다가 몸짱 보디가드 수영은 건장한 외모가 무색한 어리버리 사고뭉치로 오히려 진혁의 보살핌을 받고 있다. 그리고 제일 의뭉스런 일은 평소엔 수다스럽고 익살스런 호색한 진혁이 가족만 나타나면 품행 방정하고 착하디 착한 재벌 2세 도련님으로 대변신을 하는 것인데..! 겉만 보곤 도저히 알 수 없는 알쏭달쏭 네 남자, 다들 무슨 속사정인 걸까? 모델 뺨치는 외모의 사장과 점원이 서빙을 하고, 마성의 게이인 천재 파티쉐가 케이크를 만들고, 전직 복싱 챔피언이 주방보조인 별난 케이크숍 ‘앤티크’달콤한 네 남자의 아찔한 비밀을 둘러싸고 웃음과 감동의 드라마가 펼쳐진다!
2008	44456	서울이 보이냐?	가족, 드라마	송동윤	유승호, 오수아, 이창훈	1970년대 전라남도 신안군의 신도 지역. 이곳에 부임한 신출내기 여교사 은영은 여러 가지 사건을 통해 기쁨과 슬픔을 두루 맛본다. 서울로 수학여행을 가게 되면서 다시 여러 가지 사건이 벌어지는데...
2008	103377	세토의 신부	애니메이션	키시 세이지	엄상현, 양정화, 최석필	평범한 중학생 나가스미가 어느 여름날 인어 여자아이, 세토썬을 만나면서 벌어지는 이야기.
2008	44923	섹스 앤 더 시티	멜로/로맨스, 코미디	마이클 패트릭 킹	사라 제시카 파커, 킴 캐트럴, 신시아 닉슨	여자들은 원하고, 남자들은 궁금해 하는 그녀들의 짜릿한 연애, 솔직한 섹스, 완벽한 스타일의 모든 것! 당신을 황홀하게 할 그녀들이 온다! 뉴욕을 대표하는 잘나가는 그녀들 캐리, 사만다, 샬롯, 미란다! 남부러울 것 없는 완벽한 직업, 가던 사람도 뒤돌아보게 만드는 화려한 스타일로 뉴욕을 사로잡은 그녀들에게도 고민은 있다! 그건 바로 ‘사랑’. 뉴욕을 대표하는 싱글녀이자 유명 칼럼니스트인 ‘캐리’는 오랜 연인인 ‘미스터 빅’과의 완벽한 사랑을 꿈꾸고, 10살 연하의 배우와 불꽃 같은 사랑에 빠진 ‘사만다’는 그를 따라 할리우드로 떠나지만 자유로운 섹스와 뉴욕, 그리고 우정에 목말라한다. 쿨하고 이지적인 변호사 ‘미란다’는 평화롭기만 했던 결혼 생활에 뜻밖의 위기를 맞이하고, 남부러울 것 없는 결혼생활을 하고 있지만 아이를 가질 수 없어 고민하던 ‘샬롯’에게는 반가운 소식이 찾아오는데! 화려한 도시 뉴욕에서 영원한 해피엔딩을 꿈꾸는 그녀들. 하지만 인생에는 항상 반전이 있기 마련! 해피엔딩을 꿈꾸는 그녀들의 섹스보다 솔직하고 연애보다 짜릿한 사랑이 시작된다!
2008	66051	섹스아이콘 우씨 오브마이어	코미디, 드라마	아킴 본학	나탈리 아발롱, 마치아스 슈와바이어퍼	1960년대 우씨 오브마이어는 독일 뮌헨에 사는 10대 소녀였다. 돋보이는 외모 덕분에 사진 모델이 되고 그녀의 누드 사진들이 잡지를 장식하게 된다. 이 사실이 알려지자 부모와 인연을 끊고 무작정 길을 떠나는데, 우연히 히피적 감성의 음악그룹 무리에 합류한다. 이들의 히피문화를 접하면서 보다 자유로운 사상을 받아들이던 중 '코뮌 1(Kommune 1)'의 리더 격인 라이너 랑한스(Rainer Langhans)를 만난다. 라이너 랑한스는 독일에서 68혁명 세대를 이끈 실존인물이다. 우씨 오브마이어 자신도 후일 유명인사가 되었지만 수많은 유명인들의 연인으로 이름을 남긴다. 우씨와 라이너는 시대에 대한 정치적 저항과 함께 프리섹스주의를 선도하면서 당시 섹스, 마약, 그리고 락의 화신이었던 ‘롤링스톤즈(Rolling Stones)’를 만난다. 이후 우씨는 라이너와 결별하고 롤링 스톤즈의 그루피(groupie : 락밴드를 추종하여 그들을 따라다니는 열성팬)가 되어 리드싱어인 ‘믹 재거’, 리드기타 ‘키스 리차드’의 연인으로 유명세를 얻기 시작한다. [플레이보이]와 [스테른] 등 잡지 모델로 활발히 활동하고 이탈리아의 유명 프로듀서인 ‘카를로 퐁티’로부터 영화출연 제의를 받기도 한다. 하지만 보다 자유롭게 살기 위해 영화도 섹시아이콘으로서 유명세로 모두 버리고 새로운 모험을 시작한다. 역시 실존인물인 모험가 ‘디터 보쿰’과 만나 뜨거운 사랑을 빠진 그녀는 고급 캠핑카로 개조한 버스를 타고 1974년 파키스탄으로 떠난다. 이후 10여 년 간 아시아 대륙을 여행하는데, 인도에서 성대한 전통식 혼례도 치른다. 하지만 이들의 행복은 오래가지 못한다. 우씨가 임신 중에 유산을 하고 슬픔에 빠져 인도를 떠나기로 결심한다. 1983년 멕시코로 돌아온 뒤, 우씨는 ‘롤링스톤즈’의 키스 리차드와 우연히 다시 만난다. 이에 상심한 보쿰은 다음날 오토바이를 타고 나갔다가 변을 당한다. 우씨는 그의 죽음 앞에서 오열하며 시신을 불태우고 바다로 떠나보낸다. 60세가 넘은 지금, 그녀는 LA와 가까운 ‘토팽가 캐년(Topanga Canyon)'에서 보석디자이너로 살고 있다.
2008	47753	셀터	드라마, 멜로/로맨스	조나 마코위츠	트레버 라이트, 브래드 로우, 티나 홈즈	
2008	66516	소년 감독	가족, 드라마	이태겸	김영찬, 론다 리 잭튜니	그림 같은 하늘 아래 아름다운 논밭이 펼쳐진 강원도 노을골.할머니와 단 둘이 사는 11살 상구는, 아버지가 남긴 유일한 유산인 마을의 벽화가 허물어질 위기에 처했다는 청천벽력 같은 소식을 듣고 그것을 카메라로 찍어 남겨두기 위해 집에 있던 8mm 카메라를 꺼내 든다. 하지만 카메라 작동법은 어렵기만 하고, 결정적으로 상구에게는 필름이 없다!? 마을 사진관 할아버지의 말에 의하면, 상구의 아버지는 과거 영화 감독이었고, 서울에는 아버지와 함께 영화를 만들었던 친구가 영화 학교를 운영 중이라고 한다. 거기 가면 필름을 구할 수 있을 거라는 솔깃한 정보에 모험심이 발동한 상구. 과연 상구는 영화학교를 찾아 내서 무사히 필름을 구해 노을골로 돌아올 수 있을까? 그 때까지 아버지의 벽화는 상구를 기다려줄까?
2008	49521	소년, 소년을 만나다	드라마, 판타지	김조광수	김혜성, 이현진, 예지원	소년, 소년을 만나다! 따뜻한 봄날, 나른한 버스.작고 가냘픈 몸에 비해 조금 커 보이는 교복을 입은 민수는 키 크고 넓은 어깨의 좀 껄렁해 보이는 남학생 석이를 만난다.민수, 야구 모자의 챙 아래로 보일락 말락 하는 날카로운 눈빛의 무섭게 보이는 녀석에게 자꾸 눈길이 간다.흔들리는 민수의 눈, 두근거리는 가슴.민수는 석이와 잘 될 수 있을까?
