year	code	title	genre	directors	actors	story
2008	45931	대왕 세종	드라마	김성근, 김원석	김상경, 박상민, 안신우	서로 다른 이념과 가치관을 지닌 다양한 인물들의 대립과 갈등, 합의의 과정을 다룬 정치드라마
2008	56601	대정전의 밤에	드라마	미나모토 타카시	토요카와 에츠시, 타구치 토모로오	크리스마스 이브에 전개되는 갖가지 등장인물들의 이야기.
2008	50192	대한민국 변호사	코미디, 드라마	윤재문	이성재, 이수경, 한은정	공판을 마치고 법원을 나선 우이경은 경리 출신이라고 자신을 비웃는 오영탁을 앞질러 걸어가 택시를 잡는다. 한민국은 오류동과 함께 서둘러 헬기에 오르고, 헬기는 서울 시내 상공을 힘차게 날아간다. 이애리는 대형로펌 대보를 찾고, 그녀의 뒤를 쫓던 배수진 기자는 입구 경비에 가로막혀 들어가지 못한다. 자장면을 시켜 먹던 이경은 바닥에 깔린 신문의 이애리&amp;한민국 이혼 기사를 보고 깜짝 놀란다. 애리는 대보의 최대표에게 한민국을 상대로 재산분할 청구소송을 의뢰하겠다며 최고의 변호사를 구해달라고 말한다. 한국에 돌아온 변혁은 이전에 그가 이경과 동거했던 곳으로 향한다. 한민국은 우이경에게 자신의 변호사 하라고 말하지만 이경은 애리의 친구로서 애리의 뒤통수를 맞받아 칠 수 없다며 못한다고 한다. 이경의 아파트에서 마주친 민국과 변혁은 서로에게서 시선을 떼지 못하고 팽팽히 맞선다. 이경의 연수원 수료장을 본 변혁은 깜짝 놀라고, 당당한 표정의 이경은 변혁에게 자신의 집에서 나가달라 한다. 아버지 때문에 경찰서에 갔던 이경은 속상한 마음에 전이만과 오토바이를 타고 맘껏 속도를 내고, 그 뒤로 경찰이 쫓아오기 시작한다. 배수진의 차를 얻어 타고 경찰서로 간 민국은 이경을 데리고 나오고, 민국은 이경에게 그만 자기 편 하자고 한다. 변혁은 자신감 넘치는 발걸음으로 대보에 첫 출근한다. 민국은 도시락을 들고 이경의 사무실을 찾는다.
2008	65738	대한이, 민국씨	코미디	최진원	최성국, 공형진, 최정원	원래는 박氏이지만, 김을 너무 좋아해서 성을 김氏로 바꾼 대한이(최성국). 유일한 단짝 바보커플 민국이와(공형진) 세차 아르바이트를 하며 오늘도 열씨미 살고 있다. 그런 대한이에게 유일한 소망이자 소원은, 어릴 적부터 대한이와 민국이를 지켜 봐준 천사 같은 친구 지은(최정원). 그녀와의 결혼(?)이다. 사랑하는 지은이를 위해서, 너무 오래 걷지 말라고 지은이가 다니는 미용실 바로 앞에 횡단보도를 그려주고, 이왕 한 김에 버스도 가까운 곳에서 타라고 정류장도 옮겨주고, 그녀를 위해서라면 아낌없이 모든 것을 주는 바보계 최고의 로맨티스트이다. 원래는 미역을 좋아하지만, 자신보다 좀 더 똑똑한 친구 대한이가 김을 좋아해서, ‘미역민국’을 과감히 포기하고 같이 김氏가 되기로 한 민국씨. 세차 아르바이트를 하면서도, 세상엔 재미있어 보이는 흥미로운 일들이 어찌나 많은지, 어제는 비행사, 오늘은 택시기사, 내일은 권투선수를 꿈꾸는 바보계 최고의 욕심쟁이다. 자장면이 왜 짬뽕보다 500원 싼지도 척척 알아 맞추는 똑똑한 대한이를 의지하며, 존경하며 살고 있다. 너무 존경한 나머지, 대한이가 하자는 건 다 해야 해서 좀 피곤하지만 그래도 든든한 친구가 곁에 있어 항상 행복하다 생각하는 민국씨이다. 어느 날 지은이의 미용실에서 머리를 자르던 대한이, 민국씨에게 닥친 인생 최대의 파문!!! 머리 깎던 군인 손님에게 지은이 무심코 던진 한마디. “남자는 군대를 다녀와야 진정한 남자라고 하잖아요. 군인이야말로 최고의 일등 신랑감이죠~” 진정한 남자가 되어 지은이의 일등 신랑감이 되기로 결심한 대한. 내일 가라고 붙잡는 민국이를 버리고, 다음날 아침 동네 근처 부대로 망설임 없이 찾아가지만!!! 학력미달로 가차없이 쫓겨난 대한이. 상처받은 대한이를 위로해주는 민국과 함께 열씨미 공부해서 검정고시 합격하면 같이 가기로 하는데...과연 대한이, 민국씨 커플의 엉뚱한 프로젝트는 성공할 수 있을까?
2008	69339	댄 인 러브	코미디, 드라마, 멜로/로맨스	피터 헤지스	스티브 카렐, 줄리엣 비노쉬	좌충우돌 사춘기 세 딸을 키우는 ‘댄’(스티브 카렐)은 나홀로 행복한(?) 가정꾸리기에 정신 없는 4년 차 싱글 대디이다. 지역 신문에서 가정 상담 전문 칼럼을 쓰며 독자들에게 이런 저런 충고(!)를 하고 있는 그이지만 정작 자신의 인생은 꼬여만 간다. 큰딸 제인은 자동차 운전에 목을 매고, 둘째 카라는 실없는 놈과 연애질로 하루도 편할 날이 없다. 딸들의 연애는 진짜 사랑이 아닌, 반항심에 불과하다며 오히려 더 과잉보호를 하던 어느 날, 우연히 만난 매력적이고 아름다운 여인 ‘마리’(줄리엣 비노쉬)를 보고 참으로 오랜만에 두근거리는 사랑의 감정에 사로 잡히고 마는데… 하지만 사랑의 설렘을 만끽할 틈도 없이 천청벽력 같은 소식을 듣게 되는데, 그것은 바로 마리가 댄의 카리스마 꽃미남 동생 미치의 여자친구 라는 것!! 받아 들일 수 없는 현실과 달리 댄의 불꽃은 쉽게 꺼지지 않고, 마리 또한 댄의 순수한 매력에 조금씩 빠져들게 되는데.. 그러던 중 댄과 마리 둘만의 달콤한 키스 장면을 극성맞은 딸들에게 들켜 버리고, 아빠의 사랑을 반대하는 철부지 세 딸의 강력 철통 반대와 복수심에 불타는 동생의 배신감, 그리고 가족들은 패닉 상태의 쇼크에 빠지고 만다! 항상 가족이 우선이었던 댄은 이 모든 불행의 난관을 깨고서 진정한 사랑을 이룰 수 있을까?!
2008	69891	더 걸		미하엘 페어회벤	레나 스톨즈, 한스-레인하드 뮬러	서독의 ‘필징 시’에서 태어난 소냐는 총명하고 성실하여 학교 교사들의 각별한 사랑을 받는다. 교사의 추천으로 대통령 주최 에세이 공모전에 나간 소냐는 당당히 1등을 하게 되고 일약 필징의 스타가 된다. 그리고 또 다른 에세이 공모전에 ‘2차 세계 대전 시절의 내 고향’이라는 주제로 응모한다. 그런데 자료를 조사하다 보니 현재는 존경 받고 있는 성직자와 지식인들이 2차 세계 대전 당시에는 친 나찌 세력이었음을 알게 된다. 조사를 멈추지 않는 소냐. 그녀는 교단과 시로부터 협박당하고 심지어 이웃들로부터 테러를 당하며 부모님, 남편, 아이의 생명이 위협을 받게 된다.
2008	66617	더 게임	스릴러	윤인호	신하균, 변희봉, 이혜영	가난한 거리 화가 민희도(신하균 분)는 어느 날, 우연한 계기로 금융계의 큰 손 강노식(변희봉 분)으로부터 일생일대 내기를 제안 받게 된다.고민 끝에, 그는 사랑하는 사람과 일상을 지키기 위해 위험한 내기에 무모한 승부수를 던진다. 단 한번의 위험한 게임으로 그들의 인생은 완전히 뒤바뀌게 된다. 내기에 진 희도는 노식에게 모든 것을 빼앗기고, 노식은 부와 명예뿐만 아니라 한 청년의 모든 것인 건강한 몸까지 갖게 된다. 이에 희도는 뒤바뀐 운명을 되돌리기 위해 다시 한번 위험한 게임을 준비하는데…
2008	64082	더 시크릿	멜로/로맨스, 미스터리, 스릴러	벵상 뻬레	데이빗 듀코브니, 올리비아 썰비, 릴리 테일러	행복한 결혼 생활을 이어가고 있는 벤자민과 한나. 어느 날, 한나는 고등학생인 딸 사만다와 함께 겨울여행을 떠나던 중 불의의 교통사고를 당한다. 이 소식을 접한 벤자민은 아내와 딸이 입원한 병원으로 정신 없이 달려가지만 아내 한나는 곧 죽고 만다. 기적적으로 살아난 딸 사만다는 시간이 흐를수록 딸이 아닌 아내 한나 행세를 하려 하고 벤자민은 이런 사만다의 행동이 교통사고의 충격 때문에 일시적인 혼란에 빠진 것이라 여긴다. 하지만 아내와 자신만의 비밀까지 모두 알고 있는 딸... 이윽고 벤자민은 아내의 영혼이 딸의 몸 속으로 들어갔다는 충격적인 현실을 받아들이게 된다. 한나는 둘만의 비밀을 지키며 계속 아내로 살기로 하지만 예전처럼 자신을 사랑해주지 않는 벤자민에겐 불만이 쌓인다. 하지만 벤자민이 딸의 생활도 지켜주자고 설득하자 한나는 딸이 다니던 학교에 다니게 된다. 자신을 사만다로 알고 있는 딸의 친구들의 짓궂은 행동에 곤란을 겪을 때도 있지만 어느새 한나는 딸의 생활에 점점 동화되어 가는데…
2008	40101	더 재킷	스릴러, 판타지, 공포, 드라마	존 메이버리	애드리언 브로디, 키이라 나이틀리, 크리스 크리스토퍼슨	1991년 걸프전에서 머리에 총상을 입고 충격성 기억상실증에 걸린 잭(에드리언 브로디). 1년 뒤, 히치하이킹 한 차를 타고 캐나다로 가던 잭은 기억을 잃고 쓰러지고, 며칠 후 깨어난 그는 살인혐의를 받아 법정에 세워진 사실을 알게 된다. 재판 결과 알파인 그로브 정신병원에 보내지게 된 잭. 치료를 위해 약물 주사를 맞고 재킷이 입혀진 채, 시체보관실에 갇히게 된 그는 극심한 공포감으로 또다시 기억을 잃게 된다. 잭이 다시 깨어난 곳은 어느 허름한 식당 앞. 그곳에서 그는 웨이트리스 재키(키이라 나이틀리)를 만나게 되고, 재키는 오갈 때 없는잭을 자신의 집에 데려 온다. 그녀의 집에서 예전 자신이 쓰던 물건을 발견한 잭. 하지만, 그녀는 “그는 15년 전에 죽었다”라고 말하며 오히려 잭을 거칠게 몰아 세운다. 그 순간, 다시 시체보관실에서 눈을 뜬 잭! 그제서야 그는  미래로 시간이동을 해 그녀를 만났다는 사실을 깨닫게 된다. 그녀가 말한 죽음의 날짜까지는 앞으로 단 4일! 그는 일부러 사건을 일으켜 시체 보관함에 갇히기를 되풀이하며 미래에서 죽음의 단서를 찾기 시작한다. 그는 단서를 찾을 수 있을 것인가? 그리고 4일 뒤 예정된 미래를 뒤 바꿀 수 있을 것인가?
2008	64999	더 클럽	스릴러, 드라마, 멜로/로맨스	마셀 랭겐거	휴 잭맨, 이완 맥그리거, 미쉘 윌리엄스	뉴욕의 상류1%만이 가입할 수 있는 익명제 비밀클럽. 월스트리트, 아이비리그출신 등 상류층들로만 구성되어 있는 고객들의 섹스클럽이자 철저히 익명성을 보장하는 섹스리스트로, 전화를 통해 ‘ARE YOU FREE TONIGHT?라는 그들만의 멘트로 스케줄 확인 후, 뜨거운 원나잇 스탠드를 보내는 규칙이 존재한다. 뉴욕의 잘나가는 회계사지만 일상이 무료한 조나단(이완 맥그리거)은 사무실을 찾아온 변호사 와이어트(휴 잭맨)와 친구가 되고, 그를 통해 뉴욕 최상류층만 가입할 수 있는 비밀클럽을 알게 된다. 조나단은 스페셜 전화로 약속을 정하고 이름은 묻지 않는 채 뜨거운 관계를 갖는 이 클럽에 빠져든다. 어느 날, 지하철역에서 한눈에 반했던 여성이 비밀 클럽의 파트너로 나타나자, 조나단은 규칙을 어기고 이니셜S(미셸 윌리엄스)인 그녀와 가까워지게 된다. 하지만 함께 하룻밤을 보낸 뒤 그녀는 실종되고, 조나단은 2천만 달러를 횡령한 용의자로 지목 받게 되는데…
2008	61050	더 킹	드라마	제임스 마쉬	가엘 가르시아 베르날, 윌리암 허트	
2008	66317	더 폴: 오디어스와 환상의 문	모험, 드라마, 판타지	타셈 싱	리 페이스, 카틴카 언타루	1920년 미국 할리우드의 한 병원. 말을 타다 부상으로 하반신이 마비된 전문 스턴트맨 로이는 쇄골이 부러져 병원에 입원한 작은 꼬마 알렉산드리아와 친구가 된다. 어린 친구를 위해 로이는 매일 세상 끝 먼 곳에서 온 다섯 전사에 대한 환상적인 이야기를 들려 주고, 시간이 갈수록 현실과 환상은 서로 얽히고 뒤섞이게 되는데… 영화제 소개글. 1981년 불가리아 영화 &amp;lt요호호&amp;gt를 리메이크한 &amp;lt더 폴&amp;gt은 전 세계 18개국 26개의 로케이션에서 촬영되었다. 영화의 초현실적이고 판타스틱한 영상에도 불구하고 특수효과가 완전히 배제된 채 모든 장면이 실제로 촬영되었다는 사실이 놀랍다.
2008	68050	데스 노트 - L: 새로운 시작	범죄, 드라마, 공포, 스릴러	나카타 히데오	마츠야마 켄이치, 유키 쿠도	L이 자신의 이름을 데스노트에 적기 시작한 시점에서 죽음을 맞이하기까지 사이의 23일을 다룰 속편. 정의의 이름으로 데스노트를 건 마지막 결전을 앞둔 천재 명탐정 L(마츠야마 켄이치)에게 거대한 사건이 주어진다. 정체를 알 수 없는 누군가가 실현시키려는 ‘전인류 말살프로젝트’라는 엄청난 계획을 막아야 하는 것. 이 또 다른 사신(死神)의 목적은 악으로 찌든 현 인류를 모두 제거하고 새로운 인류를 형성, 이상적인 신세계를 만드는 것이다. 키라 라이토(후지와라 타츠야)와의 대결까지 남은 시간은 23일. 그러나 이번엔 전인류의 운명이 걸렸다. 오직 L만이 세상을 구할 수 있다!
2008	64225	데스 디파잉: 어느 마술사의 사랑	드라마, 멜로/로맨스, 스릴러	질리언 암스트롱	가이 피어스, 캐서린 제타-존스	죽음도 불사한 탈출 마술의 대가 해리 후디니의 신비로운 마술 세계와 매혹적인 심령술사의 속고 속이는 게임 속에, 피할 수 없는 사랑을 그린 서스펜스 로맨스 영화. 특히, 현대 마술계의 거장 데이비드 커퍼필드 순간 이동 마술에 버금가는 최고의 마술로 불리는 ‘탈출 마술’의 1인자 ‘해리 후디니’는 단순한 눈속임이 아닌 부단한 노력으로 육체를 단련, 궁극의 탈출 마술을 선보였던 인물로, 그는 실제로도 눈속임과 거짓말로 사람들을 현혹시키는 ‘심령술사’들에게 도전장을 내밀어, 보다 과학적이고 강력한 탈출 마술로 사람들을 매료시킨 인물이기도 하다. 심령술을 실험하겠다며 돌아가신 어머니의 마지막 유언을 알아 맞추는 사람에게 1만 달러를 제공하겠다고 공표한 해리 후디니(가이 피어스)와 돈을 위해 그에게 접근한 미모의 심령술사 메리 맥가비(캐서린 제타 존스)의 운명적인 만남과 사랑을 통해, 마술보다 더 강렬하고 드라마틱한 이야기를 펼쳐보일 예정이다.
2008	47407	데스 레이스	액션, SF, 스릴러	폴 앤더슨	제이슨 스타뎀, 타이레스	{2012년, 미국 경제가 붕괴되고 실업률이 사상 최고를 기록하면서 범죄율이 급격히 상승해 교도행정이 마비상태에 이르자, 사기업들이 영리 목적으로 모든 교도소를 운영하게 된다. 터미널 섬 교도소에서 인터넷으로 생방송되는 철창 격투는 목숨을 건 죄수들간의 결투로 공전의 히트를 기록했다. 터미널 섬은 이 시대의 콜로세움 죄수들은 이 시대의 검투사였던 것이다. 고대 로마인들이 그랬듯 곧 식상해진 오늘날의 시청자들은 더 많은 걸 요구하게 됐고, 그 결과 데스 레이스가 탄생했다.}살인 누명을 쓰고 감옥에 들어간 전직 레이싱 선수 젠슨(제이슨 스테이섬)은 교도소장 헤네시(조앤 알렌)에게 무차별 파괴 레이싱 ‘데스 레이스’의 출전을 제안받는다. '데스 레이스'의 최고 인기 레이서인 프랑켄슈타인이 4승 후 사망하자 경기의 인기 하락을 우려한 헤네시는 프랑켄슈타인의 죽음을 숨기고 젠슨에게 프랑켄슈타인의 대역을 요구한 것. 또한 만약 1승을 올린다면 젠슨은 교도소에서 나가 자유의 몸이 될 수 있는 조건이 있다. 이에 레이싱 출전을 결심한 젠슨은 여성 파트너 케이스(나탈리 마르티네즈)의 도움을 받아 단 한 사람만이 살아남을 수 있는 죽음의 레이스를 시작한다.
2008	66034	데어 윌 비 블러드	드라마	폴 토마스 앤더슨	다니엘 데이 루이스, 폴 다노	1898년 지독한 알콜 중독자에 부인도 없이 홀로 아들을 키우며 아무도 거들떠 보지 않는 황무지 사막 한가운데서 금을 캐는 무일푼 광부. 어느날 이곳에서 그는 석유 유전을 발굴하면서 일확천금의 행운을 누리게 된다. 야심찬 석유 개발과 함께 시작된 야망과 꿈은 어느새 탐욕과 폭력으로 바뀌게 되고, 쉴새 없이 샘솟는 석유와는 반대로 이들 사이에는 사랑과 존경, 희망, 믿음 등이 사라져만 가는데…
2008	61023	도레미파솔라시도	드라마	강건향	장근석, 차예련, 정의철	우스운 용가리 탈을 쓰고 놀이동산에서 알바를 하던 정원(차예련)은 자신의 탈을 쓴 모습을 놀리며 심기를 긁어 놓은 은규(장근석)에게 콜라를 들이부으며 복수를 한다. 그러던 어느 날, 옥상을 넘나들며 몰래 알바를 다니던 정원은 일주일 전 옆집으로 이사 온 은규에게 딱 걸리고, 은규가 지난 놀이동산에서 자신이 콜라를 부었던 녀석이라는 것을 알고 당황한다. 그 와중 몰래 알바를 다닌다는 사실을 부모님께 이르겠다는 은규의 협박에 못 이겨 일주일 동안 기타를 들어주기로 하는데… 정원은 매력적인 목소리와 자상함까지 갖춘 밴드 &amp;lt도레미파솔라시도&amp;gt밴드의 리드 보컬인 은규에게 점차 호감을 느끼고 은규 역시 정원에게 좋은 감정이 생기면서 두 사람은 어느 새 연인 사이가 된다. 그렇게 아름다운 사랑이 싹틀 즈음, 연습실에 찾아간 정원은 그 곳에서 우연히 10년 전 서로 좋아했지만, 불미스러운 일로 사이가 멀어진 희원(정의철)을 다시 만나게 되고 그들의 과거의 비밀들이 하나 둘씩 밝혀지면서 은규, 희원, 정원의 갈등이 시작되는데…
2008	65292	도발적 관계: 엠	드라마	히로키 류이치	미원, 코라 켄고	사토코는 사업가인 남편과 6살 난 아들과 함께 부유하고 안락한 삶을 살아가는 주부이다. 어느 날 그녀는 유치원에 간 아들을 데리러 가던 길에 자신의 아들과 놀고 있는 신문배달을 하는 미노루라는 청년을 우연히 만난다. 그녀는 첫 눈에 그가 삶이 아주 고단한 청년이라는 것을 알아챈다. 그리고 그가 12살 때 어머니를 학대하던 아버지를 살해한 과거가 있음을 알게 된다.한편, 사토코에게 자신의 어머니를 느낀 미노루는 그녀의 주변을 맴돌기 시작한다. 그러던 중 남편이 사업적 어려움으로 야쿠자로부터 위협을 받고 있는 사토코는 그들로부터 매춘을 강요 받는다. 그런 그녀를 보면서 미노루는 연민을 느낀다.영화제 소개글. 일본의 소설가 하세 세이슈의 단편 3편을 각색하여 완성된 현대인의 심리를 다룬 드라마. 사토코는 안락한 삶을 누리던 주부지만, 어느 날 날아온 이메일을 받고 창녀로 일하기 시작한다. 어린 시절 아버지를 살해한 청년 미노루는 신문을 배달하며 하루하루를 보낸다. 어느 날 그는 곤경에 빠진 사토코를 발견하고 그녀에게서 자신의 어머니를 느낀다. 정상으로 보이지만 흔들리는 마음을 가진 사람들의 욕망에 대한 보고서.
2008	47510	도쿄 마담		하마노 사치	하마다 루미	남편과 병원에 간 쿄코는 임신할 수 없다는 사실에 절망한다. 인공수정을 권하는 의사의 충고를 무시하고 쿄코는 아기를 갖기 위해 건강한 정자를 갖고 있을 것 같은 남자 사냥을 시작한다. 그리고 길에서 처음 본 남자를 유혹해 여관으로 가서 성관계를 갖는다. 그리고 다시 집에 돌아와서 남편과 관계를 갖고 누구의 아이이든 상관없이 임신만 하면 된다고 생각한다. 일요일도 다른 남자의 정자를 갖기 위해 거리로 나가 또 다시 처음 본 남자와 성관계를 갖는다. 집으로 찾아온 친언니에게 이런 사실을 전혀 부끄럽지 않게 이야기하면서 꼭 아이를 갖고 말겠다는 결심을 세운다. 한편 교코의 유혹에 빠진 한 남자의 약혼녀가 여성지 잡지 기자로서 불임 여성에 대해 취재를 하고 있었다. 기자는 여자의 직감으로 약혼자가 바람 핀 것을 알아채고 어떤 여자인지 추궁한다. 결국 쿄코라는 것을 알게되고 유부녀임이 확인되자 취재하고 싶은 욕망이 생긴다. 하지만 다른 남자와 바람 피는 것에 대해 아무런 죄책감도 없는 쿄코를 보고, 같은 여자이면서도 이해를 할 수 없다. 쿄코의 이야기는 결국 기사로 나오고 남편도 이 사실을 알게되지만 쿄코의 행동을 멈출 수는 없다. 쿄코는 또 다른 사냥감을 찾아 길을 나선다.
2008	66939	도쿄!	드라마	봉준호, 레오 카락스, 미셸 공드리	아오이 유우, 카가와 테루유키, 다케나카 나오토	segment - ‘흔들리는 도쿄(Shaking Tokyo)’(봉준호 감독 작품). 10년간 히키코모리(사회생활에 적응하지 못하고 집안에만 틀어박혀 사는 병적인 사람들을 일컫는 용어)로 집안에 틀어박혀 있던 한 남자가 어느 날 피자 배달부 여자를 사랑하게 되는 이야기. 그는 용기를 내어 바깥 세상에 나오지만 놀랍게도 온 도쿄가 전부 히키코모리 상태에 빠져있다는 것을 알게 된다. 그녀를 찾아내는 남자…. 그 순간 정신이 아찔할 정도로 강한 지진이 도시를 흔들기 시작한다. segment - ‘아키라와 히로코(Interior Design)’(미셸 공드리 감독 작품). 홋카이도에서 영화작가를 꿈꾸는 애인을 따라 상경한 히로코의 이야기. “왜 나는 여기 있는 걸까?”라며 주변의 무관심 속에 외로움을 느끼던 그녀는 어느 날, 신체의 이상한 변화에 눈뜬다. 갈비뼈의 일부가 나무가 되어가는 것이다. 나무로 변해가는 그녀가 선택하는 도쿄에서의 새로운 삶은 어떤 모습일까. segment - ‘광인(Merde)’(레오 까락스 감독 작품). 도쿄가 전율한다. 하수구에서 신출귀몰하는 괴상한 남자를 둘러싼 이야기. 도쿄 한복판에서 물의를 일으켜 체포된 정체불명의 남자는 재판소에서 괴상한 언어로 거침없이 독설을 퍼붓는다. 시민들 사이에서는 찬반양론으로 의견이 분분한 가운데, 남자의 존재를 인정할 것인가, 그렇지 않을 것인가…. 판결의 시간은 다가오고 있다.
2008	66716	도쿄, 여우비	스릴러, 액션	이준형	김사랑, 김태우, 진구	2000년 2월, 막 스타 반열에 오르던 수진은 에노시마의 CF 촬영장을 도망쳐 기치 조지역에 도착한다. 돈도 없는데 너무 배가 고팠던 그녀는 회전 초밥집에 들어가 초밥을 먹었다가 돈이 없자 밥값을 하기 위해 초밥집에서 일을 하게 된다. 그곳에서 수진은 현수를 만나고 처음에는 단지 같은 한국인이라는 이유로, 그 뒤엔 아픈 상처들을 교감하며 운명처럼 서로에게 끌리며 사랑을 시작하고 있었다. 하지만 그들 앞에 무서운 운명이 가로 막고 있었는데…
2008	66598	도화선	액션	엽위신	견자단, 예성, 고천락	1997년 화려한 도시 홍콩. 베트남에서 건너온 토니 형제는 홍콩의 암흑가에 자리잡고 잔인한 악행으로 자신들의 입지를 넓혀간다. 한편 범인을 검거하는 과정에서 항상 폭력을 휘둘러 물의를 일으키는 마 형사는 토니 형제를 검거할 증거를 찾기 위해 파트너 윌슨을 조직원으로 위장 투입시킨다. 스파이 노릇을 하던 윌슨은 그들을 체포할 수 있는 결정적 기회를 포착하지만 토니가 그 사실을 눈치채면서 윌슨과 그의 애인 주디까지 위험에 처하고, 재판을 앞둔 토니 형제는 증인들은 물론 경찰들까지 제거해나간다. 그들의 무차별한 살인에 분노가 폭발한 마 형사는 그들의 아지트를 찾아내 화끈한 결전을 예고하는데…
