year	code	title	genre	directors	actors	story
2008	65569	인 블룸	드라마, 스릴러	바딤 피얼먼	우마 서먼, 에반 레이첼 우드	열정적이고 반항적인 여고생 다이애나(에반 레이첼 우드)와 반대로 모범적인 모린(에바 아무리)은 서로 둘은 없는 단짝친구. 그들은 어느 날 교내에 총을 들고 와 무차별 난사 중인 한 남학생에 의해 둘 중 한 명만 살아 남겨 주겠다는 기막힌 제안에 부닥치게 된다. 그로부터 15년이 지난 후 남편과 사랑스런 딸 엠마와 함께 단란한 가정을 이루고 살고 있는 성인 다이애나(우마 서먼). 하지만 그녀는 워인 모를 불안과 공포, 위기의 순간에 쌓여있고 서서히 그녀에게 충격적인 결말이 그 내막을 드러낸다.
2008	65571	인 트리트먼트	드라마	파리스 바클레이, 로드리고 가르시아, 짐 맥케이	가브리엘 번, 다이앤 위스트	
2008	34521	인디아나 존스: 크리스탈 해골의 왕국	모험, 액션	스티븐 스필버그	해리슨 포드, 케이트 블란쳇, 카렌 알렌	2차 대전 후 냉전이 최고조에 다다른 1957년. 인디아나 존스(해리슨 포드)는 친한 동료 맥(레이 윈스톤)과 함께 미국 네바다주의 51구역 비밀창고에서 목숨을 위협하는 소련 특수부대 이리나 스팔코(케이트 블란쳇) 일당의 추격을 피해 힘겹게 탈출한다. 일상으로 돌아간 인디아나 존스는 대학에서 고고학 강의를 하며 평범하게 지내고 싶어하지만 비밀창고에서의 탈출 사건과 고고학 연구에 관련해 자신의 교수직을 해고하려는 정부의 또 다른 압력이 있다는 것을 알게 된다. 어쩔 수 없이 모든 것을 정리하고 대학을 떠나려던 찰나, 그의 앞에 머트 윌리암스(샤이아 라보프)가 나타난다. 반항기 가득한 청년 머트와 존스는 크리스탈 해골 관련 여러 가지 비밀들을 늘어놓으며 수천 년 간 풀리지 않은 마야 문명의 비밀이자 고고학 사상 최고의 발견이 될 ‘크리스탈 해골’을 찾아 나서게 된다. 인디아나와 머트 일행은 크리스탈 해골을 찾아 페루 마야 문명의 전설의 도시로 향하게 되는데, 그들의 행방을 수소문하던 소련 군대의 수장 이리나 일당 역시 크리스탈 해골에 얽힌 미스터리를 풀어 세계를 정복할 야욕으로 그들을 쫓는다. 세계를 지배할 힘을 지닌 크리스탈 해골! 더욱 막강해진 적들의 등장! 지금껏 경험하지 못한 놀라운 모험이 시작된다!
2008	49534	인디애니박스: 셀마의 단백질 커피	애니메이션, 판타지, 멜로/로맨스	김운기, 연상호, 장형윤		세 감독의 <원티드>, <사랑은 단백질>, <무림일검의 사생활> 3편의 묶어 개봉하는 작품.원티드(WANTED). 공개수배, 셀마를 아시나요? 평화로운 마을에 검은 베일의 수상한 노파가 나타나자 느닷없이 큰 비가 쏟아진다. 다음날 도 같은 현상이 반복되고, 마을주민들은 뒤늦게 찾아온 경관을 통해 그 노파가 공개수배자임을 전해 듣고, 점점 더 공포에 빠진다. 도대체 셀마는 누구일까?사랑은 단백질 (Love is Protein). 세상의 모든 치킨에겐 사연이 있다! 무료한 여름 밤. 자취생 재호, 경순, 홍찬은 돼지 저금통을 털어 치킨을 시킨다. 하지만 족발집의 돼지가 대신 배달을 오고, 그 돼지를 뒤늦게 따라온 닭사장은 배달된 치킨이 제 손으로 튀길 수 밖에 없었던 자기 아들 '닭돌이’라며 대성통곡한다. 그러나 세 친구는 후라이드된 닭돌이의 사연 앞에 각각 입장이 다르다.무림일검의 사생활 (A coffee Vending Machine &amp; It's Sword). ‘커피자판기’라도 괜찮아! 무림제일검이라 불리던 검객 진영영은 강적과의 대결 끝에 죽고, 소원대로 강철로 환생한다. 무슨 곡절인지 차가운 강철의 커피자판기로 환생한 진영영은 가슴에서 따뜻한 커피를 만들어내는 사내가 되고, 술을 먹으면 동정심이 왕성해지는 소녀 혜미와 첫사랑에 빠진다. 먼저 지명수배자인 ‘셀마’를 통해 한국의 정치 상황을 풍자한 애니메이션 <원티드>는 미스터리 스릴러라는 장르를 앞세우며 예고편 초반부터 심상찮은 BGM으로 분위기를 압도한다. <원티드>는 이미 세계 유수의 영화제를 통해 그 작품성을 인정받은 바 있다. 이어지는 연상호 감독의 <사랑은 단백질>은 세 명의 자취생이 통닭을 시켜먹는 과정을 통해 웃기지만 시원하게 웃을 수 없는 씁쓸한 유머를 전한다. 극의 주인공 ‘재호’가 돼지 저금통의 배를 째 통닭 주문할 돈을 마련하는 코믹한 장면과 튀겨질 수 밖에 없었던 닭돌이의 사연을 고백하는 닭사장을 등장시켜 영화의 반전과 극적 재미의 궁금증을 증폭시킨다. 마지막으로 <무림일검의 사생활>은 장형윤 감독 특유의 말랑말랑한 감수성이 절정에 달한 작품으로, 마음을 울리는 아름다운 노래 선율과 함께 커피자판기로 환생한 무림 최고수 ‘진영영’과 혜미의 아기자기한 러브씬이 담겼다.
2008	62560	인크레더블 헐크	액션, 판타지, SF	루이스 리터리어	에드워드 노튼, 리브 타일러, 팀 로스	실험 중 감마선에 노출된 이후 분노를 통제할 수 없는 상태가 되면 녹색 괴물 ‘헐크’로 변하게 되는 브루스 배너(에드워드 노튼). 필사적으로 치료제 개발에 매달리지만, 그의 능력을 이용하려는 정부 군대의 끈질긴 추격을 받고 쫓기게 된다. 한편 헐크의 거대한 힘의 비밀을 파헤치던 이들은 헐크보다 더 파괴적인 ‘어보미네이션’을 만드는데 성공, 도시 전체를 집어삼키려 한다. 이에 브루스 배너는 정상적인 인생을 되찾으려던 계획을 버리고, 어보미네이션과 정부 군대, 그리고 자기 자신과의 마지막 대결을 준비하는데...
2008	66488	인터뷰	드라마	스티브 부세미	시에나 밀러, 스티브 부세미	‘까칠한 그 남자 피에르’. 오랜 경력의 정치부 기자 피에르(스티브 부세미)는 최근 특종 성적이 좋지 못해 편집장의 눈밖에 나있다. 급기야 편집장은 그에게 할리우드 드라마 스타인 카티야의 인터뷰를 맡기고, 평소 연예계와 배우들을 무시하는 피에르는 사전 정보도 없이 약속 장소인 뉴욕의 유명한 카페로 나간다. 가뜩이나 억지로 나간 인터뷰 자리. 심지어 알지도 못하는 백치미 금발 스타가 인터뷰에 늦는 것이 아닌가! 서두르는 기색도 없이 느긋하게 들어오는 카티야. 피에르는 거침없이 그녀의 자존심을 긁기 시작한다. ‘떠오르는 할리우드 셀러브리티 카티야’. 비록 B급 공포 영화 출신으로 대작에 출연한 적은 없지만 거리나 식당에선 제법 알아보는 이가 많은 스타 카티야. 매니저와 노닥거리다가 인터뷰에 늦은 그녀는 인기인이 그렇듯 별로 미안한 기색도 없이 우아하게 레스토랑에 도착한다. 나름대로 반갑게 인사한 그녀는 자신이 출연한 작품을 보기는커녕 관심조차 없어 보이는 피에르의 공격적인 대화에 점점 자존심이 상한다. 결국 레스토랑에서 서로에게 막말만 남긴 채 일어난 두 사람. 돌아가던 중 예기치 못한 사고로 피에르가 상처를 입게 되고, 카티야는 그를 자신의 아파트로 데려가 치료해준다. 그리고 그녀의 집에서 드디어 치열한 인터뷰의 2막이 오르게 되는데……
2008	41578	일렉트로닉 걸	코미디	유보현	원경단, 왕서기, 맥가기	평범한 직장 여성인 젠에게는 누구에게도 말 못한 비밀이 있다. 바로 성적으로 흥분하면 온 몸에서 100만 볼트의 전기가 나온다는 것.  초등학교 4학년 때, 같은 반 남자애와  첫 키스를 나누다 찌릿함(?)을  처음 느낀 이후로 그녀의 인생은 한시도 조용할 때가 없었다.  대학 때 사귄 첫사랑이 그녀에게 감전되어 남성의 정체성을 잃고 커밍아웃을 하지 않나, 엘리베이터 안에서 추파를 던지는 남자들은 모두 전기구이가 되어 버리는 등 원하던 원치않던 이성과의 접촉을 늘상 골치 아파해야 하는 젠…그러나 그녀에게는 전기를 발산하는 것 말고 특별한 능력이 있었으니 바로 오르가즘을 느끼면 눈 앞에 펼쳐지는 숫자가 있었고, 줄곧 그 숫자가 로또복권 당첨번호라고 생각하며 위안하는 젠.어느 날 새로운 직장상사 레오가 그녀 앞에 나타나고, 일 중독에 가까운 레오는 젠과 함께 야근을 하다가 점차 야릇한 감정을 느끼지만 자신이 임포텐츠 환자이기 때문에 그녀에게 적극적으로 다가서지 못한다.  레오의 심정을 알리 없는 젠은 자신의 로또번호를 맞히게 해줄 상대를 레오로 정한 후 그와 섹스를 하기 위해 온갖 유혹을 하지만 레오는 ‘그래도 섹스는 사랑하는 여자하고 해야 한다’ 며 그녀를 거부한다.  자신의 목적을 달성하지 못한 젠은 회사를 그만두고 담당 의사로부터 고급 룸싸롱의 원마담을 소개받아 남자손님들을 상대하면서 로또를 맞히려고 한다.그러나 번번이 찾아오는 손님들은 하나 같이 그녀와 원하는 섹스는 하지 않고, 자신들의 말 못할 고민만 상담하자 그녀는 난감해 하지만 우여곡절 끝에 손님들의 고민을 모두 해결해 준다. 빼어난 미모와 재치로 단숨에 화류계의 에이스로 거듭난 젠. 이런 그녀에게 직장상사였던 레오가 찾아와 자신은 엄청난 부자이므로 로또 당첨은 잊어버리고 새출발하라며 청혼하지만 젠의 소문을 들은 삼합회의 보스 카우가 나타나 그들 사이를 방해하는데…
2008	47666	일지매	액션, 드라마	이용석	이준기, 박시후, 한효주	밤이 되고, 두건을 부여 맨 일지매(이준기)는 얼음꾼으로 변장한 채 수문장들을 속이고서 철문을 들어간다. 이어 전각지붕을 거침없이 뛰어가는 일지매, 곧 내수사에 도착한다. 이미 삼엄한 경비가 이뤄져 있지만, 일지매는 거침없이 보물창고인 내수고로 들어간다. 이어 잠복한 정예무사들을 낙엽처럼 처리한 일지매는 매화 한송이를 남기고는 유유히 그곳을 빠져나간다. 시간은 13년전 인조 9년으로 돌아가고, 이원호는 매화를 그리는 겸이에게 다른 꽃도 있는데 왜 유독 매화만 좋아하느냐고 묻는다. 그러자 겸이는 벚꽃을 닮았지만 야단스럽지 않고, 배꽃과 비슷해도 청승스럽지 않는데다 군자의 그윽한 격조가 느껴져 매화를 좋아한다는 대답을 들려준다. 한편, 한양인근 한 촌락이 불길에 휩싸이고 사람들이 우왕좌왕한다. 그때 맹인처는 봉순을 등에 업고 달리기에 여념이 없고, 말발굽소리가 들리자 봉순에게 계속 달려가라고 당부한 채 혼자 사천무리를 맞서지만 역부족이다. 그런가 하면 이원호와 같이 한양에 가게 된 겸이는 처음보는 한양의 모습에 실망한 기색이 역력한 와중에 봉순과 첫만남을 갖는다. 그 시각 시후는 뜻하지 않게 도둑으로 몰리고….
2008	61433	잃어버린 세계를 찾아서	모험, 가족, 판타지, 액션, SF	에릭 브레빅	브렌든 프레이저, 조쉬 허처슨	지각변동을 늘 예의주시하고 있던 지질학자 트레버(브랜든 프레이저)는 수년 전 실종된 형의 오래된 상자 속에서 우연히 &amp;lt지구 속 여행&amp;gt이라는 고서를 발견하게 된다. 책 속에 남겨진 암호가 지구 속 세상의 비밀을 밝힐 중요한 단서라고 여긴 트레버는 조카 션(조쉬 허처슨)과 함께 암호를 해독해가며 불과 얼음으로 뒤덮인 땅 아이슬란드로 향한다. 고서에 명시된 대로 찾아간 산장에서 미모의 산악가이드 한나(애니타 브리엠)의 도움을 받아 사화산 분화구에 오르지만 급작스런 기후 변화로 동굴에 갇히게 된다. 그 곳에서 그들은 지구 중심 세계로 통하는 빅 홀로 빠지게 되는데… 지구 중심의 마그마로 인해 점차 온도는 높아져 가고 그 곳을 탈출 하기 위해 그들이 극복해야 할 위험수위는 만만치 않다. 식인 식물의 위협으로부터 벗어나고 뜨거운 바람이 몰아치는 굶주린 피라냐가 우글거리는 바다를 건너, 무중력 상태로 허공에 부유하는 자석 바위 징검다리를 넘고 공룡의 습격에서 벗어나야만 탈출구로 향할 수 있다. 과연 그들은 지구 밖으로 무사히 귀환 할 수 있을까?
2008	68742	자유로운 세계	드라마	켄 로치	키어스턴 워레잉, 줄리엣 엘리스, 레슬로 주렉	이주노동자 직업소개소의 계약직 사원인 싱글맘 앤지. 상사의 성희롱을 참지 못해 부당해고를 당한 앤지는 친구 로즈와 함께 ‘앤지&amp;로즈의 레인보우 인력소개소’라는 회사를 차리고 인력알선업을 시작한다. 사업을 시작한지 얼마 지나지 않아 합법적인 이주노동자 인력알선 보다는 불법 이주노동자 인력을 쓰는 것이 훨씬 수익성이 높다는 사실을 알게 된 앤지는 하루빨리 부모님께 맡겨놓은 아들 제이미와 함께 살고 싶은 욕심에 불법 이주노동자들의 인력알선업에 점점 깊이 관여하게 된다. 그러나 불법 이주노동자들을 이용해 점점 쉽게 더 많은 돈을 벌어 들이는 것에 익숙해진 앤지와 불법 이주노동자들 사이에 임금 갈등이 불거지면서 그녀는 감당할 수 없는 위험에 직면하게 되는데. 영화제 소개글. 실업자가 된 룸메이트 앤지와 로즈는 이주노동자들을 모집해 그들의 값싼 노동력을 이용하는 사업을 시작한다. 법망을 교묘히 피해가며 비합법적인 경영을 하는 그들에게 큰 이익을 얻을 수 있는 기회가 오지만 앤지와 로즈는 엄청난 대가를 치러야만 한다는 것을 알게 된다. 좌파적 성향의 영화를 만드는 감독으로 잘 알려져 있는 켄 로치가 이주노동자 착취에 대한 이야기로 다시 돌아왔다. 해고를 당하고 이젠 다른 사람 밑에서 일하는 것에 진력이 난 룸메이트 앤지와 로즈는 이민자들을 모집해서 그들의 노동력을 이용하는 사업을 시작한다. 법망을 교묘히 피해가며 비합법적인 경영을 하는 그들에게 큰 이익을 얻을 수 있는 기회가 오지만, 거기에는 엄청난 대가가 따른다. 켄 로치의 이 영화는 노동자들의 직업보장률이 낮아지고 계약직이 늘어나는 세태에 착안한 것으로, 노동자 착취가 근대화의 자연스러운 산물이라는 자유시장의 환상을 주입시키는 모든 형태의 정부와 그 산하 기관들을 착취자의 관점에서 익살스럽게 꾸짖고 있다. “착취 당하는 사람에 대한 영화를 만드는 것은 너무 뻔하지 않은가 생각했다”는 켄 로치와 작가 폴 라버티는 “이 경우엔 그 상대편에 있는 사람들의 태도와 사고 방식을 보여주는 게 더 흥미로울 듯했다”고 이야기한다
2008	33639	작별	다큐멘터리	황윤	김혜진, 김영준, 엄기용	동물원에서 태어난 새끼 호랑이 크레인은 날 때부터 몸이 약하다. 엄마 호랑이 선아가 새끼를 낳고서도 돌보지 않아 사육사들의 손에서 자라는 크레인은, 외로움을 많이 탄다. 자원봉사자 혜진은 호랑이, 재규어, 퓨마 등 맹수들에게 장난을 치고 각자의 이름을 부르는 등 동물들을 다정하게 대해주지만, 그녀가 아끼는 동물들은 자꾸 병들어간다. 수의사 영준은 자원봉사로 다친 야생동물들을 구조하러 다닌다. 그들의 아픈 현실을 알게 될수록, 숲에서 마주치는 동물들의 발자국은 그에게 더욱 소중하게 다가온다.
2008	65794	잘 나가는 그녀에게 왜 애인이 없을까	코미디, 멜로/로맨스	수 크레이머	헤더 그레이엄, 토머스 카바나	광고회사에서 촉망 받는 크리에이터, 그레이. 금발에 멋진 외모, 쿨한 성격 그리고 밤새도록 춤추며 노는 열정까지 갖춘 잘 나가는 그녀에게도 고민이 있다. 완벽한 그녀의 유일한 고민은 몇 년째 남자다운 남자를 못 만나봤다는 것. 게다가 주위사람들은 친오빠 샘을 남친으로 오해까지 한다. 급기야 정기적인 심리상담도 받아보지만, 그녀에게는 별 효과가 없다. 좋은 짝이라도 찾을까 해서 찾아 간 센트럴파크에서, 그레이는 샘에게 너무나 잘 어울리는 매력적인 찰리를 기적처럼 만난다. 그리고 첫눈에 반한 이 커플은, 그 주말에 당장 결혼 하겠다고 나선다. 오빠의 결혼식을 위해 라스베가스에 따라간 그레이. 그날 밤, 그레이는 자신이 연애하지 못하는 이유를 알게되고, 알 수 없는 묘한 감정에 휘말리게 되는데… 과연, 그녀의 선택은 어떻게 될까?
2008	69266	잘못된 만남	코미디	정영배	정웅인, 성지루	한적한 마을 어귀에 차를 세우고 나란히 볼일을 보고 있는 아버지와 아들. 그때 지나던 택시가 아들을 치고 갈 뻔 한 상황을 모면하고 그 택시를 쫓게되면서 어린 시절의 베스트 프렌드 일도(정웅인 분)와 호철(성지루 분)의 인연이 다시 시작된다. 서울에서 고향 영덕으로 발령 받아 교통 경찰을 하게 된 열혈 경찰 ‘강일도’. 고향을 지키며 성실하게 가정을 책임지며 살고 있는 택시기사 ‘신호철’. 고등학교 동창이었던 이 둘은 우연인지 필연인지 이웃 사촌이 되면서 운명적 앙숙으로 지내게 되는데.. 15년 전 고등학교 시절의 삼각관계, 군대에서 고참과 쫄병으로의 만남, 그리고 이제는 지긋지긋한 이웃사촌을 넘어 과속과 신호 위반을 잡는 경찰과 과속과 신호위반을 해야 먹고 사는 택시기사로 다시 만났다. 일도는 군대에서 호철에게 당한 설움을 생각하며 어떻게 복수할까 매일밤 생각하고, 호철은 일도에게 첫사랑을 빼앗긴 과거가 있지만 아들들의 눈빛과 맘속에 들어있는 얄팍한 우정으로 위험에 처하는 일도를 도와 주려고 하는데.. 2008년 여름 철천지 웬수의 유쾌한 만남이 시작된다!
2008	66795	잠수종과 나비	드라마	줄리안 슈나벨	마티유 아말릭, 엠마누엘 자이그너, 마리 조지 크로즈	유명 잡지 ‘엘르’ 편집장으로남부럽지 않은 인생을 즐기던 장 도미니크 보비갑작스러운 뇌졸중으로 온몸이 마비되고신체 중 유일하게 왼쪽 눈꺼풀만 움직일 수 있게 된다자유롭던 몸짓이 한순간 잠수종에 갇힌 남자하지만 기억과 상상력에 날개를 달아새로운 도약을 시작하는데…침묵 속에서 세상을 써 내려간 남자의아름다운 실화가 시작된다!
2008	67450	저스트 어바웃 러브	멜로/로맨스	롤라 드와이옹	루시 데스클로조, 크리스타 테렛, 가엘 타바레스	여름방학을 앞둔 한 무리의 고등학교 친구들인 엘로디, 줄리, 뱅상, 니코 그리고 알렉스. 지금 그들에게 가장 중요한 문제는 졸업 후의 취직이나 대학 진학에 대한 고민이 아니다. 이 여름이 다 가기 전에 첫 경험을 치를 것이냐 말 것이냐! 2살 많은 케빈을 짝사랑하고 있는 생각 많은 엘로디. 그런 엘로디와 친한 친구 이상이 되고 싶어하는 뱅상. 고스족이라고 놀림 받지만 어쩌다 보니 뱅상과 니코, 두 사람과 얽히게 되는 줄리. 여자경험이 많음을 자랑하고 다니는 니코. 니코와는 반대로 여자에 대한 관심보다는 게임이 더 좋은 게임보이 알렉스. 하지만 이 여름, 이들의 우정 사이에서도 욕망의 묘한 기류가 흐르면서 우정이 삐걱거리기 시작한다. 영화소개. 3편의 단편을 찍고 <저스트 어바웃 러브>로 첫 장편 데뷔한 롤라 드와이옹 감독은 ‘처음’이란 것에 많은 의미를 두고 있다. 감독이 자신이 가장 알고 싶은 주제가 바로 ‘처음’이라 밝혔던 만큼, 많은 것들을 처음 경험하게 되는 십대 시절의 이야기로 첫 장편을 만든 것은 자연스럽고 당연한 것으로 보여진다. 십대들이 처음 경험하는 것 중에서 가장 궁금해하며 관심 있어하는 것이 무엇일까? 각자 머릿속에 떠오르는 몇 개의 단어들 중 공통적으로 찾을 수 있는 것 중에 하나가 바로 ‘성’이다. 롤라 드와이옹 감독은 십대들의 첫 경험을 통해 그에 따른 책임감과 정서적인 혼란스러움, 사랑과 우정 사이의 어려운 줄타기 등을 이야기하고 있다. 그녀는 자칫 심각하거나 교훈적일 수 있는 이 이야기를 담백하고 재기 넘치게 그려내는데 성공했다. 이러한 생각과 느낌들은 비단 성뿐만 아니라 여러 첫 경험에 대해서도 해당될 테니, 우리는 이 영화를 보는 동안에 자기 자신이 ‘처음’ 했던 여러 일들과 그 뒤에 남겨진 달콤씁쓸한 감정들에 대해 다시 떠올려 볼 수 있을 것이다.
2008	65669	적벽대전 1부 - 거대한 전쟁의 시작	전쟁, 액션, 모험, 드라마	오우삼	양조위, 금성무, 장풍의	위, 촉, 오 3국이 대립하던 서기 208년 중국.. 천하통일을 위해 중국대륙을 피로 물들여가던 ‘위’의 조조(장풍의)는 뛰어난 통치력과 막강한 군사력을 바탕으로 대륙의 반 이상을 차지하게 된다. 한편, 조조에게 쫓겨 퇴각에 퇴각을 거듭하던 ‘촉’의 유비군은 최후의 보루인 ‘신야성’마저 함락당하고, 손권(장첸)이 통치하는 ‘오’나라 인근 강남지역으로 피난을 떠난다. 하지만 조조에게 결코 물러서지 않겠다는 의지로 뭉친 유비군은 남은 병력으로 필사의 항쟁을 다짐한다. 하지만 이를 위해서는 ‘오’와의 연합세력을 결성해야만 하는데, 전쟁을 기피하는 손권과의 결탁 또한 어려운 일이었다. 이에, 유비군의 책사인 제갈량(금성무)은 홀로 ‘오’나라로 향하는데.. 제갈량과 주유, 그들이 만든 기적적인 연합세력. ‘촉’나라의 정벌로 사실상 천하통일을 이룬 조조는 마지막으로 ‘오’나라 에게 항복을 강요하고, 유비의 책사 제갈량은 ‘오’에 당도해 손권과의 동맹을 제안하지만 손권은 조조의 대군 때문에 망설인다. 제갈량은 손권의 마음을 움직이기 위해 ‘오’나라 제일의 명장 주유(양조위)를 먼저 찾아간다. 무기도 격한 언쟁도 없지만 제갈량과 주유의 팽팽한 심리대결은 긴장감을 더하고, 주유는 기예(技藝) 대결을 통해 제갈량과의 연합을 결심하여 자신의 주군 손권을 설득한다. 한편, 적벽으로의 출정을 앞둔 주유를 바라보는 그의 아내 소교(린즈링). 그녀는 자신을 흠모하는 조조의 100만 대군에 맞서야 하는 남편, 주유의 안위가 걱정되지만 이를 차마 말하지 못하는 가운데, 유-손 연합군은 적벽으로 향한다. 10만 vs 100만, 천지를 뒤 흔든 세기의 전쟁이 시작된다! 유-손 연합군 결성에 분노한 조조는 100만 대군을 이끌고 ‘오’를 향해 최후의 출격을 하게 되고, 10만 연합군은 양쯔강 지역의 험준한 ‘적벽’에서 조조의 100만 대군을 맞을 준비를 한다. 10만 VS 100만의 수적 열세에도 불구하고 연합군을 이끄는 주유와 제갈량은 반드시 승리할 것이라 호언장담한다. 그리고 그들은 놀라운 지략과 병법들로 서서히 조조의 100만 대군을 압도하기 시작하는데……
