year,code,title,genre,directors,actors,story,,,,,,,,,,,,,,,,,,,,,,,,,,,,,,,,,,,,,,
2007,66597,섹스 앤 이노센트,드라마,사미르,줄리 푸르니에, 카를로스 레알,취리히의 초상류층 자녀인 니코는 고교졸업 이후 자기만 생각하며 하루하루를 쉽고 편하게 보내고 있는 파티홀릭이다. 은행가인 아버지는 집에 있는 시간이 거의 없고 어머니는 삶에 대한 의지 없이 외로움에 빠져 우울증 증세를 보이기도 한다. 이런 가족에게서 사랑을 느끼지 못하는 니코는 절친한 친구인 '완다'와 클럽에서 시간을 보내며 클럽 사장인 '보리스'와 애인관계를 이어나가며 사치스런 생활을 즐기고 있다.   스페인 이민자의 아들, 파코는 자신의 성공에 대해 매우 회의적이다. 자신이 부른 힙합밴드의 곡이 슈퍼마켓에서 들리기는 하지만, 그 가사에 아무도 관심 갖지 않는다는 사실을 잘 알고 있기 때문이다. 보리스의 클럽에서 공연을 하던 중 파코는 손님들에게 공짜로 음료를 마음껏 마시게 하고 결국 난장판이 된다. 니코는 당당하면서도 도전적인 파코에게 빠져들게 되고 그를 만나기 위해 무대 뒤로 간다.   니코는 있는 그대로 말하며 삶을 포기하지 않고 자신의 방식대로 이겨나가는 반항적인 파코가 맘에 든다. 한편, 파코는 아무 걱정 없이 돌발행동을 하는 니코가 사랑스럽다. 그는 이런 니코를 보며 자신의 삶을 바꿔나가면서 자신이 정말 하고 싶어 하는 일을 나중에 하겠노라고 마음먹는다. 그러나 당장 파코는 니코를 뒤로 한 채 밴드와 함께 투어 공연을 떠나야 한다. 니코는 파코가 그러했듯 삶을 적극적으로, 반항적으로 살아보려고 노력한다. 자멸의 결과를 알지 못한 채...,,,,,,,,,,,,,,,,,,,,,,,,,,,,,,,,,
2007,37830,섹스 위드 러브,코미디,보리스 퀘시아,시그리드 알레그라시야, 엘바로 루돌프, 페트리샤 콘트라스,초등학교 자녀를 둔 학부모들이 자녀들의 성교육을 논의하기 위해 학교 모임에 부부동반으로 참석한다. 하지만 이 모임에서 정작 자신들의 섹스 고민을 털어놓고 서로의 고민을 들으면서 각각의 커플들은 각자의 아내, 남편, 그리고 섹스 파트너와의 고민들을 떠올린다.  학부모회의에 참석한 네 커플들은 사랑하지만 섹스 없이 사는 커플, 아내를 너무나 사랑하지만 아내하고만 할 수는 없어 끝없이 바람 피우는 남편, 그리고 외도하는 아내를 너무나 믿고 있는 남편 등 다양한 스타일의 부부들이다. 이들은 때로는 비극적이고, 때로는 희극적인 상황들 속에서 서로 서로 그들의 파트너를 속이고 다른 사람과 외도를 하게 된다. 그러나 비록 외도이지만 이런 육체적인 성적 열정이 자신의 파트너에게 새로운 사랑의 열정을 회복시키는 계기가 된다.,,,,,,,,,,,,,,,,,,,,,,,,,,,,,,,
2007,65763,소금인형,드라마,박경렬,황수정, 김영호, 김유석,남편의 수술비를 위해 자신을 짝사랑했던 남자와 동침을 한 아내, 이런 아내의 사랑을 깊게 느끼면서도 아내를 포용할 수 없었던 남편의 이야기를 다룬 정통 멜로 드라마,,,,,,,,,,,,,,,,,,,,,,,,,,,,,,,,,,,
2007,65677,소녀X소녀,드라마, 코미디,박동훈,임성언, 곽지민,칠공주파의 보스 세리(곽지민)는 학교에서 소문난 불량학생으로 같은 학교 꽃미남 기찬을 좋아한다. 윤미(임성언)는 전교2등의 모범생으로 어느 날 기찬이 불량배들로부터 윤미를 구해주면서 윤미 역시 기찬을 좋아하게 된다.   한편, 기찬이 모범생 윤미를 마음에 두고 있고 윤미 또한 기찬을 좋아하고 있다는 것을 알게 된 세리는 윤미에게 공부를 가르쳐 달라며 접근하다. 그러면서 윤미에게 자신이 과거에 기찬과 사귀었으며 기찬이 모범생보다는 날라리를 좋아한다고 거짓말을 한다.   그 날부터 자신이 너무 고지식한 모범생이라 기찬이 싫어할 것이라 생각한 윤미의 어설픈 날라리 연습이 시작된다. 물론 세리가 스승이다. 반대로 세리는 기찬의 맘에 들기 위해 패거리들과의 관계를 끊고 공부에 전념하려 한다. 서로의 장점을 배워가면서 가까워지는 두 사람.   드디어 순도 99% 날라리로 거듭난 윤미는 또 다른 불량 써클인 흑장미파를 건드리는 과감한 행동을 저지르고, 그 동안 연습한 껄렁껄렁한 태도로 자신 있게 기찬에게 대시하지만 결과는 대망신. 이 후 세리를 다시 어둠의 세계로 컴백시키기 위한 칠공주파 패거리의 계략으로 세리와 윤미는 절교를 선언하게 된다.   그러던 중 윤미가 건드린 흑장미파가 윤미에게 복수를 하려는 것을 알게 된 세리는 이 동네를 평정하겠다는 핑계를 대고 윤미 대신 흑장미파를 상대하러 간다. 한편 기찬에게 이 사실을 듣게 된 윤미는 앞뒤 가리지 않고 세리를 구하러 가는데.,,,,,,,,,,,,,,,,,,,,,,,,,,,,,,,,,,
2007,60779,숏버스,코미디, 드라마, 멜로/로맨스,존 카메론 미첼,숙인 리, 폴 도슨, 린지 비미시,한 번도 오르가즘을 느껴본 적 없는 섹스 테라피스트 소피아. 그녀는 성적으로 좀더 개방된 관계를 시도해 보려는 게이 커플 제이미와 제임스를 상담하던 중 ‘숏버스’라는 언더그라운드 살롱을 소개받는다. 비밀스런 모임이 이루어지는 이곳의 수많은 사람들은 예술, 음악, 정치 그리고 관계에 대해 서로 나누고 소통한다. 제이미와 제임스 사이에 새롭게 등장하게 된 모델 세스, 진정한 관계를 찾아 방황하는 세브린, 놀랍도록 솔직하고 과감한 경험을 하게 되는 소피아 등 숏버스를 찾는 외로운 영혼들은 서서히 해답과 희망을 찾아가게 되는데….   줄거리 2. 소피아는 능력 있는 성문제 상담사이지만, 정작 자신은 남편과의 섹스에서 한 번도 오르가슴을 느껴보지 못한다. SM 플레이를 직업으로 하면서 그 일에 회의를 느끼는 세브린은 소피아와 함께 서로의 문제를 해결해 주려 한다. 게이 커플인 제임스와 제이미는 서로 사랑하지만 구속 받지 않는 성생활을 원한다. 그런데 제3자인 세스를 끌어들여 자유로운 섹스를 즐겨도 뭔가 부족한 느낌이다. 이 모든 사람들의 사랑과 우정, 그리고 고민이 뉴욕의 언더그라운드 섹스 클럽 숏버스에서 펼쳐진다.   영화제 소개글. 어느 비밀스러운 언더그라운드 살롱을 중심으로, 성(性)과 사랑의 공통분모를 탐험하며 갈등을 겪는 인물들을 비극적이면서도 코믹한 터치로 그려낸 작품. 한 번도 오르가즘을 느껴본 적이 없는 섹스 테라피스트, 사랑을 할 수 없는 레즈비언, 언제 자신들의 관계를 오픈할 지 고민 중인 게이 커플을 비롯한 수많은 사람들의 이야기가 예술, 음악, 정치 그리고 그룹섹스와 같은 것들이 이루어지는 '숏버스'라는 정기모임을 둘러싸고 그려진다. 9/11 사태 이후의 뉴욕을 배경으로, 성적으로 놀랍도록 솔직하고 과감한 이 영화는 머리 속 의문, 육체적 쾌락, 마음의 명령 사이를 조율하는 새로운 방법들을 제안하고 있다.   스쿨버스 문화를 가진 미국에서 '숏버스'라는 말은 일반적인 버스를 타고 등교할 수 없는 장애를 가진 학생들을 통칭하는, 어딘가 모자라고 남들과 다른 이들을 놀리는 은어다. 영화 &amp;lt숏버스&amp;gt에는 '숏버스'라는 이름의 비밀스러운 지하 정기모임을 중심으로 어딘가 남들과 다른 고민을 가진 다양한 사람들의 이야기를 들려준다. 첫 작품 &amp;lt헤드윅&amp;gt에서 각본, 감독, 주연을 모두 훌륭하게 소화하며 세상을 놀래켰던 존 카메론 미첼의 개성은 여전하고, 음악은 더욱 훌륭하며, 성(性)적으로 감히 도전하기 힘든 높은 수위의 연기를 모든 배우들이 훌륭하게 소화해내고 있다. 2006 칸영화제에서 처음으로 &amp;lt숏버스&amp;gt가 세상에 공개된 후, 관객들이 마치 옛날 밀라노의 관객들이 베르디를 들쳐 업었던 것처럼 감독과 배우를 메고 칸의 거리를 행진했을 만큼 작품에 대한 사랑을 고백해 많은 화제를 일으켰다.,,,,,,,,,,,,,,
2007,45734,수,액션, 느와르,최양일,지진희, 강성연,경찰과 암흑가가 모두 주목하는 최고의 청부살인자이자, 자신을 길러준 '송인'(조경환) 외에 누구에게도 얼굴을 드러내지 않은 채 '해결사 수'로 불리는 '태수'(지진희). 그의 삶의 목표는 단 하나, 19년 전 배고픔을 못 이겨 마약 조직의 돈을 훔치다 자신 대신 붙잡혀 그대로 헤어져버린 쌍둥이 동생 태진을 만나는 것. 그러나 마침내 동생을 만나는 날, 태진은 그의 눈 앞에서 머리에 총을 맞고 즉사한다.   태수는 정체를 알 수 없는 범인을 잡기 위해 동생의 신분으로 위장하지만 태진은 자신을 쫓는 경찰의 신분. 태진의 약혼자이자 여형사인 미나(강성연)와 태수에게 동료를 잃은 형사 '남달구'(이기영)의 의심 속에서 태진의 살해범이 정체를 드러내기를 기다리던 태수는 동생 태진의 죽음 뒤에 19년 전 태수와 태진을 헤어지게 만들었던 장본인인 마약 조직의 보스 '구양원'(문성근)이 있다는 것 알게 되고 마침내 그 만의 피보다 진한 복수를 시작하는데......,,,,,,,,,,,,,,,,,,,,,,,,,,,,,,,,,
2007,66035,수용소의 삶 : 디지털삼인삼색2007,전쟁, 공포, 드라마, 멜로/로맨스,유진 그린, 하룬 파로키, 페드로 코스타,알프레도 멘데스, 델핀 헤켓, 프랑소아 리비에르,나치 친위대에 고통 받던 10만명의 수용소가 있던 베스터보르크에서 그 흔적을 포착한 <베스터보르크 수용소>.  리스본 교외의 판자촌에 모인 세 명의 비극의 기원을 쫓는 <토끼 사냥꾼들>. 방에서 이메일을 주고 받는 열일곱 살 동갑내기 비르질과 블랑슈의 엇가린 사랑을 다룬 <편지>.  2015년 타계한 독일과 체코를 대표하는 미디어 아티스트 하룬 파로키, 첫 장편 <피>(1990)로 베니스영화제를 진출한 이후 자신만의 소우주를 만든 페드로 코스타, 프랑스의 음유시인 유진 그린이 모여 일상에 갇힌 사람들의 표정을 담았다.,,,,,,,,,,,,,,,,,,,,,,,,,,,,,
2007,47511,순간 그리고 순간: 디지털삼인삼색2006,드라마, 멜로/로맨스,펜엑 라타나루앙, 에릭 쿠, 다레잔 오미르바예프,아난다 에버링햄, 샤미시아, 아이누 투감바예뱌,대학 동창의 부인과 사랑에 빠진 고독한 일상 수학교사 카이라트. 남편과 한 살배기 아들을 남겨두고 돈을 벌기 위해 싱가포르로 온 지 4년째인 씨티. 공항에서 우연히 마주친 그녀와 비행시간 내내 결혼한 부부처럼 함께 음식을 먹고, 영화를 보고, 책을 읽고 곁에서 잠이 드는 남자.  1991년 장편 데뷔작 <카이라트>로 로카르노 영화제에서 은표범상과 국제비평가협회상을 수상하며 카자흐스탄 뉴웨이브의 대표 감독이자 중앙아시아의 ‘로베르 브레송’으로 각인 된 다레잔 오미르바예프, <내곁에 있어줘>가 2005년 칸영화제 감독주간 개막작에 선정되며 이름을 알린 싱가포르 영화의 기수 에릭 쿠, 1997년 데뷔작 <펀 바 가라오케>로 베를린영화제에, 2003년에는 <라스트 라이프 라스트 러브>가 베니스영화제 업스트림 경쟁부문에서 남우주연상을 수상하며 급부상한 펜엑 라타나루앙. 세 아시아 감독이 선사하는 애잔한 세 단편.,,,,,,,,,,,,,,,,,,,,,,,,,,,,
2007,50263,순백지련,,강해양,장나라, 여문락, 양설,,,,,,,,,,,,,,,,,,,,,,,,,,,,,,,,,,,,,
2007,64922,숨,드라마,김기덕,장첸, 박지아, 하정우,죽음이 얼마 남지 않은 사형수 장진은 날카로운 송곳으로 자신의 목을 찔러 자살을 시도한다. 죽음을 앞당기려는 그의 노력에도 불구하고 결국 목소리만 잃은 채 다시 교도소로 돌아온다. 돌아온 그곳에서 기다리는 것은 그를 사랑하는 어린 죄수. 하지만 장진에게 이 생에 남아있는 미련은 아무것도 없다.   부족함이 없어 보이는 연의 삶은 남편의 외도를 알게 되면서 어긋나기 시작한다. 우연히 TV에서 사형수 장진의 뉴스를 본 연은 그에게 묘한 연민의 정을 느끼고 그를 만나기 위해 교도소로 향한다. 자신이 어린 시절 경험했던 죽음의 순간을 사형수 장진에게 털어놓으며 닫아 두었던 마음의 문을 열게 되는데....   연은 장진을 위해 해줄 수 있는 것을 찾고, 사계절을 선물하기로 마음 먹는다. 죽음 외에는 가진 것이 없던 장진에게 삶의 온기를 다시 불어 넣어주는 연. 계속되는 만남을 통해 둘은 단순한 욕망 이상의 감정을 갖게 되지만 연의 남편은 두 사람의 관계를 알아채고 이들의 사랑을 막기 시작한다.,,,,,,,,,,,,,,,,,,,,,,,,,,,,,,,,,,,
2007,45719,쉬즈 더 맨,코미디, 멜로/로맨스,앤디 픽맨,아만다 바인즈, 채닝 테이텀,말괄량이 바이올라(아만다 바인즈)는 헤어진 남자친구에게 복수하기 위하여 쌍둥이 오빠 세바스찬 행세를 할 결심을 하고 친구들의 도움을 받아 세바스찬으로 변신, 남자 기숙사 잠입에 성공한다.  그러나 어딘지 어색한 바이올라의 행동으로 룸메이트인 듀크와 그 친구들에게 왕따를 당하기 일보 직전의 위기에 처하는데... 다행히 전 학교 친구들의 작전으로 멋지게 분위기 반전에 성공, 친구들에게 멋진 놈이자 연애에 박식한 킹카라고 소문이 나게 된다.   한편 기숙사 생활에 적응해 나름 행복한 시간을 보내고 있는 바이올라, 점점 룸메이트 듀크가 남자로 느껴진다. 다소 쑥맥이긴 하지만 멋진 외모와 몸매, 그리고 감성적이고 순수한 마음까지 너무도 완벽한 남자 듀크! 그러나  듀크가 좋아하는 학교 퀸카 올리비아는 엉뚱하게도 바이올라가 남자인줄 알고 좋아하게 되고 듀크는 올리비아와 데이트하기 위해 바이올라의 도움을 청한다. 과연 듀크와 바이올라, 올리비아와 세바스찬의 관계는 어떻게 정리될 것인가?,,,,,,,,,,,,,,,,,,,,,,,,,,,,,,,
2007,43838,슈렉 3,코미디, 가족, 판타지, 애니메이션,크리스 밀러, 라맨 허,마이크 마이어스, 에디 머피, 카메론 디아즈,마침내 평온을 되찾은 ‘겁나먼 왕국’. 이제 자신들의 늪에 돌아가 둘만의 달콤한 생활을 꿈꾸던 슈렉과 피오나에게 엄청난 태클이 들어온다. 피오나의 아버지 해롤드 왕이 위독해져 슈렉과 피오나가 왕위를 계승해야 하는 상황이 벌어진 것.   해롤드 왕은 슈렉에게 왕위 계승 다음 서열인 피오나의 먼 친척 ‘아더 왕자’를 찾아오면 늪으로 돌아가도 좋다는 타협책을 내놓는다. 슈렉은 동키, 장화 신은 고양이와 함께 아더 왕자를 찾기 위한 머나먼 여정에 나서고….   한편, 슈렉이 없는 틈을 ‘프린스 챠밍’은 동화속 악당을 모아 겁나먼 왕국을 차지하려는 음모를 꾸미고, 왕국에 남아있는 피오나 등 5공주(백설공주, 신데렐라, 잠자는 숲속의 공주, 라푼첼)와 릴리안 왕비는 힘을 합쳐 프린스 챠밍에 맞서는데…. ‘모두가 王이 되고자 하는 시대’에 ‘스스로 王을 포기하려는’ 슈렉. 자신이 원하는 삶을 누리는 ‘진정한 王’이 될 수 있을까?,,,,,,,,,,,,,,,,,,,,,,,,,,
2007,65093,스모킹 에이스,액션,조 카나한,벤 애플렉, 제레미 피번, 라이언 레이놀즈,라스베가스 쇼에서 카드 마술로 명성을 날리는 최고의 스타 '이스라엘(제레미 피븐)'. 돈과 마약, 폭력에 찌든 그는 마피아와의 친분을 이용해 범죄를 저지르기 시작한다. 스스로가 마피아 조직의 보스가 되고 싶은 욕심에서 시작된 범죄 행각은 점점 대담해지고 결국 FBI의 추적을 받기 시작한다. 이스라엘이 FBI에 노출되자 덩달아 위험에 빠지게 된 마피아의 대부 '스파라짜'. FBI는 스파라짜의 통화를 도청하던 중 그가 이스라엘을 제거하기 위해 100만 달러를 걸었다는 정보를 입수하게 되고 이를 알게 된 이스라엘은 심각한 위협을 느끼게 된다. 결국 이스라엘은 마피아의 비밀을 FBI에 폭로하는 대가로 자신의 신변을 보호해 줄 '증인 보호 프로그램'을 요청한다. FBI 부국장 '라키(앤디 가르시아)'는 이스라엘을 보호하기 위해 그가 은신하고 있는 타호 호수에 위치한 카지노 호텔로 '메스너(라이언 레이놀즈)'와 '캐루터스(레이 리요타)' 요원을 파견한다. 한편, 이스라엘의 심장에 100만 달러가 걸렸다는 소문은 전문 킬러들 사이에 순식간에 퍼지게 되고 날고 긴다는 최고의 킬러들이 타호 호수로 몰려든다.   섹시한 여성 킬러들인 '사익스(알리샤 키스)'와 '셔리스(타라지 헨슨)', 미치광이 삼형제 다윈, 지브스, 레스터, 고문전문가 아코스타, 위장술의 대가인 라즐로 그리고 오직 돈을 위해 FBI와 마피아 사이에서 이스라엘을 빼내는 일을 의뢰 받은 보석 보증인 '듀프리(벤 애플렉)'와 전직 경찰관이었던 그의 친구들까지 합세하면서 카지노 호텔은 거친 살인 게임의 현장으로 돌변한다. 이스라엘을 보호하기 위한 FBI와 그를 제거하기 위한 킬러들의 대결은 시작되고 이들을 둘러싼 사건들은 점점 알 수 없는 음모 속으로 빠져들게 되는데.. 과연 누가 이스라엘의 심장을 가지게 될 것인가! 100만 달러를 둘러싼 거칠고 화려한 살인 게임이 시작된다!,,,,,,,,,,,,,,,,,,,,,,,,,,,,,
2007,37808,스위트 보이스,코미디, 드라마, 멜로/로맨스,그레그 프리티킨,애드리언 브로디, 밀라 요보비치,30세의 스티브는 나이 드셨지만 여전히 괄괄한 성격을 가진 그의 부모와 웨딩 플래너인 누나와 함께 살고 있다. 스티브는 직장을 그만두고 어렸을 때부터 꿈꿔왔던 ‘복화술사’가 되기로 결심한다. 그는 ‘복화술사’로의 재취업을 위해 노동상담소를 찾아가고 거기에서 아름다운 카운셀러 로레나를 만나게 된다. 그녀와의 대화로 자신의 꿈에 대해 더욱 확신을 갖게 된 그는 감사의 인사를 전하기 위해 죽마고우인 패니와 함께 그녀의 집을 찾아가지만 용기가 없어 문을 두드리지 못한다. 대신 그녀의 집 문에 “나는 당신에게 빚을 졌어요. -스티븐”라는 페인팅을 남긴다.   그 일을 계기로 싱글맘으로 딸을 혼자 키우고 있는 로레나와 데이트를 하게되고 그녀는 나이보다 훨씬 순수한 스티브에게 호감을 느끼게 된다. 하지만 그녀는 스티브의 가족들과 여자 경험이 전무한 그에게 점차 부담을 느끼기 시작한다.   한편, 스티브의 누나 하이디는 약혼자가 음주운전으로 체포되자 심난한 나날을 보낸다. 그러다 자신이 진행하는 결혼식 피로연에서 노래를 부르며 자신의 꿈이 가수였다는 사실을 새삼 떠올린다.,,,,,,,,,,,,,,,,,,,,,,,,,,,,,,,,,,
2007,66510,스카우트,코미디, 멜로/로맨스,김현석,임창정, 엄지원,1980년. 화려한 휴가를 꿈꾸던 대학 야구부 직원 호창에게 불가능한(?) 미션이 떨어진다. 라이벌 대학에 3연패의 치욕을 떨쳐 버리기 위해, 당시 세상을 떠들썩하게 했던 광주일고 3학년 선동열을 스카웃 해오라고 명받은 것!   광주로 급 파견된 호창. 경쟁 대학의 음험한 방해공작의 기운마저 느껴지는 가운데, 잡으러 온 괴물투수 선동열 대신 그가 만난 건 7년 전 헤어진 연인 세영. 이소룡이 죽던 날 갑자기 이별을 선고하고 사라졌던 세영은 7년 만에 만난 호창을 불편해 하고, 세영을 짝사랑하는 동네 주먹 곤태는 호창을 위협하기 시작한다.   결정권을 쥐고 있는 괴물투수의 부모는 꿈쩍도 하지 않고, 선동열이 경쟁대학으로 스카웃 됐다는 소문에 서울은 발칵 뒤집힌다. 동열이의 얼굴도 아직 보지 못한 호창은 사태가 악화되자, 곤태를 끌어들여 연합작전으로 ‘선동열 보쌈작전’까지 펼치는데... 호창은 과연 괴물투수 스카웃을 성공할 수 있을까? 7년 전, 그녀는 정말 이소룡 때문에 호창을 떠났던 것일까? 호창이 선동열을 찾아 헤매던 9박 10일의 마지막 날, 세상이 몰랐던 비밀이 드러난다!,,,,,,,,,,,,,,,,,,,,,,,,,,,,,
2007,56220,스쿠프,코미디, 판타지, 미스터리, 멜로/로맨스,우디 앨런,휴 잭맨, 스칼렛 요한슨, 우디 앨런,기자지망생인 ‘산드라’는 마술사 ‘시드 웨이터맨’의 공연무대에 우연히 서게 된다.   공연 도중 박스 안에서 유령처럼 나타난 유명기자 ‘조 스트롬벨’,   그에게서 악명 높은 타로 살인사건의 범인이 ‘피터 라이먼’이라는 이상한 말을 듣게 되는데…     이 엄청난 특종을 잡기 위해 ‘산드라’는 ‘시드’와 함께 ‘피터’에게 접근한다!   피터는 이제껏 만난 여자들과는 다른 ‘산드라’의 모습에 반하게 되고   산드라는 그런 다정한 피터에게 끌려 사랑에 빠지게 되는데…     과연 이 수상한 남녀의 심장 떨리는 로맨스는 어떻게 될 것인가!,,,,,,,,,,,,,,,,,,,,,,,,,,,,,,,,
2007,69916,스쿨 아웃,코미디,미겔 마르티,조르디 빌체스, 요하나 코보,하이메는 아버지 일 때문에 마드리드에서 리스본으로 전학 온 고3학생이다. 혈기 왕성한 사춘기 청년 하이메는 장례업에 종사하는 부모님, 그리고 여동생과 함께 살고 있다. 옆집에 사는 섹시한 누나는 마치 가족처럼 지낸다. 하이메는 누나의 화장실을 사용하며 욕망을 발산하기도 한다. 학교에서 하이메는 ‘투명인간’ 같은 존재이다. 고향인 스페인과 전학 온 포르투갈이 인접해 있긴 하지만 언어가 다르고 친구도 사귀지 못해서 어리숙한 이방인 취급을 받고 있다. 하지만 같은 반의 여학생을 짝사랑하면서 나름대로 즐거운 학교 생활을 보내고 있다.   졸업을 앞둔 하이메와 같은 반 친구들은 졸업여행에 들떠있다. 후보지는 프랑스에서 유학 온 이자벨이 추천한 ‘파리’와 사고뭉치 곤잘로 일행이 추천한 스페인 지중해 연안 휴양도시 ‘베니돔’. 반 학생들은 두 파로 나뉘어서 경쟁을 벌이기 시작한다. 22명의 학생 중 어느 파에도 속하지 않은 하이메가 결정권을 쥐고 있는 셈이다. 투명인간 같은 존재였던 그는 한순간에 필요한 존재가 되어 버린다. 곤잘로와 먼저 친해진 하이메는 베니돔을 찍을 것으로 예상되었지만, 짝사랑하는 여학생 마르타의 유혹에 빠져 파리를 찍는다. 마르타는 남자친구가 이자벨과 붙어다니자 화낌에(?) 하이메에게 키스를 하고 둘의 관계는 급속도로 가까워진다. 곤잘로 일행에 속한 여학생 노아는 그런 하이메가 걱정스럽다. 결국 졸업여행지를 결정하는 투표는 동점이 되고, 담임선생님은 여행 기금을 많이 모으는 쪽에 선택을 주기로 한다. 관능적인 여학생들의 적극적인 기금 모음 활동과 정자은행에 정자를 파는 등 가능한 모든 방법을 동원하는 학생들의 눈물겨운 경쟁 속에서, 하이메는 박쥐처럼 양 쪽을 왔다갔다 하며 마르타와의 관계, 곤잘로 일행과의 친분을 유지하려고 애쓴다. 결정의 순간을 앞둔 파티에서 학생들과 함께 선생님들도 광란의 시간을 보내지만 폭력으로 얼룩지면서 졸업여행은 물건너 가는 것이 아닌가 싶어진다.   (결말부) 결국 한번의 기회를 더 얻은 학생들은 이제 모든 결정을 자동차 경주에 맡긴다. 마지막 순간에 마르타가 아니라 노아를 사랑하고 있고 그들과 함께 하고 싶다는 자신의 마음을 깨달은 하이메는 아버지의 장의차를 직접 몰고 경주에서 이긴다. 졸업여행은 결국 뜨거운 태양 작열하는 지중해의 베니돔으로 결정되고, 비키니의 천국에서 하이메는 친구들과 함께, 사랑하는 노아와 함께 행복한 시간을 보낸다.,,,,,,,,,,,,,,,,,,,,,,,,,,,,,,
