year,code,title,genre,directors,actors,story,,,,,,,,,,,,,,,,,,,,,,,,,,,,,,,,,,,,,,
2007,65923,라 비 앙 로즈,드라마,올리비에 다한,마리옹 꼬띠아르 ,1925년 프랑스, 10살 어린 소녀의 노래 소리가 사람들을 사로잡는다. 노래의 주인공은 바로 훗날 전세계를 사로잡은 20세기 최고의 가수 에디트 삐아프. 거리의 가수였던 어머니에게 버림받고 서커스 단원 아버지를 따라 방랑생활을 하다 거리에서 노래를 부르며 하루하루를 연명하던 20살 그녀 앞에 행운이 찾아온다. 에디트의 목소리에 반한 루이스 레플리의 클럽에서 ‘작은 참새’라는 뜻의 ‘삐아프’ 라는 이름과 함께 성공적인 데뷔 무대를 갖게 된 것. 열정적인 그녀의 노래에 반한 사람들이 에디트에 열광하기 시작할 무렵, 그녀를 발굴한 루이스 레플리가 살해되면서 뜻밖의 시련을 겪게 된다.   하지만 시련도 잠시, 프랑스 최고의 시인 레이몽 아소에게 발탁된 에디트는 그의 시를 노래로 부르며 단숨에 명성을 얻고, 프랑스인들은 작은 체구에서 뿜어져 나오는 폭발적인 가창력, 열정적인 무대 매너의 에디트에 열광한다. ‘장미빛 인생’ 등 수많은 히트곡으로 프랑스는 물론 미국 시장까지 점령하게 된 에디트 앞에 그녀 인생의 단 하나뿐인 진실한 사랑, 세계 미들급 권투 챔피언 막셀 세르당이 나타난다. 운명적 연인과 열정적 사랑에 빠진 에디트는 프랑스에 있던 막셀에게 뉴욕에 있는 자신에게 날아와줄 것을 부탁한다. 하지만 다음날 대서양 너머의 비행기 사고 소식을 접한 에디트는 절망의 늪에 빠지게 되는데…,,,,,,,,,,,,,,,,,,,,,,,,,,,,,,,,
2007,65021,라따뚜이,코미디, 가족, 모험, 애니메이션,브래드 버드,패튼 오스왈트, 루 로마노,절대미각, 빠른 손놀림, 끓어 넘치는 열정의 소유자 ‘레미’. 프랑스 최고의 요리사를 꿈꾸는 그에게 단 한가지 약점이 있었으니, 바로 주방 퇴치대상 1호인 ‘생쥐’라는 것! 그러던 어느 날, 하수구에서 길을 잃은 레미는 운명처럼 파리의 별 다섯개짜리 최고급 레스토랑에 떨어진다. 그러나 생쥐의 신분으로 주방이란 그저 그림의 떡. 보글거리는 수프, 둑닥둑닥 도마소리, 향긋한 허브 내음에 식욕이 아닌 ‘요리욕’이 북받친 레미의 작은 심장은 콩닥콩닥 뛰기 시작하는데!   쥐면 쥐답게 쓰레기나 먹고 살라는 가족들의 핀잔에도 굴하지 않고 끝내 주방으로 들어가는 레미. 깜깜한 어둠 속에서 요리에 열중하다 재능 없는 견습생 ‘링귀니’에게 ‘딱’ 걸리고 만다. 하지만 해고위기에 처해있던 링귀니는 레미의 재능을 한눈에 알아보고 의기투합을 제안하는데. 과연 궁지에 몰린 둘은 환상적인 요리 실력을 발휘할 수 있을 것인가? 레니와 링귀니의 좌충우돌 공생공사 프로젝트가 아름다운 파리를 배경으로 이제 곧 펼쳐진다!,,,,,,,,,,,,,,,,,,,,,,,,,,,,
2007,98054,라라의 스타일기 1기,애니메이션,,쿠스미 코하루,평범한 소녀 '라라'의 특별한 스타일기!!   평범한 중학생 라라가 사랑을 쟁취하고자 연예계에 발을 담그면서 겪게 되는 시련과 좌절. 그리고 이를 이겨내기 위해 노력하는 라라의 진지하면서도 유쾌한 성장과장이 코믹하게 전개 된다.,,,,,,,,,,,,,,,,,,,,,,,,,,,,,,,,,,,,,,
2007,63017,라파예트,액션, 모험, 드라마, 멜로/로맨스, 전쟁,토니 빌,제임스 프랭코,제1차 세계대전이 한창인 프랑스. 역사상 유례없는 최대의 공중전이 펼쳐지고 수백 만명이 목숨을 잃는 전쟁이 계속되고 있다. 바다 건너 미국에서도 전쟁으로 몸살을 앓고 있지만 미정부는 참전을 결정하지 않는 가운데, 연합군의 약세는 피할 수 없어 보이는 상황인데…  한편, 가업으로 내려오던 목장을 잃고 혼란스러운 카우보이 롤링스(제임스 프랭코)는 젊음과 열정을 의미 있는 곳에 쏟고싶어 연합군에 자원, 프랑스로 향한다. 거기에는 롤링스말고도 출신과 나이, 인종은 다르지만 뜻을 위해 모여있던 7명의 젊은이들이 기다리고 있었다. 이름하여 미국인 최초의 전투비행단인 라파예트(Lafayette Escardrille). 아직 서툰 비행에도 불구하고 독일군을 상대로 맹렬히 그들은 그 어떤 연합군보다 용기있는 전투를 벌인다.   하루 하루가 위태로운 전장의 생활 중에서도 롤링스는 아름다운 여인, 루시엔을 만나 사랑을 키워나가며 팀에서도 에이스로 자리잡아간다. 그러나 독일군은 프랑스 전토를 불태울 가공할 위력의 폭탄을 싣고 파리를 향해 시시각각 다가온다. 롤링스는  무방비 지대에 홀로 남겨진 루시엔 을 구하고 싶은 안타까움과 치열한 전투 사이에서 결단을 내려야 하는데…,,,,,,,,,,,,,,,,,,,,,,,,,,,,,
2007,63908,러브 & 트러블,코미디, 멜로/로맨스,알렉 커시시언,브리트니 머피, 산티아고 카브레라, 매튜 리즈,런던 보그지의 패션 에디터, 버리기 아까운 엑스 보이프렌드와의 엔조이, 게다가 훈남 게이 룸메이트까지...모두가 부러워하는 그 여자 잭.스! 어느 날 패션 화보 촬영 중 유명 포토그래퍼 '루이기'와 작업 중 그의 새로운 어시스턴트 '파울로(샌티에고 카브레라)'를 만난다. 그녀 인생 처음으로 한 번에 필 꽂힌 바로 그 남자 파.울.로! 그러나 핸섬한 외모, 뛰어난 패션감각과 매너까지 겸비한 완벽한 남자 파울로가 웬지 수상하다.  게이들만 고용하는 것으로 유명한 '루이기'의 어시스턴트인데다 런던의 잘나가는 남자라면 죄다 게이인데 그도 혹시? 결국 쿨하고 엔조이를 즐기는 연애관으로 유명한 '잭스'에게도 그녀의 인생 최대 위기에 부딪혔으니 바로 게이에게 삘이 꽂힌 게 문제로다! 눈물을 머금을 수 밖에 없는 잭스는 게이 룸메이트 '피터'에게 '파울로'를 소개시켜주지만 '잭스'는 '파울로'의 매력을 떨칠 수 없고 '파울로' 역시 '잭스'에게 야릇한 눈길을 보내니 점점 더 마음이 흔들리는데... 런던의 완벽한 트러블 메이커들의 짜릿한 로맨스가 이제 막 시작된다!,,,,,,,,,,,,,,,,,,,,,,,,,,,,,,,,
2007,36778,러시 아워 3,액션, 코미디, 범죄, 스릴러,브렛 래트너,크리스 터커, 성룡,LA에서 열리는 세계 범죄 재판위원회에서 삼합회의 비밀을 이야기 하려던 대사가 저격을 당하는 사건이 발생한다. 그는 형사 '리'(성룡)가 경호하던 대사 '한'!  '리'는 암살범을 쫒지만 결국 놓치게 되고 그 와중에 교통경찰로 강등된 채 유유자적한 나날을 보내고 있던 '카터'(크리스 터커)와 재회한다. 사건을 해결하기 위해 파리로 날아간 두 사람, 티격태격 하면서도 사건의 실체에 다가가지만 삼합회 일당은 그들을 계속해서 궁지에 몰아넣는데...,,,,,,,,,,,,,,,,,,,,,,,,,,,,,,,,,
2007,50625,런던 콜걸, 벨,드라마,얀 디맨지, 수잔 툴리, 피터 린던,빌리 파이퍼, 이도 골드버그,아름다운 런던 여성 한나, 그녀는 ‘벨’이라는 이름으로 활동하는 고급 콜걸이다. 고급 콜걸로 살아남기 위한 자신만의 노하우 공개도 꺼리지 않는 그녀는 ‘스테파니’가 운영하는 에이전시에 소속되어 일한다. 스스로 섹스와 돈을 사랑한다고 밝히는 그녀는 자신의 일을 즐기며 살아가고 있다. 그녀는 ‘다니엘’이라는 젊고 멋진 고객을 상대하게 되는데, 이상하게도 그는 그녀를 거부하고 떠나 버린다. 이에 실망한 그녀는 다시 한번 다니엘과의 만남을 시도하는데 다니엘은 벨이 아닌 ‘한나’와 마주하길 원한다.,,,,,,,,,,,,,,,,,,,,,,,,,,,,,,,,
2007,66352,레이디 채털리,드라마, 멜로/로맨스,파스칼 페랑,마리나 핸즈, 쟝-루이스 콜로흐,제1차 세계대전이 끝나고 불구가 되어 돌아온 남편을 보살피는 레이디 채털리, 무기력증에 시달리는 그녀는 우연히 만난 사냥터지기 파킨에게 자신도 모르는 사이 끌리게 되고, 그로부터 뿜어져 나오는 생동감에 매료되고 만다. 결국 파킨과 관계를 갖게 된 채털리는 만남을 거듭할수록 그에게 빠져들게 되지만, 귀족의 부인과 사냥터지기라는 계급의 차이로 관계를 지속하는데 어려움을 느끼게 된다.   D.H 로렌스의 고전 『채털리 부인의 사랑』이 파스칼 페랑의 손끝에서 6번째로 다시 태어났다. <죽음과의 작은 협상> (Coming to terms with the Death)으로 1994년 칸영화제 황금 카메라 상을 수상했던 감독의 오랜 공백기간후의 두번째 영화라는 것, 여성감독의 시점에서 만들어진 여성에 관한 욕망을 다룬 영화라는 점에서 주목할 만하다. (전주국제영화제),,,,,,,,,,,,,,,,,,,,,,,,,,,,,,,,
2007,57997,레인 오버 미,드라마,마이크 바인더,아담 샌들러, 돈 치들,모두의 마음에 상처를 남긴 9.11 사건. 찰리 파인먼 역시 그때 사랑스런 가족 모두를 잃은 후, 직업도 만나는 사람도 없이 자신만의 세계에 갇혀 고독한 삶을 살아간다. 사랑스러운 아내와 아이들을 가진 잘나가는 치과의사 앨런 존슨. 모두가 부러워할 만한 조건을 가졌지만 그의 마음은 힘든 일과와 남편, 아버지로서의 책임감으로 무겁기만 하다.   그러던 어느 날, 대학 시절 룸메이트였던 찰리와 앨런은 우연히 마주치게 되고 신나는 밤을 보낸다. 그러나 실의에 빠져 심한 고독에 갇혀있는 찰리는 쉽사리 마음 문을 열지 못하고, 친구로서 그를 도와주고 싶은 앨런은 방법을 모색하기 시작하는데… 과연, 그들의 삶은 변화될 수 있을까?,,,,,,,,,,,,,,,,,,,,,,,,,,,,,,,,
2007,53825,레지던트 이블 3 - 인류의 멸망,액션, 공포, SF, 모험, 스릴러,러셀 멀케이,밀라 요보비치,세상의 끝... 엄브렐러사의 T-바이러스는 세계 전역으로 확산되어 인간의 살을 탐하는 제3의 인종을 탄생시킨다. 바이러스의 전염은 인류를 멸망의 위기로 몰고 가고, 지구에 대재앙을 불러온다. 모든 것이 사막에 묻힌 가운데, 카를로스(오데드 페르 분)와 클레어(알리 라터 분), 베티(아샨티 분) 등 생존자들은 무장된 차량을 타고 또다른 생존자를 찾는다.   그들의 곁을 지키는 앨리스(밀라 요보비치 분). 이들 모두는 인류의 마지막 희망을 찾고자 하지만 제3의 인종의 습격으로 위기에 처한다. 한편, 네바다에 숨겨진 엄브렐러사의 최첨단 연구소에서는 아이작 박사가 이 사태의 열쇠가 되는 앨리스를 찾고 있다. 엄브렐러사의 생체 실험의 결과, 유전자적 변형을 통해 더욱 새롭고 강력한 전사로 업그레이드된 앨리스는 생존자들을 지키고, 인류의 위기를 구할 수 있는 마지막 희망이다. 과연 그들은 인류를 구할 수 있을 것인가...,,,,,,,,,,,,,,,,,,,,,,,,,,,,
2007,56065,렌트,드라마, 뮤지컬, 멜로/로맨스,크리스 콜럼버스,로사리오 도슨, 타이 딕스, 윌슨 저메인 헤르디아,가난한 예술가들이 모여 사는 뉴욕 이스트 빌리지에 열정과 젊음의 에너지가 가득한 8명의 영혼들이 있다. 바로 로저, 미미, 마크, 머레인, 조엔느, 엔젤, 콜린스, 베니. 이들은 사회가 정한 규칙 보다는 자신만의 예술을 추구하며 각자가 원하는 삶을 살고 있다.   집세가 밀리고 건물이 철거 당할 위기에 놓인 그들은 집주인 베니에게 머레인의 건물 철거 반대 시위 공연을 막아주면 집세를 면제 해주겠다는 제안을 받게 된다. 하지만 그것만으로 이들의 열정과 우정, 사랑을 막기엔 역부족. 머레인을 사랑하는 마크와 룸메이트 로저는 그의 제안을 거절하며 베니의 방해 공작에도 불구하고 머레인의 변호사 조엔느와 함께 공연을 성공적으로 이끈다.   공연이 끝난 후 파티를 열고 있는 이들을 찾은 베니는 자신이 미미와 옛 애인 사이였다는 것을 이용해 파티를 엉망으로 만든다. 결국 로저와 미미는 헤어져 뉴욕을 떠나고, 각자의 길을 찾아 헤어진 8명. 끝없는 열정과 자유를 추구하며 함께 있어 행복했던 이들은 과연 다시 만나 서로 사랑하며 웃을 수 있을 것인가?,,,,,,,,,,,,,,,,,,,,,,,,,
2007,66711,로비스트,,이현직, 부성철,송일국, 장진영, 김미숙,국제적으로 세계 무기시장에서 활동 중인 로비스트의 이야기. 제작비 120억 원 규모의 대작 드라마로 제작됐으나 공감을 받지 못하는 내용으로 시청률 부진을 거듭했다. 종영 시청률 11.1% (TNS미디어코리아 조사)   동해 바닷가의 한적한 마을에 위치한 학교에 서울에서 온 주호(송일국)가 전학을 오자 소영(장진영) 등 같은 반 친구들은 호기심어린 눈빛을 보낸다.소영의 아버지 성식(성지루)은 큰 딸 문영(유선)이 교육감상을 받자 기분이 최고조에 달한다.하지만 성식은 동네 친구로부터 옛 애인 한숙이 이혼하고 고향으로 내려 왔다는 소식을 듣고 잡한 기분을 감추지 못한다.한숙과 만난 후 해안가 밤길을 달리던 성식은 좌초한 무장공비들의 잠수함을 발견하고 소스라치게 놀란다.초비상사태가 발생하자 김대위는 주호에게 수지(최차혜)를 잘 돌보라는 말을 남기고 작전수행을 나간다.예비군 소집에 응한 성식은 동네사람들이 포상금이 어머어마 할 거라며 축하 인사를 건네자 기분이 머쓱해 진다.사단장 장태성(이재용)은 공비토벌이 수월하게 돌아가지 않자 김대위를 질책하는데...   소영모(이미영)는 포상금이 일억이 넘을 거라는 말을 듣자 가슴이 뛰기 시작한다.성식(성지루)은 표정관리를 하라고 주의를 준다.어성리마을을 수색하던 김대위 일행은 한숙의 집으로 숨은 공비들을 발견한다.총소리가 들리자 개울가에 나와 놀던 주호(송일국)와 소영(장진영)은 깜짝 놀란다.교전중 한숙은 공비들의 총에 맞아 숨지고 김대위는 공비들을 추격한다.공비를 생포한 김대위는 차마 총을 쏘지 못하다 뒤편에서 나타난 박소좌에게 붙잡힌다.자수를 권유하던 김대위 앞에 이대위(허준호)가 나타나 박소좌와 대치하는 상황이 벌어진다.총을 버리라고 소리치던 이대위는 박소좌를 향해 사격을 하고 김대위는 쓰러지는 박소좌의 총을 맞고 사망한다.창고안에서 사고현장을 목격한 소영은 소스라치게 놀란다.졸지에 고아가 된 주호는 고모가 살고 있는 필라델피아로 떠나며 소영에게 펜던트를 건넨다.많은 포상금을 받게된 성식은 주변의 따가운 시선을 견디지 못하고 미국으로 이민을 가려고 마음먹는데...,,,,,,,,,,,,,,,,,,,,,,,,,,,,,,,,,,,
2007,62679,로빈슨 가족,애니메이션, 모험, 코미디, SF, 가족,스티븐 J. 앤더슨,안젤라 바셋, 폴 버처, 제시 플라워,별난 세상, 별난 가족들! 디즈니만이 상상할 수 있는 미래로 초대합니다. 슈퍼맨, 스파이더 맨, 헐크, 인크레더블 가족 등 살면서 별의별 희한한 사람들은 이미 다 봤다구요? 과연 그럴까요? 여기 이 가족을 만나보기전엔 확신하지 마십시오. 우리의 얕은 상식에 거침없이 하이킥을 날리는 희한한(?)가족이 옵니다.   로빈슨 가족을 소개하기 전에 그들과 함께 사는 몇몇 캐릭터들을 먼저 소개합니다. 머리는 크고 팔은 너무 짧아서 사냥을 못하는 티라노 사우르스가 있을까요? 갱단을 조직하고, 스윙밴드의 오케스트라 리더인 개구리는? 콘택트렌즈는 보험처리가 안되서 안경을 끼는 애완견은? 집사일을 보는 외눈박이 문어는? 자기 주인의 적들만 무는 충성스런(?) 불개미는? 상상이 안되신다구요? 이런 캐릭터들을 데리고 사는게 바로 로빈슨 가족입니다. 로빈슨가족 캐릭터를 소개하면 더 상상이 안되실테니 그들은 극장에서 직접 만나보시길 권해드립니다.   기대하셔도 자신있습니다. 천재발명가 루이스 그리고 미래소년 윌버 로빈슨과 함께 무엇이든 가능한 미래세상으로 모험을 떠나보시죠~ 모든 사람에겐 꿈이 있습니다. 당신은 그곳에서 무엇을 찾고 싶으십니까? 윌리엄 조이스의 원작 소설&amp;lt윌버 로빈슨과의 하루&amp;gt를 각색한 작품. 대니 엘프먼의 아름다운 음악은 보~너스로 챙기세요!,,,,,,,,,,,,,,,,,,,,,,,,,,,
2007,62733,로스트 라이언즈,드라마,로버트 레드포드,톰 크루즈, 메릴 스트립, 로버트 레드포드,차기 대통령을 노리고 있는 상원의원 어빙(톰 크루즈)은 자신의 정치적인 야심을 위해 저널리스트 제니 로스 (메릴 스트립)에게 접근하여 자신에게 유리한 글을 쓰도록 그녀를 조종하려고 한다. 전쟁을 기사화하며 그 안에서 명성을 쌓아가고 있는 그녀는 감추어진 진실과 상원의원 어빙이 던져주는 특종 사이에서 고뇌한다. 한편, 자신의 두 제자를 아프가니스탄으로 보낸 말리 교수(로버트 레드포트)는 또 다른 제자 토드를 불러 현실을 개혁하기 위해 그가 해야 할 일에 대해 말한다. 같은 시각, 어빙 의원이 제니 로스에게 설명하던 전략은 이미 아프가니스탄에서 시작되고 있었다. 어떤 대가를 치루더라도 승리만을 원했던 어빙의원의 전략은 결국 아프가니스탄의 오지에 두 청년을 고립되게 만들고, 이들은 생사의 기로를 넘나드는 사투를 벌이게 된다.   자신의 정치적 야심밖에 모르는 상원의원, 진실과 특종 사이에서 고뇌하는 저널리스트, 전쟁을 반대하는 이상주의자 교수, 그리고 그들의 세력싸움에 희생되는 젊은이들… 당신은 누구의 편에 서서 누구를 위해 싸우고, 누구를 위해 살며, 누구를 위해 죽을 것인가…,,,,,,,,,,,,,,,,,,,,,,,,,,,,
2007,62556,록키 발보아,액션, 드라마,실베스터 스탤론,실베스터 스탤론,최고의 헤비급 챔피언에서 성공한 사업가로 변신한 록키. 록키의 즐거움은 레스토랑을 찾는 사람들에게 과거에 화려했던 자신의 복싱경기 얘기를 들려주는 것. 그러던 어느 날, 한 유명 스포츠 TV에서 록키와 현재 헤비급 챔피언인 매이슨 딕슨과의 가상경기를 중계한다. 이 가상 경기는 상상 외의 큰 인기를 끌고 딕슨의 프로모터와 언론은 록키와 딕슨의 실제 경기를 록키에게 제안한다. 이 소식은 전 미국을 들끓게 만들고, 록키는 그 제안을 받아들이기로 한다. 일생 일대의 대결을 앞두고 그의 오랜 친구이자 트레이너인 듀크와 아들의 도움을 받아 훈련에 들어간 록키. 그리고 마침내 결전의 날이 다가오고.. 젊은 챔피언 복서 메이슨에 맞서 앞날을 예측할 수 없는 마지막 경기를 펼치는데.,,,,,,,,,,,,,,,,,,,,,,,,,,,,,,,,,,,
2007,55217,리버틴,드라마,로렌스 던모어,조니 뎁, 사만다 모튼,17세기 영국. 젊은 로체스터 백작은 술과 여자들에 둘러싸여 퇴폐적인 생활을 하며 금기를 깨기 위해 반항했던 방탕한 시인이다. 어느 날, 재능 없는 여배우 엘리자베스 배리를 보고 운명적으로 끌리게 된 그는 그녀를 최고의 여배우로 만들겠다고 호언장담한다. 그리고 서서히 그녀에게 빠져들며 진정한 사랑을 느끼게 된다. 한편, 영국 왕 찰스 2세는 프랑스 대사의 방문 계획에 맞춰 로체스터에게 자신의 업적을 기리는 연극을 만들어 달라고 부탁한다. 하지만 그의 기대와 달리 로체스터는 왕을 신랄하게 풍자하는 내용의 연극을 준비해 무대에 올린다. 자신의 열정과 진정한 단 한 번의 사랑을 위해 천재적 재능을 모두 불사르며 그는 스스로를 파멸로 이끌 위험 속으로 걸어 들어 가는데…,,,,,,,,,,,,,,,,,,,,,,,,,,,,,,,,,,,
2007,60480,리턴,스릴러, 미스터리,이규만,김명민, 유준상, 김태우,심장병 수술을 받던 중 수술의 고통을 그대로 느끼는 '수술 중 각성'을 겪은 10살 나상우. 상우는 극심한 고통의 기억으로 이상행동을 보이고, 어른들은 상우의 아픈 기억을 봉인한다.   옛친구, 강욱환의 갑작스러운 방문 이후 자신을 둘러싼 인물들이 의문의 죽음을 맞고 있음을 알게된 엘리트 외과의 류재우. 더욱이 함께 일하는 마취의 장석호와 정신과 전문의 오치훈과 마찰까지, 류재우는 알 수 없는 사건들에 휘말리고 결국 아내 희진마저 갑작스러운 사고를 당한다.   계속되는 의문의 사건 중심에 25년 전 '수술 중 각성'을 겪은 나상우가 연관되어 있음을 알게 된 류재우. 그의 존재를 쫓을수록 재우에게는 뜻밖의 진실이 다가오는데... 외과의 류재우, 정신과의 오치훈, 마취의 장석호, 그리고 강욱환 25년 전 사라진 나상우는 누구인가?,,,,,,,,,,,,,,,,,,,,,,,,,,,,,
2007,41595,리틀 러너,코미디, 드라마,마이클 맥고완,애덤 버처,카톨릭계 사립학교에 다니는 14살의 랄프는, 사건사고가 끊이질 않는 천진한 사춘기 소년. 몰래 담배를 피우기도 하고, 좋아하는 소녀에게 단번에 데이트 신청하는 것도 서슴지 않는다. 엄격한 교칙을 위반해 신부님들의 눈 밖에 나기 일쑤지만, 꼬박꼬박 고해성사로 용서를 구하려는 뻔뻔함이 밉지 않다. 이렇게 나름 즐겁게 생활하는 랄프지만, 단 한 가지 걱정거리는 있다. 유일한 가족인 엄마가 오랫동안 병상에 누워 계시기 때문. 하지만 엄마는 랄프가 병원을 방문할 때면  환자치곤 괜찮아. 네가 있으니 날 것 같구나. 우리 영웅 이라고 말하며 오히려 랄프를 위로한다.   어느 날, 병이 악화돼 혼수 상태에 빠지게 된 엄마. 랄프는 병원에서 엄마가 깨어 나려면 기적이 필요하다는 말을 듣게 된다. 몹시 소침해 하던 랄프는 우연히 학교 육상 부원들이 코치로부터 “너희들이 보스톤 마라톤에서 우승하는 것은 기적 같은 일”이란 질책을 듣는 것을 보고, 자신이 만들 수 있는 기적이 무엇인지 깨닫게 된 다. 이제, 주위의 만류에도 불구하고 엄마를 깨우기 위한 랄프의 보스톤 대회 도전기가 시작된다. 과거 유망한 마라토너였던 히버트 신부가 코치를 자청하는 기쁨도 잠시! 교장 선생의 완강한 반대와 뜻하지 않게 집에 일어난 화재는 랄프를 더욱 고난 속으로 내몰고 마는데.,,,,,,,,,,,,,,,,,,,,,,,,,,,,,,
2007,63885,리틀 칠드런,멜로/로맨스, 드라마,토드 필드,케이트 윈슬렛, 패트릭 윌슨, 제니퍼 코넬리,우연히 아이를 데리고 나간 놀이터에서 그를 만났다. 변호사 시험을 준비하며 아이를 돌본다는 브래드. 그의 매력적인 웃음에 살짝 마음이 떨렸다. 수영장을 다닌다는 그의 말에 발간 수영복을 주문했다. 그리고 그와 입을 맞춘 순간, 무료했던 내 삶이 달라지기 시작했다.   우연히 아이를 데리고 나간 놀이터에서 그녀를 만났다. 내 전화번호를 두고 내기를 했다는 사라. 아름답고 잘 나가는 아내에 비하면 별 볼일 없는 그냥 아줌마지만, 그녀에겐 뭔가 색다른 매력이 있다. 그리고 그녀와 입을 맞춘 순간, 답답했던 내 삶이 달라지기 시작했다.,,,,,,,,,,,,,,,,,,,,,,,,,,,,,,,,
