year,code,title,genre,directors,actors,story,,,,,,,,,,,,,,,,,,,,,,,,,,,,,,,,,,,,,,
2007,57971,인베이젼,스릴러, SF,올리버 히르비겔, 제임스 맥티그,니콜 키드먼, 다니엘 크레이그, 제레미 노담,정신과 의사 캐롤 버넬(니콜 키드먼)은 환자 중 한 명이 자기 남편이 완전히 다른 사람이 되어 버렸다는 이야기를 듣지만 대수롭지 않게 여기고 간단한 약을 처방한다. 그리고 아들 올리버와 친구들의 할로윈 행사를 지켜보다 사탕 주머니 속에서 정체 불명의 이상한 물질을 발견하게 되고, 아들의 친구 중 한 명이 이상하게 달라졌음을 느낀다.   캐롤은 동료 의사이자 친구인 벤 드리스콜(다니엘 크레이그)과 스티븐 박사(제프리 라이트)에게 사탕 주머니에서 발견한 이상한 물질의 조사를 의뢰하고, 그 물질이 인간들이 잠자는 사이 침투해 겉모습은 그대로 둔 채 정신세계만 변화시키고 있음을 알게 된다.   캐롤은 남편의 변화로 공포에 떨던 자신의 환자와 지나치게 차분해졌던 아들의 친구, 갑자기 나타나 아들을 만나게 해달라던 전 남편 그리고 질서정연하게 변해버린 거리를 무표정한 얼굴로 오가는 사람들 모두 그 물질에게 감염되어 ‘신체 강탈’ 당했음을 깨닫는다. 그 물질은 다름 아닌 인간 종족을 모두 자신들의 종족으로 변이시키려는 외계생명체였던 것.   광기에 휩싸인 도시에서 누가 감염자이고 누가 정상인인지 판별하는 것조차 어려워지고… 그들에게 사로잡히지 않기 위해서는 절대 잠들거나 절대 감정을 드러내서는 안 된다! 캐롤은 어린 아들을 보호하기 위해 목숨을 건 탈출을 시작한다!,,,,,,,,,,,,,,,,,,,,,,,,,,,,,,,
2007,40636,일루미나타,드라마,존 터투로,존 터투로, 캐서린 보로위츠, 크리스토퍼 월켄,20세기 초, 미국 동부의 어느 극장. 재능은 있으나 아직 빛을 못 본 극작가 투치오(존 터투로)는 인기 여배우인 레이첼(캐서린 보로위츠)과 연인 사이이다. ‘루스티카나’ 라는 연극이 상연되는 중, 주인공 피에로가 무대에서 쓰러지자 투치오는 무대에 나서 자신이 만든 ‘일루미나타 - 젊은 여자와 바람을 피우는 남자, 그 남자를 지독히 사랑하는 아내 일루미나타 이야기’를 상연할 것이라고 한다. 다음 날 ‘일루미나타’의 초연 후, 평론가인 베발라콰(크리스토퍼 월켄)는 혹평을 쏟아냈고 극장주는 입센의 ‘인형의 집’을 대신 상연해야겠다는 생각을 하고, 한 물 간 여배우 셀리멘느(수잔 서랜든)는 투치오를 유혹해야겠다는 결심을 한다. 위기에 처한 투치오를 위해 레이첼과 동료 배우들은 ‘일루미나타’를 계속 상연할 수 있는 작전을 세운다.,,,,,,,,,,,,,,,,,,,,,,,,,,,,,,,
2007,54871,일루셔니스트,드라마, 멜로/로맨스, 스릴러, 미스터리,닐 버거,에드워드 노튼, 폴 지아마티, 제시카 비엘,19세기 비엔나의 한 도시에서는 홀연히 나타나 사람들의 눈과 귀를 사로 잡고 있는 마술사 아이젠하임(에드워드 노튼)의 환상 마술이 한창이다. 현실과 환상의 경계를 넘나들며 초자연적인 힘을 펼쳐보이는 아이젠하임 마술에 대한 소문이 순식간에 유럽 전역으로 퍼져나가자, 황태자 레오폴드(루퍼스 스웰)까지 약혼녀 소피 (제시카 비엘)를 대동하고 공연장을 찾기에 이른다. 하지만, 아이젠하임의 무대에 보조로 서게 된 소피가 어릴 적 자신의 연인이라는 사실을 알아 본 아이젠하임은 그녀와 위험천만한 로맨스를 시작하고, 이를 눈치챈 레오폴드 황태자는 울 경감에게 아이젠하임을 사기꾼으로 몰아 체포하라는 명령을 내리는데..   아이젠하임을 헌신적으로 추종하는 대중들이 늘어나자 불안해진 레오폴드는 필사적으로 아이젠하임의 본색을 드러내려 한다. 팽팽한 신경전이 이어지는 가운데 새로운 국면을 향한 살인사건이 발생하고. 얘기치 않은 사건으로 두 사람의 관계는 파국으로 치달아 간다, 울 경감이 사건의 진실을 밝히기 위해 끈덕지게 파고드는 동안, 아이젠하임은 무대 위로 죽은 이의 영혼을 부르는 일생 일대 최고의 환상 마술을 펼쳐 보일 준비를 시작하는데...,,,,,,,,,,,,,,,,,,,,,,,,,,,,
2007,55368,입술은 안돼요,멜로/로맨스, 코미디,알랭 레네,오드리 토투, 이사벨 낭티, 사빈느 아제마,미국인 에릭 톰슨과의 이혼 사실을 숨기고 돈 많은 조르주와 결혼한 질베르트. 그녀의 비밀을 아는 것은 여동생인 아를레트뿐이다. 그런데 조르주가 에릭 톰슨과 사업 문제로 친분을 나누게 되면서부터 순조롭던 질베르트의 삶이 복잡해지기 시작한다. 에릭이 나타나자 질베르트와 아를레트는 이혼 사실을 숨기려고 애쓴다. 한편 평소 질베르트를 흠모해온 젊은 청년 샤를레는 계속해서 그녀에게 구애를 하지만 여의치가 않고, 질베르트 부부와 친분이 있는 아가씨 위게트는 샤를레를 흠모하지만 속마음을 털어놓지 못하고 애만 태운다. 결국 질베르트는 아를레트와 함께 에릭 톰슨의 거처를 찾아가고, 같은 시간 위게트 역시 에릭 톰슨과 같은 건물을 빌려 쓰던 샤를레를 찾아가 사랑을 고백한다. 결국 조르주와 질베르트, 아를레트, 에릭, 위게트, 샤를레는 한 방에 모여 자신의 짝을 찾아 한바탕 소동을 벌이게 된다.   영화제 소개글. 1925년의 빠리. 질베르트 발랑드레이는 사업가 조르주와 행복한 결혼생활을 하고 있다. 그러나 그녀는 아를레뜨에게 남편을 사랑하지만 다른 남자에게 관심이 있다고 고백한다. 한편 위게뜨 베르베리는 질베르뜨가 좋아하는 남자와 결혼하려고 한다. 여기에 미국인 사업가 에릭이 끼어들고, 바야흐로 복잡한 애정관계가 얽혀든다. &amp;lt아멜리에&amp;gt의 히로인 오두리 또뚜를 비롯한 연기자들의 호흡이 돋보이는 영화로 1920, 30년대 빠리에서 유행했던 ‘진지한’ 스타일의 연극에 오마주를 바치고 있다. &amp;lt입술은 안돼요&amp;gt는 영화와 연극, 그리고 노래가 어떻게 행복하게 결합할 수 있는가를 보여주는 작품이다. (제천국제음악영화제),,,,,,,,,,,,,,,,,,,,,,,,,,
2007,66385,저 하늘에도 슬픔이,가족, 드라마,한명구,김유나,우리집은 모두 여섯식구 입니다. 엄마, 아빠, 나, 여동생 순나, 남동생 윤식이, 그리고 욕심쟁이 막내 옥이까지... 우리 여섯 식구는 행복하게 살고 있었습니다. 하지만 아빠의 도박으로 인해 우리집의 행복은 한순간에 사라졌습니다.   아빠의 도박으로 인해 매일 아빠와 싸우시던 엄마는 어느 날 우리 사남매를 버리고 집을 떠났습니다. 엄마의 가출 후 아빠와 함께 이곳 저 곳을 떠돌다가 할아버지의 도움으로 작은 옥탑방에 방을 얻게 되었습니다. 술을 마시고 돌아오던 길에 교통사고를 당해 드러누운 아빠와 어린 동생들을 위해 저는 구두도 닦고, 신문도 팔고 껌도 팔았습니다.   오늘도 힘든 하루가 끝났습니다. 하지만 언제까지 이런 날이 계속 될까요?? 엄마가 돌아오면 좋겠습니다. 아빠는 어린동생들을 보육원에 보내자고 합니다. 동생들과 헤어지기는 싫은데 어떻게 해야 할까요?   마음씨 좋은 버스회사 사장님의 도움으로 좋은 일자리도 얻고 동생들과 함께 살아갈 수 있게 되었습니다. 또 엄마를 찾는 것을 도와주신다고 합니다. 정말 너무 너무 감사합니다. 그리고 선생님이 제 일기를 책으로 내자고 하셨습니다. 책이 많이 팔리면 우리 가족은 다시 행복하게 살 수 있나요?,,,,,,,,,,,,,,,,,,,,,,,,,,,,,,,
2007,48036,전설의 고향,공포,김지환,박신혜, 양금석,고요한 호수를 흔드는 어린 자매의 비명이 울려퍼진다. 빠진 것은 둘이었으나, 살아나온 것은 언니뿐. 한날 한시에 태어나 똑같은 얼굴로 살아온 쌍둥이자매의 운명은 이렇게 어긋난다.   십년 후, 어스름한 안개 깊은 곳에서 처녀의 흐느낌이 들려오던 밤에 한 선비가 죽임을 당한다. 우연이었을까… 바로 그날 십년 동안 잠들어있던 쌍둥이언니가 깨어난다. 아니, 십년을 기다려온 죽은 동생이 돌아온 것일지도!   똑같이 아름다웠던 자매의 얼굴이 두 모습으로 깨어난 날부터 마을의 비극이 시작되고, 조선시대의 한 평화로운 마을은 도저히 사람의 짓이라 상상할 수 없는 죽음의 행렬을 목도하게 된다. 흰 소복, 바닥까지 끌리는 젖은 머리카락, 창백한 눈빛을 한 그녀의 흔적은 살아있는 사람들을 공포로 몰아넣는데…,,,,,,,,,,,,,,,,,,,,,,,,,,,,,,,
2007,56325,제9중대,전쟁,표도르 본다르추크,표도르 본다르추크, 알렉세이 차도프,구 소련의 아프간 전쟁을 배경으로, 한 부대가 신병훈련소에서 전쟁터에 이르기까지 겪는 사건들을 그린 대작 전쟁영화. 2005년 러시아 최고의 흥행작으로, 러시아 최초로 특정 분쟁사건을 다룬 영화이기도 하다. 완고한 부대장과 세상 물정 모르는 신병, 갓 부임한 신부, 예민한 예술가 등 아무 공통점이 없는 인물들로 이루어진 제9중대는 갖가지 사건을 겪으며 전선으로 가고, 마침내 비극적인 마지막 전투를 치르게 된다. 목적을 위해 이용당하는 평범한 사람들의 이야기가 감동적으로 펼쳐진다.   1988년 아프가니스탄 침공 9년째, 끝이 좀처럼 보이지 않는 대결의 접점으로 젊은 청년들이 또 한 번 징집되었다. 화가를 꿈꾸는 예술가, 선생님이 되고자 하는 교생실습생, 결혼식을 치른 지 하루 만에 소집되어 온 새 신랑, 어린 딸을 둔 젊은 가장. 그들은 사랑하는 연인, 가족과 이별하고 비가 내리는 어느 겨울 밤 훈련소로 떠나는 기차에 몸을 싣는다. 지옥 같은 3개월의 훈련이 시작되고, 젊은 병사들은 하루하루 치열한 삶의 모든 순간들, 희망의 한 자락까지도 함께 나눈다.   D-Day, 아프가니스탄의 땅을 밟은 그날, 임무를 마치고 본국으로 후송되기 위해 수송기에 오르는 선임 병사들과 마주친 제9중대. 하지만 이들은 선임병들이 탄 수송기가 이륙한 지 5분도 안되어 폭격 당하는 것을 목격한다. 전쟁터와 죽음에 대한 두려움을 숨긴 채, 게릴라 무자헤딘과 맞서기 위해 자르단 3234 고지에 오른 그들은 최고의 전투를 맞이하게 되는데…,,,,,,,,,,,,,,,,,,,,,,
2007,69595,제니퍼 러브 휴잇의 컨페션,멜로/로맨스, 코미디,데이너 러스티그,제니퍼 러브 휴잇, 콜린 퍼거슨,성공을 위해서는 뭐든지 하는 워커홀릭이자 출세 지향주의자인 ‘카티야’는 광고회사에 근무하는 세일즈 우먼이다. 아름다운 외모와 일에 대한 열정, 그리고 광고를 따내기 위해서는 수단과 방법을 가리지 않는 전투적인 자세는 그녀를 직장에서 승승장구하게 만든다.   어느 날, 같은 빌딩에서 근무하는 ‘찰스’라는 남자와 우연히 엘리베이터를 함께 타게 되고 그들은 서로에게 한눈에 호감을 느낀다. 그 후로도 여러 번 엘리베이터에서 ‘찰스’와 마주치게 되고 마침내 그는 ‘카티야’에게 정식으로 데이트를 신청한다.   첫 데이트에서 서로 너무나 말이 잘 통했던 그들은 속옷차림으로 광장 한가운데 있는 분수에서 왈츠를 춘다. 하지만 ‘찰스’를 사랑하게 되면서 모든 것의 중심이었던 성공을 향한 의지에 조금씩 균열이 생기고 있음을 깨닫는다. 그녀에게 사랑은 그저 성공을 방해하는 귀찮은 감정의 낭비인 것일까?,,,,,,,,,,,,,,,,,,,,,,,,,,,,,,,,,,
2007,52555,조디악,범죄, 드라마, 스릴러,데이빗 핀처,제이크 질렌할, 마크 러팔로, 로버트 다우니 주니어,1969년 08월 01일, 샌프란시스코의 3대 신문사인 샌프란시스코 크로니클, 샌프란시스코 이그재미너, 발레호 타임즈 헤럴드 앞으로 한 통의 편지가 배달된다. “친애하는 편집장께, 살인자가 보내는 바요…”라는 문장으로 시작하는 이 편지에는 1968년 12월 20일 허만 호숫가에서 총에 맞아 살해된 연인, 1969년 7월 4일 블루 락 스프링스 골프코스에서 난사 당해 연인 중 남자만 살아남았던 사건이 자세하게 서술되어 있었다. 그가 편지에 적힌 단서들은 사건을 조사한 사람 혹은 범인만이 알 수 있는 사실이었다.   신문사의 업무는 일대 마비가 된다. 희대의 살인마 잭 더 리퍼 이후 언론에 편지를 보내 자신의 신원에 대한 단서를 던지며 경찰을 조롱하는 살인범은 처음이기 때문. 범인은 함께 동봉한 암호문을 신문에 공개하지 않으면 살인을 계속하겠다고 협박한다. 그리스어, 모스 부호, 날씨 기호, 알파벳, 해군 수신호, 점성술 기호 등 온갖 암호로 뒤범벅된 이 암호문을 풀기 위해 CIA와 FBI, NIA, 해군정보부, 국가안전보장국의 전문가들이 동원되지만 풀리지 않았다. 신문에 게재된 이후 어느 고등학교의 교사 부부가 암호를 풀어 범인에 대한 실마리를 제공한다. 이어 샌프란시스코 크로니클의 삽화가이자 암호광인 로버트 그레이스미스(제이크 질렌할)가 1932년에 만들어진 영화 &amp;lt가장 위험한 게임(The Most Dangerous Game)&amp;gt을 참조해 살인의 숨겨진 동기를 해독하게 된다. 경찰은 범인이 자신의 별명을 ‘조디악’이라고 밝히자 그를 ‘조디악 킬러’라고 명명하고 수사에 착수한다.   조디악 킬러의 편지와 협박이 이어지는 가운데, 1969년 9월 27일 나파 카운티에서 젊은 연인이 두건을 쓰고 총과 칼로 무장한 채 나타난 조디악 킬러에게 습격 당해 여자는 칼에 찔려 살해되고 남자는 죽음의 문턱에서 살아남는 사건이 발생한다. 한 달 후인 10월 11일, 프레시디오 하이츠 부근에서 택시운전사가 총에 맞아 사망하고 3일 후 조디악은 이 역시 자신의 짓이라며 택시운전사의 셔츠조각과 함께 다섯 번 째 편지를 보낸다. 그러나 그 편지는 이제껏 보낸 어떤 편지보다도 끔찍하고 섬뜩한 내용을 담고 있었다. 사건 당일 경찰이 자신을 검거할 수 있었을 뿐만 아니라, 다음에는 스쿨버스에서 내리는 학생들을 기다렸다가 죽이겠다는 것.   샌프란시스코는 말 그대로 공포에 싸인 도시로 변한다. 사건은 커져만 가고, 그레이스미스와 크로니클의 간판기자 폴 에이브리(로버트 다우니 주니어), 샌프란시스코 경찰청 강력계 경위 데이빗 토스키(마크 러팔로)와 윌리엄 암스트롱 경위(안소니 에드워즈)는 수사를 진행할수록 사건에 집착하게 된다. “…언제 살인을 할 것인지에 대해 더 이상 그 누구에게도 말하지 않겠다. 앞으로 저지를 살인은 단순강도나 우발적인 살해, 사고 등으로 보일 것이다. 너희들은 날 잡지 못한다. 난 너희보다 영리하니까…” -1969년 11월 9일, 조디악 킬러의 일곱 번째 편지-   하지만 조디악은 추적 망을 피해 더 많은 협박을 담은 편지를 통해 조롱을 퍼부으면서 언제나 한 발 앞서 있었다. 그리고 범인이 보낸 편지들은 그레이스미스, 에이브리, 토스키, 암스트롱, 네 명의 인생을 뒤집어 놓는다. 집요하게 조디악 킬러를 쫓던 그레이스미스의 결혼생활은 엉망이 되고 토스키는 자작극의 루머까지 뒤집어 쓰며 불명예를 당한다. 암스트롱은 좌절한 채 수사를 포기하고 에이브리는 약물중독으로 폐인이 되어 신문사를 떠났다. 조디악은 더 이상 공격 대상을 밝히지 않았다. 모방범죄가 전국에서 속출했고 유력 용의자는 거리를 활보했다. 시간이 흘러 사람들의 기억 속에 조디악의 존재가 잊혀져 가고 있다. 그러나 그레이스미스는 범인의 추격을 포기하지 않았다.,,,,,,,,,,
2007,62342,좋지 아니한가,코미디, 드라마,정윤철,천호진, 문희경, 김혜수,고개 숙인 아빠. 허리띠 졸라 맨 엄마, 전생에 왕이었다고 믿는 아들, 존재 자체가 미스터리한 딸, 그리고 묻어가는 백수 이모까지. 한 집에 모여 살지만 공통점이라곤 눈곱만치도 찾아 볼 수 없는 공통분모 제로의 심씨네 가족. 무관심하고도 무책임한 이 가족에게 어느 날 일생 최대의 위기가 찾아온다. 엄마는 노래방 총각에게 꽂히고, 아들은 우주에서 제일 나쁜 X를 사랑하고, 딸은 자신보다 더 미스터리한 선생을 만나게 된 것. 하지만 그 중 가장 충격적인 건 아빠의 일생 최대 음란사건! 그로 인해 심씨네 가족은 쪽팔려서 죽을뻔한 공동의 위기에 처하게 되는데. 과연 심씨네 가족은 이 위기에서 벗어날 수 있을까?,,,,,,,,,,,,,,,,,,,,,,,,,,,,,,
2007,66625,죽어도 해피 엔딩,코미디, 멜로/로맨스,강경훈,예지원, 임원희,청순가련, 순진무구한 캐릭터로 높은 인기를 누리고 있는 영화배우 예지원. 그녀는 갖은 역경을 이기고 최고의 여배우 자리에 오른 인물로, 한 때 좀 놀던 언니(?)의 모습을 꽁꽁 숨긴 채 너무나 우아하고 조신하게 살아가고 있다. 그러던 어느 크리스마스 이브, 예지원은 드디어 꿈에도 그리던 여우주연상 내정 소식을 듣게 되고 다음날 영화제 레드카펫을 밟는 상상을 하며 행복해 하는데…   그러나 그것도 잠시, 그녀의 집으로 예상치 못했던 손님들(?)이 들이닥친다. 바람둥이 데니스, 무식한 조폭 최사장, 속물지식인 유교수, 소심한 영화감독 박감독까지! 예고 없이 차례로 들이닥친 이들 네 남자는 약속이나 한 듯 지원에게 ‘급 프로포즈’를 해대고 지원은 그 상황이 황당하기만 하다.   갑작스런 방문에 그쳤으면 좋으련만…  엎친 데 덮친 격으로 이 남자들, 그녀 앞에서 차례로 죽어나간다!!! 실수로, 고의성 없이, 엉뚱하게, 얼떨결에 등등 어찌 되었던 그들을 죽이게 된 그녀. 수상 소식에 잠시나마 달콤했던 시간들의 대가는 너무도 쓰기만 한데…   밤은 깊어만 가고 살인을 무마하기 위해 예지원은 갖은 애를 쓴다. 하지만 매니저 두찬과 함께 시체처리에 애를 쓰는 와중에도 반갑지 않은 손님들의 방문은 계속해 이어지는데... 사고뭉치 동생이 몰고 온 수상축하객들, 조폭, 좀도둑, 그리고 이젠 형사까지!? 여배우 예지원, 과연 이 지옥 같은 상황을 어떻게 벗어날 것인가!? 이 밤은 아직 끝나지 않았다!,,,,,,,,,,,,,,,,,,,,,
2007,43369,준벅,드라마,필 모리슨,에이미 아담스, 엠베스 데이비츠,시카고에서 아웃사이더 아트를 취급하는 매력적인 딜러 메들린. 노스캐롤라이나에 살고 있는 아웃사이더 아트 화가 워크의 작품에 반한 그녀는 그의 작품을 자신의 화랑에 유치하기 위해 직접 찾아 나서기로 한다. 때마침, 그 근처에 살고 있는 남편 조지의 가족들과 첫 만남의 시간을 갖기로 하는데...   기대 이상으로 뛰어난 워크의 작품에 한눈에 반한 메들린, 까다로운 계약조건을 제시하던 워크 역시 그녀에게 긍정적인 반응을 보이고...이제 남은 것은 조지 가족과의 행복한 첫 만남. 하지만 왠지 첫 대면부터 불안하고 낯설기만 하다. 말이 없고 무뚝뚝한 아버지, 퉁명스러운 어머니, 까칠한 남동생 조니, 어린아이처럼 천진난만한 조니의 임신한 아내 애슐리. 그들 중 애슐리만이 메들린을 반기며 살갑게 대한다.   한편 워크와의 계약을 위해 그곳에서 며칠간 머물러야 하는 메들린 부부와 이들 가족과의 불안하고 낯선 동거가 이어지는데......,,,,,,,,,,,,,,,,,,,,,,,,,,,,,,,,
2007,20345,줄 위의 종달새,코미디, 드라마, 멜로/로맨스,이리 멘젤,루돌프 흐루신스키, 블라디미르 브로드스키,요리사 파벨은 종교적 이유로 토요일 노동을 거부해 해고된 뒤, 폐철처리장에서 일하게 된다. 폐철처리장 한편에는 체코에서 탈출하려다 붙잡힌 여자 죄수들이 일을 하고 있다. 경비원의 감시하에 남, 여 그룹은 서로 엄격하게 분리되어 일을 하고 있다. 그러나 감시와 통제에도 불구하고 파벨은 아름다운 아가씨 이트카와 사랑에 빠지고, 두 사람은 감시를 피해 만남을 갖기 시작한다. 그리고 몰래 결혼까지 약속하게 되는데...,,,,,,,,,,,,,,,,,,,,,,,,,,,,,,,,
2007,65463,즐거운 인생,코미디,이준익,정진영, 김윤석, 김상호,20년 전. 3년 연속 대학가요제 탈락을 끝으로 해체된 락밴드 활화산. 지금은? 명퇴 후 눈치 밥 먹는데 익숙해진 일등급 백수 기영(정진영 분), 부담스럽게 공부 잘하는 자식 만나서 낮에는 택배, 밤에는 대리운전으로 등골 빠지는 바쁜 중년 성욱(김윤석 분), 타국 땅에 마누라와 자식들을 유학 보낸 자신이 자랑스러운 기러기아빠 혁수(김상호 분)는 ‘활화산’의 리더였던 상우의 장례식장에서 돌아온 뒤 불현듯 결심한다. 꿀꿀한 인생 달래줄 락밴드 ‘활화산’을 재 결성 하기로!   다시 활화산이 된 아저씨들. 리드기타 기영, 베이스 성욱, 드럼 혁수는 녹슬어버린 연주와 삑사리 나는 노래 실력을 견디다 못해, 죽은 상우의 아들 현준(장근석 분)에게 보컬을 부탁한다. 싸가지만 빼고 외모, 실력까지 겸비한 완소남 보컬 현준의 투입으로 무대 위에서 제대로 놀 수 있게 된 ‘활화산’. 그러나 즐거움도 잠시, 그들에게는 또다시 최대 고비가 다가오는데……,,,,,,,,,,,,,,,,,,,,,,,,,,,,
2007,65429,지금 사랑하는 사람과 살고 있습니까?,멜로/로맨스, 드라마,정윤수,엄정화, 박용우, 이동건,활기차고 귀엽지만 일할 땐 누구보다 열정적인 패션 컨설턴트 유나(엄정화)와 유머러스하고 다정다감한 호텔리어 민재(박용우)는 알콩달콩 친구 같은 커플! 그러나 연애 4년, 결혼 3년에 뜨겁기보단 편안한 생활형 부부. 여자에게 무심하고 차가운 워커홀릭 영준(이동건)과 지적인 외모와 차분한 성격의 조명 디자이너 소여(한채영)는 젊고 잘난, 남 부러울 것 없는 커플! 그러나 그저 남편과 아내로서만 살아가는 설레임은 없는 부부다.   패션 컨설팅를 하기 위해 찾아온 유나와 도발적인 실랑이를 벌이게 된 영준! 낯선 홍콩에서 운명처럼 민재와 마주치는 소여! 소여는 남편 영준이나 그녀조차 몰랐던 자신의 내면을 보아주는 남자 민재에 흔들리고, 영준은 늘 웃지만 삶이 고달픈 여자, 유나가 눈에 밟힌다. 그 밤, 뜨겁게 엇갈린 두 커플- 네 남녀는 위험하면서도 은밀한 하룻밤을 보내게 되는데…   그들은 가해자이면서, 동시에 피해자의 상황에 놓였다. 아직 그들은 서로 엇갈렸다는 걸 꿈에도 모른다. 그들의 크로스 연애... 어떤 일들이 벌어질까? 그들은 어떤 선택을 하게 될까?,,,,,,,,,,,,,,,,,,,,,,,,,,,,,
2007,45244,직장 연애사,드라마,김성덕,옥주현, 신이, 김시운,직장 내에 있을 법한 흥미로운 연애 이야기를 옴니버스 형식으로 그린 8부작 TV영화.,,,,,,,,,,,,,,,,,,,,,,,,,,,,,,,,,,,,
