year,code,title,genre,directors,actors,story,,,,,,,,,,,,,,,,,,,,,,,,,,,,,,,,,,,,,,,,,,,,,,,,,,,,,,,,,,,,,,,,,,,,,,,,,,,,,,,,,,,,,,,,,,,,,,,,,,,,,,,,
2009,52072,10억,모험, 스릴러,조민호,박해일, 박희순, 신민아,수십만의 신청자 중, 인터넷 방송국 주최의 10억 상금 서바이벌 게임쇼에 8명의 참가자가 초대된다. 바다, 사막, 밀림, 강으로 이어지는 육지 속의 무인도, 호주 퍼스(Perth). 마지막 한 명이 살아 남을 때까지 멈출 수 없는 서바이벌 게임쇼가 시작됐다.  그러나 게임쇼 7일 후... 8명의 참가자와 2명의 방송진행자 中 9명은 몰살되고 한 명의 생존자는 기억상실 상태로 호주 경찰에 의해 발견된다. 사막과 밀림을 배경으로 마지막 한 명이 살아 남을 때까지 멈출 수 없었던 미스터리 게임쇼. 그 곳에선 무엇이 일어난 것일까? 왜 그들은 목숨을 건 죽음의 게임쇼를 계속할 수 밖에 없었나?,,,,,,,,,,,,,,,,,,,,,,,,,,,,,,,,,,,,,,,,,,,,,,,,,,,,,,,,,,,,,,,,,,,,,,,,,,,,,,,,,,,,,,,,,,,,,,,,
2009,52388,12 라운드,액션,레니 할린,존 시나, 에이단 길렌, 애슐리 스콧,어느 날, 대니 피셔(존 시나) 형사 앞으로 걸려온 한 통의 전화! 발신자는 바로 대니의 손에 체포 당했던 악명 높은 테러리스트 마일스(에이단 길렌)! 일년 전, 대니와의 숨막히는 추격전 끝에 예기치 못한 사고로 애인을 잃은 그는 사상 최대 스케일의 복수극을 꾸민다.  복수를 위해 교도소 탈출까지 감행한 지능범 마일스는 대니의 애인 몰리(애슐리 스콧)를 납치하고 그녀의 목숨을 담보로 대니에게 거부할 수 없는 위험천만한 12 라운드 게임을 제안한다. 각 라운드마다 더욱 더 강력해지는 미션과 예측할 수 없는 반전, 통제가 불가능한 상황에서도 12 라운드 미션을 통과하기 위한 ‘대니’의 일생일대의 사투는 계속된다.,,,,,,,,,,,,,,,,,,,,,,,,,,,,,,,,,,,,,,,,,,,,,,,,,,,,,,,,,,,,,,,,,,,,,,,,,,,,,,,,,,,,,,,,,,,,,,,,,,,
2009,52307,13구역: 얼티메이텀,액션,파트릭 알레산드렝,시릴 라파엘리, 데이빗 벨,정부의 철저한 격리로 범죄자들과 타락한 경찰의 공간이 되어버린 13구역. 새로운 정부가 들어섰지만 여전히 법도, 정의도 없는 그 곳을 지배하는 5개의 조직은 각자 자신의 구역을 삶의 터전으로 위험하고 아슬아슬한 관계를 유지한다. 어느 날, 13구역에서 경찰이 무참히 살해당하는 사건이 발생하면서, 분노한 국민들은 13구역을 완전히 없애버리자는 여론으로 들끓고 13구역은 폭동에 휩싸인다. 하지만 유일하게 정의로운 경찰 데미안과 13구역에서 희망을 보며 살아가는 레이토는 본능적으로 그것이 정부의 은밀한 계획임을 눈치채고, 곧바로 그들의 목숨을 노리는 알 수 없는 정부 세력에 의해 쫓기게 된다.  정부도, 경찰도, 그 누구도 믿을 수 없는 상황. 그들은 13구역의 5개 조직과 의기투합, 정부의 음모에 맞서 멈추지 않는 액션 본능을 폭발하는데…,,,,,,,,,,,,,,,,,,,,,,,,,,,,,,,,,,,,,,,,,,,,,,,,,,,,,,,,,,,,,,,,,,,,,,,,,,,,,,,,,,,,,,,,,,,,,,,,
2009,49857,13일의 금요일,공포,마커스 니스펠,제러드 파달렉키, 다니엘 파나베이커, 아만다 리게티,달빛이 아름답게 빛나는 크리스탈 호수 캠프장에는 한가지 전설이 있다. 20여 년 전 캠프 요원의 부주의로 한 아이가 익사한 후 그의 엄마가 아들의 복수를 위해 살인을 저지른 것. 그러나 유일한 생존자가 그녀의 목을 베었고 이것을 지켜보는 한 아이가 있었다. 익사한 줄 알았던 아이 제이슨… 그날 이후 크리스탈 캠프장은 폐쇄되고 인적조차 드문 폐허가 되었다. 그러나 밤만 되면 호수를 배회하는 그림자가 목격되고 있다는 것이다.  그리고 20년이 지난 어느 날, 크리스탈 호수로 친구들과 신나게 주말을 즐기러 온 트렌트와 친구들. 근사한 차를 타고 별장에 도착한 들뜬 일행에게 뜻하지 않는 손님이 찾아온다. 6주전 실종된 여동생을 찾는 클레이를 만난 것. 주말 파티를 즐기려는 일행에게 왠지 낯선 방문자가 꺼림직하기만 하다. 그러나 클레이의 동생 역시 크리스탈 호수에서 캠핑 중 실종되었으며 전설로만 여기던 제이슨이 점점 가깝게 다가오는 것을 알게 되는데…,,,,,,,,,,,,,,,,,,,,,,,,,,,,,,,,,,,,,,,,,,,,,,,,,,,,,,,,,,,,,,,,,,,,,,,,,,,,,,,,,,,,,,,,,,,,,,,,,,,,,
2009,53723,19,드라마,장용우,T.O.P, 승리, 허이재,한 소녀의 죽음을 둘러싸고 용의자로 몰린 세 명의 열 아홉 청춘들의 이야기. 그녀가 한강에서 익사체로 발견되는 살인 사건이 발생하고, 그녀를 둘러싼 동갑내기 3명이 용의자로 지목된다. 집에서는 구박덩어리지만 PC방에서 아르바이트를 하며 꿈을 키워나가는 쾌활한 성격의 19살 대학생 `정훈`. 영애가 죽던 마지막 날 함께 있었다는 이유로 용의자로 지목되고, 남부럽지 않은 집안에서 귀하게 자라났지만 자신에게 거는 기대와 믿음이 부담스럽기만 한 소심한 재수생 `민서`는 PC방에서 몰래 `영애`의 모습을 촬영한 것이 알려지며 경찰의 심문을 받는다. 마지막으로 아픈 엄마를 보살피기 위해 미용실에서 보조로 일하는 영애의 고등학교 동창 `은형`까지 살인사건의 유력한 용의자로 지목된다.  영문을 알 수 없는 한 소녀의 죽음과 자신들이 용의자로 몰린 상황에 당황한 그들은 경찰의 심문 조사 중 기회를 틈타 도주에 성공한다. 얼떨결에 함께 도망자의 신세가 된 그들은 경찰의 추적을 피하며, 억울한 누명을 벗기 위해 영애의 죽음을 둘러싼 진실을 찾으려고 애쓴다. 19살이라는 나이만 알 뿐, 이름도 모르는 이들과 함께 생애 첫 낯선 여행을 시작한 세 사람. 처음엔 서로를 의심하지만 시간이 갈수록 각자 다른 고민과 꿈을 갖고 있는 서로에게 마음을 열기 시작하는데…,,,,,,,,,,,,,,,,,,,,,,,,,,,,,,,,,,,,,,,,,,,,,,,,,,,,,,,,,,,,,,,,,,,,,,,,,,,,,,,,,,,,,,,,,,,,,,,,,,
2009,52799,2009 외인구단,,송창수,윤태영, 김민정, 박성민,원작만화 '공포의 외인구단'을 새롭게 각색한 드라마,,,,,,,,,,,,,,,,,,,,,,,,,,,,,,,,,,,,,,,,,,,,,,,,,,,,,,,,,,,,,,,,,,,,,,,,,,,,,,,,,,,,,,,,,,,,,,,,,,,,,,
2009,49727,2012,액션, 드라마, 스릴러, SF, 모험,롤랜드 에머리히,존 쿠삭, 아만다 피트, 치웨텔 에지오포,고대 마야 문명에서부터 끊임없이 회자되어 온 인류 멸망. 2012년, 저명한 과학자들은 오랜 연구 끝에 실제로 멸망의 시기가 다가오고 있음을 감지하고 각국 정부에 이 사실을 알린다. 그리고 곧 고대인들의 예언대로 전세계 곳곳에서는 지진, 화산 폭발, 거대한 해일 등 각종 자연 재해들이 발생해 그 누구도 막을 수 없는 최후의 순간이 도래한다. 한편, 이혼 후 가족과 떨어져 살던 소설가 잭슨 커티스(존 쿠삭)는 인류 멸망에 대비해 진행되어 왔던 정부의 비밀 계획을 알아차리고 가족과 함께 살아남기 위한 필사의 사투를 벌이는데…,,,,,,,,,,,,,,,,,,,,,,,,,,,,,,,,,,,,,,,,,,,,,,,,,,,,,,,,,,,,,,,,,,,,,,,,,,,,,,,,,,,,,,,,,,,,,,
2009,50097,20세기 소년 - 제2장: 마지막 희망,SF, 모험, 드라마,츠츠미 유키히코,카라사와 토시아키, 토요카와 에츠시, 타이라 아이리,‘피의 그믐날’로부터 15년 후인 서기 2015년. 켄지 일당은 인류를 멸망시키려 했던 테러리스트로 여겨지고 있고, 이를 저지한 ‘친구’는 전인류에게 추앙받는다. 어느덧 당당한 고교생으로 성장한 켄지의 조카 칸나는, ‘친구’에 의해 철저히 통제 된 현실을 참을 수가 없다. 결국 칸나는 ‘친구’의 존재에 의문을 품은 반 친구 고이즈미 쿄코와 함께 ‘친구’ 세뇌시설인 ‘친구랜드’로 보내진다. ‘친구랜드’는 반체제 세력을 세뇌하기 위한 국가시설로, 켄지 무리의 어린시절을 완벽하게 재현한 시뮬레이션 공간이었는데... 한편, 비밀기지의 멤버들은 ‘피의 그믐날’ 이후 뿔뿔이 흩어져, ‘친구’에 의해 통제된 세계에 저항하는 외로운 싸움을 계속하고 있었다. 우미호타루 형무소에 감금되었던 오쵸는 탈옥을 감행하고, 요시츠네는 조직을 통솔하여 잠복 중이며, 마루오는 가수 매니저로 생활하며 정체를 숨기고 있다. 몽 또한 독자적인 조사를 통해 ‘신 예언의 서’의 존재를 발견한다. 야마네, 그리고 사다키요, ‘친구’의 정체를 아는 동창들의 어린 시절 기억이 차츰차츰 되살아나고... 미스테리는 점점 더해간다. 도대체 ‘친구’는 누구란 말인가! ‘신 예언의 서’에 기록된 인류의 ‘구원자’는 과연 누구인가!,,,,,,,,,,,,,,,,,,,,,,,,,,,,,,,,,,,,,,,,,,,,,,,,,,,,,,,,,,,,,,,,,,,,,,,,,,,,,,,,,,,,,,,,,,,
2009,49047,24 시티,드라마,지아 장 커,지안빈 첸, 조안 첸, 여려평,영화 제목 ‘24 시티’는 중국 쓰촨성 청두(成都)에 있는 아파트의 이름이다. 원래 이 건물은 1958년 중국의 제1차 5개년 계획경제개발 시대에 국가 주도로 세워진 공장 ‘팩토리 420’이었으나, 냉전이 끝나자 군수산업의 위축으로 공장 운영이 불가능해졌다. 결국 2005년 중국 정부는 ‘팩토리 420’을 폐쇄하고, 이를 재개발하여 ‘24 시티’라는 거대 아파트로 만들었다. 지아 장커는 이 건물의 역사를 찍는다는 것은 중국의 근대를 다루는 것이며, 동시에 중국 사회주의 인민들의 역사를 기록하는 것이라고 생각했다. 그래서 이 영화는 실제로 이 공장에서 일했던 5명의 노동자들의 인터뷰를 담고 있으며, 그와 동시에 삼대에 걸친 세 여자의 이야기가 진행된다.,,,,,,,,,,,,,,,,,,,,,,,,,,,,,,,,,,,,,,,,,,,,,,,,,,,,,,,,,,,,,,,,,,,,,,,,,,,,,,,,,,,,,,,,,,,,,,,,,,
2009,50829,3xFTM,다큐멘터리,김일란,고종우, 김명진, 한무지,‘여자’라는 몸보다 ‘남자’라는 영혼의 모습을 따라나선 세 성전환남성(FTM) 종우, 무지, 명진. 다큐멘터리 &amp;lt3xFTM&amp;gt은 “엄마 뱃속부터 남자였고, 남자로 보여야 했고, 남자가 되어야 했던” 세 사람의 삶 속으로 깊숙이 들어가 유쾌한 웃음과 따뜻한 감동을 퍼올린다.  태어날 때부터 남자였다는 ‘종우’는 더운 여름이 오기 전에 얼음조끼를 사러 시장에 간다. 뙤약볕 아래 오토바이일을 해야 하는 그에게 가슴 압박붕대로 인한 더위를 식혀줄 얼음조끼는 여름의 필수품이다. 남자들끼리의 우정을 소중히 여기는 터프가이 ‘무지’는 오랫동안 소망해왔던 가슴 절제수술을 마치고 벅찬 기쁨을 감추기 힘들다. 그는 평생 처음으로 웃통을 벗어 던지고 남성으로서의 가슴을 당당히 공개하며 자유를 만끽한다.  보다 나다운 모습으로 살기 위해 성별변경을 감행한 ‘명진’. 주민등록번호 뒷자리가 ‘2’에서 ‘1’로 바뀌어 ‘男子’로 인정받게 되었건만, 대한민국 남성으로서의 삶은 그가 상상했던 것과는 사뭇 다르다. 여중 여고라는 딱지 때문에 다니던 회사에서 짤리고 군대 신검에서 곤란한 상황에 맞닥뜨리기도 하는 등 만만치 않은 일들도 많지만, 그렇다고 힘들어 투덜댈 그가 아니다.  사회의 편견 속에 고단함도 있지만 ‘진정한 나 자신’으로 살아갈 수 있기에 행복하다는 세 청년은 이제 다큐멘터리를 통해 친구와 가족, 보다 많은 대중들에게 설레임 가득한 손을 내밀기로 한다.,,,,,,,,,,,,,,,,,,,,,,,,,,,,,,,,,,,,,,,,,,,,,,,,,,,,,,,,,,,,,,,,,,,,,,,,,,,,,,,,,,,,,,,,,,,,,,,
2009,52745,4교시 추리영역,공포, 스릴러,이상용,유승호, 강소라,AM  11: 40 사건 발생!! 4교시 체육시간, 빈 교실에서 벌어진 살인사건, 범인을 잡지 않으면 내가 살인범이 된다! 전국 1등을 놓치지 않는 명석한 두뇌와 준수한 외모를 두루 갖춘 이른바 엄친아, 정훈! 어느 4교시 체육시간, 빈 교실을 지키던 중 평소 앙숙처럼 지내던 태규가 무참히 죽어있는 것을 발견한다! 사건의 정황, 그 전의 목격자, 동기 등 모든 것을 살펴봤을 때 살인사건의 유일한 용의자는 정훈 바로 그 자신일 수밖에 없는 절체절명의 위기에 직면하는데!! AM  11: 50 사건 진행!! “결정해! 억울한 누명을 쓰고 살인자가 되든지, 나랑 힘을 합쳐 4교시 안에 범인을 찾든지” 반에서 왕따로 낙인 찍힌 채 친구도 존재감도 없이 ‘커튼마녀’로만 기억되는 추리광, 다정! 그 4교시 체육시간, 교실에 들어왔다가 처참한 태규의 시체 앞에서 피 묻은 옷을 입은 채 당황하는 정훈을 발견한다! 사건의 정황, 그 전의 목격자, 동기 등 모든 것을 살펴봤을 때 살인사건의 유일한 용의자는 정훈뿐! 진범을 찾거나 정훈이 진범이라는 확증을 찾기 위해 추리를 시작하는 다정! 종이 울리고 다른 사람이 시체를 발견할 때까지 남은 시간은 40분! 범인은 아직 학교 안에 있다!! PM  12: 05 사건 분석!! 엉켜있던 실마리가 풀리자, 하나 둘 드러나는 진상! 빈 교실에서 살인을 저지르고 사라진 범인은… 바로 당신이야! 사립탐정을 꿈꾸는 소녀답게 그 동안 다져온 추리능력을 십분 발휘하는 다정, 중요한 순간마다 결정적인 단서를 찾아내며 살인사건을 분석해내는 정훈, 거기다 의리 빼면 시체인 단짝친구 도일의 합류로 진범을 찾기 위한 사건추리는 탄력을 받기 시작 한다!! 그리고 마지막 ‘40분’이 끝나갈 무렵, 드디어 풀릴 것 같지 않던 사건의 처참한 전모가 드러나게 되는데…,,,,,,,,,,,,,,,,,,,,,,,,,,,,,,,,,,,,,,,,,,,,,,,,,,,,,,,,,,,,,,,,,,,,,,,,,,,,,,,,,,,,,,,
2009,51082,7급 공무원,액션, 코미디,신태라,김하늘, 강지환,여행사 직원으로 위장한 경력 6년차 국가정보원 요원 ‘수지’. 과거는 밝혀도 정체만은 밝힐 수 없는 직업 특성상 남친 ‘재준’에게 조차 거짓말을 밥 먹듯 하다 일방적인 이별을 통보 받는다. 말도 없이 떠나버린 재준에 대한 서운함과 괘씸함에 몸부림 치던 그녀. 3년 뒤, 청소부로 위장한 채 산업 스파이를 쫓던 중 재준과 우연히 다시 마주치게 된다! 국제 회계사가 되어 나타난 재준. 그를 보자 수지의 마음은 다시 흔들리는데…  오랜 연인 수지의 반복되는 수상한 거짓말에 지친 ‘재준’. 한국을 떠난다는 전화 한 통으로 이별을 통보하고 러시아로 유학을 떠난다. 3년 뒤 국제회계사로 신분을 위장하고 국가정보원 해외파트 소속 요원이 되어 돌아온 재준. 깨지기 일쑤, 실수 연발의 신참이지만 의욕만은 넘치는 재준은 현장투입 첫 임무로 러시아 조직을 미행하던 중 우연히 수지와 마주친다! 호텔 청소부가 되어 있는 그녀의 모습이 쇼킹하지만 애틋한 마음만은 여전한데… 속이는 게 임무, 감추는 게 직업인 그들은 '7급 공무원'.,,,,,,,,,,,,,,,,,,,,,,,,,,,,,,,,,,,,,,,,,,,,,,,,,,,,,,,,,,,,,,,,,,,,,,,,,,,,,,,,,,,,,,,,,,,,,,,,,,,
2009,52526,9: 나인,애니메이션, SF, 판타지, 모험,쉐인 액커,일라이저 우드, 존 C. 레일리, 제니퍼 코넬리,과학문명의 폭주, 인간의 욕망이 극한으로 치닫자, 인류는 종말을 맞이했다. 남은 것은 황량한 폐허로 변해버린 지구. 하지만 인류의 마지막을 예견한 한 과학자에 의해 9개의 생명체가 탄생되었다. 홀로 남은 줄 알았던 9은 괴물 기계군단을 피해 살아남은 생존자 무리를 발견하게 된다. 오만한 리더 1, 4차원 발명가 2, 쌍둥이 학자 3과 4, 열혈 기술자 5, 별난 예술가 6, 풍운의 여전사 7, 행동대장 8.  타고난 운명을 따라 9은 이들과 함께 원정대를 이루어 전쟁을 치르려 한다. 하지만 성격도 가치관도 전부 다른 대원들은 좀처럼 합심하기 어렵고, 무엇보다 이들이 대항해야 할 적은 너무나도 강력하다. 도무지 이길 승산이 보이지 않는 전쟁, 그리고 원정대를 엄습해오는 두려움. 이들에게 선택은 둘 중 하나다! 맞서 싸우거나, 아니면 영영 숨어살거나. 괴물 기계군단과의 전쟁을 준비하는 인류의 마지막 희망 9. 이제 미래는 9의 손에 달려있다.,,,,,,,,,,,,,,,,,,,,,,,,,,,,,,,,,,,,,,,,,,,,,,,,,,,,,,,,,,,,,,,,,,,,,,,,,,,,,,,,,,,,,,,,
2009,69274,C+ 탐정,드라마, 스릴러,옥사이드 팽 천,곽부성,특출하게 잘하는 것 없는 탐정 ‘아탐’의 파리만 날리던 사무실에 오랜만에 일거리가 들어온다. ‘혜심’ 이라는 여인이 자신을 죽이려는 것을 막아달라는 남자의 의뢰. 그러나 사건을 파헤칠수록 의문의 여인 주변인물들은 하나 둘씩 죽어가고, 경찰은 모두 자살로 종결한다.  하지만 이 죽음들이 연쇄살인이라 생각한 ‘아탐’은 추적을 계속하고, 죽은 사람들이 모두 담겨있는 한 장의 사진을 발견한다. 알 수 없는 누군가로부터 살해위협까지 받으면서 사진 속 인물 중 마지막 남은 생존자를 쫓던 ‘아탐’은 믿을 수 없는 비밀과 맞닥뜨리게 되는데...,,,,,,,,,,,,,,,,,,,,,,,,,,,,,,,,,,,,,,,,,,,,,,,,,,,,,,,,,,,,,,,,,,,,,,,,,,,,,,,,,,,,,,,,,,,,,,,,,,,,,
2009,136806,SBS 특집 다큐멘터리,,서유정, 최상재,,삶의 질과 지적 욕구를 충족시켜줄 수 있는 특집 다큐멘터리,,,,,,,,,,,,,,,,,,,,,,,,,,,,,,,,,,,,,,,,,,,,,,,,,,,,,,,,,,,,,,,,,,,,,,,,,,,,,,,,,,,,,,,,,,,,,,,,,,,,,,,
2009,70123,S러버,멜로/로맨스, 드라마,데이빗 맥킨지,애쉬튼 커쳐, 앤 헤이시, 마가리타 레비에바,호화로운 펜트하우스와 화려한 파티, 최상류층의 고급스러운 일상이 펼쳐지는 L.A. 베버리힐스. 귀여운 외모와 뛰어난 매너, 남다른 스타일을 갖춘 ‘니키’(애쉬튼 커쳐)는 수많은 여자들이 순식간에 빠져드는 타고난 매력의 소유자. 섹시한 미소로 파티를 누비며 새로운 파트너를 물색하던 ‘니키’는 지성과 미모, 재력을 겸비한 변호사 ‘사만다’(앤 헤이시)를 만나고, 자신에게 흠뻑 빠진 그녀의 펜트하우스에서 럭셔리하고 안락한 생활을 시작한다. 꽃과 손수 준비한 디너, 황홀한 테크닉을 동원해 ‘사만다’를 감동시키고, 한편으론 다른 여인들과 자유로운 연애를 즐기던 어느 날. 매력적인 웨이트리스 ‘헤더’(마가리타 레비에바)가 니키에게 포착된다. 자신의 달콤한 유혹에도 넘어오지 않는 그녀에게 니키는 서서히 끌리고, 작업은 하되 사랑은 하지 않겠다는 그 만의 법칙이 흔들리기 시작하는데…,,,,,,,,,,,,,,,,,,,,,,,,,,,,,,,,,,,,,,,,,,,,,,,,,,,,,,,,,,,,,,,,,,,,,,,,,,,,,,,,,,,,,,,,,,,,,,
2009,83239,To LOVE루 -트러블-,애니메이션, 멜로/로맨스,카토 타카오,와타나베 아케노, 토마츠 하루카,평범하고 순진한 고등학생 리토. 그런 그에게 어느날 미모의 소녀 라라가 갑자기 나타나면서 평온했던 그의 일상은 순식간에 180도 바뀌게 된다. 우주 데빌루크 별의 왕녀인 라라는 세상물정을 전혀 모른채 다른 시선을 개의치 않고 리토를 끌어안거나 샤워도중 뛰쳐나가는 등 갖가지 사건을 벌이게 되는데... 한편 리토에게는 중학교 시절부터 좋아해온 동급생 소녀 하루나가 있어 자신의 마음을 전하지 못한채 늘 속앓이를 해오고 있었다. 점점 라라에게 마음이 기울면서 하루나와의 미묘한 삼각관계가 심화되는 리토. 이들의 발랄한 러브코미디가 화려한 영상속에 펼쳐지는 투러브 트러블!,,,,,,,,,,,,,,,,,,,,,,,,,,,,,,,,,,,,,,,,,,,,,,,,,,,,,,,,,,,,,,,,,,,,,,,,,,,,,,,,,,,,,,,,,,,,,,,,,,,,,,
2009,51249,가필드 - 마법의 샘물,애니메이션,마크 A.Z. 디페, 한언덕,프랭크 웰커, 그렉 버거, 그렉 이글스,‘큰웃음 대회’에서 매년 우승을 차지하며 잔뜩 거만해진 고양이 '가필드'. 엇! 그런데 이게 왠 일?! 더 이상 가필드의 유머에 사람들이 웃지 않게 된 것!! 여기에 엎친데 덮친 격으로 여친 ‘알린’까지 제멋대로인 가필드 대신 다른 대회 파트너를 찾는다. 완전 충격 먹은 우리의 가필드는 절친 '오디'와 함께 한 모금이면 '큰 웃음' 빵 터지게 해준다는 '마법의 샘물'을 찾아 신비의 숲으로 모험을 떠나게 된다. 과연 우리의 못말리는 뚱보 고양이 가필드는 잃어버린 웃음을 되찾고 여친 ‘알린’의 사랑과 ‘큰웃음 대회’ 1위의 영광을 차지할 수 있을까?,,,,,,,,,,,,,,,,,,,,,,,,,,,,,,,,,,,,,,,,,,,,,,,,,,,,,,,,,,,,,,,,,,,,,,,,,,,,,,,,,,,,,,,,,,,,,,,,,,,,,
2009,44916,감자 심포니,코미디, 액션, 드라마,전용택,전용택, 유오성, 이규회,형과 부모를 사고로 잃은 후 몇 년간 자취를 감췄던 전설적인 주먹 백이가 어린 딸과 함께 고향에 돌아온다. 지역 마피아의 보스이자 고등학교 시절 백이의 주먹 라이벌이었던 진한(유오성 분)은 자신을 퇴학시켰던 학교에 장학금을 기증함으로써 전국적인 유명인사가 되어있다. 학생시절 백이와 함께 주먹 좀 쓰며 돌아다니던 친구들은 사라졌던 친구의 귀향을 온 맘으로 반기지만 이들의 만남이 깊어질수록 자신들의 청춘을 가위눌렀던 공통의 기억들이 신음처럼 터져나온다.  약속을 어기고 떼거지로 몰려나와 백이와 친구들을 무릎 꿇렸던 진한 같은 인간이 대접받고 잘 나가는 세상, 지나간 과거를 돌아보며 살기를 거부하는 백이, 더 이상 리더로서의 책임감을 보이지 않는 백이에게 실망하는 친구들, 백이가 사랑하는 치명적인 매력의 여자, 이 여자가 끌어안는 세상의 법칙. 그리고 전국구 조폭과의 갈등에 휘말리는 진한.  아늑한 자연의 품에 안긴 강원도의 카지노 마을엔 치명적 정념의 드라마가 기지개를 켠다.,,,,,,,,,,,,,,,,,,,,,,,,,,,,,,,,,,,,,,,,,,,,,,,,,,,,,,,,,,,,,,,,,,,,,,,,,,,,,,,,,,,,,,,,,,,,,,,,
2009,84269,강심장,,박상혁, 장석진, 이환진,신동엽, 이동욱, 강호동,,,,,,,,,,,,,,,,,,,,,,,,,,,,,,,,,,,,,,,,,,,,,,,,,,,,,,,,,,,,,,,,,,,,,,,,,,,,,,,,,,,,,,,,,,,,,,,,,,,,,
2009,54359,거기엔 래퍼가 없다,드라마,이리에 유우,카미스즈키 하쿠슈, 코마키네 류스케, 미즈사와 신고,올해 일본 자주영화의 놀라운 성과. 일본 사이타마의 한적한 마을에 래퍼를 꿈꾸는 한심한 친구들이 있다. 스트립 바의 청소부로 일하는 톰, 집안의 브로콜리 농사일을 돕는 마이티, 백수 잇쿠. 그들은 무엇을 꿈꾸고 어떻게 좌절하는가? 현재를 살아가는 젊은 청춘들이라면 누구나 공감할 이름 없는 청춘들의 성장기, 또는 그들의 눈물겨운 래퍼 도전기.  (부천국제판타스틱영화제) 2009 유바리국제판타스틱영화제 그랑프리,,,,,,,,,,,,,,,,,,,,,,,,,,,,,,,,,,,,,,,,,,,,,,,,,,,,,,,,,,,,,,,,,,,,,,,,,,,,,,,,,,,,,,,,,,,,,,,,,,,
2009,49483,거북이 달린다,범죄, 코미디, 액션, 드라마,이연우,김윤석, 정경호, 견미리,하는 일이라곤 지역 발전을 위한 소싸움 대회 준비뿐인 시골마을 예산의 형사 조필성. 다섯 살 연상의 마누라 앞에서는 기 한번 못 펴는 한심한 남편이지만, 딸래미의 학교 일일교사 1순위로 꼽힐 정도로 마을에서는 나름 알아주는 형사다. 소싸움 대회를 준비하던 필성은 강력한 우승후보에 대한 정보를 입수하고, 훔쳐 나온 마누라의 쌈짓돈으로 결국 큰 돈을 따게 된다. 난생처음 마누라 앞에서 큰소리 칠 생각에 목이 메이는 조필성. 그러나 기쁨도 잠시! 갑자기 나타난 어린 놈에게 순식간에 돈을 빼앗기고 마는데, 그 놈은 바로 몇 년 전 전국을 떠들썩하게 만들었다가 행방이 묘연해진 탈주범 송기태.  희대의 탈주범을 눈 앞에서 놓친 필성은 모두에게 그 사실을 알리지만 이런 시골마을에 송기태가 나타났다는 그의 말을 아무도 믿지 않는다. 잃어버린 돈도 찾고, 딸래미 앞에서 영웅이 되고 싶은 마음에 직접 송기태의 은신처를 찾아 덮치지만 이번에는 송기태에게 새끼손가락까지 잘리는 수모를 당한다. 게다가 이 날의 사건이 언론에 공개되자, 예산서 형사들은 탈주범을 놓친 무능한 시골형사로 전락하고 필성은 형사직에서 물러나게 된다.  돈, 명예, 그리고 마지막 자존심까지 빼앗긴 필성. 그 놈을 반드시 자신의 손으로 잡아 형사로서, 그리고 한 남자로서의 명예회복을 위해 본격적으로 나서는데…,,,,,,,,,,,,,,,,,,,,,,,,,,,,,,,,,,,,,,,,,,,,,,,,,,,,,,,,,,,,,,,,,,,,,,,,,,,,,,,,,,,,,,,,,,,
