year,code,title,genre,directors,actors,story,,,,,,,,,,,,,,,,,,,,,,,,,,,,,,,,,,,,,,,,,,,,,,,,,,,,,,,,,,,,,,,,,,,,,,,,,,,,,,,,,,,,,,,,,,,,,,,,,,,,,,,,
2009,65947,사랑에서 영혼으로,공포, 드라마, 스릴러,등화도,판빙빙, 여명, 유약영,1930년대. 상하이에 중국 최초의 라디오 방송국, 미모의 DJ 만리(판빙빙)는 라디오를 통해 청취자의 사연을 읽어주는 ‘심중유귀’라는 프로를 진행하고 있었다. 영화 감독인 준추라는 애인이 있던 그녀는 그가 보낸 청혼의 편지를 읽고 들떠서 뛰어나가지만 준추의 눈 앞에서 교통사고를 당해 목숨을 잃고 만다.  만리를 잊지 못한 준추는 자신의 집 다락방에 만리의 물건들을 옮겨놓게 되고 그와 동시에 만리의 혼까지 준추의 집으로 들어오게 된다. 준추의 모친은 슬픔에 잠긴 아들이 안타까워 자신이 죽을 병에 걸렸다고 속이고 준추를 산산이라는 여자와 혼인시키지만 준추는 산산에게 차갑기만 하다. 준추의 대저택에서 외롭게 살아가던 산산은 어느 날, 다락방에서 들리는 이상한 라디오 소리에 끌려 만리의 영혼과 만나게 된다. 만리는 산산에게 괴로워하는 준추를 함께 돕자고 제안하며 자신에게 몸을 빌려달라고 부탁하는데..,,,,,,,,,,,,,,,,,,,,,,,,,,,,,,,,,,,,,,,,,,,,,,,,,,,,,,,,,,,,,,,,,,,,,,,,,,,,,,,,,,,,,,,,,,,,,,,,,,
2009,52352,사랑은 아무나 하나,,이종수,지수원, 유호정, 한고은,각기 다른 캐릭터를 가진 네 자매의 이야기  미국으로 유학을 갔다 6년만에 한국으로 돌아온 금란(한고은)은 딸 장미를 데리고 입국해 자매들을 놀라게 한다. 네딸의 엄마 애숙(박정수)은 금란이 박사학위를 받고 돌아온다는 얘기에 교수자리와 검사와의 맞선을 준비한다. 맞선에 나가라는 얘기에 금란은 동생 봉선(손화령)을 대신 내보내고 학장을 찾아간 애숙은 금란이 박사가 아니라 석사학위를 받았다는 얘기를 듣고는..,,,,,,,,,,,,,,,,,,,,,,,,,,,,,,,,,,,,,,,,,,,,,,,,,,,,,,,,,,,,,,,,,,,,,,,,,,,,,,,,,,,,,,,,,,,,,,,,,,,,,,
2009,49988,사랑을 부르는, 파리,멜로/로맨스, 드라마, 코미디,세드릭 클라피쉬,줄리엣 비노쉬, 로망 뒤리스,물랑루즈에서 메인댄서로 일하는 피에르(로메인 듀리스)는 누나와 세 아이와 함께 샹젤리제 거리가 내려다 보이는 파리의 아파트에 함께 살고 있다. 언젠가 심장병으로 자신이 죽을 지 모른다고 생각하는 그는 우연히 베란다에서 건너편 아파트에 살고 있는 아름다운 여자 래티시아(멜라니 로랜)를 지켜보게 되고 그녀를 사랑하게 된다. 그러나, 그녀의 곁에는 젊은 남자친구와 중년의 건축가 롤랭(패브리스 루치니)이 있다.  한편, 엘리즈(줄리엣 비노쉬)는 메닐몽탕의 시장에서 야채가게를 하는 주인 장을 알게 되고 그에게 호감을 갖게 된다. 장의 친구 프랭키(길스 레로쉬)는 카페에서 일하는 캐롤린을 좋아하지만 터프하고 장난스러운 태도때문에 매번 그녀에게 상처만 준다. 파리는 사랑으로 넘쳐나고 파리의 겨울도 깊어갈 때 자유분방한 사랑을 쫓는 래티시아는 롤랭에게 이별을 고하게 되는데…,,,,,,,,,,,,,,,,,,,,,,,,,,,,,,,,,,,,,,,,,,,,,,,,,,,,,,,,,,,,,,,,,,,,,,,,,,,,,,,,,,,,,,,,,,,,,,,,,,
2009,70005,사일런트 웨딩,드라마,호라티우 말라엘,메다 안드레아 빅토르, 알렉산드루 포토신,루마니아의 작은 마을의 ‘이안쿠’와 ‘마라’는 마을에서도 유명한 닭살 커플이다. 둘의 결혼식은 마을 최고의 성대한 파티로 시끌벅적하게 마련되지만 하필 결혼식 당일 스탈린의 갑작스러운 죽음! 소련군은 일주일간 애도기간을 선포하며 파티, 집회, 웃음을 절대 금지시킨다. 눈물을 머금고 뿔뿔이 흩어진 하객들…하지만 동이 틀 무렵, 마을 사람들의 조용하고 분산한 움직임이 시작되고, 세상에서 가장 조용한 비밀 결혼식을 시작하는데…,,,,,,,,,,,,,,,,,,,,,,,,,,,,,,,,,,,,,,,,,,,,,,,,,,,,,,,,,,,,,,,,,,,,,,,,,,,,,,,,,,,,,,,,,,,,,,,,,,,
2009,51187,산타렐라 패밀리,드라마, 코미디, 가족,나초 G. 베일라,하비에 카마라, 롤라 두에냐스,마드리드에서 잘 나가는 음식점을 운영하는 막시는 이미 커밍아웃한 동성애자 요리사. 완벽하다고 믿어지던 그의 삶에 갑자기 나타난 전처와의 아이들, 그리고 이웃에 이사 온 매력적인 아르헨티나 출신 전직 축구선수. 아버지로서의 역할도 새로이 배워나가야 하고 사랑도 제대로 해야 하기에 삶은 복잡해지는데...  2008 말라가스페인영화제 최우수 감독상, 남우상 수상.,,,,,,,,,,,,,,,,,,,,,,,,,,,,,,,,,,,,,,,,,,,,,,,,,,,,,,,,,,,,,,,,,,,,,,,,,,,,,,,,,,,,,,,,,,,,,,,,,,,
2009,52389,살기 위하여,다큐멘터리,이강길,이순덕, 류기화, 홍성준,서해안의 지도가 바뀐다는 세계 최대 규모의 새만금 간척사업. 하지만 평생을 갯벌에 의지해 살아온 계화도 주민들은 저 넓은 바다를 막아 무엇을 하겠다는 건지 도무지 이해할 수가 없다. 죽어가는 바다를 가운데 두고 각자의 욕망만을 이야기하는 정부와 개발업자, 명망 있는 지식인과 여러 환경 활동가들. 그리고 그 가운데에 평생을 바다에서 나고 자란 새만금의 ‘이모들’이 있었다. “사람도 조개도 갯벌도 모두 생명이다!” ‘살기 위한’ 그녀들의 절박한 외침은 모두의 마음을 움직일 수 있을까.,,,,,,,,,,,,,,,,,,,,,,,,,,,,,,,,,,,,,,,,,,,,,,,,,,,,,,,,,,,,,,,,,,,,,,,,,,,,,,,,,,,,,,,,,,,,,,,,,,,,,
2009,71687,살맛납니다,드라마,김대진,김유미, 이태성, 홍은희,결혼으로 연결되는 두 가족 내 여섯 커플의 삶과 사랑, 결혼 그리고 이혼에 관한 이야기를 그린 드라마,,,,,,,,,,,,,,,,,,,,,,,,,,,,,,,,,,,,,,,,,,,,,,,,,,,,,,,,,,,,,,,,,,,,,,,,,,,,,,,,,,,,,,,,,,,,,,,,,,,,,
2009,52752,살아있는 야생탐험,다큐멘터리,,잭 코헨,아름다운 지구의 야생세계와 환경보존에 대한 이야기를 물고기이야기, 새들의 이동, 오랑우탄을 위해 사는 사람들, 동물의 대화 등의 주제에 따라 만든 자연 옴니버스 다큐멘터리 영화,,,,,,,,,,,,,,,,,,,,,,,,,,,,,,,,,,,,,,,,,,,,,,,,,,,,,,,,,,,,,,,,,,,,,,,,,,,,,,,,,,,,,,,,,,,,,,,,,,,,,
2009,50251,삼거리 무스탕 소년의 최후,코미디, 액션, SF, 판타지,남기웅,강현중, 예수안, 이상훈,한 소년이 자신을 괴롭히던 무리들을 물리치는 과정에서 자신이 소중히 여기는 것들을 잃게 되고 그 상실감에 절망으로 몸부림친다. 사람들은 일상 속에서 무언가 잃었다고 생각했을 때 자신을 다시 한번 돌아 보게 된다. 과거, 현재를 생각하며 존재 가치에 대한 생각을 하는 것이다. 영화 &amp;lt삼거리 무스탕 소년의 최후&amp;gt는 바로 그것에 관한 이야기를 하려 한다. 남기웅 감독은 이 같은 자신의 견해를 블랙코미디와 SF적 요소를 혼합한 독특한 방식에 의해 풀어나간다. 최근 한국 독립영화계가 획득한 소중한 작품이다.,,,,,,,,,,,,,,,,,,,,,,,,,,,,,,,,,,,,,,,,,,,,,,,,,,,,,,,,,,,,,,,,,,,,,,,,,,,,,,,,,,,,,,,,,,,,,,,,,,
2009,39505,샘스 레이크,공포, 스릴러,앤드류 C. 어린,페이 매터슨, 샌드린 홀트, 윌리엄 그레고리 리,,,,,,,,,,,,,,,,,,,,,,,,,,,,,,,,,,,,,,,,,,,,,,,,,,,,,,,,,,,,,,,,,,,,,,,,,,,,,,,,,,,,,,,,,,,,,,,,,,,,,,
2009,50758,샘터분식,다큐멘터리,태준식,최영임, 안성민, 김진일,유행과 패션의 8차선 고속도로 홍대 앞. 그 속도에 묻혀 무심코 지나쳤던 골목골목. 리얼 '홍대 피플' 앞에 카메라는 멈춰 선다. '불안해 불안해'를 외치는 20대 힙합 뮤지션, '돈 안 되는 고민'만 하는 지역 활동가, '백반 값보다 비싼 커피 값'에 경악하는 분식집 사장님. 산다는 건 언제나 텅 빈 고속도로에서처럼 앞만 보고 질주할 수는 없는 일. 꿈과 좌절, 용기와 희망이 얽혀있는 교차로에서 세 주인공의 삶 역시 '가다 서다'를 반복한다. 서로 다른 듯 닮아있는 이들이 들려주는 일상은 달콤쌉쌀 솔직담백한 맛을 닮았다. 지하철 홍대입구역 2번 출구 근처 사거리에 위치한 샘터분식을 배경으로 샘터분식 주인인 최영임씨, 언더그라운드 힙합 MC인 Jerry K,‘ 민중의 집’준비위원회 상근자인 안성민씨, 그리고 샘터분식 맞은편에 위치한 컨테이너 박스의 행복 열쇠가게 아저씨에게 벌어지는 일상을 보여준다. 카메라는 지역사회 속 연대의식에서 나오는 희망에 대한 얘기를 담담하게 담아냈다.  낙엽이 떨어지기 시작하는 서울의 거리. 2007년 11월부터 이 카메라는 돌기 시작했다. 샘터분식과 그 주위를 서성이던 카메라는 어느 순간 3명의 인물앞에 멈춰선다. 인생을 걸 단체를 만들겠다는 안성민, 마지막이 될지도 모르는 솔로 앨범을 만드는 jerry.k, 매일 새벽 생존을 위한 끼니를 만드는 최영임 앞에... 눈이 내리고 추위가 엄습하며 따뜻한 봄바람으로 온세상이 연두와 노랑으로 물들때 홍대 앞 샘터분식 사거리를 지나가는 수많은 사람들 처럼 이들 역시 2008년 겨울과 봄, 여름을 맞이한다. 터질 듯, 거리 속으로 스며드는 더 콰이엇(The Quiett) 비트와 함께... 변하듯 변하지 않는 도시의 한 공간을 담당하고 있는 당신의 작은 숨소리와 함께...  연출의도. 정말 희망이라는 단어를 쓰기도 지겹다. 자본의 파멸이 눈에 보이는데 우리들의 삶은 구질구질하고 팍팍하기만 하다. 그렇다면 도시의 한 시절을 보내는 사람들은 어떤 힘으로 이 시대를 건너가나? 카메라 하나 들고 사람들의 호흡을 쫓아가 보기로 했다.,,,,,,,,,,,,,,,,,,,,,,,,,,,,,,,,,,,,,,,,,,,,,,,,,,,,,,,,,,,,,,,,,,,,,,,,,,,,,,,,,,,,,,,,,,,,
2009,49084,선덕여왕,드라마,박홍균, 김근홍,이요원, 고현정, 박예진,진흥대제가 북한산에 올라 신라를 한눈에 바라보고는 호연지기 한다. 미실은 백제의 자객들이 진흥왕을 공격하는 것을 막아낸다. 하지만 진흥은 피를 토하며 명운이 다함을 깨닫고 미실에게 유훈을 남긴다. 진흥왕은 따로 근위 화랑 설원랑에게도 미실을 죽이라 밀지를 내리지만 미실은 진흥의 죽음을 감지하고 반격을 가하는데...,,,,,,,,,,,,,,,,,,,,,,,,,,,,,,,,,,,,,,,,,,,,,,,,,,,,,,,,,,,,,,,,,,,,,,,,,,,,,,,,,,,,,,,,,,,,,,,,,,,,,
2009,46410,선샤인 클리닝,드라마, 코미디,크리스틴 제프스,에이미 아담스, 에밀리 블런트, 알란 아킨,고등학교 시절 치어걸 리더로 풋볼팀 쿼터백과 연애하며, 친구들의 부러움을 한 몸에 받았던 로즈. 하지만 지금은 아들 오스카를 혼자 키우며, 호텔과 집 청소로 생계를 유지하는 싱글맘이 되어 있다. 잘 풀리지 않기는 여동생 노라 역시 마찬가지. 툭하면 회사에서 짤리고, 독립도 못한 채 아버지에게 얹혀 살고 있다. 그런 어느 날, 아들 오스카를 사립학교에 보내기 위해 큰돈이 필요한 로즈는 새로운 직업을 택한다. 그것은 바로 피비린내 나는 범죄현장 청소! 백수 동생 노라를 끌어들여 ‘선샤인 클리닝’이라는 청소대행사를 차린 로즈는 각종 범죄현장들을 청소하며 사업을 확장해 간다. 하지만 동생 노라는 로즈가 없는 사이 범죄현장을 화재현장으로 만들어 버리고 마는데…,,,,,,,,,,,,,,,,,,,,,,,,,,,,,,,,,,,,,,,,,,,,,,,,,,,,,,,,,,,,,,,,,,,,,,,,,,,,,,,,,,,,,,,,,,,,,,,,,
2009,68339,성룡의 신주쿠 살인사건,액션, 느와르,이동승,성룡, 판빙빙, 오언조,소식이 끊긴 여자친구를 찾기 위해 일본으로 밀입국한 ‘철두’(성룡). 도쿄, 신주쿠 거리 뒷골목에서 그녀를 찾겠다는 일념 하나로 불법체류자의 비참한 생활을 이어간다. 수소문 끝에 여자친구를 만나게 되지만 그녀는 이미 차기 야쿠자 두목인 ‘에구치’의 아내가 되어 있는 상태.  연인을 잃은 슬픔을 누르며 일본에서의 성공을 다짐한 철두는 피나는 노력으로 신주쿠 뒷골목을장악하게 된다. 그러나 믿었던 친구 ‘아걸’(다니엘 우)의 배신으로 또 다른 위기를 맞는데….,,,,,,,,,,,,,,,,,,,,,,,,,,,,,,,,,,,,,,,,,,,,,,,,,,,,,,,,,,,,,,,,,,,,,,,,,,,,,,,,,,,,,,,,,,,,,,,,,,,,
2009,52508,세라핀,드라마,마르탱 프로보스트,욜랭드 모로, 울리히 터커,파리의 북동쪽의 작은 마을 ‘상리스’, 남의 집 허드렛일을 하면서 근근이 생계를 이어가는 “세라핀”. 그녀는 땔감이나 집세 낼 돈마저도 모두 털어 그림 재료를 사들이고 들꽃이나 풀, 심지어는 교회의 촛농까지도 훔쳐다가 자신만의 색을 만들어 그림을 그린다. “세라핀”은 하나님의 계시를 받아 그림을 그린다고 생각하지만, 마을 사람들은 그런 그녀를 비웃고 조롱할 뿐이다. 예술가로서의 성공도, 돈이나 명예를 위해서도 아닌 자신의 본능에 따라 그림에 몰두하는 자유로운 영혼의 그녀에게 운명처럼 한 사람이 찾아온다.  1912년,  ‘빌헬름 우데’는 휴식을 취하면서 글을 쓸 요량으로 상리스에 작은 방을 빌려 이사를 온다. 그는 ‘피카소’의 그림을 처음 구입하고 ‘루소’의 첫 개인전을 준비할 만큼 심미안을 가진 독일인 미술 평론가이자 화상이다. 그가 이사 온 아파트에는 ‘세라핀’이라는 중년 여인이 하녀 일을 하고 있었는데, 집주인은 ‘세라핀’에게 그의 시중을 들게 한다.  어느 날 저녁, 주인이 베푼 만찬에 참석한 빌헬름은 우연히 그림 하나를 발견하고 누가 그린 그림인지 묻는다. 집주인은 질문에 세라핀이라고 경멸조로 답하지만 그는 단번에 세라핀의 천부적인 재능을 알아본다. 그가 세라핀을 찾아가게 되면서 두 사람 사이의 우정도 사랑도 아닌 기묘한 관계가 이어지고, 그녀의 천부적인 재능은 빌헬름의 재정적 후원에 힘입어 빛을 보게 된다. 하지만 그녀의 천재성은 점차 광기로 변해 가는데...,,,,,,,,,,,,,,,,,,,,,,,,,,,,,,,,,,,,,,,,,,,,,,,,,,,,,,,,,,,,,,,,,,,,,,,,,,,,,,,,,,,,,,,,,,,,,,,
2009,50511,세리와 하르,드라마,장수영,장미지, 최세나,무표정한 얼굴에 내성적인 세리는 베트남에서 시집온 엄마 때문에 아이들에게 항상 놀림을 받는다. 하지만, 언젠가 박세리 선수처럼 유명한 골퍼가 되어 사람들에게 인정 받는 것이 세리의 꿈이다. 한편, 겉으론 밝고 당당한 하르는 필리핀 불법체류자의 딸로 언제 단속에 잡혀 추방당할지 몰라 불안하다. 그래서, 한국 사람처럼 주민등록증을 갖고 합법적으로 사는 것이 하르의 꿈이다.  그러나, 최근 더욱 심해진 강압적인 불법체류자 단속 때문에 하르의 가족과 이주민들의 불안감은 심해져만 가고, 인권을 무시한 절차에 한국 사람들의 불만까지 높아져 공단 분위기는 어수선하다. 그래서, 공단 해결사인 목사님은 단속을 막고 영세한 주민들을 돕기 위해 방송국 김PD에게 도움을 요청한다.  얼마 후, 김PD가 방송에 이주민들을 대표해 불법체류자인 아빠와 희망을 잃지 않고 살아가는 하르의 이야기를 내보내자 많은 사람들이 하르에 대한 지지와 후원금을 보내온다. 반면, 세리는 사람들에게 주목 받는 하르가 밉고 자신도 왕따에서 벗어나고 싶어 더 골프 연습에 매진하려고 한다. 하지만, 세리 부모님이 예고 없이 닥친 불행으로 힘들어 하며 세리를 제대로 뒷받침해주지 못하자 세리의 불만은 더 커져 간다.  그러던 어느날, 한 남자가 세리에게 다가와 하르에 대해 묻는데 그 남자는 바로 불법체류자 단속반 강철우! 세리는 별 생각 없이 하르의 아빠에 대한 이야기를 털어 놓는데, 이로 인해 하르의 가족은 더 큰 위험에 놓이게 된다. 그러고 하르는 뒤늦게 세리가 강철우에게 정보를 제공했음을 알고 복수를 계획하지만 하르의 아빠 역시 이 사실을 듣게 되면서 상황은 점점 더 복잡해 지는데..  영화제 소개글. 베트남에서 시집온 엄마 때문에 아이들에게 항상 놀림을 당하는 세리와 필리핀 미등록 이주자의 딸로 언제 단속에 잡혀 추방당할지 모르는 하르. 둘을 서로에게 상처를 주기도 하지만 다시 우정을 회복해 간다. (이주노동자 영화제)  결혼이주를 한 필리핀 엄마와 한국인 아빠를 둔 세리와, 필리핀 불법이민노동자 부모를 둔 하르는 마냥 행복하지만은 않은 열세 살 소녀들이다. 박세리처럼 골프도 잘 치고 돈도 잘 버는 사람이 되고 싶은 세리는 필리핀인 엄마가 창피하고 쪼들리는 집안형편이 불만스럽기만 하다. 한편 하르는 주민등록증을 발급받아 불법거주자에서 탈피하는 게 소원이다. 영화는, 외국인 부모를 가졌다는 사실 외에 또래의 아이들과 다를 바 없는 사춘기 소녀들을 동정적이지도, 감상적이지도 않은 시선으로 담아낸다. 때론 오해하고 때론 서로에게 뱉은 모진 말 때문에 멀어지기도 하는 두 소녀의 꿈은 골프를 잘 치는 것, 태어나고 자란 한국땅에서 당당하게 사는 것이다. 국내거주 외국인 인구 100만 명 시대에, 그들의 그리고 우리의 아이들은 어떤 모습으로 자라고 있는가. 2006년 영화진흥위원회 독립영화 제작지원 및 제 10회 CJ 독립영화 프로모션 제작지원작인 이 영화는 감독이 한국에서 합법적으로 살길 희망하는 불법체류 노동자 2세에 관한 기사에서 영감을 얻어 2년의 현장취재 끝에 완성된 작품이다. 실제 다문화가정의 아이들 중에서 캐스팅 된 장미지, 최세나 양은 아마추어 연기자임에도 자연스러운 연기를 보여준다. 영화의 막바지, 다툼 끝에 우정을 회복한 세리와 하르 앞에 불법이민자 단속반이 나타나 하르를 잡아간다. 영영 이별하게 될지도 모르는 순간 차창을 사이에 두고 나누는 소녀들의 안타까운 눈빛에서야 비로소 감정을 내보이는 이 영화는 만든 이의 진심이 무엇보다 빛나는 작품이다. &amp;lt세르와 하르&amp;gt로 인해 다문화가정과 그 아이들에 대한 새로운 인식이 생겼다면 이주여성 영화제작 워크숍도 보기를 권한다. (안지혜),,,,,,,,,,,,,,,,,,,,,,,,,,,,,,,,,,,,,,,,,,,,,,,,,,,,,,,,,,,,,,,,,,,,,,,,,,,,,,,,,,,,,
2009,90560,세바퀴,,이지현,신동엽, 김구라, 온주완,공감대 있는 수다와 생활 밀착 퀴즈를 즐길 수 있는 퀴즈 쇼 프로그램.,,,,,,,,,,,,,,,,,,,,,,,,,,,,,,,,,,,,,,,,,,,,,,,,,,,,,,,,,,,,,,,,,,,,,,,,,,,,,,,,,,,,,,,,,,,,,,,,,,,,,,
2009,51807,세븐 파운즈,드라마,가브리엘 무치노,윌 스미스, 로사리오 도슨, 우디 해럴슨,한 순간의 실수로 모든 것을 잃고, 세상에 진 빚을 갚아야 한다는 죄책감으로 7명의 운명을 바꾸기 위한 계획을 세운 벤 토마스(윌 스미스)는 에밀리(로자리오 도슨)와의 예기치 않던 사랑으로 잠시 혼란에 빠지게 된다. 하지만 에밀리와 진정한 사랑에 빠졌다는 걸 느낀 순간 마침내 오랫동안 자신이 계획해온 일을 실행에 옮길 때가 되었음을 깨닫게 된다. 선택된 7명만이 알 수 있었던 그 놀라운 비밀은 과연 무엇일까?,,,,,,,,,,,,,,,,,,,,,,,,,,,,,,,,,,,,,,,,,,,,,,,,,,,,,,,,,,,,,,,,,,,,,,,,,,,,,,,,,,,,,,,,,,,,,,,,,,,,,
2009,67574,세비지 그레이스,드라마,톰 칼린,줄리안 무어, 스티븐 딜레인, 에디 레드메인,최초로 합성수지를 발명해낸 레오 베이클랜드의 손자이자 베이라이트사의 상속인인 브룩스와 결혼해 오랜 시간 꿈꾸던 부와 명예를 한꺼번에 얻게 된 바바라. 모든 것을 누린 듯 보이지만 자신을 조롱거리로 여기는 상류층 사람들과 계속되는 남편의 무관심으로 인해 그녀의 삶은 독한 술과 위험한 정사로 채워진다. 한편 부서질듯한 불안한 정서를 가진 그들의 유일한 아들, 안토니와 기댈 곳 없는 바바라는 점점 더 많은 것을 의지하게 되고 서로에게 연민을 느끼며 정상적인 모자관계 이상의 친밀한 유대감을 형성하게 되는데..  영화제 소개글. 미국 전역을 떠들썩하게 만든 베이클라이트 집안의 비극을 영화로 옮긴 &amp;lt세비지 그레이스&amp;gt는 존속살해, 근친상간 등 실화이기에는 너무나도 충격적인 요소들로 가득하다. &amp;lt졸도&amp;gt를 통해 뉴 퀴어 시네마의 기수로 잘 알려진 톰 칼린의 우아한 연출과 줄리안 무어의 신들린 연기가 강한 여운을 남기는 화제작. (Savage Grace, based on a true American tragedy of Barbara Bakelite, an infamous socialite played by unbreakable Julianne Moore, deals with the most daring issues such as matrimony, incest and others. Directed by Tom Kalin, one of the leading filmmakers of 1990's new queer cinema.),,,,,,,,,,,,,,,,,,,,,,,,,,,,,,,,,,,,,,,,,,,,,,,,,,,,,,,,,,,,,,,,,,,,,,,,,,,,,,,,,,,,,,,,,,,,,,,
2009,51263,섹스 드라이브,모험, 코미디, 멜로/로맨스,숀 앤더스,조쉬 주커맨, 아만다 크루,졸업을 앞둔 18살의 고등학생 이안에게 또래 친구들에 비해 첫경험이 늦다는 컴플렉스를 한방에 날릴 절호의 기회가 찾아온다! 채팅으로 만난 화끈녀 말하길, “만약에 날 보러 와주면, 내 모든 걸(?) 줄게!” 브라보! 드디어 총각딱지를 뗀다! 그러나 문제는 그녀가 있는 곳이 자동차로 9시간 걸리는 테네시 녹스빌이라는 것. 기대로 잔뜩 부푼 이안은 오로지 총각딱지를 떼겠다는 일념으로 마초형의 스포츠카를 훔치고, 얼떨결에 절친남과 절친녀를 동행해 녹스빌로 향하게 된다. 그러나 이 여행은 이안의 기대와는 다르게 자꾸만 꼬여가기 시작하는데~,,,,,,,,,,,,,,,,,,,,,,,,,,,,,,,,,,,,,,,,,,,,,,,,,,,,,,,,,,,,,,,,,,,,,,,,,,,,,,,,,,,,,,,,,,,,,,,,,,
2009,53449,섹스와 도박의 상관관계,에로,이시카와 지로,,확률변동편. 미나는 섹스를 하면 묘한 기운을 얻어 파친코에서 돈을 따는 묘한 징크스가 있다. 그래서, 그녀는 파친코에서 만난 남자들과 섹스를 하곤 했다. 그러다, 우연히 한 남자를 만나 결혼을 하고 그 남자의 사랑으로 파친코도 그만 둔다. 그러나, 남편의 수술비 마련을 위해 다시 파친코 게임을 하고 결국 다시 파친코의 여왕으로 등극한다.  방랑의도박사편. 스도는 16넌전에 파친코를 운영하는 진노 사장의 계략으로 아버지를 잃게 된다. 그녀는 파친코 게임을 연구해서 진노 사장이 주최하는 파친코대회에 참가하여 승승장구하게되고, 이제 복수가 멀지 않았다고생각되는 순간, 진노 사장이 사실을 눈치채고 그녀를 제거하려 하지만, 이때 들이닥치 또다른 참가자에 의해 도움을 받고, 결국 진노 사장과 파친코 대결을 통해 아버지의 원한을 갚는다.  도박의법칙편. 피버걸즈는 파친코의 사기 도박사들을 제거하는 사립 탐정들이다. 그들은 여느때와 같이 사기 도박을 벌이는 도박사를 잡아들였는데, 죄목이 부녀자 폭행이어서 그들은 곧 석방되지만, 파친코 기계의 헛점을 활용해 다시금 그들을 잡는다.  확률대박편. 사에코는 고아원에서 자랐다. 사에코의 고아원은 파친코를 운영하는 사장에게 땅을 빼앗긴다. 그녀는 복수를 결심하고 파친코를 연구하여 회사에 취직한다. 회사 생활을 하며 복수의 날을 기다리는 사에코. 파친코의 사장의 비리를 적발하고 다시 보육원을 찾는다.,,,,,,,,,,,,,,,,,,,,,,,,,,,,,,,,,,,,,,,,,,,,,,,,,,,,,,,,,,,,,,,,,,,,,,,,,,,,,,,,,,,,,,,,,,,,,,,
2009,53154,,,,,,,,,,,,,,,,,,,,,,,,,,,,,,,,,,,,,,,,,,,,,,,,,,,,,,,,,,,,,,,,,,,,,,,,,,,,,,,,,,,,,,,,,,,,,,,,,,,,,,,,,,,,,
