year,code,title,genre,directors,actors,story,,,,,,,,,,,,,,,,,,,,,,,,,,,,,,,,,,,,,,,,,,,,,,,,,,,,,,,,,,,,,,,,,,,,,,,,,,,,,,,,,,,,,,,,,,,,,,,,,,,,,,,,
2009,50176,작전,범죄, 스릴러, 코미디, 드라마,이호재,박용하, 김민정, 박희순,억울한 게 생기면 잠도 못 자는 성격의 강현수(박용하), 찌질한 인생 한 방에 갈아타기 위해 주식에 도전하지만, 순식간에 신용불량자가 된다. 그는 독기를 품고, 수년의 독학으로 이제 실력을 갖춘 프로 개미가 되어 마침내 작전주 하나를 추격해 한번에 수천 만원을 손에 쥔다. 그러나 기쁨도 잠시, 그가 건드린 것은 전직 조폭 출신 황종구(박희순)가 작업중인 작전주였다. 몰매를 맞으며 납치된 현수는 되려 황종구의 작전을 망친 남다른 능력을 인정 받아 대한민국을 뒤흔들 600억 헤비급 작전에 엮이게 된다.  초짜 현수와는 달리, 이번 작전에 가담한 작전멤버들은 대한민국 경제를 돌리는 거물급 프로들! 오랜 조폭 생활을 청산하고 DGS홀딩스를 차려 주식작전 세계에 뛰어든 황종구, 탈세를 원하는 졸부, 비자금을 축적한 정치인 등 상류층의 자산뿐만 아니라 비밀까지 철저하게 관리해주는 유서연(김민정), 서진에셋에서 높은 실적으로 승진 가도를 달리고 있는 작전계 특급 에이스 조민형(김무열), 그리고 작전의 시발점인 대산토건의 대주주 박창주까지 최고의 멤버가 구성되었다.  이들이 벌릴 판은 부실한 건설 회사 대산토건. 작전의 최고 죽이는 아이템이라는 ‘환경 기술’을 이용해, ‘수질 개선 박테리아 연구‘ 를 하고 있는 ‘한결 벤처’에 투자, 유서연의 고객 중 한 명이자, 굴리는 돈이 왠만한 기업보다 커 ‘마산창투’라 불리우는 완벽한 쩐주의 돈을 미끼로, 대산토건 주식을 사들인다. 여기에 쪽집게 분석으로 유명한 언론 스타 김승범의 여론 몰이와 검은 머리 외국인 브라이언 최를 통해 외국 자본을 끌어들이며 판은 걷잡을 수 없이 커져만 가고, 눈 먼 개미들의 돈을 쓸어모으기 시작한다. 대박을 눈 앞에 둔 시점, 너무나 완벽하게 진행되는 작전! 작전멤버들간의 쫓고 쫓기는 또 다른 물밑 작전이 시작되는데.. 대한민국 돈이 움직이는 지상최대의 작전이 시작된다.,,,,,,,,,,,,,,,,,,,,,,,,,,,,,,,,,,,,,,,,,,,,,,,,,,,,,,,,,,,,,,,,,,,,,,,,,,,,,,,,,,,,
2009,68063,작전명 발키리,스릴러, 드라마, 전쟁,브라이언 싱어,톰 크루즈,강직한 성품의 클라우스 폰 슈타펜버그 대령은 조국과 국민을 위하는 충성스런 장교이지만 히틀러가 독일과 유럽을 파멸시키기 전에 누군가 그를 막을 방법을 찾아내기를 희망한다. 북 아프리카 전투에서 큰 부상을 입은 슈타펜버그 대령은 독일 사령부로 발령을 받으면서 권력 최상위층까지 숨어있는 비밀 저항세력에 가담, 히틀러를 제거하기 위한 직접적인 행동에 나서게 된다. 히틀러가 비상시를 대비해 세워놓은 일명 “발키리 작전”을 이용 히틀러를 암살하고 나치 정부 전복을 계획하는 것. 전 세계의 미래와 수백만의 안위, 사랑하는 가족들의 목숨이 달린 위험한 작전 최전선에 서게 된 슈타펜버그 대령은 히틀러를 직접 암살해야하는 긴박한 상황에 놓이게 되는데..,,,,,,,,,,,,,,,,,,,,,,,,,,,,,,,,,,,,,,,,,,,,,,,,,,,,,,,,,,,,,,,,,,,,,,,,,,,,,,,,,,,,,,,,,,,,,,,,,,,,
2009,51447,잘 알지도 못하면서,드라마,홍상수,김태우, 엄지원, 고현정,영화제에 심사위원으로 초청된 구경남. 프로그래머 공현희를 비롯한 영화인들과의 술자리를 핑계삼아 심사는 뒷전이다. 의무적인 영화관람이 계속되던 중 우연히 만난 오래전 절친 부상용을 만나고, 그의 집으로 향한다. 어김없이 벌어진 술자리는 부상용의 아내, 유신으로 인해 묘한 분위기로 마무리되고, 다음날 구경남은 뜬금없이 파렴치한으로 몰린 채 도망치듯 제천을 떠난다.  제주도에 특강을 가게 된 구경남. 학생들과의 뒤풀이 자리에서 선배인 화백 양천수를 만나 다음날 가의 집으로 동행한다. 그는 양천수의 아내가 자신이 연모했던 후배 고순임을 알게 되고, 그녀는 구경남에게 은밀히 쪽지를 건넨다. 이 후, 고순을 다시 찾은 구경남. 두 사람은 불장난 같은 관계 중, 우연히 들른 동네주민 조씨에게 현장을 들키고 마는데...,,,,,,,,,,,,,,,,,,,,,,,,,,,,,,,,,,,,,,,,,,,,,,,,,,,,,,,,,,,,,,,,,,,,,,,,,,,,,,,,,,,,,,,,,,,,,,,,
2009,52447,잘했군 잘했어!!,,김남원, 손형석,채림, 엄기준, 김승수,과거 남자와의 사이에서 아이를 낳았지만 헤어진 후, 연하의 멋진 순정남과 사랑하게 되는 미혼모 이강주의 사랑과 인생 이야기를 그린 드라마,,,,,,,,,,,,,,,,,,,,,,,,,,,,,,,,,,,,,,,,,,,,,,,,,,,,,,,,,,,,,,,,,,,,,,,,,,,,,,,,,,,,,,,,,,,,,,,,,,,,
2009,50833,장례식의 멤버,드라마,백승빈,이주승, 유하복, 박명신,열일곱 살 소년 희준의 장례식에 한 무리의 사람들이 모인다. 서로를 부르는 호칭으로 짐작해볼 때 이들은 아버지, 어머니, 딸로 구성된 한 가족이다. 이들은 각자의 일상에서 누구보다 가깝게 희준을 공유했던 ‘장례식의 멤버들’이지만, 정작 서로가 왜 장례식에 오게 되었는지는 알지 못한다. 더없이 냉랭한 분위기의 이 가족을 살펴보면, 아버지인 준기는 지루할 정도로 평범해 보이는 중년의 대학농구단 재활치료사이지만, 사실 누구에게도 털어놓을 수 없는 어두운 비밀을 간직한 남자이다. 한때 애거서 크리스티 같은 추리소설 작가를 꿈꿨던 어머니 정희는, 고등학교 문학교사로 일하고 있는 지금도 더 많은 미스터리를 필요로 하는 아마추어 작가이며, 이들의 딸 아미는 학교수업과 시체염습을 수년째 병행해오고 있는 조금 특별한 여고생이다. 어느덧 희준은 그들의 일상에서 서로의 가족들보다 더 많은 시간을 함께 보내며 <장례식의 멤버>라는 제목의 소설을 마무리한다. 그러던 어느날 희준은 이들에게 자신이 완성한 소설을 하나씩 선물로 준 뒤, 자살한다.  연출의 변. 고백하자면, 나의 가족은 내가 가진 비밀 중에서 가장 복잡하고 은밀한 것이다. 그들은 내 인생에서 가장 자주, 가장 오래 알고 지낸 사람들이지만, 오히려 도무지 이해할 수 없는 사람들이기도 하다. 그래서 나는 가끔 다음과 같은 질문을 스스로에게 던져보기도 한다. 유전자나 염색체 말고 우리가 서로를 가족이라 부를 수 있는 증거가 무엇이 있을까. 우리를 뭔가 정서적이고 심리적으로 이어주는 울타리, 또는, 서로 강렬하게 공유하고 있는 감정들이 있지 않을까. 그것이 비록 튼튼하게 세워진 울타리가 아니고, 또는, 아름답고 따뜻한 감정들이 아니라 할지라도 말이다. 그런 맥락에서, 이 이야기의 최초 시작은, ‘누군가의 장례식장에 한 가족이 앉아있는데, 그들은 그날 거기서 처음 만났다.’라는 한 줄의 설정에서이다. 무엇보다 내겐 이들 가족이, 장례식장을 제외하고는, 영화 내내 거의 만나지도 않는 사람들이라는 사실이 필요했고, 또, 중요했다. 왜냐하면, 이들 모두는 각자의 상처와 고통의 흔적을 스스로 보듬기에도 바쁜 사람들이라서 많은 다른 가족들처럼 지루한 일상 따위를 공유하는데 낭비할 시간이 없기 때문이다. 그럼에도 왜 이들이 가족일 수 있을까에 대해 영화가 끝난 후, 조금이라도 궁금해진다면, 나는 아주 뿌듯할 것이다.,,,,,,,,,,,,,,,,,,,,,,,,,,,,,,,,,,,,,,,,,,,,,,,,,,,,,,,,,,,,,,,,,,,,,,,,,,,,,
2009,66954,저녁의 게임,드라마,최위안,하희경, 정재진, 안찬우,어린 시절 아버지의 폭행으로 귀가 멀어버린 성재. 현재 악보 정리 일을 도와주고 있는 그녀는 어느 첼로 앙상블의 리허설에 참관하고 돌아오는 길에 트럭의 경적소리를 듣지 못한 채 앞서 가다가 트럭운전수에게 뺨을 맞는다. 그 일은 어린 시절 술에 취하면 폭력을 일삼던 아버지의 모습을 떠오르게 하고, 아버지에 대한 증오심이 되살아나게 한다. 아버지의 폭행은 어머니를 죽음으로 몰아넣고 오빠마저 잃게 했지만, 치매에 걸려 정신이 오락가락하는 늙은 아버지를 떠나지 못하는 성재. 오로지 당신의 건강과 욕망에만 집착하는 아버지를 위해 매일 지루하고 똑같은 일상을 반복하고 있다.  그러던 어느 날, 집안으로 숨어든 한 낮의 탈주범과 마주하게 된 그녀는 그 일의 충격으로 인해 오랜 시간 잊고 살아 온 자유의 의미, 그리고 자신의 존재에 대한 근원을 다시금 발견하게 되는데... 그날 밤, 또 다시 시작된 아버지만의 화투놀이에서 그녀는 그 동안 억눌렸던 감정을 분출하기 시작한다!  영화제 소개글. 재개발이 한창인 변두리 도시. 치매에 걸린 아버지와 함께 살고 있는 독신의 딸은 아버지와 매일 밤 화투를 친다. 답답한 일상 속에 갇혀버린 여인의 벗어나고 싶은 욕망과 그럴 수 없는 현실은 재개발로 어수선한 마을, 탈주범과의 조우 등 무수한 영화 속의 어지러움으로 대변된다. (전주국제영화제),,,,,,,,,,,,,,,,,,,,,,,,,,,,,,,,,,,,,,,,,,,,,,,,,,,,,,,,,,,,,,,,,,,,,,,,,,,,,,,,,,,,,,,,,,,,,,,,
2009,50184,적벽대전 2부 - 최후의 결전,전쟁, 액션,오우삼,양조위, 금성무, 장풍의,유비의 책사 제갈량은 손권과의 동맹에 극적으로 성공하고, 손권 휘하의 명장 주유와 함께 조조군을 크게 물리친다. 그리고 불리한 전세를 역전 시키기 위해 빈 배로 10만개의 화살을 구해오는 제갈량의 지략과 조조 스스로 최고의 장수의 목을 치게 하는 주유의 심리전으로 유비와 손권의 연합군에게 승리가 보이는 듯 하지만…  조조의 대군을 물리치기 위해 반드시 화공(火攻) 전략를 써야만 하는 유비와 손권 연합군. 하지만 지금은 이들에게 불리한 바람이 불고 있는 상황. 제갈량은 하늘의 기운을 읽고 때를 기다리자고 하는 가운데, 주유의 아내 소교는 조조를 만나기 위해 혼자 적진으로 향한다. 연합진영에 크게 패한 조조는 진영을 가다듬고, 드디어 최후의 전쟁을 위해 출격을 시작하는데…,,,,,,,,,,,,,,,,,,,,,,,,,,,,,,,,,,,,,,,,,,,,,,,,,,,,,,,,,,,,,,,,,,,,,,,,,,,,,,,,,,,,,,,,,,,,,,,,,,
2009,48227,전우치,액션, 코미디, 모험,최동훈,강동원, 김윤석, 임수정,500년 전 조선시대. 전설의 피리 '만파식적'이 요괴 손에 넘어가 세상이 시끄럽자, 신선들은 당대 최고의 도인 천관대사(백윤식)와 화담(김윤석)에게 도움을 요청해 요괴를 봉인하고 '만파식적’을 둘로 나눠 두 사람에게 각각 맡긴다. 한편, 천관대사의 망나니 제자 전우치(강동원)가 둔갑술로 임금을 속여 한바탕 소동을 일으키자, 신선들은 화담과 함께 천관대사를 찾아간다. 그러나 천관대사는 누군가에게 살해당하고 피리 반쪽이 사라졌다! 범인으로 몰린 전우치는 자신의 개 초랭이(유해진)와 함께 그림족자에 봉인된다. 요괴 잡는 도사도 어느덧 전설이 된 2009년 서울. 어찌된 일인지 과거 봉인된 요괴들이 하나 둘 다시 나타나 세상을 어지럽힌다. 이제는 신부, 중, 점쟁이로 제각각 은둔생활을 즐기던 신선들은 다시 모여 화담을 찾지만, 500년 전 수행을 이유로 잠적한 그는 생사조차 알 수 없다. 고심 끝에 신선들은 박물관 전시품이 된 그림족자를 찾아 전우치와 초랭이를 불러낸다. 요괴들을 잡아 오면 봉인에서 완전히 풀어주겠다는 제안에 마지 못해 요괴 사냥에 나선 전우치. 그러나 전우치는 요괴사냥은 뒷전인 채 달라진 세상구경에 바쁘고, 한 술 더 떠 과거 첫눈에 반한 여인과 똑같은 얼굴을 한 서인경(임수정)을 만나 사랑놀음까지 시작한다. 전우치 때문에 골치를 앓는 신선들 앞에 때마침 화담이 나타나지만, 화담은 만파식적의 행방을 두고 전우치와 대적하는데…,,,,,,,,,,,,,,,,,,,,,,,,,,,,,,,,,,,,,,,,,,,,,,,,,,,,,,,,,,,,,,,,,,,,,,,,,,,,,,,,,,,,,,,,,,,,
2009,45285,정승필 실종사건,코미디,강석범,이범수, 김규리,금융계의 신화로 알려진 500억대 자산관리사 정승필(이범수). 프로젝트 성공률 100%를 자랑하며 초고속 승진에다 지점장의 두터운 신임을 받는 등 회사 내에서 승승장구하지만 늘 동료들의 시기와 질투를 받고 있다. 수백 억대의 계약을 앞둔 어느 날, 약혼녀 미선(김민선)과 차를 타고 가던 중 잠시 편의점에 들리겠다며 차에서 내린 승필은 홀연히 사라지는데… ‘9시 뉴스’ 출연을 성사시켜 줄 대박 사건을 애타게 기다리던 김형사(손창민)는 때마침 정승필 실종사건의 수사를 맡게 되자 의욕적으로 목격자와 증거물을 하나 둘씩 찾아낸다. 실종 바로 직전 수백 억대의 계약을 성사시킨 승필을 둘러싸고 평소 회사에서 그의 성공을 시기하던 직장 동료들이 많았다는 주변 정황을 포착한 김형사는 정승필 주변 인물들을 조사할수록 새로운 사실들이 속속 드러나는데… 실종을 위장한 공금횡령 사건, 혹은 원한에 의한 납치 사건에 무게를 두고 수사를 계속 하던 중 유일한 목격자가 나타나 사건은 또 다른 방향으로 급선회 한다. 마지막으로 정승필이 찾았던 편의점 직원이 폭력배로 보이는 남자가 승필을 폭행했다고 진술한 것. 김형사가 다시 우발적인 살인사건에 초점을 맞춰 수사를 펼치는 동안 박형사(김뢰하)는 처음부터 의심을 품었던 정승필의 약혼녀이자 보험회사 세일즈 매니저인 미선이 승필 앞으로 실종 일주일 전, 사망보험을 가입했다는 사실을 확인하고, 사건의 용의자로 미선을 지목한다.  수사를 하면 할수록 수백 억대의 자산관리사 실종 사건은 점점 폭행, 납치, 살인 등 여러 가지로 꼬여만 가고, 때마침 ‘정승필 실종사건’이 뉴스를 통해 전국으로 알려지자 일은 걷잡을 수 없이 커져만 가는데… 정승필 실종을 둘러싼 배꼽 빠지는 코믹 수사가 지금부터 시작된다!,,,,,,,,,,,,,,,,,,,,,,,,,,,,,,,,,,,,,,,,,,,,,,,,,,,,,,,,,,,,,,,,,,,,,,,,,,,,,,,,,,,,,,,,,,,,,,,,
2009,50322,제노바,드라마,마이클 윈터바텀,콜린 퍼스, 윌라 홀랜드, 펄라 하니-자딘,자동차 사고로 아내를 잃은 후 조(콜린 퍼스)는 두 딸과 함께 이탈리아 제노바로 이주한다. 제노바의 대학에서 학생들을 가르치며 새로운 생활에 적응해 나가는 조와 달리 엄마의 죽음이 가져온 충격이 가시지 않은 두 딸들은 낯선 곳에서의 생활이 쉽지 않다. 큰 딸 켈리는 엄마의 죽음이 동생 메리와 관련되어 있다는 사실 때문에 동생을 멀리하고 제노바에서 낯선 남자들을 만나고 파티에 어울려 다니며 섹스와 마약에 빠져든다. 한편, 메리는 엄마의 죽음에 대한 충격 때문에 끊임없이 죄책감에 시달리지만 피아노에 몰두하며 제노바의 생활에 적응하려 애쓴다. 켈리와 조가 각자의 생활에 빠져 있는 사이에 혼자 있는 시간이 많아진 메리는 아무도 모르게 제노바 곳곳을 돌아다니게 된다. 그리고, 홀로 있던 메리는 항상 누군가와 대화를 나누게 된다. 바로, 얼마 전 죽은 엄마가 메리를 찾아오기 시작한 것… 어느 날 엄마와 함께 제노바의 골목길을 여행하던 메리는 낯선 도시에서 길을 잃고 마는데…,,,,,,,,,,,,,,,,,,,,,,,,,,,,,,,,,,,,,,,,,,,,,,,,,,,,,,,,,,,,,,,,,,,,,,,,,,,,,,,,,,,,,,,,,,,,,,,,,,,
2009,52013,제독의 연인,전쟁, 드라마,안드레이 크라프추크,콘스탄틴 카벤스키, 엘리자베타 보야르스카야,전투에서 대승을 거두고 영웅으로 돌아온 최고의 해군 함장 `코르챠크`(콘스탄틴 카벤스키). 승리를 축하하는 파티가 열리던 밤, 그는 고혹적인 매력의 `안나`(엘리자베타 보야르스카야)를 만나게 되고 두 사람은 거부할 수 없는 사랑에 빠진다. 그러나 얼마 후 제국은 혁명의 불길에 휩싸이고 제독의 자리에 오른 `코르챠크`는 군인의 명예와 대의를 위해서 `안나`곁을 떠나게 된다. 운명의 여인을 지켜내기 위해 그녀를 모른 척 해야 하는 `코르챠크`와 그에게 전해질 기약 없는 편지를 쓰며 그리움을 키워가는 `안나`. 기다림의 끝에서 결국 `안나`는 연인과 생사를 함께 하기로 결심하고, 간호병이 되어 `코르챠크` 몰래 먼발치에서나마 연인을 지켜보며 전장 속으로 뛰어 드는데...,,,,,,,,,,,,,,,,,,,,,,,,,,,,,,,,,,,,,,,,,,,,,,,,,,,,,,,,,,,,,,,,,,,,,,,,,,,,,,,,,,,,,,,,,,,,,,,,,,,,
2009,50081,제불찰씨 이야기,애니메이션, 드라마,이혜영, 이은미, 류지나,엄상현, 조현정, 정재헌,지금 TV에선 국회의원 최고봉을 미치게 한 혐의로 잡혀온 한 거미의 공개사형 여부를 시청자참여로 결정하는 생방송TV재판이 진행되고 있다. 사연인 즉, 이구소제사 제불찰에게 귀청소를 받던 최고봉 의원이 난데없이 정신발작을 일으켰는데, 그 사건현장에선 제불찰 대신 이 거미 한 마리가 발견된 것. 제불찰을 묘하게 닮은 이 거미와 사라진 제불찰은 어떤 관계인 것일까.  제불찰은 어린 시절 자신의 귀를 파주곤 했던 누나와의 따뜻한 추억으로 이구소제사를 시작했고, 지금 그는 잃어버린 그 누나를 애타게 찾고 있다. 귀파주기를 통해 사람들이 잘 소통할 수 있는 세상을 꿈꾸지만, 실적이 좋지 않은 제불찰에게 돌아오는 건 상사의 질책과 고객들의 무시뿐이다. 그러나 사장은 오히려 그를 격려하며 영양제까지 선물한다. 영양제를 먹은 뒤로 제불찰의 몸은 점점 허약해지고, 사람들의 질책이 계속될 때 마다 점점 더 작아져 간다.  어느덧 귀 속으로 들어갈 정도로 몸이 작아진 제불찰. 무속인 팽선녀의 귀를 후련하게 파준 일로 일약 유명해진다. 우연한 실수로 고객들의 머리 속 정신세계를 엿보게 된 제불찰은 이 비밀스런 탐험에 빠져드는데, 어느 날 꽃미남 국회의원 최고봉의 귀청소 중 그의 머리 속에서 누나와 자신의 어릴적 모습을 만나게 된다. 누나를 뺏어갔던 그의 머리 속에 담겨있는 누나의 기억을 보는 제불찰은 악몽을 꾸고 있는 것 같다. 제불찰이 그리워한 누나는 어디 있는가?  다분히 몽환적인 이적의 소설집 <지문사냥꾼>은 공상의 세계를 꿈구는 애니메이터들의 상상력을 끊임없이 자극했다. 이적의 소설집에 담긴 여러 단편 중 두 편의 작품이 최종 물망에 올랐다. 표제작인 <지문사냥꾼>과 이 소설집에서 제일 길고 흥미로운 이야기인 <제불찰 씨 이야기>. 이미 이 책을 읽은 감독들도, 애니메이션 작업을 위해 부랴부랴 이 책을 읽은 감독도 왠지 모르게 모두 <제불찰 씨 이야기>에 마음을 빼앗겼다. 한 인물의 일대기를 담고 있다는 점, 이야기의 완결성이 뛰어나다는 점 등이 애니메이션으로 만들어 보고 싶다는 욕망을 자극했다. 게다가 이 소설에는 ‘머릿속 공간’이라는 특별한 세계가 등장한다. 아무도 가본 적이 없지만 모든 사람들이 자기 안에 갖고 있는, 그래서 한 번쯤은 그 모양에 대해 궁금증을 가졌던 곳이 바로 사람의 머릿속 공간이다. 공상의 세계를 즐기는 애니메이션 감독의 입장에서 머릿속 세계를 그려볼 수 있다는 것은 더할 나위 없이 매력적인 일처럼 느껴졌다. (발췌: 씨네21북스 출간, “장편 애니메이션 제불찰 씨 이야기” 중에서)  한국 대중음악의 뮤지션이자 작가인 이적의 원작을 애니메이션으로 옮겼다. 사람들은 거미 한 마리의 공개사형 여부를 시청자들에게 미디어를 통해 질문한다. 이 거미는 알고 보면 제불찰씨라는 사람이었던 것. 그의 기구한 사연이 다양한 인생유전을 따라 펼쳐진다. 방송국에서는 전대미문의 쇼가 열리고 있다. 현역 국회의원을 미치게 한 혐의로 잡혀온 거미 한 마리의 공개 사형 여부를 시청자들에게 묻고 있는 것. 문제의 거미는 사람들의 귀지를 청소해주는 '이구소제사' 제불찰로, 사형 찬반 투표를 위해 제불찰이 거미가 되기까지의 사연이 펼쳐지는데....,,,,,,,,,,,,,,,,,,,,,,,,,,,,,,,,,,,,,,,,,,,,,,,,,,,,,,,,,,,,,,,,,,,,,,,,,,,,,,,,,,,,,,,,
2009,47332,조용한 혼돈,드라마, 멜로/로맨스,안토니오 루이지 그리말디,난니 모레티, 발레리아 골리노, 알레산드로 가스만,우연히 익사 직전의 여성을 구한 피에트로 팔라디니. 하지만 집으로 돌아온 그를 맞이하는 건 심장마비로 죽은 아내의 시신이다. 성공한 사업가이자, 행복한 가장이었던 그의 삶에, 이제 조용한 균열이 일어나기 시작한다. 갑자기 엄마를 잃은 딸이 걱정되어 조금이라도 가깝게 있고 싶은 마음에 그는 매일 딸의 학교 앞 공원에서 시간을 보내게 되는데...  영화제 소개글. 주연배우 난니 모레티 때문에 더욱 그렇겠지만 &amp;lt조용한 혼돈&amp;gt은 그가 감독, 주연을 맡았던 2001년 작 &amp;lt아들의 방&amp;gt을 떠올리게 한다. 그가 동명의 소설을 원작으로 한 이 영화의 공동 시나리오 작가로도 참여했기 때문일까? 루퍼스 웨인라이트, 라디오 헤드, 이바노 포사띠의 음악들이 삽입돼 슬픔을 일상생활에 녹여내는 사려깊은 피에트로를 보는 우리의 감정을 고조시킨다.  2008 베를린영화제 경쟁, 2008 이탈리아 도나텔로 어워드 음악상, 남우조연상, 2008 충무로영화제 경쟁.,,,,,,,,,,,,,,,,,,,,,,,,,,,,,,,,,,,,,,,,,,,,,,,,,,,,,,,,,,,,,,,,,,,,,,,,,,,,,,,,,,,,,,,,,,,,,
2009,70045,좋아서 만든 영화,다큐멘터리,고달우, 김모모,조준호, 황수정, 손현,밴드 이름이 뭐냐는 질문에 “그냥 저흰 좋아서 하는 건데요”라고 대답해 팀명을 정한 ‘좋아서 하는 밴드’. 음악이 좋아서, 사람이 좋아서 길거리에서 어쿠스틱 음악을 들려주던 이들은 서울, 제천, 부산 등 전국으로 초대받지 않은 투어를 떠난다. 시간이 흐를수록, 좋아서 시작했지만 그 일이 항상 행복한 것만은 아님을 깨닫게 되는 멤버들은 자신이 정말 좋아하는 것은 무엇인지 고민하게 되고, 서로 간에 갈등도 일어난다. 하고 싶은 일을 하며 산다는 것…누구나 한번쯤 꿈꿔봤을, 하지만 결코 쉽게 이룰 수 없는 현실에 대한 공감 가는 이야기들이 시작된다.,,,,,,,,,,,,,,,,,,,,,,,,,,,,,,,,,,,,,,,,,,,,,,,,,,,,,,,,,,,,,,,,,,,,,,,,,,,,,,,,,,,,,,,,,,,,,,,
2009,53159,주온 - 원혼의 부활,공포,아사토 마리, 미야케 류타,카고 아이, 미나미 아키나,주온 탄생 10주년'을 기념하여 제작된 &amp;lt주온 - 하얀 노파&amp;gt, &amp;lt주온 - 검은 소녀&amp;gt 2편을 하나로 묶어 개봉예정.  [주(呪): 하얀 노파] 비극의 일가족 살인사건이 일어난 저주 받은 집. 목이 잘려 살해된 어린 소녀 ‘미라이’, 처참하게 살해된 일가족. 10년 후, 어린 시절 단짝 친구였던 ‘미키’의 집 앞을 지나던 ‘아카네’는 결코 끝나지 않은 원한의 저주에 휩싸이게 된다!  [온(怨): 검은 소녀] 원인불명의 소녀 환자 ‘후키에’를 맡게 된 간호사 ‘유코’는 태어나지 못한 쌍둥이 자매가 ‘후키에’ 몸 속에서 죽어 있는 것을 발견한다. 세상의 빛조차 마주하지 못하고 죽어간 소녀의 ‘분노’는 피할 수 없는 ‘검은 원혼’이 되어 저주받은 집으로 향한다!,,,,,,,,,,,,,,,,,,,,,,,,,,,,,,,,,,,,,,,,,,,,,,,,,,,,,,,,,,,,,,,,,,,,,,,,,,,,,,,,,,,,,,,,,,,,,,,,,,,
