year	code	title	genre	directors	actors	story
2017	154052	사랑과 욕망의 짐노페디	드라마, 멜로/로맨스	유키사다 이사오	이타오 이츠지, 아시나 스미레, 오카무라 이즈미	베를린영화제 감독상을 수상할 정도로 한때는 잘 나갔지만 B급 성인영화감독으로 전락한 주인공 ‘신지’(이타오 이츠지).더 이상 작품이 없어 무력한 하루하루를 보낼 수밖에 없는 ‘신지’의 비통함은 커져만 가고, 꺾여버린 그의 현실은 도무지 나아질 기미가 보이질 않는다.한편 ‘신지’의 고독한 매력은 주변 여성들을 묘하게 자극하고, ‘신지’는 그녀들과 관계하며 위안을 얻고자 하는데…애잔한 짐노페디의 선율을 따라 흘러가는 그의 일주일은 해피 엔딩으로 끝날 수 있을까?
2017	158748	사랑받지 못한 여자	드라마, 멜로/로맨스	노진수	김화연, 신원호	군대를 갓 제대한 도경(신원호)은 외딴 섬으로 향하는 배에서 신비로운 매력을 지닌 가인(김화연)을 만나고, 물거품으로 사라질듯한 그녀의 가녀린 자태에 묘한 끌림을 느낀다.그 날 저녁, 두 사람은 ‘유바리’라는 이름의 술집에서 다시 만나 하룻밤을 보내게 되는데…가인의 마음 속에 품고 있던 욕망은 점차 커져가고 도경은 거부할 수 없는 그녀의 집착에서 벗어나기 위해 몸부림친다.
2017	146374	사랑의 시대	드라마, 멜로/로맨스	토마스 빈터베르그	트린 디어홈, 율리히 톰센, 마샤 소피 발스트룀 한센	대저택을 상속 받은 에릭 부부와 그의 딸 프레아는 친구들과 함께 ‘공동체 생활’을 시작한다.진한 우정과 깊은 사랑을 나누며 모두가 꿈꿔왔던 그들만의 유쾌한 생활을 만들어나가던 어느 날,   한 여자의 등장으로 그들의 평화롭던 사랑의 시대는 흔들리기 시작하는데…
2017	140010	사랑하기 때문에	코미디, 멜로/로맨스	주지홍	차태현, 김유정, 서현진	사랑하는 그녀에게 고백하러 가던 날,갑작스러운 사고로 사랑에 서툰 사람들의 몸에들어갈 수 있는 뜻밖의 능력(?)을 가지게 된작곡가 '이형'(차태현)  여고생 K양을 시작으로 이혼위기 P씨, 모태솔로 노총각 Y씨첫사랑만 찾는 치매할머니 K씨까지!유일하게 자신의 비밀을 알아챈 4차원 소녀'스컬리'(김유정)의 도움으로 인생 최대의 위기를 기회로 바꿔보기로 한다.  '이형'은 과연 인생 최고의 순간을 맞이할 수 있을 것인가?
2017	159406	사망탑의 결전	액션	오사원	이소룡, 김태정, 황정리	무술 고수 '진강'은 무술 수련은 뒷전이고 놀기만 하는 동생 '진국' 때문에 걱정이 태산이다.그러던 어느 날, 진강은 절친한 친구 '진곡'이 죽었다는 소식을 듣게 된다.스승으로부터 진곡에게 숨겨둔 딸 '시미코'가 있다는 이야기를 들은 진강은 그녀를 찾아 나선다.시미코는 일본 긴자의 한 클럽에서 노래를 부르고 있었는데, 진강에게 아버지가 한달 전에 갑자기 나타나 전해주고 갔다는 상자를 내민다.하지만 그 때 갑자기 쳐들어온 정체 불명의 남자들!공격하는 그들을 간신히 물리친 진강은 진곡의 장례식에서도 수상한 남자들을 만나고, 진곡의 죽음에 석연치 않은 무언가가 숨겨져 있음을 직감하는데...
2017	159559	사슬-두여자의유혹	멜로/로맨스, 스릴러	박선욱	홍새희, 정향, 민도윤	사라진 애인으로 신경질적인 민아의 정신과 육체를 위로하는 진경. 진경이 있어 민아는 다행이다. 어느 날 민아는 수강생 윤재를 만나게 되고, 전 남친을 닮은 외모와 체취에 홀리듯 윤재에게 좋은 감정을 느끼게 되는데, 윤재는 민아를 유혹하여 강제로 겁탈한다. 이를 알게 된 진경은 윤재에게 접근하는데…민아, 진경, 윤재의 사슬같이 엉키고 꼬인 사랑의 결말은 과연 어떻게 될까?
2017	142633	사월의 끝	드라마, 스릴러, 미스터리	김광복	박지수, 이빛나, 장소연	낡은 아파트에 공무원 시험 준비생 ‘현진’이 이사를 온다.음산한 기운이 감도는 동네, 그리고 수상한 주민들.옆집 여고생 ‘주희’의 과외를 맡게 된 현진은주희 가족의 은밀한 사연을 듣게 되면서 그녀에게 연민을 느낀다.어느 날 같은 동네에 사는 누군가를 죽이고 싶다고 이야기 하는 주희.그리고 며칠 후 실제로 그들이 살해 당하자 현진은 주희를 의심한다.이 소식을 들은 또 다른 여자, 주민센터 사회복지담당 박주무관은오랫동안 잊고 지낸 한 아이의 얼굴을 떠올리며 낡은 아파트로 향한다.
2017	156153	사이코메트리	드라마, 스릴러	토마스 로스	조 우드콕, 코스모 자비스, 제임스 코스모	상류층들만 노리는 연쇄 살인마 엠마.국가는 가장 위험한 현상 수배자로 그녀의 행방에 주목하고 있다.그리고 그녀를 쫓는 한 사람. 소리를 형상화 시킬 수 있는 초능력을 가진 형사 가브리엘. 그는 뛰어난 사이코 메트리 능력으로 그녀의 살인 사건을 형상화 하며그녀를 압박하기 시작하는데…과연 엠마의 폭주 살인을 막고 그녀의 비밀을 풀어낼 수 있을 것인가?
2017	90922	사일런스	드라마	마틴 스코세이지	앤드류 가필드, 리암 니슨, 아담 드라이버	17세기, 선교를 떠난 ‘페레이라’ 신부(리암 니슨)의 실종 소식을 들은 ‘로드리게스’(앤드류 가필드)와 ‘가르페’(아담 드라이버) 신부는 사라진 스승을 찾고 복음을 전파하기 위해 목숨을 걸고 일본으로 떠난다. 천주교에 대한 박해가 한창인 그 곳에서, 두 신부는 어렵게 믿음을 이어가고 있는 사람들과 마주하게 된다. 생각보다 훨씬 더 처참한 광경을 목격한 두 신부는 고통과 절망에 빠진 이들에게 침묵하는 신을 원망하며 온전한 믿음마저 흔들리게 되는데…
2017	138103	사임당 빛의 일기		윤상호	이영애, 송승헌, 오윤아	조선시대 사임당 신씨의 삶을 재해석해 그의 예술혼과 불멸의 사랑을 그린 드라마
2017	168517	사촌누나와 동거	에로, 멜로/로맨스	김순수	이은미, 강민우	공대생 현우와 작가지망생 지윤은 사촌지간으로, 집안끼리 가까워 어릴 적부터 친하게 지냈다. 어른들은 둘만 집에 두고 종종 모임에 나갔다오곤 했는데, 그러면서 진호와 하나는 같이 잠을 자며 친형제 이상의 유대감을 쌓았다.그러다 서로를 이성으로 의식하기 시작하고, 결국 건너서는 안 될 강을 건너버린 둘. 부모님에게 둘 사이 관계를 들켜버린 뒤 현우네 집이 멀리 이사를 가며 둘의 관계도 끝나버린다.그 후, 십 여년이 지나 성인이 된 두 사람은 한집에서 생활하게 되는데…
2017	159523		
2017	159734	사쿠라다 리셋 -전편-	SF	후카가와 요시히로	노무라 슈헤이, 쿠로시마 유이나, 타이라 유우나	주민의 절반이 특수한 능력을 가진 마을 “사쿠라다”아사이 케이는 「기억유지」능력을 가진 고등학생으로, 케이와 함께 행동하는 하루키 미소라는 세계를 최대 3일 전까지 되돌리는 「리셋」능력을 가지고 있다.「리셋」을 하면 하루키는 자신의 기억도 전부 잊게 되지만, 케이의「기억」은 절대로「리셋」되지 않아 두 사람이 함께 능력을 쓰면 세계를 최대 3일 전까지 다시 시작할 수 있다.하지만 그런 케이와 하루키에게도 돌이킬 수 없는 “과거”가 있었다.그것은 2년 전,「리셋」의 영향으로 죽은 동급생, 소마 스미레에 관한 것이었는데.어느 날 케이는 소속된 “봉사클럽”에서 고등학교 봉사활동의 일환으로 의뢰를 받는다. 능력을 빼앗겨버린 사사노의 의뢰를 받은 케이는 유폐당한 “마녀”와 만나게 되는데…
2017	159735	사쿠라다 리셋 -후편-	멜로/로맨스, SF	후카가와 요시히로	노무라 슈헤이, 쿠로시마 유이나, 타이라 유우나	평온하던 사쿠라다 시 곳곳에서 “능력폭주사건”이 발생하게 된다.사쿠라다의 능력자를 제어하는 관리국 대책실 실장인 우라치 마사무네는 ‘말소 계획’을 실행, 마을에서 능력을 소멸시켜 버린다.이후, 사쿠라다에서 능력이 있었다는 기억을 가진 사람은 이 세계에서 아사이 케이 단 한 명이 되고 말았다.케이는 자신의 과거와 마주하며 처음으로 사쿠라다 마을을 나가게 되는데.능력자의 마을 “사쿠라다”에서 성스러운 재생을...장대한 청춘 미스터리가 드디어 마침표를 찍는다!
2017	154358	사탄의 영혼	공포, 스릴러	제프 프루그	미건 워너	말로리와 어거스트 커플은 말로리의 할머니 간병을 위해 그녀의 집에 가게 된다. 할머니는 자꾸 로딜리라는 광대를 찾으며 기이한 행동을 하고, 그 집에서는 이상한 일이 일어난다. 한편 말로리는 어릴 때 떠난 줄 알았던 엄마를 할머니가 죽였단 걸 알게 되고, 복수에 눈이 멀어 할머니를 끔찍하게 살해하게 된다. 그 이후 말로리 와 어거스트는 끔찍한 일들을 겪게 되는데...
2017	164335	산상수훈	드라마	유영의	백서빈	천국이 정말 존재 하는 걸까?착하게 살면, 나는 정말 천국에 갈 수 있을까?하나님은 선악과를 왜 만들어 우리를 시험에 빠트렸을까?하나님은 왜 나의 고통은 돌봐 주시지 않는 걸까?누구도 속 시원히 말해준 적 없었던 신과 인간과의 관계감히 말할 수 없어 묻어뒀었지만 누구나 한 번쯤은 떠올렸던 궁금증들.무조건적인 믿음만으로 강요될 수 없는난해하고 철학적인 질문들이 점차 논리적으로 증명되어 가는데....
2017	159002	산타 클라리타 다이어트			드류 베리모어, 티모시 올리펀트, 리카르도 차비라	산타 클라리타에 사는 부동산업자인 부부가 막연하고 불안한 삶을 살아가던 중 죽음과 파괴 등의 극적인 변화를 긍정적으로 겪어나가게 되는 이야기
2017	137890	살인자의 기억법	범죄, 스릴러	원신연	설경구, 김남길, 설현	예전에는 연쇄살인범이었지만 지금은 알츠하이머에 걸린 병수.우연히 접촉사고로 만나게 된 남자 태주에게서 자신과 같은 눈빛을 발견하고 그 역시 살인자임을 직감한다. 병수는 경찰에 그를 연쇄살인범으로 신고하지만 태주가 그 경찰이었고, 아무도 병수의 말을 믿지 않는다.태주는 은희 곁을 맴돌며 계속 병수의 주변을 떠나지 않고,병수는 혼자 태주를 잡기 위해 필사적으로 기록하고 쫓지만 기억은 자꾸 끊기고,오히려 살인 습관들이 되살아나며 병수는 망상과 실제 사이에서 혼란스러워진다. 다시 시작된 연쇄 살인사건, 놈의 짓이 맞을까!  네 기억은 믿지 마라! 그 놈은 살인자다!
2017	151130	삼인행: 생존 게임	액션, 범죄	두기봉	고천락, 자오웨이, 종한량	과잉진압의 실수로 용의자에게 상해를 입히고 공범까지 놓친 형사 ‘첸’(고천락)머리에 총상을 입고 급히 수술을 받아야 함에도 병원 탈출을 계획하는 용의자 ‘슌’(종한량)일전에 일어난 의료사고로 자신의 능력을 입증해야만 하는 신경외과 의사 ‘통’(자오웨이) 자신의 실수를 감추기 위해 ‘첸’은 급기야 ‘통’을 이용해 ‘슌’을 죽이기로 결심하고 생사가 오가는 병동은 극한 대치상황으로 치닫게 되는데...한정된 병동 안에서 벌어지는 쫓고 쫓기는 추격전!두기봉 감독의 스타일리쉬한 총격전이 다시 시작된다!
2017	151559	새벽의 저주: 좀비랜드	SF, 공포	글렌 밀러	이온 버틀러, 앤드류 아스퍼, 라라 네스토르	에덴 야생 동물원은 생전 야생동물 보호에 삶을 바쳤던 할아버지의 뜻을 따라 ‘앨런’이 야심 차게 준비한 동물원 겸 복합 놀이공간.앨런은 개장을 앞두고 대학생 인턴 사원을 채용해 최종 점검에 나서지만 수의 병동에서 치료 중이던 원숭이로부터 알 수 없는 바이러스가 발생해 급속도로 동물원 전체로 퍼져나간다.사장인 앨런을 비롯한 보안요원과 인턴들의 노력에도 불구하고 바이러스에 감염된 동물들은 미친 듯이 날뛰며 사람들을 공격한다.신고를 접수 받은 경찰도 질병 통제센터의 허가를 기다려야 한다고만 하고, 그 사이 대부분의 동물들이 감염되어 사상자 수도 점점 늘어만 가는데..정체불명의 바이러스 앞에 인류는 무사할 수 있을까?
2017	165563	새엄마 2: 그녀의 남자가 되다	멜로/로맨스	강정훈		이혼 후 작은 인테리어 회사를 운영하는 카즈야는 섹시한 여직원 미오의 고백을 받고 사귀기로 한다.하지만 바람기를 주체 못한 카즈야는 또 다른 여자와 짜릿한 쾌락을 즐기고, 화가 난 미오는 보란 듯이 카즈야의 아들 나오키에게 육탄 공세를 펼친다. 아버지의 여자와의 뜨거운 하룻밤.
2017	159507	새엄마 새누나	멜로/로맨스, 드라마	김민식		어느 날, 아버지 진이 부원장으로 있는 병원에 입원하게 된 야스. 마침 그 병원의 의사이자 아버지 재혼 상대자의 딸 치세가 그의 옆자리로 입원하게 된다. 둘은 곧 서로에게 감정을 느끼고, 병실에서 격정의 사랑을 나누게 된다. 그런데 그들의 관계에 대한 소문이 퍼져 결국, 아버지, 어머니의 귀에 들어가게 되고, 그 사실에 놀라워하던 야스의 아버지는 뜻밖의 계획을 세운다. 그는 며칠 뒤, 진찰을 핑계로 치세의 몸을 더듬고.. 같은 시간, 야스는 아버지의 재혼을 막으면 치세가 자신을 받아줄 거라는 생각에, 치세 어머니의 진료실로 찾아가 그녀를 범하며 영상을 찍기 시작하는데...
2017	157415	새엄마: 아들의 여자가 되다	멜로/로맨스	사카모토 후토시	카타세 마코, 하네다 치사토	새엄마라고 하기엔 너무나 매력적인 그녀.아버지, 아들, 그리고 새엄마 간에 시작된 파격 삼각관계.금지된 욕망은 더욱 더 그들의 몸을 뜨겁게 만든다.
2017	170637		
2017	170659	새엄마:하고 싶은 여자	멜로/로맨스, 드라마	키무라 히로유키		재혼한 남편의 아들 나오키, 은둔생활 5년째인 그는 쉽사리 그녀에게 마음을 열지 않는데, 어느 날 무심코 나오키의 방문을 연 그녀는 그의 자위현장을 목격하고, 놀란 그녀의 모습에 나오키는 드디어 마음의 문을 열지만… 쌓인 욕망을 그녀에게 풀어버리는 나오키.
2017	153346	색시공...주홍글씨의 비밀	멜로/로맨스, 드라마	김문옥	김지니, 이성훈	색시공(色是空)이란? 세상에 존재하는 모든 것은 사라진다-라는 뜻이다.따라서 이 영화의 테마는 인간의 존재의 의미를 ‘근친상간’이라는 충격적인 소재를 통하여 문득 ‘에로티시즘’을 연상 시키는듯하나, 절제된 연출 표현으로 차원이 다른 각도에서 인간 본연의 삶과 죽음을 재조명 하고 있다.서울근교에 위치한 3층짜리 빌라에, 1층에는 젊은 미망인 ‘과부’가 살고 있었고, 2층에는 해외 출장중인 독신 대학교수의 애완견 토토의 강아지 밥을 주기 위한 알바를 하느라 ‘학생’이 거주하고 있고, 3층에는 단란주점에서 노래도 하고 술을 파는 술집여자 ‘여자’가 살고 있었다.평소와 마찬가지로 단란주점에서 밤새 영업을 마친 ‘3층여자’가 오토바이로 퇴근을 하여 샤워를 하는 등 ‘3층여자’의 일상에서 영화는 시작된다. (중략)
2017	119546	샤룩칸의 팬	스릴러, 액션	마니쉬 샤르마	샤룩 칸, 디피카 아민	팬은 가라브(샤룩 칸)라는 젊은 20대 남자의 이야기이다. 그가 살고 있는 세상은 슈퍼스타인 영화배우 아리안(샤룩 칸)를 중심으로 돌아간다. 그에게 아리안은 신과 같은 존재이다. 젊은 가라브는 자신의 생일에 소원을 신께 빌기 위하여 꿈의 도시 뭄바이를 향한다. 그는 영화배우 아리안의 최고의 팬이였고, 그와 닮은점도 많았다. 그렇게 그는 자신의 슈퍼스타에게 찾아가게 된다. 그러나 일들이 계획대로 되지 않을때 가라브의 사랑과 열정이 넘지 말아야 할 선을 넘게 되는 위험한 집착으로 바뀌게 되는데...[제21회 부산국제영화제]
2017	165546	샤오린 2017: 소림 고수전	액션	도효		무림 도적패를 이끄는 대장 소제갈은 중국 역사상 가장 위대한 황제였던 청나라 강희제의 진귀한 보물함을 빼앗는다. 이를 되찾으려 찾아온 소림사의 승려들까지도 모두 죽이라고 명령하는 소제갈. 이들의 사악한 술수에 승려들은 속수무책으로 당한다. 소림사의 명예를 되찾고 강희제의 보물을 되찾기 위해 소림사 최고의 고수들이 이들 앞에 나타난다.
2017	160135	서서평, 천천히 평온하게	다큐멘터리	홍주연, 홍현정	하정우, 윤안나, 안은새	약 100여 년 전, 가난하고 억압받던 조선 땅에 '작은 예수'라 불리는 파란 눈의 여인이 있었다. 나환자와 걸인, 무지하고 힘없는 여성들의 어머니 ‘서서평’ 선교사. 이일학교(한일장신대학교 전신), 조선간호부회(대한간호협회 전신), 여전도회연합회 등을 창설하여 여성운동과 간호 분야에 힘쓴 그녀는 고아 14명을 자녀 삼고, 오갈 곳 없는 과부 38명과 한집에 머물렀다. 상처 많았던 그녀가 낯선 땅을 품고, 조선의 작은 밀알이 되어 상한 영혼들을 치유하기까지… 한 여인의 슬픔과 한 그리스도인의 뜨거움, 한 선교사의 치열함으로 가득한 이야기가 찾아온다.
2017	142323	서유기3: 월광보합 리턴즈	액션, 판타지, 코미디	유진위	한경, 당언, 막문위	인간으로 환생한 자하는 자신의 운명을 알기 위해 월광보합을 이용하여 과거로 가서 천서를 훔쳐본다.그렇게 자신이 지존보와 함께 있으면 죽는다는 걸 알게되고,지존보를 백정정에게 보내려 하지만 실패하고 만다.결국 자하는 자신이 우마왕과 혼인하면 모든 게 순리대로 될 거라고 믿고 우마왕을 찾아가는데...
2017	127346	석조저택 살인사건	스릴러, 서스펜스	정식, 김휘	고수, 김주혁, 문성근	해방 후 경성, 거대한 석조저택에서 두 남자가 마주한다.그리고 울린 여섯 발의 총성.최초 신고자의 전화를 받고 경찰이 출동하고, 운전수 ‘최승만’을 살해한 혐의로 경성 최고의 재력가 ‘남도진’이 체포된다. 하지만 현장에 남은 건 사체를 태운 흔적과 핏자국, 그리고 잘려나간 손가락 뿐. 미스터리한 석조저택 살인사건을 두고 치열한 법정공방이 벌어지는데… 정체불명의 운전수 최승만(고수) 경성 최고의 재력가 남도진(김주혁) 사건을 무마하려는 변호사(문성근) 유죄를 입증하려는 검사(박성웅)치밀하게 계획되고 잔인하게 실행된 살인사건! 이 모든 것은 누군가가 설계한 속임수다!
2017	152600	선 섹스 후 사랑	멜로/로맨스	김현철	최민호	"언더웨어 디자인회사에서 근무하고 있는 공수는 같은 회사 동료인 신입 디자이너 수연을 짝사랑한다.대기업 디자인PT를 준비하던 공수는 수연에게 자신의 마음을 고백하기로 결심하고 호시탐탐 고백할 기회를 노리지만 그 기회는 잘생기고 능력까지 갖춘 직장 상사인 이과장에 의해 매번 무산되고 만다. 어느날 실의에 빠져 살던 공수에게 운명처럼 마법팔찌가 나타나고 마법팔찌가 가진 놀랍고 신비로운 힘을 이용해 자신의 욕망을 조금씩 채워나가는 공수는 팔찌의 힘을 빌어 수연에게 다가가게 되는데..."
2017	165588	성 심청전		이슬	안소희, 가희, 최세웅	거액의 재산을 가진 맹인 남자. 허세와 거짓으로 사는 남자 간호사. 그리고, 실오라기 하나 걸치지 않은 알몸으로 집안을 은밀히 활보하는 여자. 각기 다른 세 사람이 외딴 섬 같이 거대한 저택에서 충격적인 숨바꼭질을 시작한다.불의의 사고로 시력과 가족을 모두 잃게 된 명우는 시골 변두리에 좋은 집을 짓고 하루하루 무료하게 살고 있다. 이따금씩 고급콜걸을 불러 성욕을 해결하곤 하지만 앞이 보이지 않는 어둠의 장막 속에서 중년의 쓸쓸함과 다가올 노년의 외로움은 깊어만 간다. 명우를 도와줄 돌보미로 동수가 찾아오게 되고 이 둘의 관계는 처음의 어색함에서 서로 신뢰하는 브로맨스로 발전하게 된다. 동수는 시골생활의 무료함도 달랠 겸 여자친구 호란을 명우의 집으로 초대하고 셋은 저녁식사를 하게 되고 간만에 둘은 뜨거운 밤을 보내게 된다. 헤어지기 싫은 동수는 딱히 갈 곳 없는 호란에게 묘한 제안을 하다. 다음날 동수는 명우 몰래 호란을 자기 방에 지내게 하고 셋은 위험한 동거를 시작하게 되는데…
2017	168309	성 프란치스코	드라마	르노 페리, 아노드 루베	엘리오 게르마노, 제레미 레니에	1209년 여름, 프란치스코와 ‘작은형제회’는 평등한 인간, 무소유의 삶을 교리로 삼고 교황청에 정식으로 새로운 수도회 설립을 인준해줄 것을 요구하지만 지나치게 이상적인 교리라는 이유로 거절당한다.그러면서 ‘작은형제회’ 안에서 프란치스코에 반대하는 목소리가 높아지는데…
2017	168520	성판17: 남자들의 17가지 성적 판타지	멜로/로맨스, 코미디	송은주	최재환, 박경희	기하가 꿈꾸는 성적 판타지…난데없이 나타난 조희가 실현시켜 준다. 그녀는 누구인가?여자친구 영은이 딴 남자와 침대에서 뒹굴고 있는 모습을 본 기하! 오 마이 갓!격한 배신감에 사무쳐 있을 즈음, 난데없이 기하가 사는 옥탑 옆 건물에 조희가는 여자가 이사를 온다.예쁘고 다정해 보이는 조희, 기하에게 호감을 보이는 것은 물론 제대로 된 섹스 경험이 없는 기하가 “소원이 섹스…”라고 하자,한 술 더 떠서 기하의 판타지 속 섹스를 실현해 주겠다고 한다.단 3주 후면 조희는 어딘가로 떠나야 한다고 하는데…
2017	166583	세 번째 살인	서스펜스, 드라마	고레에다 히로카즈	후쿠야마 마사하루, 야쿠쇼 코지, 히로세 스즈	그는 자백했고, 사형은 확실했다승리밖에 모르는 냉정한 변호사 시게모리모든 범행을 자백한 살인범 미스미그리고 피해자의 딸 사키에또 한 번 진술이 번복되자, 모든 것에 의심이 가기 시작했다
2017	156431	세가지색 판타지 - 반지의 여왕		권성창	김슬기, 안효섭, 윤소희	못난 얼굴에 모난 마음이 절정에 닿을 즈음 가문의 비밀을 간직한 절대 반지를 물려받게 된 주인공의 모습을 그린 코믹 드라마
2017	154611	세가지색 판타지 - 우주의 별이		김지현	수호, 지우	오빠 팬심이 넘치는 저승사자 별이와 요절이 예상되는 가수 우주가 펼치는 시공을 초월한 감각 로맨스
2017	109933	세상의 모든 엄마와 딸들	드라마	폴 더드리지	셀마 블레어, 커트니 콕스, 크리스티나 리치	세상에 태어나 처음 엄마와 딸이 된 그녀들전부 처음 겪는 일이기에 서툴고 어려워 서로가 서로를 이해하지 못하고 오해만 쌓여간다.잘 지내보려고 노력하지만 오히려 관계는 점점 악화되어만 가는데…그래도 사랑할 수 밖에 없는 이 세상 하나뿐인 존재, 엄마와 딸
2017	149059	세일즈맨	드라마	아쉬가르 파라디	샤하브 호세이니, 타라네 앨리두스티	연극 ‘세일즈맨의 죽음’을 준비 중인 젊은 부부 ‘라나’와 ‘에마드’.살고 있던 건물이 붕괴될 위기에 처하자 이전 세입자의 물건들이 남아 있는 기이한 느낌의 아파트로 이사를 간다. 하지만 남편 '에마드'가 집을 비운 어느 날, 그들의 삶이 송두리째 바뀌는 사건이 일어나는데...
2017	157406	섹스메이트	멜로/로맨스, 스릴러	이슬	이현정, 이유림	따뜻한 사랑 한번 받지 못하고 고아원에서 자라 인생의 어떤 희망도 없이 뭇 사내들에게 몸을 팔며 건조하게 살아갈 뿐인 보도방녀 미란. 발버둥 칠수록 더욱 삶의 굴레는 무거워 지고 끝내 보도 방을 택할 수 밖에 없었던 여대생 세희. 보도방 첫 출근에서 세희는 돌이킬 수 없는 사고가 생긴다. 그로인해 세상에 방치되고 인생을 알기도 전에 벼랑으로 내몰린 두 여자는 자살여행을 떠난다.
