year	code	title	genre	directors	actors	story
2017	129017	인투 더 포레스트	스릴러	패트리샤 로제마	엘렌 페이지, 에반 레이첼 우드	전기가 모든 생활의 에너지가 된 멀지 않은 미래, 넬과 에바는 아버지와 함께 숲 속에서 생활하며 안락한 시간을 보낸다.하지만 어느 날 갑자기 전기 공급이 차단되자 두 자매와 아버지는 음식도 정보 공유도 불가능한 상황에 처하게 된다.전기 부족으로 마을로 나가 구호물품조차 수급할 수 없는 자매들은 숲에서 필요한 자원을 구해 생활을 연명하지만, 사고로 아버지조차 사망하게 되면서 더 큰 위기에 빠지게 되고 마을 사람들마저 숲으로 들어오게 되면서 자매는 점점 더 큰 위협에 노출되는데...
2017	138295	인페르날	공포	브라이언 코인	앤디 오스트로프, 헤더 아데어, 앨리사 코에너	네이슨과 소피아는 예상치 못한 임신으로 결혼식을 하게 된다. 둘 사이에 갖게 된 딸 이모진은 자폐증세가 있는 아이로 자신의 다락방에 알 수 없는 괴물이 출현한다고 한다. 소피아는 이모진을 치료하려고 하지만 네이슨은 딸이 정상이라 믿는다. 점점 증세가 심해지는 이모진을 위해 소피아는 네이슨의 반대에도 불구하고 자신의 어머니와 신부님을 불러 퇴마의식을 진행하려 한다. 네이슨도 소피아의 의견에 결국 동조하고 다음날 아침 신부님과 상담을 하기로 약속하지만 그날밤 이미 이모진은 악마에게 정신을 지배 당하게 되는데..
2017	170675	인피니티 포스 스페셜 에디션 1	애니메이션	스즈키 키요타카		무료한 일상을 보내던 에미는 바이크 곡예운전이라는 새로운 놀이를 찾아낸다.그런데 우연히 지나가던 시부야 한복판에서 갑자기 내려 꽂힌 빛을 맞게 되는데…그 빛이 사라지면서 이상한 차림을 한 전사들과 이상한 기계군단이 나타난다.에미의 집에서 당분간 지내게 된 켄, 테츠야, 타케시, 죠지. 죠지는 평행세계들이 소멸하고 있으며, 그 범인이 Z라는 인물이라고 설명한다.그리고 그 세계들을 소멸시키는 힘을 가진 케이스가 지금은 에미의 손에 있다는 것을…데미안 그레이와 홀로 싸우러 갔다가 부상당한 타케시. 그리고 데미안 그레이는 운석을 낙하시켜 대형 참사를 일으키려 한다.사람들을 지키기 위하여 히어로들은 힘을 합쳐 운석을 막고 데미안 그레이를 쓰러뜨리기로 하는데…억지로 핼러윈 파티에 참석하게 된 에미는 영 불편한 기분이었다.친구 마리아의 이야기 하나하나가 신경에 거슬려 견딜 수 없었던 에미는 결국 파티장을 뛰쳐나가는데…뒤쫓아온 마리아와 다투고 또다시 밤길을 헤매던 에미는 처음 보는 여자 괴인과 마주친다.
2017	158466	일본 엄마	멜로/로맨스	김무원	안민상, 아시타 유키	아들 기호가 결혼하겠다며 일본에서 데려온 그녀, 유키.그러나 기호는 한국에 오자 전 여친을 만나며 바람을 피우기 시작한다.처음에는 예비 며느리를 달래는 마음으로 유키를 위로하던 민철은어느 순간부터 자신이 유키를 여자로 보고 있다는 사실을 깨닫는다.결국, 기호 몰래 민철과 유키의 뜨거운 정사가 펼쳐지는데...
2017	148996	일주일간 친구	멜로/로맨스, 드라마	무라카미 쇼스케	야마자키 켄토, 카와구치 하루나	“며칠만이라도, 너의 단 한사람이 되고 싶어”일주일이면 모든 기억이 리셋 되어 버리는 ‘후지미야’모든 친구관계를 단절한 채 자발적 외톨이로 교내 생활을 이어가던 그녀의 앞에일주일마다 똑 같은 고백을 하는 끈질긴 녀석, ‘하세’가 등장한다.“상관 없어. 월요일이 되면 변함없이 물어 볼게”굳게 닫힌 ‘후지미야’의 일상에 변화가 생기려던 그때,‘후지미야’의 오랜 친구 ‘하지메’가 그녀 앞에 나타나고깨질 듯 아프게 머리를 헤집는 기억들이 되살아 나기 시작하는데…‘후지미야’의 기억 너머에는 무슨 일이 있었던 걸까과연 ‘하세’는 ‘후지미야’와 일주일간 친구가 될 수 있을까?
2017	70627	잃어버린 도시 Z	액션, 모험, 드라마	제임스 그레이	찰리 허냄, 로버트 패틴슨, 시에나 밀러	아마존 탐사 중 지금껏 알려지지 않은 문명의 증거를 발견한 퍼시 포셋(찰리 허냄)은이 문명을 인류 역사의 마지막 퍼즐 ‘Z’라 부르며 탐사에 열을 올린다.하지만 예기치 못한 사고로 번번히 탐사에 실패한 그는 ‘Z’를 찾는 일에 더욱 집착하게 되고,포기를 모르는 그의 집념은 점차 광기로 변해간다. 그리고, 마지막 탐사라는 이름으로아들 잭(톰 홀랜드)과 함께 아마존 정글로 다시 들어가는데…
2017	144280	임금님의 사건수첩	코미디, 모험, 액션	문현성	이선균, 안재홍	모든 사건은 직접 파헤쳐야 직성이 풀리는 총명한 왕 ‘예종’(이선균).그를 보좌하기 위해 학식, 가문, 외모(?)는 물론 한 번 본 것은 절대 잊지 않는 비상한 재주까지 겸비한 신입사관 ‘이서’가 임명된다. 하지만 의욕과 달리 어리바리한 행동을 일삼던 이서는 예종의 따가운 눈총을 한 몸에 받으며 고된 궁궐 생활을 시작한다. 때마침 한양에 괴이한 소문이 돌기 시작하고, 예종은 모든 소문과 사건이 심상치 않음을 직감한다.예종과 이서는 모든 과학적 지식과 견문을 총동원,괴소문의 실체를 파헤치기 위해 나서는데…! 사건 쫓는 임금 X 임금 쫓는 신입사관궁 넘고 담 넘는 유쾌한 과학수사가 시작된다!
2017	142627	임페리엄	범죄, 드라마, 스릴러	다니엘 래거시스	다니엘 래드클리프, 토니 콜렛, 번 고먼	FBI 대외테러전담반의 신참 요원 ‘네이트’ (다니엘 래드클리프)는 의미 있는 일을 직접 완수하고 자신이 속한 조직에서 인정받고 싶지만 현실은 그의 생각과는 달리 냉혹하기만 하다.어느 날, 우연한 기회에 국내테러전담반 선배 요원인 ‘안젤라’ (토니 콜렛)의 호출을 받은 네이트는 그녀로부터 백인지상주의 조직의 인종청소를 위한 폭탄 테러 모의에 대해 듣게 되고 충격에 빠진다.그녀는 이들의 최근 심상치 않은 움직임이 계속 감지되고 있다며 네이트에게 조직에 잠입하여 이들의 계획과 정보를 빼내기 위한 위장수사업무를 제안하는데...
2017	158649	잇 컴스 앳 나잇	미스터리, 스릴러	트레이 에드워드 슐츠	조엘 에저튼, 크리스토퍼 애봇, 라일리 코프	의문의 존재를 피해 외딴 숲에 집을 짓고 자신만의 규칙을 만들어 아내와 아들을 돌보는 남자.어느 날, 한 가족이 그의 집에 은신하고 정체를 알 수 없는 기이한 일들이 시작되면서 점점 광기에 사로잡히는데…
2017	163046	자매의 S스캔들	멜로/로맨스	김현빈	신유주, 윤세나	거칠고 남자 같은 성격의 유진과 여성스럽고 귀여운 외모를 가진 유정.착실하게 회사 생활을 하며 잘 지내던 유정은 이번 구조 조정에 자신이 있다는 사실을 알게 된다. 이를 미끼로 성상납을 하라는 노대표에게 유정은 어쩔 수 없이 하룻밤을 보내게 되고…이를 알게 된 유진은 자신과 유정을 괴롭힌 노대표를 용서할 수 없어 복수를 계획하게 되는데…
2017	163077	자매의 사정	멜로/로맨스	윤채아		병원에 근무하는 미리아는 원장 센타에게 부탁하여 동생 유마를 견습의로 취직시킨다. 일하게 된 지 얼마 후, 센타의 아들 만타와 사귀는 사이가 된 유마.자신도 결혼한 상태로 미리아와 불륜을 저지름에도 불구하고 둘의 사이를 반대하는 유마.결국 사이를 갈라놓기 위해, 자신의 욕구를 충족시키기 위해서 유마를 범하는 센타.그 사실을 어렴풋이 알게 된 만타는 병원을 그만두고 시골로 같이 내려가자 하는데..
2017	160080	자유부인 2017	멜로/로맨스	윤대이	이채담	군대입대를 앞두고 여행을 다니던 주연은 작은 아버지 댁에서 시간을 보내다 입대할 예정으로 지방의 소도시 버스터미널에 내린다.과묵하고 무뚝뚝한 작은아버지에 비해 젊고 상냥한 숙모는 그를 환하게 반겨준다. 숙모를 만난 병원에서 그녀의 친구 미진과도 인사를 나누고 어렸을 때 친구였던 태호와도 안부를 묻는다.네 사람은 미진의 태권도 도장에서 만나 운동으로 즐거운 시간을 보내고 주연은 미진과 술 한잔과 함께 뜨거운 밤을 보내게 된다.주연은 그날 밤 자신의 친구 태호와 작은엄마 사이에 묘한 상황이 벌어졌음을 짐작하지만 애써 모른 척 한다. 그런 숙모를 묵묵히 지켜보는 주연. 그리고 집요하게 작은엄마의 잠재된 성적환상을 끌어내는 태호. 주연에게 깊이 빠져드는 미진까지. 주연의 입대 전 여행은 점점 깊은 일탈의 늪으로 빠져들게 되는데 ... .
2017	166189	작은 엄마	멜로/로맨스	이리단	대호, 세희, 유리	법대 진학을 위해 서울에 있는 아버지 친구 민철의 집에 얹혀 살게 된 연우. 민철의 어린 아내 수경이 바로 자신이 고교 시절 흠모했던 연상녀라는 걸 알게 된다. 친삼촌 같은 민철이기에 이러면 안 된다고 생각하지만 연우는 수경을 볼때마다 자꾸만 가슴이 뛴다. 게다가 수경의 절친 유라는 연우의 젊은 육체를 호시탐탐 노리는데…
2017	166191	작은 엄마 2: 삼촌의 여자들	멜로/로맨스	강정훈		시나리오 작가 마루야마는 삼촌 타카다의 집에 얹혀 살며 삼촌의 여자들을 모델로 시나리오를 써간다.시도 때도 없이 삼촌을 찾아오는 젊고 섹시한 여자들과 상상 속에서 사랑을 나누던 마루야마!어느 날, 삼촌의 애인 사츠키가 마루야마에게 도발적인 유혹의 손길을 보내면서 마루야마의 상상은 현실이 된다.
2017	164363	작은엄마 : 시조카 역습	드라마	나카메구로 코우지		미호는 남편과 둘이서 살고 있다. 어느 날 남편의 형의 아들(남편의 조카) 타케시가 대학 입시 때문에 미호의 집에서 지내게 되는데, 미호는 젊은 타케시에게 호감을 느낀다. 일이 바쁘다는 핑계로 부부관계를 하지 않는 남편에게 불만을 가지고 있던 미호는 남편 몰래 시험을 앞둔 조카를 유혹하고 타케시와 관계를 가지게 되는데…
2017	137859	작쩐	액션, 코미디	썬다오	이범수, 진소춘, 등가가	한국에서 대부업을 운영중인 중국인 메이다즈는 용봉경을 둘러싸고 위험에 빠진 처형과 아내를 구하기 위해 제주도로 건너온 거물들과 용봉경을 가지기 위한 속고 속이는 게임을 펼친다.여기에 빚 때문에 어쩔 수 없이 킬러가 된 차기범은 제주도에 놀러 왔다 도박으로 빈털털이가 된 부부와 함께 용봉경을 차지하기 위해 힘을 합치는데...
2017	159527	잔다르크	공연실황	모셰 라이저, 파트리스 코리에	리카르도 샤이, 안나 네트렙코, 프란체스코 멜리	1845년 라 스칼라 극장에서 초연된 베르디의 일곱 번째 오페라로 독일의 문호 프리드리히 실러의 ‘오를레앙의 처녀’가 원작이며 테미스토클레 솔레라가 대본을 썼다. 오페라는 잔 다르크가 주인공이지만 실존인물에 대한 이야기보단 원작을 바탕으로 하고 있어 역사적 사실과 차이가 있다.프랑스 역사상 가장 로맨틱한 이야기. 프랑스와 영국이 백년전쟁을 하던 시기, 프랑스군은 영국군에 밀려 프랑스 남부까지 후퇴에 이른다. 그 때 잔 다르크가 샤를 왕을 도와 프랑스를 위기에서 구해낸다. 샤를 왕과 잔 다르크는 서로에게 이끌리지만, 잔 다르크가 아버지 자코모에 의해 화형될 위기에 처한다.
2017	159741	잠깐만 회사 좀 관두고 올게	드라마	나루시마 이즈루	후쿠시 소우타, 쿠도 아스카	열정은 번아웃, 월급은 로그아웃, 인생은 삼진아웃 직전의 회사원 다카시는 계속된 야근으로 지하철에서 쓰러진다. 선로로 떨어질 뻔한 아찔한 순간, 그를 구해준 이는 다름아닌 초등학교 동창 야마모토! 운명적 만남을 계기로 두 사람은 급속도로 친해지고, 우울하기만 했던 다카시의 인생에도 즐거운 변화가 찾아온다.  “야마모토 덕분에 월요일도, 상사도 두렵지 않아!”늘 싱글벙글한 미소 뒤에 비밀을 간직한 듯한 야마모토가 궁금했던 다카시는 인터넷 검색을 해보고, 그가 이미 3년 전에 죽은 사람이란 걸 알게 되는데! 야마모토, 넌 대체 누구니?
2017	146151	잠자는 소녀	가족, 드라마	로즈마리 마이어스	비터니 휘트모어, 해리슨 펠드만, 이몬 파렌	성장기 소녀 '그레타'와 친구 '엘리엇'이 겪게되는약간은 터무니없고, 환상적인 꿈 이야기를 그린 잔혹 동화
2017	146530	장기왕: 가락시장 레볼루션	드라마	정다원	정두원, 최시온, 박예영	떳떳한 직장보다 실속 있고 따뜻한 주머니를 원한 두수는 비밀리에 가락시장에서 일을 한다.하루하루 허리가 휘는 고된 노동과 노예계약서를 앞세운 사장님의 전횡에도꿋꿋한 두수에게는 숨겨진 재능이 있었으니 나름 장기판의 숨은 고수였던 것!가락시장의 장기판을 휩쓸며 실력 하나로 통쾌하게 악인을 응징하기도 하며내기 장기에 빠진 사장님을 장인어른으로 만들기도 하는 등 대활약을 펼친다. 어느 날, 진정한 고수들의 진검승부가 펼쳐지는 장기판의 무림, 탑골공원에 대한 소문을 듣고두수는 탑골공원 앞을 어슬렁 거리다 우연히 고등학교 때 짝사랑했던 민주를 만나게 된다.체 게바라를 좋아했던 민주는 노숙인들의 보금자리인 다시서기센터 철거반대 서명운동을 하고 있었던 것.민주와 함께 노숙인들을 도우면서 두수는 오랜만에 보람과 즐거움, 삶의 의욕을 느끼게 된다.다시서기센터를 철거하려는 건물주 박영감이 내기장기의 제왕임을 알게 된 두수는센터를 지켜내기 위해 일생일대의 장기 대결에 도전하게 되는데..
2017	137696	장산범	미스터리, 스릴러	허정	염정아, 박혁권	도시를 떠나 장산으로 이사 온 희연(염정아)은무언가에 겁을 먹고 혼자 숲 속에 숨어있는 여자애(신린아)를 만난다.희연은 소녀를 집으로 데려오지만,남편(박혁권)은 딸 준희의 목소리를 흉내 내는 이 소녀를 수상하게 여긴다.소녀가 찾아온 뒤 하나 둘씩 실종되는 사람들사라진 시어머니(허진)와 남편…그리고 들려오는 ‘그것’의 목소리누군가 우리 가족의 목소리를 흉내 내고 있다!
2017	156337	재꽃	드라마	박석영	정하담, 장해금, 정은경	한적한 시골 마을에서 평범한 삶을 보내고 있는 하담(정하담)에게 한 번도 만나본 적 없는 아빠를 찾겠다며 자신과 꼭 닮은 열한 살 소녀, 해별(장해금)이 찾아온다 . 고요했던 마을은 해별의 등장과 함께 복잡미묘한 감정들이 소용돌이 치게 되는데…
2017	149512	재심	드라마	김태윤	정우, 강하늘, 김해숙	대한민국을 뒤흔든 택시기사 살인사건 발생! 유일한 목격자였던 10대 소년 현우는 경찰의 강압적인 수사에 누명을 쓰고 10년을 감옥에서 보내게 된다한편, 돈도 빽도 없이 빚만 쌓인 벼랑 끝 변호사 준영은 거대 로펌 대표의 환심을 사기 위한 무료 변론 봉사 중 현우의 사건을 알게 되고 명예와 유명세를 얻기에 좋은 기회라는 본능적 직감을 하게 된다. 그러나 실제로 현우를 만난 준영은 다시 한번 정의감에 가슴이 뜨거워지는 자신을 발견하게 되고 현우는 준영의 도움으로 다시 한번 세상을 믿어볼 희망을 찾게 되는데..다시 심장을 뛰게 만들 진심을 만나라!제8회 호주한국영화제 초청 상영 (2017)제6회 프랑크푸르트한국영화제 초청 상영 (2017)
2017	144990	재키	드라마	파블로 라라인	나탈리 포트만, 피터 사스가드, 그레타 거윅	우아하고 기품 있는 스타일과 친근한 이미지로 국민들에게 큰 사랑을 받았던존 F. 케네디 대통령의 부인, 재클린 케네디.하지만 퍼레이드 도중 충격적인 암살 사건으로 대통령이 사망하면서 그녀는 혼란에 빠진다.남편의 죽음을 가장 가까이에서 지켜본 슬픔을 달랠 새도 없이, 의연하게 장례식을 준비해야 하는 그녀.더 이상 퍼스트 레이디가 아닌 재키는 백악관을 지휘하는 데 어려움을 겪지만 곧 자신이야말로남편의 시대를 마무리할 수 있는 한 사람이라는 것을 깨닫는다.모두가 사랑한 퍼스트 레이디, 전설을 새로 쓰다!
2017	162824	저수지 게임	스릴러, 다큐멘터리	최진성	주진우, 조미래, 정재호	탐사보도 전문 ‘악마 기자’ 주진우가누구나 알지만, 아무도 말 못하는 그분의 ‘검은 돈’을 찾고 있다. 해외를 넘나들며 그 돈과 관련된 연결고리의 실체를 추적해온 집념의 5년. 위험을 감수한 ‘딥쓰로트’의 제보로 드디어 그분의 꼬리 밟기에 성공하는데...“저 돈을 쫓아가 보면 XX의 돈이 있어”파도 파도, 까도 까도 끝없는 검은 돈의 연결고리가 밝혀진다!
2017	116866	저스티스 리그	액션, 모험, 판타지, SF	잭 스나이더	벤 애플렉, 갤 가돗, 제이슨 모모아	인류의 수호자인 슈퍼맨이 사라진 틈을 노리고 ‘마더박스’를 차지하기 위해 빌런 스테픈울프가 악마군단을 이끌고 지구에 온다.마더박스는 시간과 공간, 에너지, 중력을 통제하는 범우주적인 능력으로 행성의 파괴마저도 초래하는 물체로 이 강력한 힘을 통제하기 위해 고대부터 총 3개로 분리되어 보관되고 있던 것.인류에 대한 믿음을 되찾고 슈퍼맨의 희생 정신에 마음이 움직인 브루스 웨인은 새로운 동료인 다이애나 프린스에게 도움을 청해 이 거대한 적에 맞서기로 한다.배트맨과 원더 우먼은 새로이 등장한 위협에 맞서기 위해 아쿠아맨, 사이보그, 플래시를 찾아 신속히 팀을 꾸린다.이들 슈퍼히어로 완전체는 스테픈울프로부터 마더박스를 지키기 위해 지구의 운명을 건 전투를 벌인다!
2017	168101	저지 캅: 테러 어택	SF, 액션	이안 카슨	에단 맥도웰, 모건 오벤레더	시민으로 구성된 테러조직에 의해 L.A가 핵폭탄 공격을 받고 사라진다.미국을 비롯한 전세계는 충격과 공포에 휩싸이고, 미국 국방 보안을 책임지고 있는 사설 보안 업체 '노콥'은 테러 조직을 말살하기 위해 고군분투하는데...
2017	126282	전설의 검	액션, 모험	스테파노 밀라	말콤 맥도웰, 그렉 챈들러 매니스	기원전 55년, 시저는 끝없는 야망으로 영토를 넓히려 전설의 검을 찾아 헤맸지만 결국 검은 역사 속에 묻히게 된다.그로부터 수 세기 후, 프랑스의 헨리 2세 왕은 자신이 아끼는 큰아들 헨리에게 왕좌를 물려주기 위해 둘째 아들 리차드를 처치하고자 한다.그리고 리차드를 감옥에 가두고 세 가지의 관문을 내리는데…감옥에 갇힌 리차드는 바실레우스의 도움을 받아 관문을 하나씩 통과하지만, 바실레우스는 애인이 죽자 자살을 선택하며 리차드의 세상이 온다고 예언한다.그 때, 아버지를 못마땅해 하던 헨리는 리차드에게 반란을 일으켜 새 나라를 만들자며 아버지 헨리 2세와 전쟁을 하자고 제안한다.그 낌새를 알아차린 헨리 2세는 전쟁을 선포하며 출격하는데....
2017	126021	전성수배	액션, 범죄, 스릴러, 드라마	왕도	조문탁, 유엽, 추자현	10년 전 펑웬은행 사장인 샤오윈펑의 부인인 린란이 한 여자를 죽이려고 하자 당시 담당형사였던 탕위에는 인질을 구하기 위해 린란을 쏴 죽인다.린란가 죽고 난 3개월 뒤 탕위에의 약혼녀인 쉬야마저 실종되고 그렇게 세월은 10년이란 시간이 흐른다.10년 뒤 샤오윈펑과 파트너였던 바이샤오윈이 누군가에게 피살되고 바이샤오윈의 동생인 바이샤오뤄는 탕위에를 찾아와 CCTV속의 린란을 보여준다.탕위에는 샤오윈펑을 조사하다 10년 전에 죽은 린란을 만나게 되는데...과연 탕위에가 본 린란은 누굴까. 그는 약혼녀인 쉬야를 찾을 수 있을까?
2017	163100	절대 무림 신공	액션	해도	한삭, 유관성	주요 물건을 운반하는 천하제일의 표국으로 유명한 백마표국, 백소천의 둘째 딸의 혼인을 앞두고 강호 각 문파의 장문인들이 축하를 위해 낙양성으로 몰려들게 된다.둘째 딸의 혼례 전날 의문의 위패가 배달되고, 백마표국을 위협하는 세력들로부터 포위되자 백소천은 소림사 무림고수인 이소백에게 과거 자신의 사위였던 추평을 찾아달라고 부탁한다.한편, 혼례를 앞둔 둘째 딸이 갑자기 살해되면서 백소천은 자신의 제자 백학을 의심하여 그의 무공을 폐하고자 한다.
2017	142262	절벽 위의 트럼펫	멜로/로맨스	한상희	사쿠라바 나나미, 엘조, 오츠카 네네	심장 수술 후 회복을 위해 오키나와에 잠시 머물게 된 ‘아오이’는섬의 길목에서 절벽 위 트럼펫을 부는 소년 ‘지오’를 만난다.꿈과 사랑, 모든 것을 포기하고 떠나온 ‘아오이’와 돌아가신 부모님이 남긴 트럼펫만을 가족이라 여기는 ‘지오’.우연한 만남 이후 두 사람은 강한 끌림을 느끼게 되고,서로를 통해 가슴 두근거리는 설렘과 삶의 의미를 되찾게 된다.그러던 어느 날, ‘지오’와 ‘아오이’는 함께 돌고래를 보러 가기로 약속하지만,두 사람 앞에 예상치 못한 시간이 기다리고 있는데…
2017	161337	절정욕구 유부녀	에로	하마 류지	카노 아야코	1. 노리코는 결혼한지 얼마 안되는 부부이다. 최근엔 섹스가 야근 때문에 피곤한 남편의 몸이 뜻대로 움직이지 않는다.미안해하는 남편에게 아내는 이해한다며 잠자리에 든다. 다음날 아내는 남편의 권유로 각각 생명보험에 계약한다.막대한 사망보험 금액을 알게 되자 아내는 풍족하고 성적으로 만족하는 생활을 꿈꾼다. 우연히 이웃집 청년과 눈이 맞아 격렬한 정사를 나누는 사이가 됨에 따라, 아내는 남편의 사고만을 바라게 된다.아내는 보험 설계사를 불러 남편의 보험금액을 늘리고 싶다고 한다. 설계사는 젊은 애인이라도 생겼냐고 하면서 아내의 허를 찌르고 정사를 나눈다.그리고 설계사에게 남편 역시 아내의 보험금액을 기존의 계약에서 몇 배로 늘렸다는 사실을 듣는다. 2.젊은 유부녀인 유카는 중년남과 결혼 한 사이. 남편의 밤 생활이 시원치 않아 불만족하며 살고 있다. 그리고 낮에 폰섹스 회사로 전화를 걸어 자위를 한다.그리고 남편의 형인 아주버님이 집에 찾아와서 며칠을 지낸다. 밤중에 유카를 유혹하는 아주버님. 거절을 해보지만 같이 목욕을 하다 정사를 나눈다. 그리고 아주버님이 떠나자 다시 폰섹스 회사로 전화를 한다.3. 남편이 사채를 쓰고 도망가자 사채업자들이 집으로 찾아온다. 아내와 젊은 딸이 빚을 갚겠다고는 하지만 언제가 될지 모른다. 이자라도 내라며 둘의 몸을 탐하는 사채업자.4.미나코는 27살 야간 경비일을 하고 있다. 철없는 남편 때문에 돈을 벌어야 하는 그녀는 같은 일을 하는 동료와 사무실에서 정사를 벌인다.
2017	161348	젊은 아내	멜로/로맨스	나루세 코코미	나루세 코코미, 마키 아즈사	자신의 일거수일투족을 다 감시하는 의처증 남편에게 시달리던 코코미는 우연히 첫사랑 료스케와 재회한다. 료스케는 버스에서 치한에게 희롱 당하는 코코미를 구해주고, 결혼생활에 지쳐있던 코코미는 다시 한 번 료스케에게 반한다. 한편, 남편은 코코미를 의심하며 그녀에게 더 집착하기 시작한다.
2017	163111	젊은 아내: 남편 교환의 날	멜로/로맨스	이진		신혼부부 집들이에 모인 네 명의 남녀가 벌이는 성행각을 그린 성애 영화
