year	code	title	genre	directors	actors	story
2017	149048	100미터	드라마, 코미디	마르셀 바레나	다니 로비라, 카라 엘레할데, 알렉산드라 지메네즈	성공한 광고회사 직원 라몬은회사와 집에서는 사랑과 존경을 받아오지만홀아비인 장인어른이 자신의 집으로 이사온 이후 성격 차이로 늘 티격태격 이다.그러던 어느 날 갑자기 온 몸이 마비되는 다발성 경화증이라는 진단을 받은 라몬은30대 중반의 나이에 생을 포기해야 할지,아니면 병마와 싸워 이겨낼지 선택의 기로에 서지만자신의 가족과 다발성 경화증 환자들의 완치를 위해가장 힘든 철인 3종 경기인‘아이언 맨’에 도전하기로 결정하는데…
2017	161331	1812 나폴레옹 대전투	드라마	올렉 페센코	아나톨리 벨리, 세르게이 베르주코프	나폴레옹의 부하가 러시아의 전투 작전계획을 훔쳐 프랑스 황제에게 전달한다.이 사실은 젊은 귀족 알렉세이 타루소프 덕분에 러시아 군의 지휘관인 쿠투조프 장군에게 알려진다.타루소프는 쿠투조프에게 간청하여 러시아 창기병 연대에 합류해 고르제프스키, 키크나드제 왕자, 그리고 푸트카 상사와 같은 새로운 친구를 만나게 된다.보로디노의 끔찍한 전투가 끝난 후에 그들은 많은 예기치 못한 모험을 하게 되는데...
2017	158191	1987	드라마	장준환	김윤석, 하정우, 유해진	1987년 1월, 경찰 조사를 받던 스물두 살 대학생이 사망한다.증거인멸을 위해 박처장(김윤석)의 주도 하에 경찰은 시신 화장을 요청하지만, 사망 당일 당직이었던 최검사(하정우)는 이를 거부하고 부검을 밀어붙인다.단순 쇼크사인 것처럼 거짓 발표를 이어가는 경찰. 그러나 현장에 남은 흔적들과 부검 소견은 고문에 의한 사망을 가리키고, 사건을 취재하던 윤기자(이희준)는 ‘물고문 도중 질식사’를 보도한다. 이에 박처장은 조반장(박희순)등 형사 둘만 구속시키며 사건을 축소하려 한다.한편, 교도소에 수감된 조반장을 통해 사건의 진상을 알게 된 교도관 한병용(유해진)은 이 사실을 수배 중인 재야인사에게 전달하기 위해 조카인 연희(김태리)에게 위험한 부탁을 하게 되는데…한 사람이 죽고, 모든 것이 변화하기 시작했다.모두가 뜨거웠던 1987년의 이야기.
2017	159555	19금 섹스비디오	멜로/로맨스	박범수	윤지	지금 막 결혼에 골인한 진우와 준미.... 둘만의 허니문 여행을 떠난다. 진우는 둘만의 아름다운 추억을 간직하기 위해 비디오 카메라를 준비해 간다. 신혼 첫날밤  진우는 둘만의 첫날밤을 영상에 간직하고픈 욕심에 준미 몰래 호텔방 안에 카메라를 설치한다. 그리고 준미 몰래 찍은 첫날밤 비디오를 혼자서 간직하고자 한다. 한편, 진우는 항상 잘난척만 하는 친구 정천에게 준미의 절친한 친구인 영희를 소개시켜주고 정천은 평소 말과는 달리 자유분방한 영희의 페이스에 말려 그녀에게 휘둘리기만 하는데.. 그러던 어느 날 진우와 준미의 신혼 집에 도둑이 들고 첫날밤 비디오 테이프가 없어진다. 망연자실한 진우는 정천에게 상담을 해 보지만 정천은 그런 상황이 재미있는지 자꾸 장난만 친다. 결국 진우는 고민 끝에 준미에게 모든 사실을 털어놓는데..
2017	166418	2017 잘츠부르크 - 아이다	공연실황		안나 네트렙코, 에카테리나 세멘척, 프란체스코 멜리	에티오피아에서 포로로 잡혀온 아이다는 에티오피아의 공주였지만 현재는 이것을 숨긴 채 파라오의 딸인 이집트 공주 암네리스의 몸종으로 있다. 암네리스는 이집트 군의 대장으로 임명된 라다메스와의 결혼을 꿈꾸지만 라다메스는 이미 아이다와 몰래 사랑하고 있는 사이다. 암네리스는 이 둘의 사랑을 알아차리고 분노에 휩싸여 둘에게 가혹한 벌을 내리게 된다.
2017	166419	2017 잘츠부르크 - 티토 황제의 자비	공연실황			비텔리아는 아버지의 왕위를 빼앗은 티토에게 복수를 꿈꾼다. 예정된 티토의 결혼이 때마침 취소되자 비텔리아는 그의 아내가 되어 권력을 얻고자 하는 계획을 세운다. 하지만 황후가 되려는 계획이 뜻대로 잘 풀리지 않자 황제의 절친한 친구이자 그녀를 좋아하는 세스토를 이용하여 티토를 암살하려 한다. 비텔리아를 향한 사랑과 티토에 대한 우정 사이에서 괴로워하던 세스토는 결국 암살 계획을 실행에 옮기지만 미수에 그치고 혼자 모든 죄를 짊어지려 한다. 자신을 끝까지 배신하지 않는 세스토를 보고 비텔리아는 자기 자신에게 수치심을 느껴 결국 모든 죄를 티토에게 자백하지만 자비로운 티토는 모두를 용서한다.
2017	163043	2035 매드 레이스	SF, 스릴러	크리스토퍼 제임스 밀러	카일 모리스, 마크 맥개리, 토드 브라운	2035년, 섹터 박사는 전파 발생기를 이용해 외계 생명체의 피부조직으로 혈청을 만드는 데 성공한다.그리고 그 혈청으로 인간들을 돌연변이로 만드는 실험을 자행해가며 세상을 지배하게 된다.한편, 1998년과 2035년을 넘나들 수 있는 특별한 능력을 가진 시간여행자 잭 슬래이드는 그 혈청을 만들어낸 전파 발생기가 1998년도에 최초로 발명됐으며, 이 모든 재앙의 시작을 막을 수 있는 인물이 '카다이자'라는 사실을 알게 되고 그녀를 찾아 다니기 시작하는데..
2017	144927	23 아이덴티티	공포, 스릴러	M. 나이트 샤말란	제임스 맥어보이, 안야 테일러 조이	23개의 인격을 가진 남자 ‘케빈’(제임스 맥어보이). 그는 언제 누가 등장할지 모르는 인격들 사이를 오가며 유일하게 자신을 이해하는 ‘플레처’ 박사(베티 버클리)에게만 자신의 이야기를 꺼내 놓는다. 어느 날, ‘케빈’은 지금까지 등장한 적 없는 24번째 인격의 지시로 3명의 소녀들을 납치하고 오래도록 계획했던 비밀스러운 일을 꾸민다. 소녀들이 그에게서 도망치려 할수록 ‘케빈’의 인격들은 점차 폭주하기 시작하는데…그 안의 수 많은 인격 중 누가, 누구를 위해 움직이는가
2017	147927	24주	드라마	앤 조라 베라치드	줄리아 옌체, 비얀 미들, 요하나 가스트도프	타고난 재능으로 최고의 자리에 오른 스탠드업 코미디언 아스트리드.셀러브리티 답게 그녀의 일거수일투족은 화제가 되고, 뱃속의 아이 역시 태어나기 전부터 유명세를 치르고 있다.그러나 출산을 세 달 앞두고, 아스트리드 부부는 뱃속의 태아에 문제가 생겼음을 알게되는데…
2017	161335	28살 미망인의 속옷	에로	긴 류지		암으로 남편을 잃은 타카코는 남편의 첫 제사를 지낸다. 제사가 끝나고 사채업자 쿠보가 찾아온다.타카코는 남편의 치료비 때문에 쿠보에게 빚을 진 상태. 타카코는 형편이 어려워 몸으로 빚을 갚는다.남편 친구인 슌타는 타카코의 집에서 나오는 쿠보를 보고 수상하게 여긴다. 시누이인 이츠키는 사채업자인 쿠보에게 자신이 빚을 대신 갚겠다고 하고 정사를 나눈다.한편 남편친구인 슌타는 타카코에게 호감을 느끼고 그녀가 사채 때문에 괴로워하는 것을 위로해준다.그러면서 둘은 육체적인 관계를 맺고 타카코는 양심에 가책을 느낀다.
2017	165558	3분 파트너	멜로/로맨스	박주영	이수, 이채담	대구는 선배 수경을 좋아하지만 그녀는 관심도 없다. 동기인 희주는 대구를 몰래 좋아하고 있지만 대구는 오직 수경만을 바라보는데, 그러던 어느 날 그에게 찾아온 3분 파트너. 속는 셈 치고 사용한 3분 파트너를 통해 3분만에 수경이 대구 앞에 나타나고 둘은 열정적인 밤을 보내게 되는데, 대구는 점점 3분 파트너에 빠져들게 되고 더 많은 여자들을 만나게 되면서 점점 변해가는데. 대구는 과연 수경과의 사랑에 성공 할 수 있을까?
2017	148880	416 프로젝트 “망각과 기억” part1	다큐멘터리	416연대 미디어위원회		PROJECT 1 <인양>9명 희생자의 수습과 참사의 진상규명을 위해 시급한 문제가 바로 세월호의 온전한 인양이다. 징부는 인양과정에 유가족의 참여를 약속했지만 여러 이유를 대가며 유가족을 배제하고 있다. 유가족과 희생자 시신수습을 한 민간잠수사, 자원활동가는 세월호 인양현장에서 가장 가까운 동거차도에서 감시 활동을 벌이고 있다인양에서 무엇을 보고자 할까? 그들의 평범한 삶은 세월호 사건 이후 완전히 바뀌어 버렸다. 국가가 나에게 무슨 의미인지 대답을 할 수 없게 되었다. 인양되어 올라오는 것은 선체만이 아니다. 인양, 그것은 국가의 실체를 알기 위함이다.PROJECT 2 <도둑>2015년 12월 세월호 참사 진상규명을 위한 청문회가 사흘 동안 열렸다. 416가족협의회 유가족들은 청문회를 대비해서 많은 준비를 했다. 이미 특별법 제정과 특별조사위원회의 활동 과정을 통해 반쪽짜리 청문회가 될 것을 예상했지만, 그래도 희망을 저버릴 수 없었다. 여지없이 공백이 드러난 청문회였다. 생중계는커녕 제대로 된 언론 보도도 없고, 여당 추천의 조사위원들의 모습도 없고, 대통령의 7시간에 대한 조사도 없고, 주요 자료들은 삭제되거나 조작되었다. 국민들은 진실을 알 권리가 있지만, 그 권리는 도둑맞았다.PROJECT 3 <자국> 안산시 와동, 선부동, 고잔동 일대에는 커다란 시간의 간극이 생겼습니다. 수백 명의 아이들이 사라져버린 공간에는 무수한 기억들이 맴돕니다. 아이들은 보이지 않지만 우리는 부모들의 기억을 통해 아이들의 자국을 만질 수 있습니다. 기억은 자국을 통해 현재에 와 닿고, 아이들은 수학여행을 가기 전처럼 놀고 싸우고 웃습니다. 부모들은 지금의 고통을 견디고 미래를 이야기하려고 합니다.PROJECT 4 <교실>2016년 2월. 흔한 교실들. 뻔한 졸업식들로부터 2016년 1월 9일 안산 단원고에서 벌어진 길고 긴 방학식까지. ‘교실’은 이 시간 안에 놓인 몇 명의 인물을 쫓아간다. 단원고 희생 학생의 어머니 이영옥씨. 그리고 4월 출산을 앞두고 있는 세월호 광화문 농성장 지킴이 곽서영씨. 단원고 졸업생이자 교실 존치를 위한 활동에 참여하고 있는 최승원씨. 정해진 시간 안에 각자의 시간들이 존재하고 그 사이 ‘416교실’ 존치 논란의 사회적 책임자들의 ‘말’들을 삽입한다. 세월호 참사의 현장인 ‘416교실’의 보존은 결국 참사가 가르치는 새로운 ‘교육’을 만들기 위한 작은 시작일 뿐이라는 의미를 길어 올린다. 단원고 희생학생들의 ‘교실’에 남겨진 주인공들. 우리들은 세월호 희생학생들의 길고 긴 방학의 한 가운데에 놓여 있다.PROJECT 5 <살인>2015년 4월, 세월호가 침몰한지 1년 후 관련자들에 대한 재판이 열렸다. 그 결과를 보고 유가족들은 분노를 참을 수 없었다. 그리고 416가족협의회와 416연대는 중대재해기업처벌법 제정연대를 만들었다. 416가족협의회의 활동은 세월호 사건에 관한 진상규명이 한 축이고, 안전사회를 위한 기틀을 마련하는 것이 또 다른 한 축이다.한국은 참사의 나라이다. 그러나 이제 세월호 사건을 마지노선으로, 참사의 고리를 끊어야 한다. 안전사회는 먼 미래를 위해 지금부터 그려야 하는 구체적인 그림이다.PROJECT 6 <블루-옐로우 프로젝트 in 대구>일상 속 블루에서 시작해 옐로우로 가는 여정. 세월호 참사의 현장, 진상규명을 위한 집회, 1년 6개월이 지났지만 여전히 세월호를 일상 속에 품고 사는 대구 시민들의 모습이 그 사이에 담긴다.PROJECT 7 <선언>세월호 침몰로, 그리고 그 이후 지속된 폭력으로 참사 피해자의 고통은 계속되고 있다. 말할 수 없어서 그만큼 곪아 들어간 상처. 이들의 말을 듣기 위해 인권실태조사가 진행되었고, 말을 나눌 자리로서 ‘풀뿌리토론’이 진행되었다. 이를 통해 슬픔과 분노를 나누고 행동할 말을 찾았다. 국가를 향해, 공권력을 향해, 그리고 우리들을 향해. 그렇게 2년여의 시간이 흐르고 4.16인권선언이 발표되었다. 사람들의 말들이 단단하게 뭉쳐 선언문에 담겼다. 그들의 결의이자 싸움의 무기였던 ‘말’들을 건네고 듣는 것으로 다시 행동이 시작된다.
2017	152616	47 미터	공포, 스릴러	조하네스 로버츠	맨디 무어, 클레어 홀트	멕시코의 태평양 연안에서 특별한 휴가를 맞은 ‘리사’와 ‘케이트’. 잊을 수 없는 추억을 만들기 위해 익스트림 스포츠인 상어 체험(샤크 케이지)에 도전한다.하지만 즐거움도 잠시, 자매가 올라 탄 케이지는 알 수 없는 사고로 순식간에 심해 47미터까지 추락하고 만다.무시무시한 식인 상어 무리에 둘러싸인 '샤크 케이지' 속에서산소 탱크로 버틸 수 있는 시간은 단 20분!
2017	144081	50가지 그림자: 심연	드라마, 멜로/로맨스	제임스 폴리	다코타 존슨, 제이미 도넌	크리스찬 그레이(제이미 도넌)는 아나스타샤 스틸(다코타 존슨)을 잊지 못해 되찾으려고 하지만아나스타샤는 지금까지와 다른 새로운 관계를 원한다.과거의 상처를 고백하며 점점 변해가는 크리스찬의 모습에 아나스타샤는 결국 그를 받아들이고,둘은 서로에게 더욱 깊이 빠져들며 뜨거운 사랑을 나눈다.그러나 그의 숨겨진 과거와 비밀을 아는 사람들이 아나스타샤를 위협하기 시작하면서그들의 관계는 위태로워지는데
2017	126052	50가지 욕망의 그림자	스릴러, 드라마	자레드 콘	카리스마 카펜터, 브라이스 드래퍼, 다니엘 볼드윈	40대 이혼녀인 ‘미셸’은 우연히 식당에서 ‘라이언’이란 남자를 만나 뜨거운 관계를 갖게 되는데 점점 그에게 이끌려 변태적인 성관계에 빠져든다.아버지의 투자회사에서 일하는 미셸은 라이언에게 빠져 회사의 중요한 계약까지 망치고 점점 인생이 망가져 간다.그러던 어느 날, 집에 돌아온 미셸은 자신의 딸이 라이언과 함께 침대에 있는 광경을 목격하게 되고 라이언에게 딸에게서 떠나라고 소리치지만 소용없다.그녀는 그런 라이언을 처단할 방법을 찾게 되는데..그녀는 강렬한 유혹을 뿌리치고 모든 것을 제자리로 돌려놓을 수 있을까?
2017	169527	50대 장모님의 불타는 사위 사랑		김두민		50대 장모님 불타는 성욕, 그 두번째 이야기 가족여행!딸의 남편이 될 남자와의 비밀스러운 성관계 결혼전 관계는 용서가 된다?딸이 모르는 엄마의 욕정풀이 현장 지금바로 확인하세요
2017	146526	7년-그들이 없는 언론	다큐멘터리	김진혁	강지웅, 권성민, 권석재	이명박 정부 초기인 2008년부터 현재까지 총 20여명의 언론인이 해직되었다.해직 언론인 대부분이 노조 간부가 아닌 것은 물론, 그 중 상당수는 평범한 언론사의 직장인으로서 생활하던 이들이다. 자신이 다니던 언론사가 권력에 의해 망가지는 모습을 견디지 못했던 그들은 공정방송이란 상식적인 요구를 하였으나, 돌아온 것은 해직통보였다.7년의 시간이 흐른 지금, 자신이 몸담았던 언론사에 대한 권력의 통제는 이미 관성이 되어버렸고, 그런 현실을 바라보는 그들의 시선도 착찹하기만 한데…그들은 돌아갈 수 있을까? 만약 돌아간다면 그 곳은... 그들이 간절히 원했던 그런 언론사이긴 한 걸까?
2017	144988	7번째 내가 죽던 날	드라마, 미스터리	라이 루소 영	조이 도이치	친구들에게 동경의 대상인 샘은남자 친구와의 달콤한 데이트, 끝내주는 파티까지완벽한 하루를 보냈다그러나 그날 밤,집으로 돌아가던 샘과 친구들은 차 사고로 목숨을 잃는다. 어떤 영문인지 이른 아침 잠에서 깨어난 샘은자신이 죽지 않고, 다시 어제로 돌아왔다는 상황에 혼란스러워하고자신이 죽던 날이 반복되고 있음을 깨닫게 된다. 반복되는 ‘오늘’에 갇혔다너라면, 어떻게 할래?
2017	155715	7호실	블랙코미디	이용승	신하균, 도경수	서울의 망해가는 DVD방 사장 두식(신하균). 학자금 빚을 갚으려 DVD방에서 일하는 알바생 태정(도경수). 팔리지도 않던 가게에 기적처럼 매수자가 나타난 바로 그 때! 예상치 못한 사고가 일어나고, 두식은 시체를 7호실에 숨겨 봉쇄한다. 한편, 빚을 해결해주는 조건으로 마약을 7호실에 잠시 감춰놨던 태정은 늘 열려있던 그 방의 문을 두식이 갑자기 잠가버리자 당황하는데… 닫아야 사는 사장 vs 열어야 사는 알바생! 두 남자의 생존이 걸린 문제의 방 ‘7호실’
2017	168864	8th FILM DABIN 프로젝트 : 이채은 배우전	드라마	이현지, 김대웅, 임오정	이채은, 서영주, 이정아	1. 시대의 기분연출 : 이현지  주연 : 이채은  러닝타임 : 18m  등급 : 15세관람가자기경영의 모범인 오원경은 29번째 생일을 회사에서 맞이한다. 동시에 구조조정을 거쳐 4년을 기다려왔던 대리 진급에서 어이없는 이유로 떨어졌다는 소식을 접한다. 2. 월세와 보증금연출 : 김대웅  주연 : 이채은,서영주  러닝타임 : 21m  등급 : 15세관람가고등학교 동창이자 미대에 다니는 민희(24)와 은진(24). 등록금을 못 내서 아르바이트로 근근이 살아가고 있는 민희는 걱정거리 없이 클럽을 즐기며 사는 은진의 오피스텔에 얹혀산다.어느 날, 은진이 클럽에서 만난 외국인과 동거를 하겠다하자졸지에 집에서 쫓겨나게 된 민희는 담담히 자신의 처지를 수긍하고 집을 알아보려 하지만 보증금 없인 집을 구할 수가 없다.갈 곳 잃은 민희..3. 거짓말연출 : 임오정  주연 : 이채은,이정아  러닝타임 : 32m  등급 : 15세관람가어느 겨울 아침, 우연히 잘못 도착한 항공편지를 들고 이영희와 최연희는 선배의 결혼식으로 출발한다. 말이 필요없는 말 많은 관계의 위로의 답장.4. 그들은 대화중연출 : 이민아  주연 : 이채은,이희준  러닝타임 : 5m  등급 : 15세관람가여자와 남자가 대화중이다. 대화가 들리지만 들리지 않는다. 대화가 정점으로 치닫는 순간 여자의 눈물이 별안간 말려 올라간다. 상황은 역전되었다. 그는 들었을까...? 그녀는 들었을까?
2017	138254	8인의 수상한 신사들	액션, 코미디	기타노 다케시	후지 타츠야	아들 부부가 여행으로 집을 비운 사이 걸려 온 보이스 피싱 전화 한 통에 순진하게 속아 넘어갈 뻔한 류조.그는 한때 이름을 알렸던 야쿠자의 옛 동료들과 함께 자신들을 무시했던 사기범을 쫓기로 한다.하지만 사기범 뒤에는 깡패 조직이 뒤를 봐주고 있음을 알게 되는데…과연, 그들은 옛 명성을 잇는 활약을 펼칠 수 있을까?
2017	158485	LA 대지진	액션, 모험, 드라마	데이비드 지달리	헨리 이안 쿠식, 카메론 리차드슨, 말콤 바렛	정유 회사의 사장 리터는 LA 국립공원 근처에 새 시추 스테이션을 열어 기름을 빼내려는 계획을 세운다.그 이후 LA 는 점차 상상 할수 없는 거대한 지진이 발생하고, 그로인해 사람들은 목숨을 잃어 간다. 지질 연구소에서 일하는 에밀리는 LA 대지진의 진원지인 시추 스테이션 이란 사실을 알게 되고 파괴하려 하지만 리터는 그걸 막기 위해 또다른 음모를 세우는데..
2017	159696	TV소설 그 여자의 바다			한유이, 김주영, 최성재	6, 70년대를 배경으로 시대의 비극이 빚어낸 아픈 가족사를 딛고 피보다 진한 정을 나누는 세 모녀의 가슴 시린 성장기를 담은 드라마
2017	171883	VJ의 은밀한 사생활	멜로/로맨스, 드라마	오다카 히로		취준생 사나코는 취업스트레스를 인터넷 체팅으로 풀곤한다. 그더던 어느 날, 고교동창 마미가 인터넷상에서 큰 인기몰이를 하고 있다는 사실을 알게 되고, 호기심에 마미의 촬영현장을 방문, 그녀를 향한 남자들의 열기에 감탄한 사나코 또한 방송을 시작, 인기가 급상승 하지만 얼마후 방송사고로 그녀의 사생활이 노출, 위기가 닥친다.
2017	127398	가디언즈 오브 갤럭시 VOL. 2	액션, SF	제임스 건	크리스 프랫, 조 샐다나, 데이브 바티스타	최강 빌런 ‘타노스’에 맞서 은하계를 구하고 최고의 해결사로 등극한 ‘가.오.갤’ 멤버들.하지만 외계 여사제 ‘아이샤’가 맡긴 임무를 수행하던 중 실수로 또 다시 쫓기는 신세로 전락한다.한편 자신에게 숨겨진 힘의 원천에 대해 고민하던 리더 ‘스타로드’는 갑작스레 나타난 아버지로 인해 또 다른 위기에 빠지게 되는데…
2017	164302	가루지기: 변강쇠 더 비기닝	멜로/로맨스	정진호	한세희, 정재식	한 마을에서 떡장수를 하며 살고 있는 변강쇠는 옆집에 살고 있는 홍련을 좋아한다. 그렇게 두 사람만의 첫날밤이 시작되는데, 아뿔사 강쇠는 1분을 넘기지 못하고 그대로 자지러진다.그런 강쇠의 이야기는 삽시간에 동네에 퍼지고,  그 사실을 알게 된 강쇠는 충격에 빠져 동네를 떠나기로 결심한다.실의에 빠진 채 이곳저곳을 돌던 강쇠는 허기에 지쳐있는 한 노인을 도와주게 된다.그런데 사실 그 노인은 전설이 대물 황노인 이였다.강쇠는 황노인에게 대물 특급 훈련을 받게 된다. 그 후 강쇠는 자신감을 찾고 다시 마을로 내려가게 되는데...
2017	159551	가면 무도회	공연실황	쥬세페 베르디	주빈 메타, 표트르 베찰라, 게오르게 페테안	총독 리카르도는 자신의 충직한 비서관이자 친구인 레나토의 아내 아멜리아를 사랑한다. 상관과 아내의 관계를 알아차린 레나토는 자신이 밝혀 내려던 음모에 오히려 자신이 가담하게 되고 결국 가면 무도회에서 리카르도를 칼로 찌르지만, 리카르도는 아멜리아의 결백과 레나토의 사면을 선언하며 숨을 거둔다.
2017	162415	가을 우체국	멜로/로맨스, 드라마	임왕태	보아, 이학주	꿈 같은 미래를 준비하던 수련은 자신이 인생에 끝에 서 있다는 사실을 알게 된다.조용히 삶을 정리하고 싶지만 ‘준’만은 수련의 뜻대로 되지 않는데……
2017	161333		
2017	167332	가정교사의 은밀한 개인교습-무삭제판-	에로	카리노나 마이	코바야카와 레이코	에피소드1남편 친구 아들인 재수생 겐타의 가정교사를 맡게 된 음란한 가정교사 레이코는 그날 밤 겐타를 상상하며 자위를 하기 시작한다. 다음 날 그녀는 가슴골이 보일 정도로 깊게 파인 옷을 차려입고 겐타의 집을 방문하는데, 한창 성에 민감할 시기인 겐타는 그녀의 옷차림에 수업에 집중할 수 없게 된다. 그래서 좀처럼 집중하지 못하는 겐타의 긴장을 풀어주기 위해 레이코는 특단의 방법으로 마사지는 해주지만 어렸을 때와 다르게 너무나도 성장해버린 겐타의 모습에 흥분을 감추지 못한 레이코는 그만 겐타의 속옷을 벗겨버린다.에피소드2남편은 과학연구로 한 해의 절반을 해외에 나가 있는 날이 많으며 아내 레이코는 집안일을 하며 소일거리로 시간제 가정교사를 하고 있다. 그러던 어느 날 레이코는 남편의 오랜 친구로부터 부탁을 받고 그의 아들 재수생인 켄지의 가정교사를 맡게 된다. 옛날부터 사람을 가르치는 것을 좋아했던 레이코는 켄지가 좀 더 수업에 집중할 수 있도록 자신의 몸을 이용해 그의 이해력을 도우며 주입식 교육을 시킨다.
2017	169546	가족사진	드라마, 가족	무카이 무네토시	미츠무네 카오루, 타카야마 미야코	같은 대학 사진 동아리의 단짝 4인방. 미키의 아버지가 운영하는 찻집은 아지트이자 또 하나의 가족과 같은 따뜻한 장소. 졸업을 앞둔 이들은 추억여행을 계획하지만, 자금을 관리하던 친구가 모아둔 돈을 잃어버리는 등 차질이 빚어지고, 화해는 했지만 어딘가 공허함을 느끼기 시작한 미키는 어느 날 가게에 붙어있는 개점 당시 촬영 한 가족 사진을 보고 아이디어가 떠오른다. 친구, 가족, 그리고 소중한 가족사진
