year	code	title	genre	directors	actors	story
2017	146480	덩케르크	액션, 드라마, 스릴러, 전쟁	크리스토퍼 놀란	핀 화이트헤드, 마크 라이런스, 톰 하디	해변: 보이지 않는 적에게 포위된 채 어디서 총알이 날아올지 모르는 위기의 일주일바다: 군인들의 탈출을 돕기 위해 배를 몰고 덩케르크로 항해하는 하루하늘: 적의 전투기를 공격해 추락시키는 임무, 남은 연료로 비행이 가능한 한 시간“우리는 해변에서 싸울 것이다. 우리는 상륙지에서 싸울 것이다. 우리는 들판에서 싸우고 시가에서도 싸울 것이다. 우리는 끝까지 싸울 것이다”
2017	145246	덫	멜로/로맨스, 스릴러	윤여창	권해성, 이유진	항상 짧은 테니스복의 육감적인 그녀, 아연. 잘나가는 검사 민석은 테니스장 주차장에서 아연을 만나고 의도치 않게 도움을 주게 된다. 이후 아연의 잦은 연락이 시작되고 유부남인 민석은 그녀의 지나친 호의를 거부하려 하지만 쉽지 않다. 어느 날, 민석은 뇌물 혐의 투서 한 장을 받게 되고, 검사직에 위기가 온다. 아내와도 위태로운 상황에 그의 눈 앞에 아른거리는 아연. 결국 또 다시 우연히 만난 그녀와 가져서는 안 될 관계를 시작하는데…
2017	166181	데몬 헌터	액션, 모험, 판타지	조 카바나	니암 호건, 애런 탤벗, 케빈 오맬리	어느 날, 네 명의 여자를 납치한 납치범이자 강간범인 ‘벤 해처’가 잔혹하게 토막 난 채 발견된다. 그리고 현장에 있던 24살의 여성 ‘타린 파커’가 범인으로 긴급 체포된다. 자신의 살인을 정당하다고 말하는 ‘타린’. 그런 그녀를 조사하던 ‘베켓’ 형사는 그녀가 7년 전 살인 사건 피해자의 언니라는 사실을 알게 된다. 그런 와중에 ‘타린’을 풀어주지 않으면 살인이 계속될 것이라는 정체 모를 협박과 미스터리 한 살인이 계속되고, 베켓의 딸까지 납치되고 마는데…
2017	137700	데몬: 악령의 저주	공포	란드 보슬러	매튜 커리 홈즈, 안나마리아 데마라, 에일린 다이어츠	남자친구와의 이별로 힘든 시간을 보내던 ‘미셸’은 깊은 산 속에 위치한별장으로 도망치듯 떠나고, 기분을 달래려 친구 ‘캘리’, ‘데이나’, ‘샤런’, ‘잭’을 초대한다. 미셸을 위로하기 위해 파자마 파티를 즐기던 그녀들은 우연히 지하실에서‘스피릿 보드’와 ‘플랑셰트’를 발견하고 영혼을 소환하는 위험한 게임을 시작한다. 게임을 하던 중, 미셸과 친구들은 영혼계와 연결된 문을 열게 되고오랫동안 잠들어있던 저주받은 악령들을 깨어나면서 끔찍한 악몽이 시작되는데…
2017	159595	데블스 윙즈	액션, 범죄, 스릴러	대니얼 콜롬비	카를로스 구에레로, 데이빗 다넬로, 엔리케 헤레라	사업가인 아버지의 갑작스러운 죽음으로 고통스러운 나날을 보내던 아들 엠마누엘.자신의 멘토였던 아버지의 죽음이 쉽사리 받아들여지지 않았던 그는 우연히 아버지의 죽음 이면에 부패한 권력이 얽혀있다는 것을 알게 된다.그 중심에는 악명높은 전 시장과 부패한 변호사가 있고,위험한 마약상들까지 연루되었다는 사실까지 밝혀내는데...아버지를 잃은 아들의 분노의 복수가 시작된다!
2017	166194	데스 트랩:사신의 법칙	공포	요코야마 카즈히로	오이카와 나오	엘리트집안 딸과의 결혼을 앞두고 문란한 과거를 청산하기 위해 과거의 여자를 저주해달라며 찾아온 남자. 이혼한 엄마가 자신의 의견은 안중에 없이 재혼을 하려하자 홧김에 저주를 의뢰하는 학생. 딸의 이식수술 비용을 마련하지 못해 저주를 통한 사고사로 사망보험금을 타려는 남자. 각자의 사연으로 저승사자들의 바를 찾아온 그들, 하지만 인과에 따라 벌을 내리기도, 희망을 주기도 하는 인간적인 저승사자들의 이야기.
2017	142324	데스노트: 더 뉴 월드	액션, 스릴러	사토 신스케	히가시데 마사히로, 이케마츠 소스케, 토다 에리카	‘키라’와 ‘L’의 죽음 10년 후, 지구 곳곳에서는 이유를 알 수 없는 죽음이 번져가기 시작한다. 사라진 ‘데스노트’와 연관이 있음을 직감한 일본 경시청은 데스노트 특별수사 대책 본부를 세우고, 데스노트를 이용한 범죄와의 전면전을 선포한다.  그러던 중 일본 도쿄 한복판에서 많은 사람들이 동시다발적으로 사망하는 사건이 발생한다.그와 동시에 의문의 해커로부터 자신이 키라라는 바이러스 메시지가 퍼지면서,  여섯 권의 데스노트가 다시 나타났음을 알게 된다.여섯 권의 데스노트를 모두 손에 넣어 세상을 지배하려는 의문의 해커 ‘시엔’을 막기 위해 천재적인 추리력을 지닌 ‘류자키’와 데스노트 특별수사팀 팀장 ‘미시마’가 수사에 박차를 가하게 되면서이들은 피할 수 없는 대결을 하게 되는데... 여섯 권의 데스노트 차지할 것인가, 빼앗길 것인가! 전쟁은 다시 시작됐다!
2017	155305	데이빗 린치: 아트 라이프	다큐멘터리	존 구옌, 릭 반즈, 올리비아 니르고르-홀름	데이빗 린치	할리우드 자신의 스튜디오 빈티지 마이크 앞에 선 ‘컬트의 제왕’ 데이빗 린치.어린 딸 ‘룰라’에게 들려주는 가장 비밀스러운 자신의 이야기를 시작한다. 아이다 호의 작은 마을에서 순수하고 행복한 어린 시절을 보낸 소년이 필라델피아의 예술 학교에 진학 후 기괴하고 미스터리 한 감독이 되기까지….데이빗 린치가 직접 들려주는 그의 작품세계와 진정한 아트 라이프
2017	149479	델타 보이즈	드라마, 코미디	고봉수	백승환, 신민재, 김충길	돈에 대한 욕심도, 열정도 제로인 ‘일록’. 그에게 어느 날 친구 ‘예건’이 뜻밖의 제안을 하게 되는데 바로 남성 사중창 대회에 참가하는 것.처음엔 어이가 없다고 생각했지만 ‘일록’은 은근히 끌리게 되고 그렇게 이름만 멋들어진 남성 사중창 그룹 ‘델타 보이즈’가 결성된다!비주얼을 담당하는 공장 알바남 ‘일록’, 시카고에서 날아온 또라이 ‘예건’, 빈손으로 등장하는 법이 없는 꽁치 파는 꽁지머리 청년 ‘대용’, 1+1으로 찾아온 도너츠 노점남 ‘준세’가 뭉쳤다!우리가 바로 델타 보이즈!
2017	142644	도묘필기: 미이라의 부활	미스터리, 모험	이인항	루한, 정백연, 마사순	도굴꾼 집안에서 태어난 우시에는 과부묘에 들어갔다가 우연히 사모릉에 들어가는 열쇠를 손에 넣게 된다.사모릉은 불멸의 삶에 대한 거대한 비밀이 얽혀있는 고대 무덤.우시에는 할아버지의 유품인 도묘필기에서 사모릉에 대한 정보를 입수하고 숙부와 함께 팀을 꾸려 사모릉에 들어간다.한편, 영생을 누릴 수 있는 방법이 적힌 동판의 마지막 조각을 찾던 헨드릭스는 용병을 고용하여 우시에와 그의 숙부를 뒤쫓는데..
2017	158869	도살장	공포	포엘 로빈슨, 패트릭 로버트 영	레베카 케네디, 엘리스 그리어, 댄 크리드	살인을 게임으로 즐기는 신혼부부, 알코올 중독 게이 경찰, 비밀을 가진 도망자 남매.인간성 제로의 나쁜 놈, 평판이 나쁜 놈, 인생이 더 나빠질 게 없는 놈.이보다 더 나쁜 놈을 만났다!무차별 잔혹 살인을 저지르는 가면 쓴 살인마에게 잡혀 산 속에 고립되고 만 사람들.이토록 잔인한 살인은 없었다! 과연 인간 살육 게임에서 살아남는 자.누가 될 것인가?
2017	165582	도시 전설	공포	다이치로 나츠메		찢어진 입을 하고 “나 예뻐?”라며 묻는다는 ‘빨간 마스크’, 주문을 외우면 정확히 4시 44분에 나타나 주문을 외운 사람을 죽인다는 ‘4시 할멈’, 적당한 대상을 찾아 빙의후 식량으로 쓸 사람들을 찾아나선다는 ‘작은 아저씨’, 허무맹랑한 이야기로 치부하는 그들에게 현실로 다가오는 일본 도시전설.
2017	166111	도촬 아가씨 대기실	에로	코지마 유지		유사성행위를 하는 풍속업소인 패션 헬스에 종사하는 여성들의 대기실을 몰래 촬영한다.이들은 대기실에서 동료와 수다를 떨면서 자신의 호출을 기다린다.처음 일을 시작하는 이를 위해 어떻게 하면 손님이 좋아할지 알려주기도 하고, 직업상 고충이나 싫은 손님에 대한 뒷이야기도 끊이지 않는다.동료들과 어울리지 못하는 한 여성은 구석에서 혼자 시간을 보내고, 처음 온 여성은 그녀에게 친절하게 다가가지만, 다른 동료들은 이를 저지한다.그렇게 시간을 보내다가 전화벨이 울리고, 선택된 여성은 옷을 갈아입고 손님을 맞이하기 위해 대기실을 떠난다.
2017	43074	도쿄 느와르	드라마	이시오카 마사토, 쿠마자와 나오토	요시모토 타카미, 나카무라 아이미, 요시노 키미카	Part 1 BIRTHDAY인터넷 회사에서 12년 동안 일해 온 기타지마 (요시모토 다카미 분).회사를 마치고 귀가하던 어느 날 그녀는 베일에 싸인 헤어 디자이너를 우연히 만나게 되고 그는 초라한 행색의 기타지마를 아름다운 여인으로 변신시킨다.그리고 그녀에게 고급 호텔에서 남자를 만나는 일을 해보라고 권유한다. Part2 GIRL'S LIFE남자친구 토모야한테 버림받은 대학생 마유키(나카무라 아이미 분)는 안마 시술소에서 3개월째 아르바이트를 하고 있다.이러한 생활을 통해 마음의 안정을 찾고 있던 미유키 앞에 토모야가 찾아와 용서를 구하고 그의 말과 태도로 인해 그녀의 감정은 다시 요동치기 시작한다. Part 3 NIGHT LOVERS나오(요시노 키미카 분)는 자신 앞에서 갑작스레 사라진 남자친구 유지를 찾기 위해 안간힘을 쓴다.애타게 남자친구를 찾던 나오는 우연히 인터넷에서 자신과 이름이 같은 여성을 발견하게 되고 그 여자의 글을 읽으며 자신과 유지의 관계에 대해 깊은 고민에 빠지게 된다.
2017	144188	도쿄 연애사건	코미디	야마우치 켄지	후키코시 미츠루, 안도 와코, 키시이 유키노	평범한 대학생 타에코와 동갑내기 친구 마야.어느 날, 마야는 타에코에게 "너의 아빠가 좋아!'라며 폭탄 고백을 하고이 고백으로 인해 타에코와 그녀의 가족은 예측불허의 사건들에 휘말린다.상식파괴! 공식파괴! 우정파괴!뻔뻔한 마야의 극단적 로맨스가 펼쳐진다!
2017	161988	돈 슬립	공포, 스릴러	필립 구즈먼	조셀린 도나휴, 제시 브래포드, 제스 보레고	베스는 수면 마비라는 수면 장애로 매일 밤 잠을 이루지 못해 주변 사람들에게 도움을 청하지만 외면당한다. 베스의 고통을 외면하던 쌍둥이 동생 케이트는 베스가 자다가 목숨을 잃자 죄책감에 괴로워한다. 그러던 어느 날 베스의 남자 친구였던 에반까지 악령을 보게 되자, 케이트는 하산 박사를 찾아가 도움을 요청한다. 하산 박사는 수면 마비의 악순환을 끊으려면 스스로 마비 상태에서 풀려나야 한다고 주장하고, 세 사람은 목숨을 건 위험천만한 도박을 감행하는데...
2017	158771	돈 지오반니	공연실황	메트오페라	사이먼 킨리사이드, 히블라 게르츠마바, 말린 비스트룀	스페인 세비야에 살고 있는 귀족 돈 지오반니는 기사장의 딸인 돈나 안나에게 반해 몰래 안나의 방에 침입한다. 뜻을 이루지 못하고 쫓겨나오던 돈 지오반니는 기사장과 맞닥뜨리자 결투 끝에 그를 죽이고 도망친다. 돈나 엘비라는 돈 지오반니에게 헌신했지만 버림받은 여인이다. 한편 하인에게 엘비라를 떠넘기고 도망친 돈 지오반니는 마을 결혼 잔치에서 새 신부 체를리나를 보고 한눈에 반한다. 그녀를 한적한 곳으로 데려가지만 그 순간 나타난 엘비라의 폭로로 돈 지오반니의 실상을 알아버린 체를리나는 신랑에게 돌아간다. 그의 만행을 알게 된 마을사람들에게 쫓기던 돈 지오반니에게 기사장의 석상이 찾아온다. 기사장은 그를 비난하며, 회개하면 목숨은 살려 주겠다고 말하지만 그는 굽히지 않고 지옥불 앞에서도 당당하게 죽음을 택한다.
2017	157192	돈 킬 잇: 악마사냥꾼	판타지, 공포, 액션	마이크 멘데즈	돌프 룬드그렌, 크리스티나 크레브	미시시피 주 외딴 시골 마을 치커리 크리크에서 연이은 살인 사건이 일어난다. 공통점은 범인이 앞선 사건의 범인을 죽였다는 것. FBI는 자국 내 테러 가능성을 염두에 두고 요원 에블린 피어스를 파견하는데, 곧 그녀 앞에 악마 사냥꾼 제베다이아 우들리가 나타나 이것이 악마의 짓임을 밝힌다. 자신의 빙의체를 죽인 대상에게로  옮겨가는 독특한 악마를 잡아 가두기 위해 FBI 요원 에블린과 악마 사냥꾼 제베다이아가 힘을 합치게 되는데! 과연 그들은 치커리 크리크에 평화를 가져 올 수 있을 것인가?
2017	130931	돈키호테 맨 오브 라만차	모험	다비드 비이어, 데이브 도로시, 마힌 이브라힘	카멘 아젠지아노, 호라티오 샌즈	기사도 책에 푹 빠진 라만차 마을의 남자가 스스로 기사 돈키호테라 칭한다.종자 산초와 말 로시난테를 타고도탄에 빠진 세상을 구하기 위해 모험을 떠난다.풍차와 대결하고 죄수를 풀어주고 둘시네아를 위해기상천외한 기행을 펼치는데…괴짜 기사의 꽈당 모험이 부활한다!
2017	164988	돌아온 복단지		권성창	강성연, 고세원, 송선미	가난하지만 당당하게 살아온 여자가 바닥으로 추락한 왕자를 만나 진정한 사랑과 가족에 대해 깨닫게 되는 이야기를 다룬 드라마
2017	162419	돌아온다	드라마	허철	김유석, 손수현	아무도 찾지 않을 것 같은외딴 곳에 있는 평범한 막걸리집,이곳은 마음 속에 그리움을 품은이들의 안식처가 되어주고 있다.그리고 그곳의 막걸리를 마시면 그리운 사람이 돌아온다는 현판을 걸어두고는다시 만나리라는 주문을 건다. 마치 신에게 기도하듯이. 그러던 어느 날, 서울에서 '주영'이라는 젊은 여성도막걸리집을 찾아오는데...
2017	168150	동거:친구의 여자친구	멜로/로맨스, 드라마	안금성	김인애	신출내기 웹툰 작가 ‘병태’의 집에 어느 날 고등학교 동창인 ‘봉석’과 그의 여자친구인 ‘윤희’가 들어온다.제발 사고나 나지 않기를 바라며 불편한 동거를 하던 중, ‘봉석’이 일 때문에 집을 떠나고 ‘윤희’만 남게 된다.그때부터 ‘병태’는 ‘윤희’ 에게 이성의 감정을 느끼며 아슬아슬한 동거를 계속하게 되는데…
2017	153423	동창회의 목적: 더 비기닝	멜로/로맨스, 드라마	정대만	유지원, 한영훈	걔랑 걔랑 사귄다고? 나도 걔랑 했는데?친구끼리 막 해도 되는 건가?알아도 모른 척, 몰라도 아는 척 했던 수많은 썸들의 전말 공개!시도 때도 없이 이뤄지는 은밀한 작업들.오늘은 선배랑, 내일은 후배랑, 모레는 동기랑.우리들의 끈적끈적한 동창회의 목적이 밝혀진다.
2017	162869	두 개의 사랑	스릴러	프랑소와 오종	마린 백트, 제레미 레니에	우울증으로 정신과를 찾은 ‘클로에’는 의사 ‘폴’과 사랑에 빠져 동거를 시작한다. 우연히 폴의 쌍둥이 형제 ‘루이’의 존재를 알게 된 클로에는 젠틀한 매력의 폴과 달리 섹시하고 야성적인 루이와도 사랑을 나눈다.위험한 관계를 유지하던 클로에는 그들의 숨겨진 비밀에 대해 알게 되는데…
2017	158734	두 번째 아내	멜로/로맨스	키타자와 유키오	마루 준코	어느 날 갑자기 재혼을 하겠다며 유코라는 젊은 여자를 데려온 아버지. 얼마 지나지 않아 자신의 딸까지 데려오는데.. 유코가 집에 들어온 이후 급격히 건강이 안좋아지는 아버지. 딸 미오는 수상한 유코의 뒷조사를 하게 되고, 두번의 결혼 사실과 남편들의 모두 사망한 사실을 발견하게 된다. 아버지를 지키려는 미오. 그리고 그들의 재산을 노리는 유코.
2017	161306	두 엄마	멜로/로맨스	이도시	송인호, 이유찬, 유진	동정이란 이유로 짝사랑하는 여자와 어긋나 상심해 있던 준형에게 친 형제 같은 친구 대진의 엄마 서영이 다가온다. 남자로 거듭날 수 있도록 섹스를 가르쳐주겠다는 서영의 파격적인 제안을 준형은 차마 거절하지 못한다.한편, 준형과 달리 여자들에게 인기가 많은 대진. 그러나 그는 오래 전부터 준형의 엄마인 연희를 짝사랑해온 상태. 부모님이 이혼할 것 같다는 준형의 말을 들은 대진은 이제 연희에게 적극적인 애정 공세를 펼치기 시작한다.
2017	170644	두처제2	멜로/로맨스	박주영	박률, 나영, 용팔	병으로 떠난 아내와 사별을 하게 된 형부는 어린 두 처제를 돌보게 된다.어렵고 힘든 시간이었지만 성실함과 책임감으로 남부럽지 않게 두 처제를 성인이 될 때 까지 키워왔다.그런 믿음직한 형부의 모습에 반한 처제들.이젠 어린 처제가 아닌 성숙한 여자가 된 처제들은 형부를 더 이상 형부가 아닌 남자로 생각하게 되고 각자의 매력으로 형부를 유혹하게 된다.그러던 어느날 형부는 꿈속에서 처제들과 적나라한 섹스를 경험하게 되는데 그날 이후 형부도 더 이상 처제들이 어린 처제가 아닌 성숙한 여자로 의식하게 되면서 두 처제의 유혹에 점점 마음이 흔들리게 되는데..과연, 처제들의 형부에 대한 사랑은 이루어 질 수 있을까?
2017	131161	둠스데이: 지구 최후의 전쟁	모험, 가족, 드라마	마틴 바른비츠	윌리엄 요크 닐센, 토마스 가비, 피터 간츨러	지구온난화 현상으로 인해 정체불명의 괴수가 등장, 전 인류를 위협한다. 도심을 파괴하고 목숨을 위협하는 괴물에게 속수무책으로 당하던 사람들은 살아남기 위해, 그리고 사랑하는 가족을 구하기 위해 괴물과 맞서기로 결심한다.
2017	165585	드래곤 스펠: 마법 꽃의 비밀	애니메이션, 판타지	마누크 데포얀	방지원, 이세원, 박상우	아버지처럼 드래곤 헌터가 꿈인 ‘니키’는 잘못된 마법주문으로 마법 세계 ‘찬티스피어’에 빠지게 된다. 이곳은 열라 빠른 달팽이와 초대형 잠자리 등 상상도 못 했던 일들이 눈앞에 펼쳐지는 마법세상. 어리둥절하기만 한 니키는 찬티스피어의 신비소녀 ‘록키’를 만나게 되고 마법세상 뿐 아니라 인간세상을 위협하려는 전설의 마지막 드래곤을 물리칠 여정을 시작 하는데…
2017	158486	드래곤 워	액션, 코미디	제프 라이즈너	잭 E. 쿠렌튼, 비앙카 하세, 크리스토퍼 존 제닝스	유성우가 쏟아지는 저녁, 큰돈을 벌기 위해 조나스와 랄스는 운석을 찾아 나선다.운좋게 운석을 발견하지만 그건 익룡의 알이 었다.그걸 모른채 차에 싣고 돌아가던중 거대한 익룡의 공격을 받게 된다.쫒아오는 익룡을 죽이고 도망가던 중 셀수 없을 만큼 거대한 익룡들이 공격해 온다.공격에 맞서기 위해 무기가 많은 술집을 찾아가지만 결국 익룡의 먹이로 끌려가게 되고 세상에서 전혀 볼수 없었던 공포의 여왕 익룡을 만나게 되는데..
2017	170686	드래곤 플라이	SF, 액션	조 니	코린 네멕, 도미니카 줄리엣	중남미 정글에서 현지 연구를 하다 실종된 아버지를 찾기 위해 곤충학자인 지나(도미니카 줄리엣)은 친구 론다(니콜렛 노엘)과 함께 중앙아메리카로 떠난다.지나는 정글 속 실험실에서 발견된 몇 장의 사진을 단서로 정글을 뒤지던 중 임무 수행중인 파병 군인들을 만나게 되고 그 중 리더인 존(코린 네멕)과 마이어스(벤자민 이스터데이)에게 도움을 요청한다.수색 도중 깊은 숲 속에서 거대 말벌의 공격을 받게 되고 지나의 아버지도 그들에게 잡혀갔음을 알게 된다.총알도 뚫을 수 없는 껍질을 가진 괴물 곤충을 없앨 방법은 무엇인가! 거대 말벌의 치명적 약점을 찾아낸 그들은 마지막 방법을 시도하는데...
2017	102687	드론: 미래전쟁	액션	릭 로젠탈	맷 오리어리, 엘로이즈 멈포드	아프가니스탄에서 911 테러를 주도한 테러리스트의 행방을 쫓고 있는 ‘수’ 중위와 ‘잭’ 이병.드디어, 행방이 묘연하던 테러리스트 용의자의 흔적을 찾아내고그를 제거하라는 상부의 명령이 떨어진다.테러리스트를 향해 드론 조종을 시작한 ‘수’ 중위는무고한 시민들의 목숨까지 모두 희생시켜야만 하는 최악의 상황에 직면하게 되고어떠한 선택을 내려야 할지 갈등에 빠지게 되는데…911 테러 그 후,살아남은 자들을 위해 반드시 그를 막아야 한다!
2017	168177	들킨 불륜 현장의 아내	에로	코지마 유키오		보는 걸로만 만족하는 남편 때문에 항상 욕구불만인 유코는 시아버지와의 야릇한 관계를 상상하며 욕구를 달래곤 한다.자신의 욕구밖에 채울 줄 모르는 남편 히로시 앞에서 보란 듯이 시아버지와 상상 속에서 섹스를 하는 유코는 그 어느 때보다 더 행복해 보인다.간혹 그런 유코의 야릇한 상상 때문에 현실에서 말실수를 하곤 하지만, 그래도 유코는 상상 속에서만큼은 시아버지의 노리개가 되는 것을 포기하지 않는다.
2017	163663	딥	뮤지컬, 애니메이션, 모험	줄리오 소토 거피드	심규혁, 사문영, 이인성	뉴욕이 통째로 바다에 잠겨버린 미래깊은 바닷속 산호초 동굴에 모여 살아가던 바다 생물들.어느 날 말썽꾸러기 문어 ‘딥’의 장난 때문에 폭발이 일어나고 마을은 위험에 빠진다.마을을 구할 ‘전설의 고래’를 찾기 위해 ‘딥’과 겁쟁이 ‘이보’, 흥새우 ‘앨리’, 다중이 ‘모라’까지, 바다 사총사는 처음으로 바닷속 도시탐험을 떠나게 되는데…
2017	127466	딥씨 챌린지	다큐멘터리	존 브루노, 레이 퀸트, 앤드류 라이트	제임스 카메론	10대 시절, 영화보다 해양탐사에 더 관심이 많았던 제임스 카메론.오늘은 세계적 명성을 가진 영화감독이 아닌,누구보다 열정적인 내셔널 지오그래픽 전속 해양 탐험가로서의 오랜 꿈을 이루기 위해 인류의 마지막 미개척지 마리아나 해구에 진입한다.7년간의 노력 끝에 탄생한 잠수정 ‘딥씨 챌린저’와 함께 지구에서 가장 깊은 곳을 향해 잠수를 시작한 그는그곳에서 새로운 세상을 마주하게 된다.
2017	137346	딥워터 호라이즌	액션, 드라마	피터 버그	마크 월버그, 딜런 오브라이언, 케이트 허드슨	2010년 4월 20일, 미국 루이지애나주 앞바다 멕시코만 석유 시추선 ‘딥워터 호라이즌’ 호.무리한 작업량으로 인하여 이미 배가 시한폭탄 같은 상태임에도본사는 일정과 비용을 이유로 안전검사를 무시한다.‘딥워터 호라이즌’ 호의 총 책임자 ‘지미’(커트 러셀)와 엔지니어 팀장 ‘마이크’(마크 월버그)는 이에 반대하지만,본사 관리자 ‘돈’(존 말코비치)은 이런 항의를 묵살하고 작업을 강행한다.본격적인 작업이 시작된 직후, 굴착반 ‘케일럽’(딜런 오브라이언)은 시추관에서 이상 징후를 감지한다.그리고 그 순간, 배 전체를 뒤흔드는 폭발음과 함께 ‘딥워터 호라이즌’ 호는 거대한 화염에 휩싸이는데…사상 최악의 해양 재난참혹한 불길 속, 살아남기 위한 그들의 사투가 시작된다!
2017	165526	딸의 친구 2	멜로/로맨스	계장혁	선혜, 이수	매번 사업을 실패하고 이혼까지 당한 용철은 딸과도 인연을 끊은 채 힘든 삶을 살아가고어렵게 시작한 사업이 또 망하자 친구 희영과 함께 지내고 있는 딸 민정을 찾아가게 된다.용철은 그곳에서 희영을 보며 애틋한 감정을 느끼게 되고 희영 또한 용철에게 애정을 느끼며 정사를 벌이게 되고 그 사실을 딸 민정의 남자친구 동민이 알게 되면서 음모를 꾸미는데...
